Publication Type,Authors,Title,Abstract,DOI
J,"Mohanpuria, P; Rana, NK; Yadav, SK",Biosynthesis of nanoparticles: technological concepts and future applications,"Nanotechnology involves the production, manipulation and use of materials ranging in size from less than a micron to that of individual atoms. Although nanomaterials may be synthesized using chemical approaches, it is now possible to include the use of biological materials. In this review, we critically assess the role of microorganisms and plants in the synthesis of nanoparticles.",10.1007/s11051-007-9275-x
J,"Arima, Y; Iwata, H",Effect of wettability and surface functional groups on protein adsorption and cell adhesion using well-defined mixed self-assembled monolayers,"Self-assembled monolayers (SAMs) of alkanethiols, which can provide flat and chemically well-defined surfaces, were employed as model surfaces to understand cellular interaction with artificial materials. SAMs presenting a wide range of wettabilities were prepared by mixing two kinds of alkanethiols carrying terminal methyl (CH3) hydroxyl (OH), carboxylic acid (COOH), or amino (NH2) groups. Adhesion behavior of human umbilical vein endothelial cells (HUVECs) and HeLa cells on these mixed SAMs were examined. The number of adhered HUVECs reached a maximum on CH3/OH mixed SAMs with a water contact angle of 40 degrees, while cell adhesion increased with decreasing water contact angle up to 60-70 degrees and then leveled off on CH3/COOH and CH3/NH2 mixed SAMs. Numbers of adhered HeLa cells showed a maximum on CH3/OH and CH3/COOH mixed SAMs with a water contact angle of 50 degrees. These facts suggest that cell adhesion is mainly determined by surface wettability, but is also affected by the surface functional group, its surface density, and the kinds of cells. The effect of exchange of adsorbed proteins on cell adhesion was also examined. HUVECs were cultured on the mixed SAMs preadsorbed with albumin. Cell adhesion was effectively prohibited on hydrophobic SAMs pretreated with albumin. Albumin strongly adsorbed and resisted replacement by cell adhesive proteins on hydrophobic SAMs. On the other hand, cells adhered to albumin-adsorbed hydrophilic SAW Displacement of preadsorbed albumin with cell adhesive proteins effectively occurs on these hydrophilic SAMs. This effect contributes to induce SAMs with moderate wettability to give suitable surfaces for cell adhesion. (c) 2007 Elsevier Ltd. All rights reserved.",10.1016/j.biomaterials.2007.03.013
J,"Wang, Q; Hisatomi, T; Jia, QX; Tokudome, H; Zhong, M; Wang, CZ; Pan, ZH; Takata, T; Nakabayashi, M; Shibata, N; Li, YB; Sharp, ID; Kudo, A; Yamada, T; Domen, K",Scalable water splitting on particulate photocatalyst sheets with a solar-to-hydrogen energy conversion efficiency exceeding 1%,"Photocatalytic water splitting using particulate semiconductors is a potentially scalable and economically feasible technology for converting solar energy into hydrogen(1-3). Z-scheme systems based on two-step photoexcitation of a hydrogen evolution photocatalyst (HEP) and an oxygen evolution photocatalyst (OEP) are suited to harvesting of sunlight because semiconductors with either water reduction or oxidation activity can be applied to the water splitting reaction(4,5). However, it is challenging to achieve efficient transfer of electrons between HEP and OEP particles(6,7). Here, we present photocatalyst sheets based on La-and Rh-codoped SrTiO3 (SrTiO3:La, Rh; ref. 8) and Mo-doped BiVO4 (BiVO4:Mo) powders embedded into a gold (Au) layer. Enhancement of the electron relay by annealing and suppression of undesirable reactions through surface modification allow pure water (pH 6.8) splitting with a solar-to-hydrogen energy conversion efficiency of 1.1% and an apparent quantum yield of over 30% at 419 nm. The photocatalyst sheet design enables efficient and scalable water splitting using particulate semiconductors.",10.1038/NMAT4589
J,"Lam, L; Teng, JG",Design-oriented stress-strain model for FRP-confined concrete,"External confinement by the wrapping of FRP sheets (or FRP jacketing) provides a very effective method for the retrofit of reinforced concrete (RC) columns subject to either static or seismic loads. For the reliable and cost-effective design of FRP jackets, an accurate stress-strain model is required for FRP-confined concrete. In this paper, a new design-oriented stress-strain model is proposed for concrete confined by FRP wraps with fibres only or predominantly in the hoop direction based on a careful interpretation of existing test data and observations. This model is simple, so it is suitable for direct use in design, but in the meantime, it captures all the main characteristics of the stress-strain behavior of concrete confined by different types of FRP. In addition, for unconfined concrete, this model reduces directly to idealized stress-strain curves in existing design codes. In the development of this model, a number of important issues including the actual hoop strains in FRP jackets at rupture, the sufficiency of FRP confinement for a significant strength enhancement, and the effect of jacket stiffness on the ultimate axial strain, were all carefully examined and appropriately resolved. The predictions of the model are shown to agree well with test data. (C) 2003 Elsevier Ltd. All rights reserved.",10.1016/S0950-0618(03)00045-X
J,"Park, NG",Organometal Perovskite Light Absorbers Toward a 20% Efficiency Low-Cost Solid-State Mesoscopic Solar Cell,"Recently, perovskite CH3NH3PbI3 sensitizer has attracted great attention due to its superb light-harvesting characteristics. Organometallic or organic materials were mostly used as sensitizers for solid-state dye-sensitized solar cells at early stages. Inorganic nanocrystals have lately received attention as light harvesters due to their high light-absorbing properties. Metal chalcogenides have been investigated with solid-state dye-sensitized solar cells; however, the best power conversion efficiency was reported to be around 6%. CH3NH3PbX3 (X = Cl, Br, or I) perovskite sensitizer made a breakthrough in solid-state mescoscopic solar cells, where the first record efficiency of around 10% was reported in 2012 using submicrometer-thick TiO2 film sensitized with CH3NH3PbI3. A rapid increase in efficiency approaching 14% followed shortly. In this Perspective, recent progress in perovskite-sensitized solid-state mesoscopic solar cells is reviewed. On the basis of the recent achievements, a power conversion efficiency as high as 20% is expected based on optimized perovskite-based solid-state solar cells.",10.1021/jz400892a
J,"Hessel, CM; Pattani, VP; Rasch, M; Panthani, MG; Koo, B; Tunnell, JW; Korgel, BA",Copper Selenide Nanocrystals for Photothermal Therapy,"Ligand-stabilized copper selenide (Cu(2-x)Se) nanocrystals, approximately 16 nm in diameter, were synthesized by a colloidal hot injection method and coated with amphiphilic polymer. The nanocrystals readily disperse in water and exhibit strong near-infrared (NIR) optical absorption with a high molar extinction coefficient of 7.7 x 10(7) cm(-1) M(-1) at 980 nm. When excited with 800 nm light, the Cu(2-x)Se nanocrystals produce significant photothermal heating with a photothermal transduction efficiency of 22%, comparable to nanorods and nanoshells of gold (Au). In vitro photothermal heating of Cu(2-x)Se nanocrystals in the presence of human colorectal cancer cell (HCT-116) led to cell destruction after 5 mm of laser irradiation at 33 W/cm(2), demonstrating the viabilitiy of Cu(2-x)Se nanocrystals for photothermal therapy applications.",10.1021/nl201400z
J,"Cao, LL; Jones, AK; Sikka, VK; Wu, JZ; Gao, D",Anti-Icing Superhydrophobic Coatings,"We use nanoparticle-polymer composites to demonstrate the anti-icing capability of superhydrophobic surfaces and report direct experimental evidence that such surfaces are able to prevent ice formation upon impact of supercooled water both in laboratory conditions and in natural environments. We rind that the anti-icing capability of these composites depends not only on their superhydrophobicity but also on the size of the particles exposed on the surface. The critical particle sizes that determine the superhydrophobicity and the anti-icing property are in two different length scales, The effect of particle size on ice formation is explained by using a classical heterogeneous nucleation theory. This result implies that the anti-icing property of a surface is not directly correlated with the superhydrophobicity, and thus, it is uncertain whether a superhydrophobic surface is anti-icing without detailed knowledge of the surface morphology, The result also opens up possibilities for rational design of anti-icing superhydrophobic surfaces by tuning surface textures in multiple length scales.",10.1021/la902882b
J,"Sergienko, IA; Dagotto, E",Role of the Dzyaloshinskii-Moriya interaction in multiferroic perovskites,"With the perovskite multiferroic RMnO3 (R=Gd,Tb,Dy) as guidance, we argue that the Dzyaloshinskii-Moriya interaction (DMI) provides the microscopic mechanism for the coexistence and strong coupling between ferroelectricity and incommensurate magnetism. We use Monte Carlo simulations and zero-temperature exact calculations to study a model incorporating the double-exchange, superexchange, Jahn-Teller, and DMI terms. The phase diagram contains a multiferroic phase between A and E antiferromagnetic phases, in excellent agreement with experiments.",10.1103/PhysRevB.73.094434
J,"Tao, A; Kim, F; Hess, C; Goldberger, J; He, RR; Sun, YG; Xia, YN; Yang, PD",Langmuir-Blodgett silver nanowire monolayers for molecular sensing using surface-enhanced Raman spectroscopy,"Langmuir-Blodgett technique was used to assemble monolayers (with areas over 20 cm(2)) of aligned silver nanowires that are similar to50 nm in diameter and 2-3 mum in length. These nanowires possess pentagonal cross-sections and pyramidal tips. They are close-packed and are aligned parallel to each other. The resulting nanowire monolayers serve as excellent substrates for surf ace-enhanced Raman spectroscopy (SERS) with large electromagnetic field enhancement factors (2 x 105 for thiol and 2,4-dinitrotoluene, and 2 x 109 for Rhodamine 6G) and can readily be used in ultrasensitive, molecule-specific sensing utilizing vibrational signatures.",10.1021/nl0344209
J,"Deshpande, VS; Fleck, NA; Ashby, MF",Effective properties of the octet-truss lattice material,"The effective mechanical properties of the octet-truss lattice structured material have been investigated both experimentally and theoretically. Analytical and FE calculations of the elastic properties and plastic yielding collapse surfaces are reported. The intervention of elastic buckling of the struts is also analysed in an approximate manner. Good agreement is found between the predictions of the strength and experimental observations from tests on the octet-truss material made from a casting aluminium alloy. Moreover, the strength and stiffness of the octet-truss material are stretching-dominated and compare favourably with the corresponding properties of metallic foams. Thus, the octet-truss lattice material can be considered as a promising alternative to metallic foams in lightweight structures. (C) 2001 Elsevier Science Ltd. All rights reserved.",10.1016/S0022-5096(01)00010-2
J,"Yazyev, OV; Helm, L",Defect-induced magnetism in graphene,"We study from first principles the magnetism in graphene induced by single carbon atom defects. For two types of defects considered in our study, the hydrogen chemisorption defect and the vacancy defect, the itinerant magnetism due to the defect-induced extended states has been observed. Calculated magnetic moments are equal to 1 mu(B) per hydrogen chemisorption defect and 1.12-1.53 mu(B) per vacancy defect depending on the defect concentration. The coupling between the magnetic moments is either ferromagnetic or antiferromagnetic, depending on whether the defects correspond to the same or to different hexagonal sublattices of the graphene lattice, respectively. The relevance of itinerant magnetism in graphene to the high-T-C magnetic ordering is discussed.",10.1103/PhysRevB.75.125408
J,"Chen, M; Wang, X; Yu, YH; Pei, ZL; Bai, XD; Sun, C; Huang, RF; Wen, LS",X-ray photoelectron spectroscopy and auger electron spectroscopy studies of Al-doped ZnO films,"The chemical state of oxygen, aluminum and zinc in Al-doped ZnO (ZAO) films was investigated by X-ray photoelectron spectroscopy (XPS), as well as the transition zone of the film-to-substrate, by auger electron spectroscopy (AES). The results show that zinc remains mostly in the formal valence states of Zn2+. A distinct asymmetry in Al 2p(3/2) photoelectron peaks has been resolved into two components, one is metallic Al and the other is oxidized Al. The depth profile of the two components revealed that metallic Al mainly exists in the thin surface layer. The close inspection of Ols shows that Ols is composed of three components, centered at 530.15 +/- 0.15, 531.25 +/- 0.20 and 532.40 +/- 0.15 eV, respectively. AES reveals an abrupt transition zone between the ZAO and quartz substrate. (C) 2000 Elsevier Science B.V. All rights reserved.",10.1016/S0169-4332(99)00601-7
J,"Avouris, P",Graphene: Electronic and Photonic Properties and Devices,"Graphene is in many respects a nanomaterial with unique properties. Here I discuss the electronic structure, transport and optical properties of graphene, and how these are utilized in exploratory electronic and optoeleccronic devices. Some suggestions for needed advances are made.",10.1021/nl102824h
J,"Huebsch, N; Arany, PR; Mao, AS; Shvartsman, D; Ali, OA; Bencherif, SA; Rivera-Feliciano, J; Mooney, DJ",Harnessing traction-mediated manipulation of the cell/matrix interface to control stem-cell fate,"Stem cells sense and respond to the mechanical properties of the extracellular matrix. However, both the extent to which extracellular-matrix mechanics affect stem-cell fate in three-dimensional microenvironments and the underlying biophysical mechanisms are unclear. We demonstrate that the commitment of mesenchymal stem-cell populations changes in response to the rigidity of three-dimensional microenvironments, with osteogenesis occurring predominantly at 11-30 kPa. In contrast to previous two-dimensional work, however, cell fate was not correlated with morphology. Instead, matrix stiffness regulated integrin binding as well as reorganization of adhesion ligands on the nanoscale, both of which were traction dependent and correlated with osteogenic commitment of mesenchymal stem-cell populations. These findings suggest that cells interpret changes in the physical properties of adhesion substrates as changes in adhesion-ligand presentation, and that cells themselves can be harnessed as tools to mechanically process materials into structures that feed back to manipulate their fate.",10.1038/NMAT2732
J,"Bai, JW; Zhong, X; Jiang, S; Huang, Y; Duan, XF",Graphene nanomesh,"Graphene has significant potential for application in electronics(1-5), but cannot be used for effective field-effect transistors operating at room temperature because it is a semimetal with a zero bandgap(6,7). Processing graphene sheets into nano-ribbons with widths of less than 10 nm can open up a bandgap that is large enough for room-temperature transistor operation(8-19), but nanoribbon devices often have low driving currents or transconductances(18,19). Moreover, practical devices and circuits will require the production of dense arrays of ordered nanoribbons, which remains a significant challenge(20,21). Here, we report the production of a new graphene nanostructure-which we call a graphene nanomesh-that can open up a bandgap in a large sheet of graphene to create a semiconducting thin film. The nanomeshes are prepared using block copolymer lithography and can have variable periodicities and neck widths as low as 5 nm. Graphene nanomesh field-effect transistors can support currents nearly 100 times greater than individual graphene nanoribbon devices, and the on-off ratio, which is comparable with the values achieved in individual nanoribbon devices, can be tuned by varying the neck width. The block copolymer lithography approach used to make the nanomesh devices is intrinsically scalable and could allow for the rational design and fabrication of graphene-based devices and circuits with standard semiconductor processing.",10.1038/NNANO.2010.8
J,"Lazzeri, M; Vittadini, A; Selloni, A",Structure and energetics of stoichiometric TiO<sub>2</sub> anatase surfaces -: art. no. 155409,"We present an ab initio density-functional investigation of the structure and energetics of several stoichiometric 1 X 1 low-index surfaces of anatase, a TiO2 polymorph similar to9% less dense and similar to1.2 kcal/mol less stable than rutile. Although our calculations do not reproduce the relative ordering of the two phases that is observed experimentally, the calculated bulk structural and elastic properties of both polymorphs are in excellent agreement with the experiment, suggesting that surface relaxations are correctly described as well. As expected, the surface energies of anatase appear to be related to the presence of undercoordinated Ti atoms: the surfaces with fourfold-coordinated Ti atoms have a larger energy than those with fivefold-coordinated Ti. Furthermore, we find that the average surface energy of a TiO2 anatase macroscopic crystal is smaller than that of rutile. Finally, patterns in the relaxation of the surface atoms which are com;non to different surfaces are analyzed.",10.1103/PhysRevB.63.155409
J,"Hatakeyama, T; Shiren, K; Nakajima, K; Nomura, S; Nakatsuka, S; Kinoshita, K; Ni, JP; Ono, Y; Ikuta, T",Ultrapure Blue Thermally Activated Delayed Fluorescence Molecules: Efficient HOMO-LUMO Separation by the Multiple Resonance Effect,,10.1002/adma.201505491
J,"Yavuz, MS; Cheng, YY; Chen, JY; Cobley, CM; Zhang, Q; Rycenga, M; Xie, JW; Kim, C; Song, KH; Schwartz, AG; Wang, LHV; Xia, YN",Gold nanocages covered by smart polymers for controlled release with near-infrared light,"Photosensitive caged compounds have enhanced our ability to address the complexity of biological systems by generating effectors with remarkable spatial/ temporal resolutions(1-3). The caging effect is typically removed by photolysis with ultraviolet light to liberate the bioactive species. Although this technique has been successfully applied to many biological problems, it suffers from a number of intrinsic drawbacks. For example, it requires dedicated efforts to design and synthesize a precursor compound for each effector. The ultraviolet light may cause damage to biological samples and is suitable only for in vitro studies because of its quick attenuation in tissue(4). Here we address these issues by developing a platform based on the photothermal effect of gold nanocages. Gold nanocages represent a class of nanostructures with hollow interiors and porous walls(5). They can have strong absorption (for the photothermal effect) in the near-infrared while maintaining a compact size. When the surface of a gold nanocage is covered with a smart polymer, the pre-loaded effector can be released in a controllable fashion using a near-infrared laser. This system works well with various effectors without involving sophisticated syntheses, and is well suited for in vivo studies owing to the high transparency of soft tissue in the near-infrared region(6).",10.1038/NMAT2564
J,"Hoppe, H; Sariciftci, NS",Morphology of polymer/fullerene bulk heterojunction solar cells,"Within the different organic photovoltaic devices the conjugated polymer/fullerene bulk heterojunction approach is one of the foci of today's research interest. These devices are highly dependent on the solid state nanoscale morphology of the two components (donor/acceptor) in the photoactive layer. The need for finely phase separated polymer - fullerene blends is expressed by the limited exciton diffusion length present in organic semiconductors. Typical distances that these photo-excitations can travel within a pristine material are around 10 - 20 nm. In an efficient bulk heterojunction the scale of phase separation is therefore closely related to the respective exciton diffusion lengths of the two materials involved. Once the excitons reach the donor/ acceptor interface, the photoinduced charge transfer results in the charge separation. After the charges have been separated they require percolated pathways to the respective charge extracting electrodes in order to supply an external direct current. Thus also an effective charge transport relies on the development of a suitable nanomorphology i.e. bicontinuous interpenetrating phase structures within these blend films. The present feature article combines and summarizes the experimental findings on this nanomorphology - efficiency relationship.",10.1039/b510618b
J,"Camanho, PP; Dávila, CG; de Moura, MF",Numerical simulation of mixed-mode progressive delamination in composite materials,"A new decohesion element with the capability of dealing with crack propagation under mixed-mode loading is proposed and demonstrated. The element is used at the interface between solid finite elements to model the initiation and non-self-similar growth of delaminations in composite materials. A single relative displacement-based damage parameter is applied in a softening law to track the damage state of the interface and to prevent the restoration of the cohesive state during unloading. The softening law is applied in the three-parameter Benzeggagh-Kenane mode interaction criterion to predict mixed-mode delamination propagation. To demonstrate the accuracy of the predictions, steady-state delamination growth is simulated for quasi-static loading of various single mode and mixed-mode delamination test specimens and the results are compared with experimental data.",10.1177/0021998303034505
J,"Yan, J; Fan, ZJ; Wei, T; Qian, WZ; Zhang, ML; Wei, F",Fast and reversible surface redox reaction of graphene-MnO<sub>2</sub> composites as supercapacitor electrodes,"We present a quick and easy method to synthesize graphene-MnO2 composites through the self-limiting deposition of nanoscale MnO2 on the surface of graphene under microwave irradiation. These nanostructured graphene-MnO2 hybrid materials are used for investigation of electrochemical behaviors. Graphene-MnO2 composite (78 wt.% MnO2) displays the specific capacitance as high as 310 F g(-1) at 2 mV s(-1) (even 228 F g(-1) at 500 mV s(-1)), which is almost three times higher than that of pure graphene (104 F g(-1)) and birnessite-type MnO2 (103 F g(-1)). Interestingly, the capacitance retention ratio is highly kept over a wide range of scan rates (88% at 100 mV s(-1) and 74% at 500 mV s(-1)). The improved high-rate electrochemical performance may be attributed to the increased electrode conductivity in the presence of graphene network, the increased effective interfacial area between MnO2 and the electrolyte, as well as the contact area between MnO2 and graphene. (C) 2010 Elsevier Ltd. All rights reserved.",10.1016/j.carbon.2010.06.047
J,"Win, KY; Feng, SS",Effects of particle size and surface coating on cellular uptake of polymeric nanoparticles for oral delivery of anticancer drugs,"This study evaluated cellular uptake of polymeric nanoparticles by using Caco-2 cells, a human colon adenocarcinoma cell line, as an in vitro model with the aim to apply nanoparticles of biodegradable polymers for oral chemotherapy. The feasibility was demonstrated by showing the localization and quantification of the cell uptake of fluorescent polystyrene nanoparticles of standard size and poly(lactic-co-glycolic acid) (PLGA) nanoparticles coated with polyvinyl alcohol (PVA) or vitamin E TPGS. Coumarin-6 loaded PLGA nanoparticles were prepared by a modified solvent extraction/evaporation method and characterized by laser light scattering for size and size distribution, scanning electron microscopy (SEM) for surface morphology, zeta-potential for surface charge, and spectrofluorometry for fluorescent molecule release from the nanoparticles. The effects of particle size and particle surface coating on the cellular uptake of the nanoparticles were quantified by spectrofluorometric measurement. Cellular uptake of vitamin E TPGS-coated PLGA nanoparticles showed 1.4 folds higher than that of PVA-coated PLGA nanoparticles and 4-6 folds higher than that of nude polystyrene nanoparticles. Images of confocal laser scanning microscopy, cryo-SEM and transmission electron microscopy clearly evidenced the internalization of nanoparticles by the Caco-2 cells, showing that surface modification of PLGA nanoparticles with vitamin E TPGS notably improved the cellular uptake. It is highly feasible for nanoparticles of biodegradable polymers to be applied to promote oral chemotherapy. (C) 2004 Elsevier Ltd. All rights reserved.",10.1016/j.biomaterials.2004.07.050
