Publication Type,Authors,Title,Abstract,DOI
J,"Fürstner, R; Barthlott, W; Neinhuis, C; Walzel, P",Wetting and self-cleaning properties of artificial superhydrophobic surfaces,"The wetting and the self-cleaning properties (the latter is often called the ""Lotus-Effect"") of three types of superhydrophobic surfaces have been investigated: silicon wafer specimens with different regular arrays of spikes hydrophobized by chemical treatment, replicates of water-repellent leaves of plants, and commercially available metal foils which were additionally hydrophobized by means of a fluorinated agent. Water droplets rolled off easily from those silicon samples which had a microstructure consisting of rather slender spikes with narrow pitches. Such samples could be cleaned almost completely from artificial particulate contaminations by a fog consisting of water droplets (diameter range, 8-20 mum). Some metal foils and some replicates had two levels of roughening. Because of this, a complete removal of all particles was not possible using artificial fog. However, water drops with some amount of kinetic impact energy were able to clean these surfaces perfectly. A substrate where pronounced structures in the range below 5 mum were lacking could not be cleaned by means of fog because this treatment resulted in a continuous water film on the samples.",10.1021/la0401011
J,"Brincker, R; Zhang, LM; Andersen, P",Modal identification of output-only systems using frequency domain decomposition,"In this paper a new frequency domain technique is introduced for the modal identification of output-only systems, i.e. in the case where the modal parameters must be estimated without knowing the input exciting the system. By its user friendliness the technique is closely related to the classical approach where the modal parameters are estimated by simple peak picking. However, by introducing a decomposition of the spectral density function matrix, the response spectra can be separated into a set of single degree of freedom systems, each corresponding to an individual mode. By using this decomposition technique close modes can be identified with high accuracy even in the case of strong noise contamination of the signals. Also, the technique clearly indicates harmonic components in the response signals.",10.1088/0964-1726/10/3/303
J,"You, JB; Hong, ZR; Yang, Y; Chen, Q; Cai, M; Song, TB; Chen, CC; Lu, SR; Liu, YS; Zhou, HP; Yang, Y",Low-Temperature Solution-Processed Perovskite Solar Cells with High Efficiency and Flexibility,"Perovskite compounds have attracted recently great attention in photovoltaic research. The devices are typically fabricated using condensed or mesoporous TiO2 as the electron transport layer and 2,2'7,7'-tetrakis-(N,N-dip-methoxyphenylamine)9,9'-spirobifluorene as the hole transport layer. However, the high-temperature processing (450 degrees C) requirement of the TiO2 layer could hinder the widespread adoption of the technology. In this report, we adopted a low-temperature processing technique to attain high-efficiency devices in both rigid and flexible substrates, using device structure substrate/ITO/PEDOT:PSS/CH(3)NH(3)Pbl(3-x)Cl(x)/PCBM/Al, where PEDOT:PSS and PCBM are used as hole and electron transport layers, respectively. Mixed halide perovskite, CH(3)NH(3)Pbl(3-x)Cl(x) was used due to its long carrier lifetime and good electrical properties. All of these layers are solution-processed under 120 degrees C. Based on the proposed device structure, power conversion efficiency (PCE) of 11.5% is obtained in rigid substrates (glass/ITO), and a 9.2% PCE is achieved for a polyethylene terephthalate/ITO flexible substrate.",10.1021/nn406020d
J,"Bourdin, B; Francfort, GA; Marigo, JJ",The variational approach to fracture,,10.1007/s10659-007-9107-3
J,"Namasivayam, C; Kavitha, D","Removal of Congo Red from water by adsorption onto activated carbon prepared from coir pith, an agricultural solid waste","The adsorption of Congo Red by coir pith carbon was carried out by varying the parameters such as agitation time, dye concentration, adsorbent dose, pH and temperature. Equilibrium adsorption data followed both Langmuir and Freundlich isotherms. Adsorption followed second-order rate kinetics. The adsorption capacity was found to be 6.7 mg dye per g of the adsorbent. Acidic pH was favourable for the adsorption of Congo Red. Desorption studies suggest that chemisorption might be the major mode of adsorption. (C) 2002 Elsevier Science Ltd. All rights reserved.",10.1016/S0143-7208(02)00025-6
J,"Bullard, JW; Jennings, HM; Livingston, RA; Nonat, A; Scherer, GW; Schweitzer, JS; Scrivener, KL; Thomas, JJ",Mechanisms of cement hydration,"The current state of knowledge of cement hydration mechanisms is reviewed, including the origin of the period of slow reaction in alite and cement, the nature of the acceleration period, the role of calcium sulfate in modifying the reaction rate of tricalcium aluminate, the interactions of silicates and aluminates, and the kinetics of the deceleration period. In addition, several remaining controversies or gaps in understanding are identified, such as the nature and influence on kinetics of an early surface hydrate, the mechanistic origin of the beginning of the acceleration period, the manner in which microscopic growth processes lead to the characteristic morphologies of hydration products at larger length scales, and the role played by diffusion in the deceleration period. The review concludes with some perspectives on research needs for the future. Published by Elsevier Ltd.",10.1016/j.cemconres.2010.09.011
J,"Loh, KP; Bao, QL; Ang, PK; Yang, JX",The chemistry of graphene,"A review on the latest developments on graphene, written from the perspective of a chemist, is presented. The role of chemistry in bringing graphene research to the next level is discussed.",10.1039/b920539j
J,"Yu, DS; Goh, K; Wang, H; Wei, L; Jiang, WC; Zhang, Q; Dai, LM; Chen, Y",Scalable synthesis of hierarchically structured carbon nanotube-graphene fibres for capacitive energy storage,"Micro-supercapacitors are promising energy storage devices that can complement or even replace batteries in miniaturized portable electronics and microelectromechanical systems. Their main limitation, however, is the low volumetric energy density when compared with batteries. Here, we describe a hierarchically structured carbon microfibre made of an interconnected network of aligned single-walled carbon nanotubes with interposed nitrogen-doped reduced graphene oxide sheets. The nanomaterials form mesoporous structures of large specific surface area (396 m(2) g(-1)) and high electrical conductivity (102 S cm(-1)). We develop a scalable method to continuously produce the fibres using a silica capillary column functioning as a hydrothermal microreactor. The resultant fibres show a specific volumetric capacity as high as 305 F cm(-3) in sulphuric acid (measured at 73.5 mA cm(-3) in a three-electrode cell) or 300 F cm(-3) in polyvinyl alcohol (PVA)/H3PO4 electrolyte (measured at 26.7 mA cm(-3) in a two-electrode cell). A full micro-supercapacitor with PVA/H3PO4 gel electrolyte, free from binder, current collector and separator, has a volumetric energy density of similar to 6.3 mWh cm(-3) (a value comparable to that of 4 V-500 mu Ah thin-film lithium batteries) while maintaining a power density more than two orders of magnitude higher than that of batteries, as well as a long cycle life. To demonstrate that our fibre-based, all-solid-state micro-supercapacitors can be easily integrated into miniaturized flexible devices, we use them to power an ultraviolet photodetector and a light-emitting diode.",10.1038/NNANO.2014.93
J,"Zhang, LL; Zhou, R; Zhao, XS",Graphene-based materials as supercapacitor electrodes,"Graphene is an emerging carbon material that may soon find practical applications. With its unusual properties, graphene is a potential electrode material for electrochemical energy storage. This article highlights recent research progress in graphene-based materials as supercapacitor electrodes. With a brief description of the working principle of supercapacitors, research progress towards the synthesis and modification of graphene-based materials, including graphene oxide, fullerenes, and carbon nanotubes, is presented. Applications of such materials with desirable properties to meet the specific requirements for the design and configuration of advanced supercapacitor devices are summarized and discussed. Future research trends towards new approaches to the design and synthesis of graphene-based nanostructures and architectures for electrochemical energy storage are proposed.",10.1039/c000417k
J,"Speer, J; Matlock, DK; De Cooman, BC; Schroth, JG",Carbon partitioning into austenite after martensite transformation,"A model is developed to describe the endpoint of carbon partitioning between quenched martensite and retained austenite, in the absence of carbide formation. The model assumes a stationary alpha/gamma interface, and requires a uniform chemical potential for carbon, but not iron, in the two phases, leading to a metastable equilibrium condition identified here as ""constrained paraequilibrium"" or CPE. The model is explained with example calculations showing the characteristics of the constrained paraequilibrium condition, and applications are discussed with respect to new microstructures and processes, including a new ""quenching and partitioning,"" or Q&P process, to create mixtures of carbon-depleted martensite, and carbon-enriched retained austenite. Important new implications with respect to fundamental elements of the bainite transformation are also discussed. (C) 2003 Published by Elsevier Science Ltd on behalf of Acta Materialia Inc.",10.1016/S1359-6454(03)00059-4
J,"Muth, JT; Vogt, DM; Truby, RL; Mengüç, Y; Kolesky, DB; Wood, RJ; Lewis, JA",Embedded 3D Printing of Strain Sensors within Highly Stretchable Elastomers,"A new method, embedded-3D printing (e-3DP), is reported for fabricating strain sensors within highly conformal and extensible elastomeric matrices. e-3DP allows soft sensors to be created in nearly arbitrary planar and 3D motifs in a highly programmable and seamless manner. Several embodiments are demonstrated and sensor performance is characterized.",10.1002/adma.201400334
J,"Notomi, M",Theory of light propagation in strongly modulated photonic crystals: Refractionlike behavior in the vicinity of the photonic band gap,"Although light propagation in weakly modulated photonic crystals is basically similar to propagation in a diffraction grating in which conventional refractive index loses its meaning, we demonstrate that light propagation in strongly modulated two-dimensional (2D)/3D photonic crystals becomes refractionlike in the vicinity of the photonic bandgap. Such a crystal behaves as a material having an effective refractive index controllable by the band structure. This situation is analogous to the effective-mass approximation id electron-band theory. By utilizing this phenomenon, negatively refractive material can be realized, which has interesting optical properties such as mirror-image refraction.",10.1103/PhysRevB.62.10696
J,"van de Burgt, Y; Lubberman, E; Fuller, EJ; Keene, ST; Faria, GC; Agarwal, S; Marinella, MJ; Talin, AA; Salleo, A",A non-volatile organic electrochemical device as a low-voltage artificial synapse for neuromorphic computing,"The brain is capable of massively parallel information processing while consuming only similar to 1-100 fJ per synaptic event(1,2). Inspired by the efficiency of the brain, CMOS-based neural architectures(3) and memristors(4,5) are being developed for pattern recognition and machine learning. However, the volatility, design complexity and high supply voltages for CMOS architectures, and the stochastic and energy-costly switching of memristors complicate the path to achieve the interconnectivity, information density, and energy efficiency of the brain using either approach. Here we describe an electrochemical neuromorphic organic device (ENODe) operating with a fundamentally different mechanism from existing memristors. ENODe switches at low voltage and energy (<10 pJ for 10(3) mu m(2) devices), displays >500 distinct, non-volatile conductance states within a similar to 1V range, and achieves high classification accuracy when implemented in neural network simulations. Plastic ENODes are also fabricated on flexible substrates enabling the integration of neuromorphic functionality in stretchable electronic systems(6,7). Mechanical flexibility makes ENODes compatible with three-dimensional architectures, opening a path towards extreme interconnectivity comparable to the human brain.",10.1038/NMAT4856
J,"Sivanantham, A; Ganesan, P; Shanmugam, S",Hierarchical NiCo<sub>2</sub>S<sub>4</sub> Nanowire Arrays Supported on Ni Foam: An Efficient and Durable Bifunctional Electrocatalyst for Oxygen and Hydrogen Evolution Reactions,"A recent approach for solar-to-hydrogen generation has been water electrolysis using efficient, stable, and inexpensive bifunctional electrocatalysts within strong electrolytes. Herein, the direct growth of 1D NiCo2S4 nanowire (NW) arrays on a 3D Ni foam (NF) is described. This NiCo2S4 NW/NF array functions as an efficient bifunctional electrocatalyst for overall water splitting with excellent activity and stability. The 3D-Ni foam facilitates the directional growth, exposing more active sites of the catalyst for electrochemical reactions at the electrode-electrolyte interface. The binder-free, self-made NiCo2S4 NW/NF electrode delivers a hydrogen production current density of 10 mA cm(-2) at an overpotential of 260 mV for the oxygen evolution reaction and at 210 mV (versus a reversible hydrogen electrode) for the hydrogen evolution reaction in 1 M KOH. This highly active and stable bifunctional electrocatalyst enables the preparation of an alkaline water electrolyzer that could deliver 10 mA cm(-2) under a cell voltage of 1.63 V. Because the nonprecious-metal NiCo2S4 NW/NF foam-based electrodes afford the vigorous and continuous evolution of both H-2 and O-2 at 1.68 V, generated using a solar panel, they appear to be promising water splitting devices for large-scale solar-to-hydrogen generation.",10.1002/adfm.201600566
J,"Nie, JF",Precipitation and Hardening in Magnesium Alloys,"Magnesium alloys have received an increasing interest in the past 12 years for potential applications in the automotive, aircraft, aerospace, and electronic industries. Many of these alloys are strong because of solid-state precipitates that are produced by an age-hardening process. Although some strength improvements of existing magnesium alloys have been made and some novel alloys with improved strength have been developed, the strength level that has been achieved so far is still substantially lower than that obtained in counterpart aluminum alloys. Further improvements in the alloy strength require a better understanding of the structure, morphology, orientation of precipitates, effects of precipitate morphology, and orientation on the strengthening and microstructural factors that are important in controlling the nucleation and growth of these precipitates. In this review, precipitation in most precipitation-hardenable magnesium alloys is reviewed, and its relationship with strengthening is examined. It is demonstrated that the precipitation phenomena in these alloys, especially in the very early stage of the precipitation process, are still far from being well understood, and many fundamental issues remain unsolved even after some extensive and concerted efforts made in the past 12 years. The challenges associated with precipitation hardening and age hardening are identified and discussed, and guidelines are outlined for the rational design and development of higher strength, and ultimately ultrahigh strength, magnesium alloys via precipitation hardening.",10.1007/s11661-012-1217-2
J,"Barlat, F; Brem, JC; Yoon, JW; Chung, K; Dick, RE; Lege, DJ; Pourgoghrat, F; Choi, SH; Chu, E",Plane stress yield function for aluminum alloy sheets - part 1: theory,"A new plane stress yield function that well describes the anisotropic behavior of sheet metals, in particular, aluminum alloy sheets, was proposed. The anisotropy of the function was introduced in the formulation using two linear transformations on the Cauchy stress tensor. It was shown that the accuracy of this new function was similar to that of other recently proposed non-quadratic yield functions. Moreover, it was proved that the function is convex in stress space. A new experiment was proposed to obtain one of the anisotropy coefficients. This new formulation is expected to be particularly suitable for finite element (FE) modeling simulations of sheet forming processes for aluminum alloy sheets. (C) 2002 Elsevier Science Ltd. All rights reserved.",10.1016/S0749-6419(02)00019-0
J,"Dal Corso, A",Pseudopotentials periodic table: From H to Pu,"We discuss the generation of a library of projector augmented-wave (PAW) and ultrasoft pseudopotentials (PPs) for all elements of the periodic table from H to Pu. The PPs are compared with two libraries: pslibrary.0.3.1 and the GBRV library (Garrity et al., 2013). The PPs are tested on the lattice constants of the fcc and bcc structures of the 63 elements of the GBRV library. The same parameters are used to generate fully relativistic PPs that are compared with the scalar relativistic PPs. The PPs of lanthanides and actinides are tested on all-electron data available in the literature. (C) 2014 Elsevier B.V. All rights reserved.",10.1016/j.commatsci.2014.07.043
J,"Ramasubramaniam, A",Large excitonic effects in monolayers of molybdenum and tungsten dichalcogenides,"Quasiparticle band structures and optical properties of MoS2, MoSe2, MoTe2, WS2, and WSe2 monolayers are studied using the GW approximation in conjunction with the Bethe-Salpeter equation (BSE). The inclusion of two-particle excitations in the BSE approach reveals the presence of two strongly bound excitons (A and B) below the quasiparticle absorption onset arising from vertical transitions between a spin-orbit-split valence band and the conduction band at the K point of the Brillouin zone. The transition energies for monolayer MoS2, in particular, are shown to be in excellent agreement with available absorption and photoluminescence measurements. Excitation energies for the remaining monolayers are predicted to lie in the range of 1-2 eV. Systematic trends are identified for quasiparticle band gaps, transition energies, and exciton binding energies within as well as across the Mo and W families of dichalcogenides. Overall, the results suggest that quantum confinement of carriers within monolayers can be exploited in conjunction with chemical composition to tune the optoelectronic properties of layered transition-metal dichalcogenides at the nanoscale.",10.1103/PhysRevB.86.115409
J,"Dickey, MD",Stretchable and Soft Electronics using Liquid Metals,"The use of liquid metals based on gallium for soft and stretchable electronics is discussed. This emerging class of electronics is motivated, in part, by the new opportunities that arise from devices that have mechanical properties similar to those encountered in the human experience, such as skin, tissue, textiles, and clothing. These types of electronics (e.g., wearable or implantable electronics, sensors for soft robotics, e-skin) must operate during deformation. Liquid metals are compelling materials for these applications because, in principle, they are infinitely deformable while retaining metallic conductivity. Liquid metals have been used for stretchable wires and interconnects, reconfigurable antennas, soft sensors, self-healing circuits, and conformal electrodes. In contrast to Hg, liquid metals based on gallium have low toxicity and essentially no vapor pressure and are therefore considered safe to handle. Whereas most liquids bead up to minimize surface energy, the presence of a surface oxide on these metals makes it possible to pattern them into useful shapes using a variety of techniques, including fluidic injection and 3D printing. In addition to forming excellent conductors, these metals can be used actively to form memory devices, sensors, and diodes that are completely built from soft materials. The properties of these materials, their applications within soft and stretchable electronics, and future opportunities and challenges are considered.",10.1002/adma.201606425
J,"Compton, BG; Lewis, JA",3D-Printing of Lightweight Cellular Composites,"A new epoxy-based ink is reported, which enables 3D printing of lightweight cellular composites with controlled alignment of multiscale, high-aspect-ratio fiber reinforcement to create hierarchical structures inspired by balsa wood. Young's modulus values up to 10 times higher than existing commercially available 3D-printed polymers are attainable, while comparable strength values are maintained.",10.1002/adma.201401804
J,"Padmavathy, N; Vijayaraghavan, R",Enhanced bioactivity of ZnO nanoparticles-an antimicrobial study,"In this study, we investigate the antibacterial activity of ZnO nanoparticles with various particle sizes. ZnO was prepared by the base hydrolysis of zinc acetate in a 2-propanol medium and also by a precipitation method using Zn(NO3)(2) and NaOH. The products were characterized by x-ray diffraction (XRD) analysis, transmission electron microscopy (TEM) and photoluminescence (PL) spectroscopy. Bacteriological tests such as minimum inhibitory concentration (MIC) and disk diffusion were performed in Luria-Bertani and nutrient agar media on solid agar plates and in liquid broth systems using different concentrations of ZnO by a standard microbial method for the first time. Our bacteriological study showed the enhanced biocidal activity of ZnO nanoparticles compared with bulk ZnO in repeated experiments. This demonstrated that the bactericidal efficacy of ZnO nanoparticles increases with decreasing particle size. It is proposed that both the abrasiveness and the surface oxygen species of ZnO nanoparticles promote the biocidal properties of ZnO nanoparticles.",10.1088/1468-6996/9/3/035004
J,"Chen, WT; Zhu, AY; Sanjeev, V; Khorasaninejad, M; Shi, ZJ; Lee, E; Capasso, F",A broadband achromatic metalens for focusing and imaging in the visible,"A key goal of metalens research is to achieve wavefront shaping of light using optical elements with thicknesses on the order of the wavelength. Such miniaturization is expected to lead to compact, nanoscale optical devices with applications in cameras, lighting, displays and wearable optics. However, retaining functionality while reducing device size has proven particularly challenging. For example, so far there has been no demonstration of broadband achromatic metalenses covering the entire visible spectrum. Here, we show that by judicious design of nanofins on a surface, it is possible to simultaneously control the phase, group delay and group delay dispersion of light, thereby achieving a transmissive achromatic metalens with large bandwidth. We demonstrate diffraction-limited achromatic focusing and achromatic imaging from 470 to 670 nm. Our metalens comprises only a single layer of nanostructures whose thickness is on the order of the wavelength, and does not involve spatial multiplexing or cascading. While this initial design (numerical aperture of 0.2) has an efficiency of about 20% at 500 nm, we discuss ways in which our approach may be further optimized to meet the demand of future applications.",10.1038/s41565-017-0034-6
J,"Wu, JJ; Liu, SC",Low-temperature growth of well-aligned ZnO nanorods by chemical vapor deposition,"1D single-crystalline zinc oxide nanostructures are promising for nanoscale optoelectronic applications. Here a simple chemical vapor deposition method for the growth of well-aligned ZnO nanorods (see Figure) at low temperature is demonstrated. The nanorods, which grow on fused silica and are preferentially oriented in the c-axis direction, are strongly UV light emitting, peaking at around 386 nm at room temperature. [GRAPHICS] Low-Temperature Growth of Well-Aligned ZnO Nanorods by Chemical Vapor Deposition.",10.1002/1521-4095(20020205)14:3<215::AID-ADMA215>3.0.CO;2-J
J,"Vetrone, F; Naccache, R; Zamarrón, A; de la Fuente, AJ; Sanz-Rodríguez, F; Maestro, LM; Rodriguez, EM; Jaque, D; Solé, JG; Capobianco, JA",Temperature Sensing Using Fluorescent Nanothermometers,"Acquiring the temperature of a single living cell is not a trivial task. In this paper, we devise a novel nanothermometer, capable of accurately determining the temperature of solutions as well as biological systems such as HeLa cancer cells. The nanothermometer is based on the temperature-sensitive fluorescence of NaYF4:Er3+,Yb3+ nanoparticles, where the intensity ratio of the green fluorescence bands of the Er3+ dopant ions (H-2(11/2) -> I-4(15/2) and S-4(3/2) -> I-4(15/2)) changes with temperature. The nanothermometers were first used to obtain thermal profiles created when heating a colloidal solution of NaYF4:Er3+,Yb3+ nanoparticles in water using a pump-probe experiment. Following incubation of the nanoparticles with HeLa cervical cancer cells and their subsequent uptake, the fluorescent nanothermometers measured the internal temperature of the living cell from 25 degrees C to its thermally induced death at 45 degrees C.",10.1021/nn100244a
