Publication Type,Authors,Title,Abstract,DOI
J,"Tada, H; Mitsui, T; Kiyonaga, T; Akita, T; Tanaka, K",All-solid-state Z-scheme in CdS-Au-TiO<sub>2</sub> three-component nanojunction system,"Natural photosynthesis, which achieves efficient solar energy conversion through the combined actions of many types of molecules ingeniously arranged in a nanospace, highlights the importance of a technique for site-selective coupling of different materials to realize artificial high-efficiency devices(1). In view of increasingly serious energy and environmental problems, semiconductor-based artificial photosynthetic systems consisting of isolated photochemical system 1 (PS1), PS2 and the electron-transfer system have recently been developed(2,3). However, the direct coupling of the components is crucial for retarding back reactions to increase the reaction efficiency. Here, we report a simple technique for forming an anisotropic CdS-Au-TiO2 nanojunction, in which PS1(CdS), PS2(TiO2) and the electron-transfer system (Au) are spatially fixed. This three-component system exhibits a high photocatalytic activity, far exceeding those of the single- and two-component systems, as a result of vectorial electron transfer driven by the two-step excitation of TiO2 and CdS.",10.1038/nmat1734
J,"Chen, YZ; Wang, CM; Wu, ZY; Xiong, YJ; Xu, Q; Yu, SH; Jiang, HL",From Bimetallic Metal-Organic Framework to Porous Carbon: High Surface Area and Multicomponent Active Dopants for Excellent Electrocatalysis,"Bimetallic metal-organic frameworks are rationally synthesized as templates and employed for porous carbons with retained morphology, high graphitization degree, hierarchical porosity, high surface area, CoNx moiety and uniform N/Co dopant by pyrolysis. The optimized carbon with additional phosphorus dopant exhibits excellent electrocatalytic performance for the oxygen reduction reaction, which is much better than the benchmark Pt/C in alkaline media.",10.1002/adma.201502315
J,"Liu, JP; Jiang, J; Cheng, CW; Li, HX; Zhang, JX; Gong, H; Fan, HJ",Co<sub>3</sub>O<sub>4</sub> Nanowire@MnO<sub>2</sub> Ultrathin Nanosheet Core/Shell Arrays: A New Class of High-Performance Pseudocapacitive Materials,A smart hybrid nanowire array consisting of Co3O4 porous nanowire core and a MnO2 ultrathin nanosheet shell is fabricated using a general 3D interfacial carbon-assisted hydrothermal method. The array exhibits a high capacitance with good cycle performance and remarkable rate capability that is ranging among the best reported to date for hybrid metal oxide systems in the absence of a conducting matrix.,10.1002/adma.201100058
J,"Ni, ZY; Liu, QH; Tang, KC; Zheng, JX; Zhou, J; Qin, R; Gao, ZX; Yu, DP; Lu, J",Tunable Bandgap in Silicene and Germanene,"By using ab initio calculations, we predict that a vertical electric field is able to open a band gap in semimetallic single-layer buckled silicene and germanene. The sizes of the band gap in both silicene and germanene increase linearly with the electric field strength. Ab initio quantum transport simulation of a dual-gated silicene field effect transistor confirms that the vertical electric field opens a transport gap, and a significant switching effect by an applied gate voltage is also observed. Therefore, biased single-layer silicene and germanene can work effectively at room temperature as field effect transistors.",10.1021/nl203065e
J,"Fu, J; Cano, ZP; Park, MG; Yu, AP; Fowler, M; Chen, ZW","Electrically Rechargeable Zinc-Air Batteries: Progress, Challenges, and Perspectives","Zinc-air batteries have attracted much attention and received revived research efforts recently due to their high energy density, which makes them a promising candidate for emerging mobile and electronic applications. Besides their high energy density, they also demonstrate other desirable characteristics, such as abundant raw materials, environmental friendliness, safety, and low cost. Here, the reaction mechanism of electrically rechargeable zinc-air batteries is discussed, different battery configurations are compared, and an in depth discussion is offered of the major issues that affect individual cellular components, along with respective strategies to alleviate these issues to enhance battery performance. Additionally, a section dedicated to battery-testing techniques and corresponding recommendations for best practices are included. Finally, a general perspective on the current limitations, recent application-targeted developments, and recommended future research directions to prolong the lifespan of electrically rechargeable zinc-air batteries is provided.",10.1002/adma.201604685
J,"Perrault, SD; Walkey, C; Jennings, T; Fischer, HC; Chan, WCW",Mediating Tumor Targeting Efficiency of Nanoparticles Through Design,"Here we systematically examined the effect of nanoparticle size (10-100 nm) and surface chemistry (i.e., poly(ethylene glycol)) on passive targeting of tumors in vivo. We found that the physical and chemical properties of the nanoparticles influenced their pharmacokinetic behavior, which ultimately determined their tumor accumulation capacity. Interestingly, the permeation of nanoparticles within the tumor is highly dependent on the overall size of the nanoparticle, where larger nanoparticles appear to stay near the vasculature while smaller nanoparticles rapidly diffuse throughout the tumor matrix. Our results provide design parameters for engineering nanoparticles for optimized tumor targeting of contrast agents and therapeutics.",10.1021/nl900031y
J,"Wang, GX; Shen, XP; Yao, J; Park, J",Graphene nanosheets for enhanced lithium storage in lithium ion batteries,"Graphene nanosheets were synthesized in large quantities using a chemical approach. Field emission electron microscope observation revealed that loose graphene nanosheets agglomerated and crumpled naturally into shapes resembling flower-petals. High resolution transmission electron microscope analysis, Raman spectroscopy and ultraviolet-visible spectroscopy measurements confirmed the graphitic crystalline structure of the graphene nanosheets. The nanosheets exhibited an enhanced lithium storage capacity as anodes in lithium-ion cells and good cyclic performance. (C) 2009 Elsevier Ltd. All rights reserved.",10.1016/j.carbon.2009.03.053
J,"Al-Saleh, MH; Sundararaj, U",Electromagnetic interference shielding mechanisms of CNT/polymer composites,"The electromagnetic interference (EMI) shielding mechanisms of multi-walled carbon nanotube (MWCNT)/polymer composites were analyzed experimentally and theoretically. For the experimental analysis, EMI shielding effectiveness (SE) of MWCNT/polypropylene (PP) composite plates made in three different thicknesses and at four different concentrations were studied. A model based on the shielding of electromagnetic plane wave was used to theoretically study the EMI shielding mechanisms. The experimental results showed that absorption is the major shielding mechanism and reflection is the secondary shielding mechanism. The modeling results demonstrated that multiple-reflection within MWCNT internal surfaces and between MWCNT external surfaces decrease the overall EMI SE. The EMI SE of MWCNT/PP composites increased with increase in MWCNT content and shielding plate thickness. (C) 2009 Elsevier Ltd. All rights reserved.",10.1016/j.carbon.2009.02.030
J,"Ma, KK; Wen, HM; Hu, T; Topping, TD; Isheim, D; Seidman, DN; Lavernia, EJ; Schoenung, JM",Mechanical behavior and strengthening mechanisms in ultrafine grain precipitation-strengthened aluminum alloy,"To provide insight into the relationships between precipitation phenomena, grain size and mechanical behavior in a complex precipitation-strengthened alloy system, Al 7075 alloy, a commonly used aluminum alloy, was selected as a model system in the present study. Ultrafine-grained (UFG) bulk materials were fabricated through cryomilling, degassing, hot isostatic pressing and extrusion, followed by a subsequent heat treatment. The mechanical behavior and microstructure of the materials were analyzed and compared directly to the coarse-grained (CG) counterpart. Three-dimensional atom-probe tomography was utilized to investigate the intermetallic precipitates and oxide dispersoids formed in the as-extruded UFG material. UFG 7075 exhibits higher strength than the CG 7075 alloy for each equivalent condition. After a T6 temper, the yield strength (YS) and ultimate tensile strength (UTS) of UFG 7075 achieved 734 and 774 MPa, respectively, which are similar to 120 MPa higher than those of the CG equivalent. The strength of as-extruded UFG 7075 (YS: 583 MPa, UTS: 631 MPa) is even higher than that of commercial 7075-T6. More importantly, the strengthening mechanisms in each material were established quantitatively for the first time for this complex precipitation-strengthened system, accounting for grain-boundary, dislocation, solid-solution, precipitation and oxide dispersoid strengthening contributions. Grain-boundary strengthening was the predominant mechanism in as-extruded UFG 7075, contributing a strength increment estimated to be 242 MPa, whereas Orowan precipitation strengthening was predominant in the as-extruded CG 7075 (similar to 102 MPa) and in the T6-tempered materials, and was estimated to contribute 472 and 414 MPa for CG-T6 and UFG-T6, respectively. (C) 2013 Acta Materialia Inc. Published by Elsevier Ltd. All rights reserved.",10.1016/j.actamat.2013.09.042
J,"Wu, ZS; Winter, A; Chen, L; Sun, Y; Turchanin, A; Feng, XL; Müllen, K",Three-Dimensional Nitrogen and Boron Co-doped Graphene for High-Performance All-Solid-State Supercapacitors,,10.1002/adma.201201948
J,"Liu, ZK; Jiang, J; Zhou, B; Wang, ZJ; Zhang, Y; Weng, HM; Prabhakaran, D; Mo, SK; Peng, H; Dudin, P; Kim, T; Hoesch, M; Fang, Z; Dai, X; Shen, ZX; Feng, DL; Hussain, Z; Chen, YL",A stable three-dimensional topological Dirac semimetal Cd<sub>3</sub>As<sub>2</sub>,"Three-dimensional (3D) topological Dirac semimetals (TDSs) are a recently proposed state of quantum matter(1-6) that have attracted increasing attention in physics and materials science. A 3D TDS is not only a bulk analogue of graphene; it also exhibits non-trivial topology in its electronic structure that shares similarities with topological insulators. Moreover, a TDS can potentially be driven into other exotic phases (such as Weyl semimetals(1,7), axion insulators(1,4) and topological superconductors(8,9)), making it a unique parent compound for the study of these states and the phase transitions between them. Here, by performing angle-resolved photoemission spectroscopy, we directly observe a pair of 3D Dirac fermions in Cd3As2, proving that it is a model 3D TDS. Compared with other 3D TDSs, for example, beta-cristobalite BiO2 (ref. 3) and Na3Bi (refs 4,5), Cd3As2 is stable and has much higher Fermi velocities. Furthermore, by in situ doping we have been able to tune its Fermi energy, making it a flexible platform for exploring exotic physical phenomena.",10.1038/NMAT3990
J,"Kim, YH; Sachse, C; Machala, ML; May, C; Müller-Meskamp, L; Leo, K",Highly Conductive PEDOT:PSS Electrode with Optimized Solvent and Thermal Post-Treatment for ITO-Free Organic Solar Cells,"Highly conductive poly(3,4-ethylenedioxythiophene):poly(styrenesulfonate) (PEDOT:PSS) films as stand-alone electrodes for organic solar cells have been optimized using a solvent post-treatment method. The treated PEDOT: PSS films show enhanced conductivities up to 1418 S cm(-1), accompanied by structural and chemical changes. The effect of the solvent treatment on PEDOT: PSS has been investigated in detail and is shown to cause a reduction of insulating PSS in the conductive polymer layer. Using these optimized electrodes, ITO-free, small molecule organic solar cells with a zinc phthalocyanine (ZnPc): fullerene C-60 bulk heterojunction have been produced on glass and PET substrates. The system was further improved by pre-heating the PEDOT: PSS electrodes, which enhanced the power conversion efficiency to the values obtained for solar cells on ITO electrodes. The results show that optimized PEDOT: PSS with solvent and thermal post-treatment can be a very promising electrode material for highly efficient flexible ITO-free organic solar cells.",10.1002/adfm.201002290
J,"Durkop, T; Getty, SA; Cobas, E; Fuhrer, MS",Extraordinary mobility in semiconducting carbon nanotubes,"Semiconducting carbon nanotube transistors with channel lengths exceeding 300 microns have been fabricated. In these long transistors, carrier transport is diffusive and the channel resistance dominates the transport. Transport characteristics are used to extract the field-effect mobility (79 000 cm(2)/Vs) and estimate the intrinsic mobility (>100 000 cm(2)/Vs) at room temperature. These values exceed those for all known semiconductors, which bodes well for application of nanotubes in high-speed transistors, single- and few-electron memories, and chemical/biochemical sensors.",10.1021/nl034841q
J,"van de Walle, A; Asta, M; Ceder, G",The Alloy Theoretic Automated Toolkit: A user guide,"Although the formalism that allows-the calculation of alloy-thermodynamic properties from first-principles has been known for decades, its practical implementation has so far remained a tedious process. The Alloy Theoretic Automated Toolkit (ATAT) drastically simplifies this procedure by implementing decision rules based on formal statistical analysis that frees the researchers from a constant monitoring during the calculation process and automatically ""glues"" together the input and the output of various codes, in order to provide a. high-level interface to the calculation of alloy thermodynamic properties from first-principles. ATAT implements the Structure Inversion Method (SIM), also known as the Connolly-Williams method, in combination with semi-grand-canonical Monte Carlo simulations. In order to make this powerful toolkit available to the wide community of researchers who could benefit from,it, this article present-a concise user guide outlining the steps required to obtain thermodynamic information from ab initio calculations. (C) 2003 Elsevier Science Ltd. All rights reserved.",10.1016/S0364-5916(02)80006-2
J,"Jana, NR; Gearheart, L; Murphy, CJ",Seeding growth for size control of 5-40 nm diameter gold nanoparticles,"Following a seeding growth approach, gold nanoparticles of diameters 5-40 nm were prepared with 10-15% standard deviation in diameter from 3.5 +/- 0.7 nm gold particle seeds. Particle size can be controlled by varying the ratio of seed to metal salt, and thus any size in the range 5-40 mn can be prepared. The method can also be scaled up to produce 10-100 mg of gold nanoparticles.",10.1021/la0104323
J,"Mouri, S; Miyauchi, Y; Matsuda, K",Tunable Photoluminescence of Monolayer MoS<sub>2</sub> via Chemical Doping,We demonstrate the tunability of the photoluminescence (PL) properties of monolayer (1L)-MoS2 via chemical doping. The PL intensity of 1L-MoS2 was drastically enhanced by the adsorption of p-type dopants with high electron affinity but reduced by the adsorption of n-type dopants. This PL modulation results from switching between exciton PL and trion PL depending on carrier density in 1L-MoS2. Achievement of the extraction and injection of carriers in 1L-MoS2 by this solution-based chemical doping method enables convenient control of optical and electrical properties of atomically thin MoS2.,10.1021/nl403036h
J,"Juenger, MCG; Winnefeld, F; Provis, JL; Ideker, JH",Advances in alternative cementitious binders,"There is a burgeoning interest in the development, characterization, and implementation of alternatives to Portland cement as a binder in concrete. The construction materials industry is under increasing pressure to reduce the energy used in production of Portland cement clinker and the associated greenhouse gas emissions. Further, Portland cement is not the ideal binder for all construction applications, as it suffers from durability problems in particularly aggressive environments. Several alternative binders have been available for almost as long as Portland cement, yet have not been extensively used, and new ones are being developed. In this paper, four promising binders available as alternatives to Portland cement are discussed, namely calcium aluminate cement, calcium sulfoaluminate cement, alkali-activated binders, and supersulfated cements. The history of the binders, their compositions and reaction mechanisms, benefits and drawbacks, unanswered questions, and primary challenges are described. (C) 2010 Elsevier Ltd. All rights reserved.",10.1016/j.cemconres.2010.11.012
J,"De Jong, WH; Hagens, WI; Krystek, P; Burger, MC; Sips, AJAM; Geertsma, RE",Particle size-dependent organ distribution of gold nanoparticles after intravenous administration,"A kinetic study was performed to determine the influence of particle size on the in vivo tissue distribution of spherical-shaped gold nanoparticles in the rat. Gold nanoparticles were chosen as model substances as they are used in several medical applications. In addition, the detection of the presence of gold is feasible with no background levels in the body in the normal situation. Rats were intravenously injected in the tail vein with gold nanoparticles with a diameter of 10, 50, 100 and 250 nm, respectively. After 24 h, the rats were sacrificed and blood and various organs were collected for gold determination. The presence of gold was measured quantitatively with inductively coupled plasma mass spectrometry (ICP-MS). For all gold nanoparticle sizes the majority of the gold was demonstrated to be present in liver and spleen. A clear difference was observed between the distribution of the 10 rum particles and the larger particles. The 10 rum particles were present in various organ systems including blood, liver, spleen, kidney, testis, thymus, heart, lung and brain, whereas the larger particles were only detected in blood, liver and spleen. The results demonstrate that tissue distribution of gold nartoparticles is size-dependent with the smallest 10 run nanoparticles showing the most widespread organ distribution. (C) 2008 Elsevier Ltd. All rights reserved.",10.1016/j.biomaterials.2007.12.037
J,"Hu, H; Zhao, ZB; Wan, WB; Gogotsi, Y; Qiu, JS",Ultralight and Highly Compressible Graphene Aerogels,,10.1002/adma.201204530
J,"Yu, YJ; Zhao, Y; Ryu, S; Brus, LE; Kim, KS; Kim, P",Tuning the Graphene Work Function by Electric Field Effect,"We report variation of the work function for single and bilayer graphene devices measured by scanning Kelvin probe microscopy (SKPM). By use of the electric field effect, the work function of graphene can be adjusted as the gate voltage tunes the Fermi level across the charge neutrality point, Upon biasing the device, the surface potential map obtained by SKPM provides a reliable way to measure the contact resistance of individual electrodes contacting graphene.",10.1021/nl901572a
J,"Tang, ZY; Kotov, NA; Magonov, S; Ozturk, B",Nanostructured artificial nacre,"Finding a synthetic pathway to artificial analogs of nacre and bones represents a fundamental milestone in the development of composite materials. The ordered brick-and-mortar arrangement of organic and inorganic layers is believed to be the most essential strength- and toughness-determining structural feature of nacre. It has also been found that the ionic crosslinking of tightly folded macromolecules is equally important. Here, we demonstrate that both structural features can be reproduced by sequential deposition of polyelectrolytes and clays. This simple process results in a nanoscale version of nacre with alternating organic and inorganic layers. The macromolecular folding effect reveals itself in the unique saw-tooth pattern of differential stretching curves attributed to the gradual breakage of ionic crosslinks in polyelectrolyte chains. The tensile strength of the prepared multilayers approached that of nacre, whereas their ultimate Young modulus was similar to that of lamellar bones. Structural and functional resemblance makes clay polyelectrolyte multilayers a close replica of natural biocomposites. Their nanoscale nature enables elucidation of molecular processes occurring under stress.",10.1038/nmat906
J,"Xu, JJ; Wang, K; Zu, SZ; Han, BH; Wei, ZX",Hierarchical Nanocomposites of Polyaniline Nanowire Arrays on Graphene Oxide Sheets with Synergistic Effect for Energy Storage,"We introduced a facile method to construct hierarchical nanocomposites by combining one-dimensional (1D) conducting polyaniline (PANI) nanowires with 2D graphene oxide (GO) nanosheets. PANI nanowire arrays are aligned vertically on GO substrate. The morphologies of PANI nanowires can be controlled by adjusting the ratios of aniline to GO, which are attributed to different nucleation processes. The hierarchical nanocomposite structures of PANI GO were further proved by UV-vis, FTIR, and XRD measurements. The hierarchical nanocomposite possessed higher electrochemical capacitance and better stability than each individual component as supercapacitor electrode materials, showing a synergistic effect of PANI and GO. This study will further guide the preparation of functional nanocomposites by combining different dimensional nanomaterials.",10.1021/nn1006539
J,"Sun, J; Lee, HW; Pasta, M; Yuan, HT; Zheng, GY; Sun, YM; Li, YZ; Cui, Y",A phosphorene-graphene hybrid material as a high-capacity anode for sodium-ion batteries,"Sodium-ion batteries have recently attracted significant attention as an alternative to lithium-ion batteries because sodium sources do not present the geopolitical issues that lithium sources might. Although recent reports on cathode materials for sodium-ion batteries have demonstrated performances comparable to their lithium-ion counterparts, the major scientific challenge for a competitive sodium-ion battery technology is to develop viable anode materials. Here we show that a hybrid material made out of a few phosphorene layers sandwiched between graphene layers shows a specific capacity of 2,440 mA h g(-1) (calculated using the mass of phosphorus only) at a current density of 0.05 A g(-1) and an 83% capacity retention after 100 cycles while operating between 0 and 1.5 V. Using in situ transmission electron microscopy and ex situ X-ray diffraction techniques, we explain the large capacity of our anode through a dual mechanism of intercalation of sodium ions along the x axis of the phosphorene layers followed by the formation of a Na3P alloy. The presence of graphene layers in the hybrid material works as a mechanical backbone and an electrical highway, ensuring that a suitable elastic buffer space accommodates the anisotropic expansion of phosphorene layers along the y and z axial directions for stable cycling operation.",10.1038/NNANO.2015.194
J,"Suk, JW; Kitt, A; Magnuson, CW; Hao, YF; Ahmed, S; An, JH; Swan, AK; Goldberg, BB; Ruoff, RS",Transfer of CVD-Grown Monolayer Graphene onto Arbitrary Substrates,"Reproducible dry and wet transfer techniques were developed to improve the transfer of large-area monolayer graphene grown on copper foils by chemical vapor deposition (CVD). The techniques reported here allow transfer onto three different classes of substrates: substrates covered with shallow depressions, perforated substrates, and flat substrates. A novel dry, transfer technique was used to make graphene-sealed microchambers without trapping-liquid inside. The dry transfer technique utilizes a polydimethylsiloxane frame that attaches to the poly(methyl methacrylate) spun over the graphene film, and the monolayer graphene was transferred onto shallow depressions with 300 nm depth. The improved wet transfer onto perforated substrates with 2.7 mu m diameter holes yields 98% coverage of holes covered with continuous films, allowing the ready use of Raman spectroscopy and transmission electron microscopy to study the intrinsic properties of CVD-grown monolayer graphene. Additionally, monolayer graphene transferred onto flat substrates has fewer cracks and tears, as well as lower sheet resistance than previous transfer techniques. Monolayer graphene films transferred onto glass had a sheet resistance of similar to 980 Omega/sq and a transmittance of 97.6%. These transfer techniques open up possibilities for the fabrication of various graphene devices with unique configurations and enhanced performance.",10.1021/nn201207c
J,"Agnew, SR; Yoo, MH; Tomé, CN",Application of texture simulation to understanding mechanical behavior of Mg and solid solution alloys containing Li or Y,"The viscoplastic self-consistent model was used to interpret differences in the mechanical behavior of hexagonal close packed magnesium alloys. There are only subtle differences in the compression textures of magnesium and its solid solution alloys containing lithium or yttrium. However, the plane strain compression textures of the alloys showed an increasing tendency for the basal poles to rotate away from the ""normal direction"" towards the ""rolling direction"". Texture simulations enabled these distinctions to be attributed to the increased activity of the non-basal (c + a) slip mode. The alloys had improved compressive ductilities compared to pure magnesium, and the increased c + a slip mode activity provides a satisfying explanation for this improvement, since it can accommodate c-axis compression within individual grains. Accounting for individual deformation mode hardening enabled the flow curves to be simulated and the anisotropic plastic response of textured wrought alloys to be mechanistically understood and predicted. (C) 2001 Acta Materialia Inc. Published by Elsevier Science Ltd. All rights reserved.",10.1016/S1359-6454(01)00297-X
