Publication Type,Authors,Title,Abstract,DOI
J,"Yoon, Y; Ganapathi, K; Salahuddin, S",How Good Can Monolayer MoS<sub>2</sub> Transistors Be?,"Monolayer molybdenum disulfide (MoS2), unlike its bulk form, is a direct band gap semiconductor with a band gap of 1.8 eV. Recently, field-effect transistors have been demonstrated experimentally using a mechanically exfoliated MoS2 monolayer, showing promising potential for next generation electronics. Here we project the ultimate performance limit of MoS2 transistors by using nonequilibrium Green's function based quantum transport simulations. Our simulation results show that the strength of MoS2 transistors lies in large ON-OFF current ratio (>10(10)), immunity to short channel effects (drain-induced barrier lowering similar to 10 mV/V), and abrupt switching (subthreshold swing as low as 60 mV/decade). Our comparison of monolayer MoS2 transistors to the state-of-the-art III-V materials based transistors, reveals that while MoS2 transistors may not be ideal for high-performance applications due to heavier electron effective mass (m* = 0.45m(0)) and a lower mobility, they can be an attractive alternative for low power applications thanks to the large band gap and the excellent electrostatic integrity inherent in a two-dimensional system.",10.1021/nl2018178
J,"Lee, H; Rho, J; Messersmith, PB",Facile Conjugation of Biomolecules onto Surfaces via Mussel Adhesive Protein Inspired Coatings,"A new surface bioconjugation strategy is presented. A polydopamine surface coating provides chemical activation on material surfaces, is resistant to hydrolysis, and offers selectivity in coupling of biomolecules via nucleophilic groups through simple pH control. Control of orientation of immobilized biomolecules may be possible using terminally modified DNA or His-containing proteins.",10.1002/adma.200801222
J,"Abashian, A; Abe, K; Abe, R; Abe, K; Adachi, I; Ahn, BS; Ahn, HS; Aihara, H; Akatsu, M; Akhmetshin, R; Alexander, JP; Alimonti, G; An, Q; Aoki, K; Asai, M; Asano, Y; Aso, T; Aulchenko, V; Bakich, AM; Banas, E; Behari, S; Behera, PK; Beiline, D; Bondar, A; Bozek, A; Browder, TE; Casey, BCK; Chang, P; Chang, YH; Chao, Y; Chen, HS; Chen, HF; Chen, YQ; Cheon, BG; Chidzik, S; Choi, S; Choi, Y; Dneprovsky, L; Doi, Y; Dong, LY; Dragic, J; Drutskoy, A; Eidelman, S; Enomoto, R; Everton, CW; Fang, F; Fujii, H; Fujimoto, K; Fujita, Y; Fukunaga, C; Fukushima, M; Funahashi, Y; Garmash, A; Gordon, A; Gotow, K; Goriletsky, VI; Grinyov, BV; Guler, H; Guo, RS; Haba, J; Haitani, F; Hamasaki, H; Hanada, H; Hanagaki, K; Hara, K; Hara, T; Haruyama, T; Hastings, NC; Hayashi, K; Hayashii, H; Hazumi, M; Heenan, EM; Higashi, Y; Higuchi, T; Hikita, S; Hirai, T; Hirano, H; Hirose, M; Hitomi, N; Hojo, T; Hoshi, Y; Hoshina, K; Hou, WS; Hsu, SC; Huang, HC; Huang, TJ; Ichizawa, S; Igarashi, S; Igarashi, Y; Iijima, T; Ikeda, H; Ikeda, H; Inami, K; Inoue, Y; Ishikawa, A; Ishino, H; Itami, S; Itoh, R; Iwai, G; Iwai, M; Iwasaki, H; Iwasaki, Y; Jackson, D; Jang, HK; Jalocha, P; Jones, M; Joo, KK; Kagan, R; Kakuno, H; Kaneko, J; Kang, JS; Kang, JH; Kani, T; Kapusta, P; Kasami, K; Katayama, N; Kawai, H; Kawai, H; Kawai, M; Kawamura, N; Kawasaki, T; Kichimi, H; Kim, CH; Kim, DW; Kim, HJ; Kim, H; Kim, H; Kim, SK; Kinoshita, K; Kobayashi, S; Kobayashi, T; Koike, S; Kondo, Y; Korotushenko, K; Kumar, S; Kuniya, T; Kurihara, E; Kuzmin, A; Kwon, YJ; Lange, J; Lee, MC; Lee, MH; Lee, SH; Leonidopoulos, C; Li, J; Li, Y; Liu, HM; Liu, T; Lu, RS; Lyubinsky, VR; Makida, Y; Mamada, H; Manabe, A; Mao, ZP; Marlow, D; Matsuda, T; Matsubara, T; Matsumoto, S; Matsumoto, T; Matsuo, H; Mindas, C; Miyabayashi, K; Miyake, H; Miyata, H; Mohapatra, A; Moffitt, LC; Moloney, GR; Moorhead, GF; Morgan, N; Mori, S; Murakami, A; Murakami, T; Nagai, I; Nagamine, T; Nagasaka, Y; Nagashima, Y; Nagayama, S; Nakadaira, T; Nakamura, T; Nakano, E; Nakao, M; Nakajima, M; Nakajima, T; Nam, JW; Narita, S; Natkaniec, Z; Neichi, K; Nishida, S; Nitoh, O; Noguchi, S; Nomura, T; Nozaki, T; Ogawa, K; Ogawa, S; Ohkubo, R; Ohnishi, Y; Ohshima, Y; Okabe, T; Okazaki, N; Okuno, S; Olsen, SL; Ooba, T; Ohshima, T; Ostrowicz, W; Ozaki, H; Pakhlov, P; Palka, H; Panova, AI; Park, CS; Park, CW; Park, H; Peak, LS; Peng, JC; Peng, KC; Peters, M; Piilonen, L; Prebys, E; Rabberman, R; Rodriguez, JL; Romanov, L; Root, N; Rosen, M; Rosanska, M; Rybicki, K; Ryuko, J; Sagawa, H; Sahu, S; Saito, M; Sakai, Y; Sakamoto, H; Sanda, W; Sanpei, M; Sasaki, T; Sasao, N; Satpathy, A; Satapathy, M; Sato, N; Schrenk, S; Semenov, S; Senyo, K; Sevior, ME; Shakhova, KV; Shen, DZ; Shibuya, H; Shimada, K; Shpilinskaya, LI; Shwartz, B; Sidorov, A; Sidorov, V; Singh, J; Stanic, S; Stock, R; Suda, R; Sugi, A; Sugiyama, A; Suitoh, S; Sumisawa, K; Sumiyoshi, T; Sung, HF; Suzuki, J; Suzuki, JI; Suzuki, K; Suzuki, S; Suzuki, SY; Swain, S; Tajima, H; Takahashi, S; Takahashi, T; Takasaki, F; Takayama, T; Tan, N; Takita, M; Tamai, K; Tamura, N; Tanaka, J; Tanaka, M; Tanaka, Y; Tatomi, T; Taylor, GN; Teramoto, Y; Tomoto, M; Tomura, T; Tovey, SN; Trabelsi, K; Tsai, KL; Tsuboyama, T; Tsujita, Y; Tsukada, K; Tsukamoto, T; Tsukamoto, T; Uehara, S; Ueki, M; Ueno, K; Ujiie, N; Unno, Y; Uno, S; Ushiroda, Y; Usov, Y; Varner, G; Varvell, KE; Vinograd, EL; Wang, CH; Wang, CC; Wang, MZ; Wang, YF; Watanabe, M; Watanabe, Y; Wixted, R; Won, E; Xu, ZZ; Yabsley, B; Yamada, Y; Yamaga, M; Yamaguchi, A; Yamaguchi, H; Yamaki, T; Yamamoto, H; Yamanaka, T; Yamaoka, H; Yamaoka, Y; Yamashita, Y; Yamauchi, M; Yan, DS; Yanaka, S; Ye, SW; Yin, ZW; Yokoyama, M; Yokoyama, T; Yoshida, K; Yoshimura, Y; Yu, CX; Yuta, H; Zaslavsky, BG; Zhang, CC; Zhang, J; Zhang, SQ; Zhang, ZP; Zhao, H; Zhao, ZG; Zheng, YH; Zheng, ZP; Zhilich, V; Zontar, D",The Belle detector,"The Belle detector was designed and constructed to carry out quantitative studies of rare B-meson decay modes with very small branching fractions using an asymmetric e(+)e(-) collider operating at the Y(4S) resonance, the KEK-B-factory. Such studies require data samples containing similar to10(7) B-meson decays. The Belle detector is configured around a 1.5 T superconducting solenoid and iron structure surrounding the KEK-B beams at the Tsukuba interaction region. B meson decay vertices are measured by a silicon vertex detector situated just outside of a cylindrical beryllium beam pipe. Charged particle tracking is performed by a wire drift chamber (CDC). Particle identification is provided by dE/dx measurements in CDC, aerogel threshold Cherenkov counter and time-of-flight counter placed radially outside or CDC. Electromagnetic showers are detected in an array of CsI(TI) crystals located inside the solenoid coil. Muons and K(L) mesons are identified by arrays of resistive plate counters interspersed in the iron yoke. The detector covers the 0 region extending from 17degrees to 150degrees, The part of the uncovered small-angle region is instrumented with a pair of BGO crystal arrays placed on the surfaces of the QCS cryostats in the forward and backward directions. Details of the design and development works of the detector subsystems, which include trigger, data acquisition and computer systems,are described. Results of performance of the detector subsystems are also presented. (C) 2002 Published by Elsevier Science B.V.",10.1016/S0168-9002(01)02013-7
J,"Dubbeldam, D; Calero, S; Ellis, DE; Snurr, RQ",RASPA: molecular simulation software for adsorption and diffusion in flexible nanoporous materials,"A new software package, RASPA, for simulating adsorption and diffusion of molecules in flexible nanoporous materials is presented. The code implements the latest state-of-the-art algorithms for molecular dynamics and Monte Carlo (MC) in various ensembles including symplectic/measure-preserving integrators, Ewald summation, configurational-bias MC, continuous fractional component MC, reactive MC and Baker's minimisation. We show example applications of RASPA in computing coexistence properties, adsorption isotherms for single and multiple components, self- and collective diffusivities, reaction systems and visualisation. The software is released under the GNU General Public License.",10.1080/08927022.2015.1010082
J,"Oganesyan, V; Huse, DA",Localization of interacting fermions at high temperature,"We suggest that if a localized phase at nonzero temperature T > 0 exists for strongly disordered and weakly interacting electrons, as recently argued, it will also occur when both disorder and interactions are strong and T is very high. We show that in this high-T regime, the localization transition may be studied numerically through exact diagonalization of small systems. We obtain spectra for one-dimensional lattice models of interacting spinless fermions in a random potential. As expected, the spectral statistics of finite-size samples cross over from those of orthogonal random matrices in the diffusive regime at weak random potential to Poisson statistics in the localized regime at strong randomness. However, these data show deviations from simple one-parameter finite-size scaling: the apparent mobility edge '' drifts '' as the system's size is increased. Based on spectral statistics alone, we have thus been unable to make a strong numerical case for the presence of a many-body localized phase at nonzero T.",10.1103/PhysRevB.75.155111
J,"Brayner, R; Ferrari-Iliou, R; Brivois, N; Djediat, S; Benedetti, MF; Fiévet, F",Toxicological impact studies based on <i>Escherichia coli</i> bacteria in ultrafine ZnO nanoparticles colloidal medium,"We report here preliminary studies of blocidal effects and cellular internalization of ZnO nanoparticles on Escherichia coli bacteria. ZnO nanoparticles were synthesized in di(ethylene glycol) (DEG) medium by forced hydrolysis of ionic Zn2+ salts. particle size and shape were controlled by addition of small molecules and macromolecules such as tri-n-octylphosphine oxide, sodium dodecyl sulfate, polyoxyethylene stearyl ether, and bovine serum albumin. Transmission electron microscopy (TEM) and X-ray diffraction analyses were used to characterize particle structure, size, and morphology. Bactericidal tests were performed in Luria-Bertani medium on solid agar plates and in liquid systems with different concentrations of small and macromolecules and also with ZnO nanoparticles. TEM analyses of bacteria thin sections were used to study biocidal action of ZnO materials. The results confirmed that E. coli cells after contact with DEG and ZnO were damaged showing a Gram-negative triple membrane disorganization. This behavior causes the increase of membrane permeability leading to accumulation of ZnO nanoparticles in the bacterial membrane and also cellular internalization of these nanoparticles.",10.1021/nl052326h
J,"Müller, J; Böscke, TS; Schröder, U; Mueller, S; Bräuhaus, D; Böttger, U; Frey, L; Mikolajick, T",Ferroelectricity in Simple Binary ZrO<sub>2</sub> and HfO<sub>2</sub>,"The transition metal oxides ZrO2 and HfO2 as well as their solid solution are widely researched and, like most binary oxides, are expected to exhibit centrosymmetric crystal structure and therewith linear dielectric characteristics. For this reason, those oxides, even though successfully introduced into microelectronics, were never considered to be more than simple dielectrics possessing limited functionality. Here we report the discovery of a field-driven ferroelectric phase transition in pure, sub 10 nm ZrO2 thin films and a composition- and temperature-dependent transition to a stable ferroelectric phase in the HfO2-ZrO2 mixed oxide. These unusual findings are attributed to a size-driven tetragonal to orthorhombic phase transition that in thin films, similar to the anticipated tetragonal to monoclinic transition, is lowered to room temperature. A structural investigation revealed the orthorhombic phase to be of space group Pbc2(1), whose noncentrosymmetric nature is deemed responsible for the spontaneous polarization in this novel, nanoscale ferroelectrics.",10.1021/nl302049k
J,"Di Piazza, A; Müller, C; Hatsagortsyan, KZ; Keitel, CH",Extremely high-intensity laser interactions with fundamental quantum systems,"The field of laser-matter interaction traditionally deals with the response of atoms, molecules, and plasmas to an external light wave. However, the recent sustained technological progress is opening up the possibility of employing intense laser radiation to trigger or substantially influence physical processes beyond atomic-physics energy scales. Available optical laser intensities exceeding 10(22) W/cm(2) can push the fundamental light-electron interaction to the extreme limit where radiation-reaction effects dominate the electron dynamics, can shed light on the structure of the quantum vacuum, and can trigger the creation of particles such as electrons, muons, and pions and their corresponding antiparticles. Also, novel sources of intense coherent high-energy photons and laser-based particle colliders can pave the way to nuclear quantum optics and may even allow for the potential discovery of new particles beyond the standard model. These are the main topics of this article, which is devoted to a review of recent investigations on high-energy processes within the realm of relativistic quantum dynamics, quantum electrodynamics, and nuclear and particle physics, occurring in extremely intense laser fields.",10.1103/RevModPhys.84.1177
J,"Clerk, AA; Devoret, MH; Girvin, SM; Marquardt, F; Schoelkopf, RJ","Introduction to quantum noise, measurement, and amplification","The topic of quantum noise has become extremely timely due to the rise of quantum information physics and the resulting interchange of ideas between the condensed matter and atomic, molecular, optical-quantum optics communities. This review gives a pedagogical introduction to the physics of quantum noise and its connections to quantum measurement and quantum amplification. After introducing quantum noise spectra and methods for their detection, the basics of weak continuous measurements are described. Particular attention is given to the treatment of the standard quantum limit on linear amplifiers and position detectors within a general linear-response framework. This approach is shown how it relates to the standard Haus-Caves quantum limit for a bosonic amplifier known in quantum optics and its application to the case of electrical circuits is illustrated, including mesoscopic detectors and resonant cavity detectors.",10.1103/RevModPhys.82.1155
J,"Mukherjee, S; Libisch, F; Large, N; Neumann, O; Brown, LV; Cheng, J; Lassiter, JB; Carter, EA; Nordlander, P; Halas, NJ",Hot Electrons Do the Impossible: Plasmon-Induced Dissociation of H<sub>2</sub> on Au,"Heterogeneous catalysis is of paramount importance in chemistry and energy applications. Catalysts that couple light energy into chemical reactions in a directed, orbital-specific manner would greatly reduce the energy input requirements of chemical transformations, revolutionizing catalysis-driven chemistry. Here we report the room temperature dissociation of H-2 on gold nanoparticles using visible light. Surface plasmons excited in the Au nanoparticle decay into hot electrons with energies between the vacuum level and the work function of the metal. In this transient state, hot electrons can transfer into a Feshbach resonance of an H-2 molecule adsorbed on the Au nanoparticle surface, triggering dissociation. We probe this process by detecting the formation of HD molecules from the dissociations of H-2 and D-2 and investigate the effect of Au nanoparticle size and wavelength of incident light on the rate of HD formation. This work opens a new pathway for controlling chemical reactions on metallic catalysts.",10.1021/nl303940z
J,"Burkov, AA; Hook, MD; Balents, L",Topological nodal semimetals,"We present a study of ""nodal-semimetal"" phases in which nondegenerate conduction and valence bands touch at points (the ""Weyl semimetal"") or lines (the ""line-node semimetal"") in three-dimensional momentum space. We discuss a general approach to such states by perturbation of the critical point between a normal insulator (NI) and a topological insulator (TI), breaking either time-reversal (TR) or inversion symmetry. We give an explicit model realization of both types of states in a NI-TI superlattice structure with broken TR symmetry. Both the Weyl and the line-node semimetals are characterized by topologically protected surface states, although in the line-node case, some additional symmetries must be imposed to retain this topological protection. The edge states have the form of ""Fermi arcs"" in the case of the Weyl semimetal: these are chiral gapless edge states, which exist in a finite region in momentum space, determined by the momentum-space separation of the bulk Weyl nodes. The chiral character of the edge states leads to a finite Hall conductivity. In contrast, the edge states of the line-node semimetal are ""flat bands"": these states are approximately dispersionless in a subset of the two-dimensional edge Brillouin zone, given by the projection of the line node onto the plane of the edge. We discuss unusual transport properties of the nodal semimetals and, in particular, point out quantum critical-like scaling of the dc and optical conductivities of the Weyl semimetal and similarities to the conductivity of graphene in the line-node case.",10.1103/PhysRevB.84.235126
J,"Hättig, C; Weigend, F",CC2 excitation energy calculations on large molecules using the resolution of the identity approximation,"A new implementation of the approximate coupled cluster singles and doubles method CC2 is reported, which is suitable for large scale integral-direct calculations. It employs the resolution of the identity (RI) approximation for two-electron integrals to reduce the CPU time needed for calculation and I/O of these integrals. We use a partitioned form of the CC2 equations which eliminates the need to store double excitation cluster amplitudes. In combination with the RI approximation this formulation of the CC2 equations leads to a reduced scaling of memory and disk space requirements with the number of correlated electrons (n) and basis functions (N) to, respectively, O(N-2) and O(nN(2)), compared to O(n(2)N(2)) in previous implementations. The reduced CPU, memory and disk space requirements make it possible to perform CC2 calculations with accurate basis sets on large molecules, which would not be accessible with conventional implementations of the CC2 method. We present an application to vertical excitation energies of alkenes C2nH2n+2, for n=1-12, and report results for the lowest lying dipole-allowed transitions for the TZVPP basis sets, which for n=12 contain 1108 basis functions. Comparison with conventional CC2 results for the smaller alkenes show that for CC2 ground state energies and for excitation energies of valence states, the error due to the RI approximation is negligible compared to the usual basis set error, if auxiliary basis sets are used, which have been optimized for MP2 energy calculations. (C) 2000 American Institute of Physics. [S0021-9606(00)31237-5].",10.1063/1.1290013
J,"Joo, SH; Park, JY; Tsung, CK; Yamada, Y; Yang, PD; Somorjai, GA",Thermally stable Pt/mesoporous silica core-shell nanocatalysts for high-temperature reactions,"Recent advances in colloidal synthesis enabled the precise control of the size, shape and composition of catalytic metal nanoparticles, enabling their use as model catalysts for systematic investigations of the atomic-scale properties affecting catalytic activity and selectivity. The organic capping agents stabilizing colloidal nanoparticles, however, often limit their application in high-temperature catalytic reactions. Here, we report the design of a high-temperature-stable model catalytic system that consists of a Pt metal core coated with a mesoporous silica shell (Pt@mSiO(2)). Inorganic silica shells encaged the Pt cores up to 750 degrees C in air and the mesopores providing direct access to the Pt core made the Pt@mSiO(2) nanoparticles as catalytically active as bare Pt metal for ethylene hydrogenation and CO oxidation. The high thermal stability of Pt@mSiO(2) nanoparticles enabled high-temperature CO oxidation studies, including ignition behaviour, which was not possible for bare Pt nanoparticles because of their deformation or aggregation. The results suggest that the Pt@mSiO(2) nanoparticles are excellent nanocatalytic systems for high-temperature catalytic reactions or surface chemical processes, and the design concept used in the Pt@mSiO(2) core-shell catalyst can be extended to other metal/metal oxide compositions.",10.1038/NMAT2329
J,"Ziegler, JF",SRIM-2003,"SRIM is a software package concerning the stopping and range of ions in matter. Since its introduction in 1985, major upgrades are made about every five years. For SRIM-2003, the following major improvements were made: (1) About 2200 new experimental stopping powers were added to the database, increasing it to over 25,000 stopping values. (2) Improved corrections were made for the stopping of ions in compounds. (3) New heavy ion stopping calculations have led to significant improvements on SRIM stopping accuracy. (4) A self-contained SRIM module has been included to allow SRIM stopping and range values to be controlled and read by other software applications. A full catalog of stopping power plots has been published at www.SRIM.org. Over 500 plots show the accuracy of the stopping and ranges produced by SRIM along with 25,000 experimental data points. References to the citations which reported the experimental data are included. Published by Elsevier B.V.",10.1016/j.nimb.2004.01.208
J,"Shankar, SS; Rai, A; Ankamwar, B; Singh, A; Ahmad, A; Sastry, M",Biological synthesis of triangular gold nanoprisms,"The optoelectronic and physicochemical properties of nanoscale matter are a strong function of particle size. Nanoparticle shape also contributes significantly to modulating their electronic properties. Several shapes ranging from rods to wires to plates to teardrop structures may be obtained by chemical methods; triangular nanoparticles have been synthesized by using a seeded growth process. Here, we report the discovery that the extract from the lemongrass plant, when reacted with aqueous chloroaurate ions, yields a high percentage of thin, flat, single-crystalline gold nanotriangles. The nanotriangles seem to grow by a process involving rapid reduction, assembly and room-temperature sintering of 'liquid-like' spherical gold nanoparticles. The anisotropy in nanoparticle shape results in large near-infrared absorption by the particles, and highly anisotropic electron transport in films of the nanotriangles.",10.1038/nmat1152
J,"Pfeiffer, C; Grbic, A",Metamaterial Huygens' Surfaces: Tailoring Wave Fronts with Reflectionless Sheets,"Huygens' principle is a well-known concept in electromagnetics that dates back to 1690. Here, it is applied to develop designer surfaces that provide extreme control of electromagnetic wave fronts across electrically thin layers. These reflectionless surfaces, referred to as metamaterial Huygens' surfaces, provide new beam shaping, steering, and focusing capabilities. The metamaterial Huygens' surfaces are realized with two-dimensional arrays of polarizable particles that provide both electric and magnetic polarization currents to generate prescribed wave fronts. A straightforward design methodology is demonstrated and applied to develop a beam-refracting surface and a Gaussian-to-Bessel beam transformer. Metamaterial Huygens' surfaces could find a wide range of applications over the entire electromagnetic spectrum including single-surface lenses, polarization controlling devices, stealth technologies, and perfect absorbers.",10.1103/PhysRevLett.110.197401
J,"Maldacena, J; Shenker, SH; Stanford, D",A bound on chaos,"We conjecture a sharp bound on the rate of growth of chaos in thermal quantum systems with a large number of degrees of freedom. Chaos can be diagnosed using an out-of-time-order correlation function closely related to the commutator of operators separated in time. We conjecture that the influence of chaos on this correlator can develop no faster than exponentially, with Lyapunov exponent lambda(L) <= 2 pi k(B)T/h. We give a precise mathematical argument, based on plausible physical assumptions, establishing this conjecture.",10.1007/JHEP08(2016)106
J,"Popoff, SM; Lerosey, G; Carminati, R; Fink, M; Boccara, AC; Gigan, S",Measuring the Transmission Matrix in Optics: An Approach to the Study and Control of Light Propagation in Disordered Media,We introduce a method to experimentally measure the monochromatic transmission matrix of a complex medium in optics. This method is based on a spatial phase modulator together with a full-field interferometric measurement on a camera. We determine the transmission matrix of a thick random scattering sample. We show that this matrix exhibits statistical properties in good agreement with random matrix theory and allows light focusing and imaging through the random medium. This method might give important insight into the mesoscopic properties of a complex medium.,10.1103/PhysRevLett.104.100601
