Publication Type,Authors,Title,Abstract,DOI
J,"Geim, AK; Novoselov, KS",The rise of graphene,"Graphene is a rapidly rising star on the horizon of materials science and condensed-matter physics. This strictly two-dimensional material exhibits exceptionally high crystal and electronic quality, and, despite its short history, has already revealed a cornucopia of new physics and potential applications, which are briefly discussed here. Whereas one can be certain of the realness of applications only when commercial products appear, graphene no longer requires any further proof of its importance in terms of fundamental physics. Owing to its unusual electronic spectrum, graphene has led to the emergence of a new paradigm of 'relativistic' condensed-matter physics, where quantum relativistic phenomena, some of which are unobservable in high-energy physics, can now be mimicked and tested in table-top experiments. More generally, graphene represents a conceptually new class of materials that are only one atom thick, and, on this basis, offers new inroads into low-dimensional physics that has never ceased to surprise and continues to provide a fertile ground for applications.",10.1038/nmat1849
J,"Grimme, S; Antony, J; Ehrlich, S; Krieg, H",A consistent and accurate ab initio parametrization of density functional dispersion correction (DFT-D) for the 94 elements H-Pu,"The method of dispersion correction as an add-on to standard Kohn-Sham density functional theory (DFT-D) has been refined regarding higher accuracy, broader range of applicability, and less empiricism. The main new ingredients are atom-pairwise specific dispersion coefficients and cutoff radii that are both computed from first principles. The coefficients for new eighth-order dispersion terms are computed using established recursion relations. System (geometry) dependent information is used for the first time in a DFT-D type approach by employing the new concept of fractional coordination numbers (CN). They are used to interpolate between dispersion coefficients of atoms in different chemical environments. The method only requires adjustment of two global parameters for each density functional, is asymptotically exact for a gas of weakly interacting neutral atoms, and easily allows the computation of atomic forces. Three-body nonadditivity terms are considered. The method has been assessed on standard benchmark sets for inter- and intramolecular noncovalent interactions with a particular emphasis on a consistent description of light and heavy element systems. The mean absolute deviations for the S22 benchmark set of noncovalent interactions for 11 standard density functionals decrease by 15%-40% compared to the previous (already accurate) DFT-D version. Spectacular improvements are found for a tripeptide-folding model and all tested metallic systems. The rectification of the long-range behavior and the use of more accurate C-6 coefficients also lead to a much better description of large (infinite) systems as shown for graphene sheets and the adsorption of benzene on an Ag(111) surface. For graphene it is found that the inclusion of three-body terms substantially (by about 10%) weakens the interlayer binding. We propose the revised DFT-D method as a general tool for the computation of the dispersion energy in molecules and solids of any kind with DFT and related (low-cost) electronic structure methods for large systems.",10.1063/1.3382344
J,"Weigend, F; Ahlrichs, R","Balanced basis sets of split valence, triple zeta valence and quadruple zeta valence quality for H to Rn: Design and assessment of accuracy","Gaussian basis sets of quadruple zeta valence quality for Rb-Rn are presented, as well as bases of split valence and triple zeta valence quality for H-Rn. The latter were obtained by (partly) modifying bases developed previously. A large set of more than 300 molecules representing (nearly) all elements - except lanthanides - in their common oxidation states was used to assess the quality of the bases all across the periodic table. Quantities investigated were atomization energies, dipole moments and structure parameters for Hartree-Fock, density functional theory and correlated methods, for which we had chosen Moller-Plesset perturbation theory as an example. Finally recommendations are given which type of basis set is used best for a certain level of theory and a desired quality of results.",10.1039/b508541a
J,"Henkelman, G; Uberuaga, BP; Jónsson, H",A climbing image nudged elastic band method for finding saddle points and minimum energy paths,"A modification of the nudged elastic band method for finding minimum energy paths is presented. One of the images is made to climb up along the elastic band to converge rigorously on the highest saddle point. Also, variable spring constants are used to increase the density of images near the top of the energy barrier to get an improved estimate of the reaction coordinate near the saddle point. Applications to CH4 dissociative adsorption on Ir(111) and H-2 on Si(100) using plane wave based density functional theory are presented. (C) 2000 American Institute of Physics. [S0021-9606(00)71246-3].",10.1063/1.1329672
J,"Hasan, MZ; Kane, CL",Colloquium: Topological insulators,"Topological insulators are electronic materials that have a bulk band gap like an ordinary insulator but have protected conducting states on their edge or surface. These states are possible due to the combination of spin-orbit interactions and time-reversal symmetry. The two-dimensional (2D) topological insulator is a quantum spin Hall insulator, which is a close cousin of the integer quantum Hall state. A three-dimensional (3D) topological insulator supports novel spin-polarized 2D Dirac fermions on its surface. In this Colloquium the theoretical foundation for topological insulators and superconductors is reviewed and recent experiments are described in which the signatures of topological insulators have been observed. Transport experiments on HgTe/CdTe quantum wells are described that demonstrate the existence of the edge states predicted for the quantum spin Hall insulator. Experiments on Bi1-xSbx, Bi2Se3, Bi2Te3, and Sb2Te3 are then discussed that establish these materials as 3D topological insulators and directly probe the topology of their surface states. Exotic states are described that can occur at the surface of a 3D topological insulator due to an induced energy gap. A magnetic gap leads to a novel quantum Hall state that gives rise to a topological magnetoelectric effect. A superconducting energy gap leads to a state that supports Majorana fermions and may provide a new venue for realizing proposals for topological quantum computation. Prospects for observing these exotic states are also discussed, as well as other potential device applications of topological insulators.",10.1103/RevModPhys.82.3045
J,"Ferrari, AC; Meyer, JC; Scardaci, V; Casiraghi, C; Lazzeri, M; Mauri, F; Piscanec, S; Jiang, D; Novoselov, KS; Roth, S; Geim, AK",Raman spectrum of graphene and graphene layers,"Graphene is the two-dimensional building block for carbon allotropes of every other dimensionality. We show that its electronic structure is captured in its Raman spectrum that clearly evolves with the number of layers. The D peak second order changes in shape, width, and position for an increasing number of layers, reflecting the change in the electron bands via a double resonant Raman process. The G peak slightly down-shifts. This allows unambiguous, high-throughput, nondestructive identification of graphene layers, which is critically lacking in this emerging research area.",10.1103/PhysRevLett.97.187401
J,"Ravel, B; Newville, M","<i>ATHENA, ARTEMIS, HEPHAESTUS</i>:: data analysis for X-ray absorption spectroscopy using <i>IFEFFIT</i>","A software package for the analysis of X-ray absorption spectroscopy (XAS) data is presented. This package is based on the IFEFFIT library of numerical and XAS algorithms and is written in the Perl programming language using the Perl/Tk graphics toolkit. The programs described here are: (i) ATHENA, a program for XAS data processing, (ii) ARTEMIS, a program for EXAFS data analysis using theoretical standards from FEFF and (iii) HEPHAESTUS, a collection of beamline utilities based on tables of atomic absorption data. These programs enable high-quality data analysis that is accessible to novices while still powerful enough to meet the demands of an expert practitioner. The programs run on all major computer platforms and are freely available under the terms of a free software license.",10.1107/S0909049505012719
J,"Hess, B; Kutzner, C; van der Spoel, D; Lindahl, E","GROMACS 4: Algorithms for highly efficient, load-balanced, and scalable molecular simulation","Molecular simulation is an extremely useful, but computationally very expensive tool for studies of chemical and biomolecular systems. Here, we present a new implementation of our molecular simulation toolkit GROMACS which now both achieves extremely high performance on single processors from algorithmic optimizations and hand-coded routines and simultaneously scales very well on parallel machines. The code encompasses a minimal-communication domain decomposition algorithm, full dynamic load balancing, a state-of-the-art parallel constraint solver, and efficient virtual site algorithms that allow removal of hydrogen atom degrees of freedom to enable integration time steps up to 5 fs; for atomistic simulations also in parallel. To improve the scaling properties of the common particle mesh Ewald electrostatics algorithms, we have in addition used a Multiple-Program, Multiple-Data approach, with separate node domains responsible for direct and reciprocal space interactions. Not only does this combination of algorithms enable extremely long simulations of large systems but also it provides that simulation performance on quite modest numbers of standard cluster nodes.",10.1021/ct700301q
J,"Ferrari, AC; Robertson, J",Interpretation of Raman spectra of disordered and amorphous carbon,"The model and theoretical understanding of the Raman spectra in disordered and amorphous carbon are given. The nature of the G and D vibration modes in graphite is analyzed in terms of the resonant excitation of pi states and the long-range polarizability of pi bonding. Visible Raman data on disordered, amorphous, and diamond like carbon are classified in a three-stage model to show the factors that control the position, intensity, and widths of the G and D peaks. It is shown that the visible Raman spectra depend formally on the configuration of the sp(2) sites in sp(2)-bonded clusters. In cases where the sp(2) clustering is controlled by the sp(3) fraction, such as in as-deposited tetrahedral amorphous carbon (ta-C) or hydrogenated amorphous carbon (a-C:H) films, the visible Raman parameters can be used to derive the sp(3) fraction.",10.1103/PhysRevB.61.14095
J,"Blondel, VD; Guillaume, JL; Lambiotte, R; Lefebvre, E",Fast unfolding of communities in large networks,"We propose a simple method to extract the community structure of large networks. Our method is a heuristic method that is based on modularity optimization. It is shown to outperform all other known community detection methods in terms of computation time. Moreover, the quality of the communities detected is very good, as measured by the so-called modularity. This is shown first by identifying language communities in a Belgian mobile phone network of 2 million customers and by analysing a web graph of 118 million nodes and more than one billion links. The accuracy of our algorithm is also verified on ad hoc modular networks.",10.1088/1742-5468/2008/10/P10008
J,"Bussi, G; Donadio, D; Parrinello, M",Canonical sampling through velocity rescaling,"The authors present a new molecular dynamics algorithm for sampling the canonical distribution. In this approach the velocities of all the particles are rescaled by a properly chosen random factor. The algorithm is formally justified and it is shown that, in spite of its stochastic nature, a quantity can still be defined that remains constant during the evolution. In numerical applications this quantity can be used to measure the accuracy of the sampling. The authors illustrate the properties of this new method on Lennard-Jones and TIP4P water models in the solid and liquid phases. Its performance is excellent and largely independent of the thermostat parameter also with regard to the dynamic properties. (c) 2007 American Institute of Physics.",10.1063/1.2408420
J,"Balandin, AA; Ghosh, S; Bao, WZ; Calizo, I; Teweldebrhan, D; Miao, F; Lau, CN",Superior thermal conductivity of single-layer graphene,We report the measurement of the thermal conductivity of a suspended single-layer graphene. The room temperature values of the thermal conductivity in the range similar to(4.84 +/- 0.44) x 10(3) to (5.30 +/- 0.48) x 10(3) W/mK were extracted for a single-layer graphene from the dependence of the Raman G peak frequency on the excitation laser power and independently measured G peak temperature coefficient. The extremely high value of the thermal conductivity suggests that graphene can outperform carbon nanotubes in heat conduction. The superb thermal conduction property of graphene is beneficial for the proposed electronic applications and establishes graphene as an excellent material for thermal management.,10.1021/nl0731872
J,"Qi, XL; Zhang, SC",Topological insulators and superconductors,"Topological insulators are new states of quantum matter which cannot be adiabatically connected to conventional insulators and semiconductors. They are characterized by a full insulating gap in the bulk and gapless edge or surface states which are protected by time-reversal symmetry. These topological materials have been theoretically predicted and experimentally observed in a variety of systems, including HgTe quantum wells, BiSb alloys, and Bi2Te3 and Bi2Se3 crystals. Theoretical models, materials properties, and experimental results on two-dimensional and three-dimensional topological insulators are reviewed, and both the topological band theory and the topological field theory are discussed. Topological superconductors have a full pairing gap in the bulk and gapless surface states consisting of Majorana fermions. The theory of topological superconductors is reviewed, in close analogy to the theory of topological insulators.",10.1103/RevModPhys.83.1057
J,"Soler, JM; Artacho, E; Gale, JD; García, A; Junquera, J; Ordejón, P; Sánchez-Portal, D",The SIESTA method for <i>ab initio</i> order-<i>N</i> materials simulation,"We have developed and implemented a selfconsistent density functional method using standard norm-conserving pseudopotentials and a flexible, numerical linear combination of atomic orbitals basis set, which includes multiple-zeta and polarization orbitals. Exchange and correlation are treated with the local spin density or generalized gradient approximations. The basis functions and the electron density are projected on a real-space grid, in order to calculate the Hartree and exchange-correlation potentials and matrix elements, with a number of operations that scales linearly with the size of the system. We use a modified energy functional, whose minimization produces orthogonal wavefunctions and the same energy and density as the Kohn-Sham energy functional, without the need for an explicit orthogonalization. Additionally, using localized Wannier-like electron wavefunctions allows the computation time and memory required to minimize the energy to also scale linearly with the size of the system. Forces and stresses are also calculated efficiently and accurately, thus allowing structural relaxation and molecular dynamics simulations.",10.1088/0953-8984/14/11/302
J,"Segall, MD; Lindan, PJD; Probert, MJ; Pickard, CJ; Hasnip, PJ; Clark, SJ; Payne, MC","First-principles simulation: ideas, illustrations and the CASTEP code","First-principles simulation, meaning density-functional theory calculations with plane waves and pseudopotentials, has become a prized technique in condensed-matter theory. Here I look at the basics of the suject, give a brief review of the theory, examining the strengths and weaknesses of its implementation, and illustrating some of the ways simulators approach problems through a small case study. I also discuss why and how modern software design methods have been used in writing a completely new modular version of the CASTEP code.",10.1088/0953-8984/14/11/301
J,"Chai, JD; Head-Gordon, M",Long-range corrected hybrid density functionals with damped atom-atom dispersion corrections,"We report re-optimization of a recently proposed long-range corrected (LC) hybrid density functional [J.-D. Chai and M. Head-Gordon, J. Chem. Phys., 2008, 128, 084106] to include empirical atom-atom dispersion corrections. The resulting functional, omega B97X-D yields satisfactory accuracy for thermochemistry, kinetics, and non-covalent interactions. Tests show that for non-covalent systems, omega B97X-D shows slight improvement over other empirical dispersion-corrected density functionals, while for covalent systems and kinetics it performs noticeably better. Relative to our previous functionals, such as omega B97X, the new functional is significantly superior for non-bonded interactions, and very similar in performance for bonded interactions.",10.1039/b810189b
J,"Stukowski, A",Visualization and analysis of atomistic simulation data with OVITO-the Open Visualization Tool,"The Open Visualization Tool (OVITO) is a new 3D visualization software designed for post-processing atomistic data obtained from molecular dynamics or Monte Carlo simulations. Unique analysis, editing and animations functions are integrated into its easy-to-use graphical user interface. The software is written in object-oriented C++, controllable via Python scripts and easily extendable through a plug-in interface. It is distributed as open-source software and can be downloaded from the website http://ovito.sourceforge.net/.",10.1088/0965-0393/18/1/015012
J,"Thouin, F; Valverde-Chávez, DA; Quarti, C; Cortecchia, D; Bargigia, I; Beljonne, D; Petrozza, A; Silva, C; Kandada, ARS",Phonon coherences reveal the polaronic character of excitons in two-dimensional lead halide perovskites,"Hybrid organic-inorganic semiconductors feature complex lattice dynamics due to the ionic character of the crystal and the softness arising from non-covalent bonds between molecular moieties and the inorganic network. Here we establish that such dynamic structural complexity in a prototypical two-dimensional lead iodide perovskite gives rise to the coexistence of diverse excitonic resonances, each with a distinct degree of polaronic character. By means of high-resolution resonant impulsive stimulated Raman spectroscopy, we identify vibrational wavepacket dynamics that evolve along different configurational coordinates for distinct excitons and photocarriers. Employing density functional theory calculations, we assign the observed coherent vibrational modes to various low-frequency (less than or similar to 50 cm(-1)) optical phonons involving motion in the lead iodide layers. We thus conclude that different excitons induce specific lattice reorganizations, which are signatures of polaronic binding. This insight into the energetic/configurational landscape involving globally neutral primary photoexcitations may be relevant to a broader class of emerging hybrid semiconductor materials.",10.1038/s41563-018-0262-7
J,"Wang, XC; Maeda, K; Thomas, A; Takanabe, K; Xin, G; Carlsson, JM; Domen, K; Antonietti, M",A metal-free polymeric photocatalyst for hydrogen production from water under visible light,"The production of hydrogen from water using a catalyst and solar energy is an ideal future energy source, independent of fossil reserves. For an economical use of water and solar energy, catalysts that are sufficiently efficient, stable, inexpensive and capable of harvesting light are required. Here, we show that an abundant material, polymeric carbon nitride, can produce hydrogen from water under visible-light irradiation in the presence of a sacrificial donor. Contrary to other conducting polymer semiconductors, carbon nitride is chemically and thermally stable and does not rely on complicated device manufacturing. The results represent an important first step towards photosynthesis in general where artificial conjugated polymer semiconductors can be used as energy transducers.",10.1038/NMAT2317
J,"Pendry, JB",Negative refraction makes a perfect lens,"With a conventional lens sharpness of the image is always limited by the wavelength of light. An unconventional alternative to a lens, a slab of negative refractive index material, has the power to focus all Fourier components of a 2D image, even those that do not propagate in a radiative manner. Such ""superlenses"" can be realized in the microwave band with current technology. Our simulations show that a version of the lens operating at the frequency of visible light can be realized in the form of a thin slab of silver. This optical version resolves objects only a few nanometers across.",10.1103/PhysRevLett.85.3966
J,"Mak, KF; Lee, C; Hone, J; Shan, J; Heinz, TF",Atomically Thin MoS<sub>2</sub>: A New Direct-Gap Semiconductor,"The electronic properties of ultrathin crystals of molybdenum disulfide consisting of N = 1, 2, ..., 6 S-Mo-S monolayers have been investigated by optical spectroscopy. Through characterization by absorption, photoluminescence, and photoconductivity spectroscopy, we trace the effect of quantum confinement on the material's electronic structure. With decreasing thickness, the indirect band gap, which lies below the direct gap in the bulk material, shifts upwards in energy by more than 0.6 eV. This leads to a crossover to a direct-gap material in the limit of the single monolayer. Unlike the bulk material, the MoS2 monolayer emits light strongly. The freestanding monolayer exhibits an increase in luminescence quantum efficiency by more than a factor of 10(4) compared with the bulk material.",10.1103/PhysRevLett.105.136805
J,"Delley, B",From molecules to solids with the DMol<SUP>3</SUP> approach,"Recent extensions of the DMol(3) local orbital density functional method for band structure calculations of insulating and metallic solids are described. Furthermore the method for calculating semilocal pseudopotential matrix elements and basis functions are detailed together with other unpublished parts of the methodology pertaining to gradient functionals and local orbital basis sets. The method is applied to calculations of the enthalpy of formation of a set of molecules and solids. We find that the present numerical localized basis sets yield improved results as compared to previous results for the same functionals. Enthalpies for the formation of H, N, O, F, Cl, and C, Si, S atoms from the thermodynamic reference states are calculated at the same level of theory. It is found that the performance in predicting molecular enthalpies of formation is markedly improved for the Perdew-Burke-Ernzerhof [Phys. Rev. Lett. 77, 3865 (1996)] functional. (C) 2000 American Institute of Physics. [S0021-9606(00)30342-7].",10.1063/1.1316015
J,"Perdew, JP; Ruzsinszky, A; Csonka, GI; Vydrov, OA; Scuseria, GE; Constantin, LA; Zhou, XL; Burke, K",Restoring the density-gradient expansion for exchange in solids and surfaces,Popular modern generalized gradient approximations are biased toward the description of free-atom energies. Restoration of the first-principles gradient expansion for exchange over a wide range of density gradients eliminates this bias. We introduce a revised Perdew-Burke-Ernzerhof generalized gradient approximation that improves equilibrium properties of densely packed solids and their surfaces.,10.1103/PhysRevLett.100.136406
J,"Naguib, M; Kurtoglu, M; Presser, V; Lu, J; Niu, JJ; Heon, M; Hultman, L; Gogotsi, Y; Barsoum, MW",Two-Dimensional Nanocrystals Produced by Exfoliation of Ti<sub>3</sub>AlC<sub>2</sub>,,10.1002/adma.201102306
J,"Splendiani, A; Sun, L; Zhang, YB; Li, TS; Kim, J; Chim, CY; Galli, G; Wang, F",Emerging Photoluminescence in Monolayer MoS<sub>2</sub>,"Novel physical phenomena can emerge in low-dimensional nanomaterials. Bulk MoS2, a prototypical metal dichalcogenide, is an indirect bandgap semiconductor with negligible photoluminescence. When the MoS2 crystal is thinned to monolayer, however, a strong photoluminescence emerges, indicating an indirect to direct bandgap transition in this d-electron system. This observation shows that quantum confinement in layered d-electron materials like MoS2 provides new opportunities for engineering the electronic structure of matter at the nanoscale.",10.1021/nl903868w
J,"Jain, A; Ong, SP; Hautier, G; Chen, W; Richards, WD; Dacek, S; Cholia, S; Gunter, D; Skinner, D; Ceder, G; Persson, KA",Commentary: The Materials Project: A materials genome approach to accelerating materials innovation,"Accelerating the discovery of advanced materials is essential for human welfare and sustainable, clean energy. In this paper, we introduce the Materials Project (www.materialsproject.org), a core program of the Materials Genome Initiative that uses high-throughput computing to uncover the properties of all known inorganic materials. This open dataset can be accessed through multiple channels for both interactive exploration and data mining. The Materials Project also seeks to create open-source platforms for developing robust, sophisticated materials analyses. Future efforts will enable users to perform ""rapid-prototyping"" of new materials in silico, and provide researchers with new avenues for cost-effective, data-driven materials design. (C) 2013 Author(s).",10.1063/1.4812323
