Publication Type,Authors,Title,Abstract,DOI
J,"Liang, PW; Liao, CY; Chueh, CC; Zuo, F; Williams, ST; Xin, XK; Lin, JJ; Jen, AKY",Additive Enhanced Crystallization of Solution-Processed Perovskite for Highly Efficient Planar-Heterojunction Solar Cells,"An effective method to control the rate of perovskite crystallization by incorporating rationally chosen additives into the perovskite precursor solutions is demonstrated. The processing additives simultaneously facilitate nucleation and modulate the kinetics of crystal growth during crystallization, leading to much smoother perovskite morphology with improved coverage area and crystal uniformity. As a result, it enables very high PCE (similar to 12%) planar-heterojunction solar cells to be fabricated through the low-temperature solution processes (under 150 degrees C). This study opens up a new direction for optimizing perovskite active layer properties to expand device performance ceilings.",10.1002/adma.201400231
J,"Tang, J; Kemp, KW; Hoogland, S; Jeong, KS; Liu, H; Levina, L; Furukawa, M; Wang, XH; Debnath, R; Cha, DK; Chou, KW; Fischer, A; Amassian, A; Asbury, JB; Sargent, EH",Colloidal-quantum-dot photovoltaics using atomic-ligand passivation,"Colloidal-quantum-dot (CQD) optoelectronics offer a compelling combination of solution processing and spectral tunability through quantum size effects. So far, CQD solar cells have relied on the use of organic ligands to passivate the surface of the semiconductor nanoparticles. Although inorganic metal chalcogenide ligands have led to record electronic transport parameters in CQD films, no photovoltaic device has been reported based on such compounds. Here we establish an atomic ligand strategy that makes use of monovalent halide anions to enhance electronic transport and successfully passivate surface defects in PbS CQD films. Both time-resolved infrared spectroscopy and transient device characterization indicate that the scheme leads to a shallower trap state distribution than the best organic ligands. Solar cells fabricated following this strategy show up to 6% solar AM1.5G power-conversion efficiency. The CQD films are deposited at room temperature and under ambient atmosphere, rendering the process amenable to low-cost, roll-by-roll fabrication.",10.1038/NMAT3118
J,"Kühn, S; Håkanson, U; Rogobete, L; Sandoghdar, V",Enhancement of single-molecule fluorescence using a gold nanoparticle as an optical nanoantenna,"We investigate the coupling of a single molecule to a single spherical gold nanoparticle acting as a nanoantenna. Using scanning probe technology, we position the particle in front of the molecule with nanometer accuracy and measure a strong enhancement of more than 20 times in the fluorescence intensity simultaneous to a 20-fold shortening of the excited state lifetime. Comparisons with three-dimensional calculations guide us to decipher the contributions of the excitation enhancement, spontaneous emission modification, and quenching. Furthermore, we provide direct evidence for the role of the particle plasmon resonance in the molecular excitation and emission processes.",10.1103/PhysRevLett.97.017402
J,"Liu, S; Tian, JQ; Wang, L; Zhang, YW; Qin, XY; Luo, YL; Asiri, AM; Al-Youbi, AO; Sun, XP","Hydrothermal Treatment of Grass: A Low-Cost, Green Route to Nitrogen-Doped, Carbon-Rich, Photoluminescent Polymer Nanodots as an Effective Fluorescent Sensing Platform for Label-Free Detection of Cu(II) Ions",,10.1002/adma.201200164
J,"Bashkatov, AN; Genina, EA; Kochubey, VI; Tuchin, VV","Optical properties of human skin, subcutaneous and mucous tissues in the wavelength range from 400 to 2000 nm","The optical properties of human skin, subcutaneous adipose tissue and human mucosa were measured in the wavelength range 400-2000 nm. The measurements were carried out using a commercially available spectrophotometer with an integrating sphere. The inverse adding-doubling method was used to determine the absorption and reduced scattering coefficients from the measurements.",10.1088/0022-3727/38/15/004
J,"Hu, LB; Pasta, M; La Mantia, F; Cui, LF; Jeong, S; Deshazer, HD; Choi, JW; Han, SM; Cui, Y","Stretchable, Porous, and Conductive Energy Textiles","Recently there is strong interest in lightweight, flexible, and wearable electronics to meet the technological demands of modern society. Integrated energy storage devices of this type are a key area that is still significantly underdeveloped, Here, we describe wearable power devices using everyday textiles as the platform. With an extremely simple ""dipping and drying"" process using single-walled carbon nanotube (SWNT) ink, we produced highly conductive textiles with conductivity of 125 S cm(-1) and sheet resistance less than 1 Omega/sq. Such conductive textiles show outstanding flexibility and stretchability and demonstrate strong adhesion between the SWNTs and the textiles of interest. Supercapacitors made from these conductive textiles show high areal capacitance, up to 0.48F/cm(2), and high specific energy. We demonstrate the loading of pseudocapacitor materials into these conductive textiles that leads to a 24-fold increase of the areal capacitance of the device. These highly conductive textiles can provide new design opportunities for wearable electronics and energy storage applications.",10.1021/nl903949m
J,"Mishin, Y; Mehl, MJ; Papaconstantopoulos, DA; Voter, AF; Kress, JD","Structural stability and lattice defects in copper: <i>Ab initio</i>, tight-binding, and embedded-atom calculations - art. no. 224106","We evaluate the ability of the embedded-atom method (EAM) potentials and the tight-binding (TB) method to predict reliably energies and stability of nonequilibrium structures by taking Cu as a model material. Two EAM potentials are used here. One is constructed in this work by using more fitting parameters than usual and including ab initio energies in the fitting database. The other potential was constructed previously using a traditional scheme. Excellent agreement is observed between ab initio, TB, and EAM results for the energies and stability of several nonequilibrium structures of Cu, as well as for energies along deformation paths between different structures. We conclude that not only TB calculations but also EAM potentials can be suitable for simulations in which correct energies and stability of different atomic configurations are essential, at least for Cu. The bcc, simple cubic, and diamond structures of Cu were identified as elastically unstable, while some other structures (e.g., hcp and 9R) are metastable. As an application of this analysis, nonequilibrium structures of epitaxial Cu films on (001)-oriented fcc or bcc substrates are evaluated using a simple model and atomistic simulations with an EAM potential. In agreement with experimental data, the structure of the film can be either deformed fee or deformed hcp. The bcc structure cannot be stabilized by epitaxial constraints.",10.1103/PhysRevB.63.224106
J,"Hartnoll, SA; Herzog, CP; Horowitz, GT",Building a holographic superconductor,"We show that a simple gravitational theory can provide a holographically dual description of a superconductor. There is a critical temperature, below which a charged condensate forms via a second order phase transition and the (dc) conductivity becomes infinite. The frequency dependent conductivity develops a gap determined by the condensate. We find evidence that the condensate consists of pairs of quasiparticles.",10.1103/PhysRevLett.101.031601
J,"Alù, A; Engheta, N",Achieving transparency with plasmonic and metamaterial coatings -: art. no. 016623,"The possibility of using plasmonic and metamaterial covers to drastically reduce the total scattering cross section of spherical and cylindrical objects is discussed. While it is intuitively expected that increasing the physical size of an object may lead to an increase in its overall scattering cross section, here we see how a proper design of these lossless metamaterial covers near their plasma resonance may induce a dramatic drop in the scattering cross section, making these objects nearly ""invisible"" or ""transparent"" to an outside observer-a phenomenon with obvious applications for low-observability and noninvasive probe design. Physical insights into this phenomenon and some numerical results are provided.",10.1103/PhysRevE.72.016623
J,"Schelling, PK; Phillpot, SR; Keblinski, P",Comparison of atomic-level simulation methods for computing thermal conductivity,"We compare the results of equilibrium and nonequilibrium methods to compute thermal conductivity. Using Sillinger-Weber silicon as a model system, we address issues related to nonlinear response, thermal equilibration, and statistical averaging. In addition, we present an analysis of finite-size effects and demonstrate how reliable results can be obtained when using nonequilibrium methods by extrapolation to an infinite system size. For the equilibrium Green-Kubo method, we show that results for the thermal conductivity are insensitive to the choice of the definition of local energy from the many-body part of the potential. Finally, we show that the results obtained by the equilibrium and nonequilibrium methods are consistent with each other and for the case of Si are in reasonable agreement with experimental results.",10.1103/PhysRevB.65.144306
J,"Stöckle, RM; Suh, YD; Deckert, V; Zenobi, R",Nanoscale chemical analysis by tip-enhanced Raman spectroscopy,"A fine metal tip brought to within a few nanometers of a molecular film is found to give strong enhancement of Raman scattered light from the sample. This new principle can be used for molecular analysis with excellent spatial resolution, only limited by the tip apex size and shape. No special sample preparation is required, and the enhancement is identical at every sample location, allowing for quantitative surface-enhanced Raman spectroscopy measurements. When scanning the tip over the sample surface. topographic information is obtained simultaneously and can be directly correlated with the spectroscopic data. (C) 2000 Elsevier Science B.V. All rights reserved.",10.1016/S0009-2614(99)01451-7
J,"Zhang, XQ; Cheng, XB; Chen, X; Yan, C; Zhang, Q",Fluoroethylene Carbonate Additives to Render Uniform Li Deposits in Lithium Metal Batteries,"Lithium (Li) metal has been considered as an important substitute for the graphite anode to further boost the energy density of Li-ion batteries. However, Li dendrite growth during Li plating/stripping causes safety concern and poor lifespan of Li metal batteries (LMB). Herein, fluoroethylene carbonate (FEC) additives are used to form a LiF-rich solid electrolyte interphase (SEI). The FEC-induced SEI layer is compact and stable, and thus beneficial to obtain a uniform morphology of Li deposits. This uniform and dendrite-free morphology renders a significantly improved Coulombic efficiency of 98% within 100 cycles in a Li | Cu half-cell. When the FEC-protected Li metal anode matches a high-loading LiNi0.5Co0.2Mn0.3O2 (NMC) cathode (12 mg cm(-2)), a high initial capacity of 154 mAh g(-1) (1.9 mAh cm(-2)) at 180.0 mA g(-1) is obtained. This LMB with conversion-type Li metal anode and intercalation-type NMC cathode affords an emerging energy storage system to probe the energy chemistry of Li metal protection and demonstrates the material engineering of batteries with very high energy density.",10.1002/adfm.201605989
J,"Böhlen, TT; Cerutti, F; Chin, MPW; Fossò, A; Ferrari, A; Ortega, PG; Mairani, A; Sala, PR; Smirnov, G; Vlachoudisl, V",The FLUKA Code: Developments and Challenges for High Energy and Medical Applications,"The FLUKA Monte Carlo code is used extensively at CERN for all beam-machine interactions, radioprotection calculations and facility design of forthcoming projects. Such needs require the code to be consistently reliable over the entire energy range (from MeV to TeV) for all projectiles (full suite of elementary particles and heavy ions). Outside CERN, among various applications worldwide, FLUKA serves as a core tool for the HIT and CNAO hadron-therapy facilities in Europe. Therefore, medical applications further impose stringent requirements in terms of reliability and predictive power, which demands constant refinement of sophisticated nuclear models and continuous code improvement. Some of the latest developments implemented in FLUKA are presented in this paper, with particular emphasis on issues and concerns pertaining to CERN and medical applications.",10.1016/j.nds.2014.07.049
J,"Ishigami, M; Chen, JH; Cullen, WG; Fuhrer, MS; Williams, ED",Atomic structure of graphene on SiO<sub>2</sub>,"We employ scanning probe microscopy to reveal atomic structures and nanoscale morphology of graphene-based electronic devices (i.e., a graphene sheet supported by an insulating silicon dioxide substrate) for the first time. Atomic resolution scanning tunneling microscopy images reveal the presence of a strong spatially dependent perturbation, which breaks the hexagonal lattice symmetry of the graphitic lattice. Structural corrugations of the graphene sheet partially conform to the underlying silicon oxide substrate. These effects are obscured or modified on graphene devices processed with normal lithographic methods, as they are covered with a layer of photoresist residue. We enable our experiments by a novel cleaning process to produce atomically clean graphene sheets.",10.1021/nl070613a
J,"Park, MH; Kim, MG; Joo, J; Kim, K; Kim, J; Ahn, S; Cui, Y; Cho, J",Silicon Nanotube Battery Anodes,"We present Si nanotubes prepared by reductive decomposition of a silicon precursor in an alumina template and etching. These nanotubes show impressive results, which shows very high reversible charge capacity of 3247 mA h/g with Coulombic efficiency of 89%, and also demonstrate superior capacity retention even at 5C rate (=15 A/g). Furthermore, the capacity in a Li-ion full cell consisting of a cathode of LiCoO2 and anode of Si nanotubes demonstrates a 10 times higher capacity than commercially available graphite even after 200 cycles.",10.1021/nl902058c
J,"Marschall, R",Semiconductor Composites: Strategies for Enhancing Charge Carrier Separation to Improve Photocatalytic Activity,"The formation of semiconductor composites comprising multicomponent or multiphase heterojunctions is a very effective strategy to design highly active photocatalyst systems. This review summarizes the recent strategies to develop such composites, and highlights the most recent developments in the field. After a general introduction into the different strategies to improve photocatalytic activity through formation of heterojunctions, the three different types of heterojunctions are introduced in detail, followed by a historical introduction to semiconductor heterojunction systems and a thorough literature overview. Special chapters describe the highly-investigated carbon nitride heterojunctions as well as very recent developments in terms of multiphase heterojunction formation, including the latest insights into the anatase-rutile system. When carefully designed, semiconductor composites comprising two or three different materials or phases very effectively facilitate charge separation and charge carrier transfer, substantially improving photocatalytic and photoelectrochemical efficiency.",10.1002/adfm.201303214
J,"Han, Y; Xu, Z; Gao, C",Ultrathin Graphene Nanofiltration Membrane for Water Purification,"A method of fabricating ultrathin (approximate to 22-53 nm thick) graphene nanofiltration membranes (uGNMs) on microporous substrates is presented for efficient water purification using chemically converted graphene (CCG). The prepared uGNMs show well packed layer structure formed by CCG sheets, as characterized by scanning electron microscopy, atomic force microscopy, and transmission electron microscopy. The performance of the uGNMs for water treatment was evaluated on a dead end filtration device and the pure water flux of uGNMs was high (21.8 L m(-2) h(-1) bar(-1)). The uGNMs show high retention (>99%) for organic dyes and moderate retention (approximate to 20-60%) for ion salts. The rejection mechanism of this kind of negatively charged membranes is intensively studied, and the results reveal that physical sieving and electrostatic interaction dominate the rejection process. Because of the ultrathin nature of uGNMs, 34 mg of CCG is sufficient for making a square meter of nanofiltration membrane, indicating that this new generation graphene-based nanofiltration technology would be resource saving and cost-effective. The integration of high performance, low cost, and simple solution-based fabrication process promises uGNMs great potential application in practical water purification.",10.1002/adfm.201202601
J,"Kurganov, A; Tadmor, E",New high-resolution central schemes for nonlinear conservation laws and convection-diffusion equations,"Central schemes may serve as universal finite-difference methods for solving nonlinear convection-diffusion equations in the sense that they are not tied to the specific eigenstructure of the problem, and hence can be implemented in a straightforward manner as black-box solvers for general conservation laws and related equations governing the spontaneous evolution of large gradient phenomena. The first-order Lax-Friedrichs scheme (P. D. Lax, 1954) is the forerunner for such central schemes. The central Nessyahu-Tadmor (NT) scheme (H. Nessyahu and E. Tadmor, 1990) offers higher resolution while retaining the simplicity of the Riemann-solver-free approach. The numerical viscosity present in these central schemes is of order O((Delta x)(2r)/Delta t). In the convective regime where Delta t similar to Delta x, the improved resolution of the NT scheme and its generalizations is achieved by lowering the amount of numerical viscosity with increasing r. At the same time, this family of central schemes suffers from excessive numerical viscosity when a sufficiently small time step is enforced, e.g., due to the presence of degenerate diffusion terms. In this paper we introduce a new family of central schemes which retain the simplicity of being independent of the eigenstructure of the problem, yet which enjoy a much smaller numerical viscosity (of the corresponding order O((Delta x)(2r-1))). In particular, our new central schemes maintain their high-resolution independent of O(1/Delta t), and letting Delta t down arrow 0, they admit a particularly simple semi-discrete formulation. The main idea behind the construction of these central schemes is the use of more precise information of the local propagation speeds. Beyond these CFL related speeds, no characteristic information is required. As a second ingredient in their construction, these central schemes realize the (nonsmooth part of the) approximate solution in terms of its cell averages integrated over the Riemann fans of varying size. The semi-discrete central scheme is then extended to multidimensional problems, with or without degenerate diffusive terms. Fully discrete versions are obtained with Runge-Kutta solvers. We prove that a scalar version of our high-resolution central scheme is nonoscillatory in the sense of satisfying the total-variation diminishing property in the one-dimensional case and the maximum principle in two-space dimensions. We conclude with a series of numerical examples, considering convex and nonconvex problems with and without degenerate diffusion, and scalar and systems of equations in one- and two-space dimensions. Time evolution is carried out by the: third- and fourth-order explicit embedded integration Runge-Kutta methods recently proposed by A. Medovikov (1998). These numerical studies demonstrate the remarkable resolution of our new family of central scheme. (C) 2000 Academic Press.",10.1006/jcph.2000.6459
J,"Jackson, P; Wuerz, R; Hariskos, D; Lotter, E; Witte, W; Powalla, M","Effects of heavy alkali elementsin Cu(In,Ga)Se<sub>2</sub> solar cells with efficiencies up to 22.6%","We report on the use and effect of the alkali elements rubidium and caesium in the place of sodium and potassium in the alkali post deposition treatment (PDT) as applied to Cu(In,Ga)Se-2 (CIGS) solar cell absorbers. In order to study the effects of the different alkali elements, we have produced a large number of CIGS solar cells with high efficiencies resulting in a good experimental resolution to detect even small differences in performance. We examine the electrical device parameters of these fully functional devices and observe a positive trend in the I-V parameters when moving from devices without PDT to KF-, RbF-, and eventually to CsF-PDT. A diode analysis reveals an improved diode quality for cells treated with heavier alkalis. Furthermore, secondary ion mass spectrometry (SIMS) measurements reveal a competitive mechanism induced within the class of alkali elements in the CIGS absorber induced by the alkali post deposition treatment.",10.1002/pssr.201600199
J,"Sondergaard, CR; Olsson, MHM; Rostkowski, M; Jensen, JH",Improved Treatment of Ligands and Coupling Effects in Empirical Calculation and Rationalization of p<i>K</i><sub>a</sub> Values,"The new empirical rules for protein pK(a) predictions implemented in the PROPKA3.0 software package (Olsson et al. J. Chem. Theory Comput. 2010, 7, 525-537) have been extended to the prediction of pK(a) shifts of active site residues and ionizable ligand groups in protein ligand complexes. We present new algorithms that allow pK(a) shifts due to inductive (i.e., covalently coupled) intraligand interactions, as well as noncovalently coupled interligand interactions in multiligand complexes, to be included in the prediction. The number of different ligand chemical groups that are automatically recognized has been increased to 18, and the general implementation has been changed so that new functional groups can be added easily by the user, aided by a new and more general protonation scheme. Except for a few cases, the new algorithms in PROPKA3.1 are found to yield results similar to or better than those obtained with PROPKA2.0 (Bas et al. Proteins: Struct., Funct., Bioinf 2008, 73, 765-783). Finally, we present a novel algorithm that identifies noncovalently coupled ionizable groups, where pK(a) prediction may be especially difficult. This is a general improvement to PROPKA and is applied to proteins with and without ligands.",10.1021/ct200133y
J,"Ambacher, O; Foutz, B; Smart, J; Shealy, JR; Weimann, NG; Chu, K; Murphy, M; Sierakowski, AJ; Schaff, WJ; Eastman, LF; Dimitrov, R; Mitchell, A; Stutzmann, M",Two dimensional electron gases induced by spontaneous and piezoelectric polarization in undoped and doped AlGaN/GaN heterostructures,"Two dimensional electron gases in AlxGa1-xN/GaN based heterostructures, suitable for high electron mobility transistors, are induced by strong polarization effects. The sheet carrier concentration and the confinement of the two dimensional electron gases located close to the AlGaN/GaN interface are sensitive to a large number of different physical properties such as polarity, alloy composition, strain, thickness, and doping of the AlGaN barrier. We have investigated these physical properties for undoped and silicon doped transistor structures by a combination of high resolution x-ray diffraction, atomic force microscopy, Hall effect, and capacitance-voltage profiling measurements. The polarization induced sheet charge bound at the AlGaN/GaN interfaces was calculated from different sets of piezoelectric constants available in the literature. The sheet carrier concentration induced by polarization charges was determined self-consistently from a coupled Schrodinger and Poisson equation solver for pseudomorphically and partially relaxed barriers with different alloy compositions. By comparison of theoretical and experimental results, we demonstrate that the formation of two dimensional electron gases in undoped and doped AlGaN/GaN structures rely both on piezoelectric and spontaneous polarization induced effects. In addition, mechanisms reducing the sheet carrier concentrations like nonabrupt interfaces, dislocations, and the possible influence of surface states on the two dimensional electron gases will be discussed briefly. (C) 2000 American Institute of Physics. [S0021- 8979(00)03401-0].",10.1063/1.371866
J,"Xiao, ZG; Yuan, YB; Shao, YC; Wang, Q; Dong, QF; Bi, C; Sharma, P; Gruverman, A; Huang, JS",Giant switchable photovoltaic effect in organometal trihalide perovskite devices,"Organolead trihalide perovskite (OTP) materials are emerging as naturally abundant materials for low-cost, solution-processed and highly effcient solar cells(1-9). Here, we show that, in OTP-based photovoltaic devices with vertical and lateral cell configurations, the photocurrent direction can be switched repeatedly by applying a small electric field of < 1V mu m(-1). The switchable photocurrent, generally observed in devices based on ferroelectric materials, reached 20.1 mAcm(-2) under one sun illumination in OTP devices with a vertical architecture, which is four orders of magnitude larger than lthat measured in other ferroelectric photovoltaic devices(10,11). This field-switchable photovoltaic effect can be explained by the formation of reversible p-i-n structures induced by ion drift in the perovskite layer. The demonstration of switchable OTP photovoltaics and electric-field-manipulated doping paves the way for innovative solar cell designs and for the exploitation of OTP materials in electrically and optically readable memristors and circuits.",10.1038/NMAT4150
