Publication Type,Authors,Title,Abstract,DOI,ID,rule1,rule2,rule3,rule4,rule5,rule6,rule7,rule8,rule9,rule10,rule11,rule12,rule13,rule14,rule15,rule16,rule17,rule18,rule19,rule20,rule21,rule22,rule23,rule24,rule25,rule26,rule27,rule28,rule29,rule30,rule31
J,"Gref, R; Lück, M; Quellec, P; Marchand, M; Dellacherie, E; Harnisch, S; Blunk, T; Müller, RH",'Stealth' corona-core nanoparticles surface modified by polyethylene glycol (PEG):: influences of the corona (PEG chain length and surface density) and of the core composition on phagocytic uptake and plasma protein adsorption,"Nanoparticles possessing poly(ethylene glycol) (PEG) chains on their surface have been described as blood persistent drug delivery system with potential applications for intravenous drug administration. Considering the importance of protein interactions with injected colloidal dug carriers with regard to their in vivo fate, we analysed plasma protein adsorption onto biodegradable PEG-coated poly(lactic acid) (PLA), poly(lactic-co-glycolic acid) (PLGA) and poly(epsilon-caprolactone) (PCL) nanoparticles employing two-dimensional gel electrophoresis (2-D PAGE). A series of corona/core nanoparticles of sizes 160-270 nm were prepared from diblock PEG-PLA, PEG-PLGA and PEG-PCL and from PEG-PLA:PLA blends. The PEG Mw was varied from 2000-20 000 g/mole and the particles were prepared using different PEG contents. It was thus possible to study the influence of the PEG corona thickness and density, as well as the influence of the nature of the core (PLA, PLGA or PCL), on the competitive plasma protein adsorption, zeta potential and particle uptake by polymorphonuclear (PMN) cells. 2-D PAGE studies showed that plasma protein adsorption on PEG-coated PLA nanospheres strongly depends on the PEG molecular weight (Mw) (i.e. PEG chain length at the particle surface) as well as on the PEG content in the particles (i.e. PEG chain density at the surface of the particles). Whatever the thickness or the density of the corona, the qualitative composition of the plasma protein adsorption patterns was very similar, showing that adsorption was governed by interaction with a PLA surface protected more or less by PEG chains. The main spots on the gels were albumin, fibrinogen, IgG, Ig light chains, and the apolipoproteins apoA-I and apoE. For particles made of PEG-PLA45K with different PEG Mw, a maximal reduction in protein adsorption was found for a PEG Mw of 5000 g/mole. For nanospheres differing in their PEG content from 0.5 to 20 wt %, a PEG content between 2 and 5 wt % was determined as a threshold value for optimal protein resistance. When increasing the PEG content in the nanoparticles above 5 wt % no further reduction in protein adsorption was achieved. Phagocytosis by PMN studied using chemiluminescence and zeta potential data agreed well with these findings: the same PEG surface density threshold was found to ensure simultaneously efficient steric stabilization and to avoid the uptake by PMN cells. Supposing all the PEG chains migrate to the surface, this would correspond to a distance of about 1.5 nm between two terminally attached PEG chains in the covering 'brush'. Particles from PEG5K-PLA45K, PEG5K-PLGA45K; and PEG5K-PCL45K copolymers enabled to study the influence of the core on plasma protein adsorption, all other parameters (corona thickness and density) being kept constant. Adsorption patterns were in good qualitative agreement with each other. Only a few protein species were exclusively present just on one type of nanoparticle. However, the extent of proteins adsorbed differed in a large extent from one particle to another. In vivo studies could help elucidating the role of the type and amount of proteins adsorbed on the fate of the nanoparticles after intraveinous administration, as a function of the nature of their core. These results could be useful in the design of long circulating intravenously injectable biodegradable drug carriers endowed with protein resistant properties and low phagocytic uptake. (C) 2000 Elsevier Science B.V. All rights reserved.",10.1016/S0927-7765(99)00156-3,35,yes,no,no,yes,yes,no,yes,no,yes,yes,yes,yes,yes,yes,yes,yes,yes,yes,no,yes,yes,yes,yes,yes,yes,yes,yes,yes,yes,yes,yes
J,"Sigman, DM; Casciotti, KL; Andreani, M; Barford, C; Galanter, M; Böhlke, JK",A bacterial method for the nitrogen isotopic analysis of nitrate in seawater and freshwater,"We report a new method for measurement of the isotopic composition of nitrate (NO3-) at the natural-abundance level in both seawater and freshwater. The method is based on the isotopic analysis of nitrous oxide (N2O) generated from nitrate by denitrifying bacteria that lack N2O-reductase activity. The isotopic composition of both nitrogen and oxygen from nitrate are accessible in this way. In this first of two companion manuscripts, we describe the basic protocol and results for the nitrogen isotopes. The precision of the method is better than 0.2 parts per thousand (1 SD) at concentrations of nitrate down to 1 muM, and the nitrogen isotopic differences among various standards and samples are accurately reproduced. For samples with 1 muM nitrate or more, the blank of the method is less than 10% of the signal size, and various approaches may reduce it further.",10.1021/ac010088e,36,yes,yes,no,no,yes,yes,yes,yes,no,no,yes,no,no,no,no,yes,yes,yes,yes,no,no,no,no,yes,yes,no,no,no,yes,yes,yes
J,"McFarland, AD; Van Duyne, RP",Single silver nanoparticles as real-time optical sensors with zeptomole sensitivity,"This work utilizes dark-field optical microscopy to demonstrate the localized surface plasmon resonance gamma(max) response of individual Ag nanoparticles to the formation of a monolayer of small-molecule adsorbates. The adsorption of fewer than 60 000 1-hexadecanethiol molecules on single Ag nanoparticles results in a localized surface plasmon resonance shift of 40.7 nm. Additionally, the kinetics of the single nanoparticle response was shown to be comparable to that of other real-time sensor technologies.",10.1021/nl034372s,37,no,no,no,no,yes,yes,yes,yes,no,no,yes,no,yes,yes,no,yes,yes,yes,yes,no,no,no,yes,yes,no,no,no,no,yes,yes,
J,"Miller, JS; Stevens, KR; Yang, MT; Baker, BM; Nguyen, DHT; Cohen, DM; Toro, E; Chen, AA; Galie, PA; Yu, X; Chaturvedi, R; Bhatia, SN; Chen, CS",Rapid casting of patterned vascular networks for perfusable engineered three-dimensional tissues,"In the absence of perfusable vascular networks, three-dimensional (3D) engineered tissues densely populated with cells quickly develop a necrotic core(1). Yet the lack of a general approach to rapidly construct such networks remains a major challenge for 3D tissue culture(2-4). Here, we printed rigid 3D filament networks of carbohydrate glass, and used them as a cytocompatible sacrificial template in engineered tissues containing living cells to generate cylindrical networks that could be lined with endothelial cells and perfused with blood under high-pressure pulsatile flow. Because this simple vascular casting approach allows independent control of network geometry, endothelialization and extravascular tissue, it is compatible with a wide variety of cell types, synthetic and natural extracellular matrices, and crosslinking strategies. We also demonstrated that the perfused vascular channels sustained the metabolic function of primary rat hepatocytes in engineered tissue constructs that otherwise exhibited suppressed function in their core.",10.1038/NMAT3357,38,yes,no,yes,no,yes,no,yes,no,yes,no,yes,yes,no,no,no,no,yes,yes,no,yes,no,no,no,yes,yes,yes,yes,no,yes,yes,yes
J,"Lau, KKS; Bico, J; Teo, KBK; Chhowalla, M; Amaratunga, GAJ; Milne, WI; McKinley, GH; Gleason, KK",Superhydrophobic carbon nanotube forests,"The present study demonstrates the creation of a stable, superhydrophobic surface using the nanoscale roughness inherent in a vertically aligned carbon nanotube forest together with a thin, conformal hydrophobic poly(tetrafluoroethylene) (PTFE) coating on the surface of the nanotubes. Superhydrophobicity is achieved down to the microscopic level where essentially spherical, micrometer-sized water droplets can be suspended on top of the nanotube forest.",10.1021/nl034704t,39,yes,yes,no,no,yes,yes,yes,yes,no,no,yes,no,no,no,no,no,yes,yes,yes,no,no,no,no,no,yes,yes,no,no,yes,yes,no
J,"Feng, BJ; Zhang, J; Zhong, Q; Li, WB; Li, S; Li, H; Cheng, P; Meng, S; Chen, L; Wu, KH",Experimental realization of two-dimensional boron sheets,"A variety of two-dimensional materials have been reported in recent years, yet single-element systems such as graphene and black phosphorus have remained rare. Boron analogues have been predicted, as boron atoms possess a short covalent radius and the flexibility to adopt sp(2) hybridization, features that favour the formation of two-dimensional allotropes, and one example of such a borophene material has been reported recently. Here, we present a parallel experimental work showing that two-dimensional boron sheets can be grown epitaxially on a Ag(111) substrate. Two types of boron sheet, a beta(12) sheet and a chi(3) sheet, both exhibiting a triangular lattice but with different arrangements of periodic holes, are observed by scanning tunnelling microscopy. Density functional theory simulations agree well with experiments, and indicate that both sheets are planar without obvious vertical undulations. The boron sheets are quite inert to oxidization and interact only weakly with their substrate. We envisage that such boron sheets may find applications in electronic devices in the future.",10.1038/NCHEM.2491,40,yes,no,yes,yes,yes,no,yes,yes,no,no,yes,yes,no,yes,yes,no,yes,yes,yes,no,yes,no,no,yes,yes,yes,yes,yes,yes,yes,yes
J,"Sun, YM; Seo, JH; Takacs, CJ; Seifter, J; Heeger, AJ",Inverted Polymer Solar Cells Integrated with a Low-Temperature-Annealed Sol-Gel-Derived ZnO Film as an Electron Transport Layer,"Highly efficient and air-stable inverted polymer solar cells are fabricated with a poly(2,7-carbazole) derivative (PCDTBT):fullerene derivative (PC70BM) active layer. Low-temperature-annealed sol-gel-derived zinc oxide (ZnO) and molybdenum oxide films are selected as the electron and hole transporting layers, respectively. Power conversion efficiency (PCE) of 6.3% is demonstrated, which is the highest reported to date for inverted polymer solar cells.",10.1002/adma.201004301,41,yes,yes,no,no,yes,no,no,yes,no,no,yes,yes,no,yes,no,yes,yes,yes,yes,no,no,no,yes,yes,yes,no,no,no,yes,yes,no
J,"Saito, T; Nishiyama, Y; Putaux, JL; Vignon, M; Isogai, A",Homogeneous suspensions of individualized microfibrils from TEMPO-catalyzed oxidation of native cellulose,"Never-dried native celluloses (bleached sulfite wood pulp, cotton, tunicin, and bacterial cellulose) were disintegrated into individual microfibrils after oxidation mediated by the 2,2,6,6-tetramethylpiperidine-1-oxyl (TEMPO) radical followed by a homogenizing mechanical treatment. When oxidized with 3.6 mmol of NaClO per gram of cellulose, almost the totality of sulfite wood pulp and cotton were readily disintegrated into long individual microfibrils by a treatment with a Waring Blendor, yielding transparent and highly viscous suspensions. When observed by transmission electron microscopy, the wood pulp and cotton microfibrils exhibited a regular width of 3-5 nm. Tunicin and bacterial cellulose could be disintegrated by sonication. A bulk degree of oxidation of about 0.2 per one anhydroglucose unit of cellulose was necessary for a smooth disintegration of sulfite wood pulp, whereas only small amounts of independent microfibrils were obtained at lower oxidation levels. This limiting degree of oxidation decreased in the following order: sulfite wood pulp > cotton > bacterial cellulose, tunicin.",10.1021/bm060154s,42,yes,no,no,no,no,no,no,no,yes,no,yes,yes,yes,yes,no,no,yes,yes,no,yes,no,no,yes,yes,no,no,no,no,yes,yes,
J,"Pei, SF; Zhao, JP; Du, JH; Ren, WC; Cheng, HM",Direct reduction of graphene oxide films into highly conductive and flexible graphene films by hydrohalic acids,"We report a simple but highly-effective hydrohalic acid reducing method to reduce graphene oxide (GO) films into highly conductive graphene films without destroying their integrity and flexibility at low temperature based on the nucleophilic substitution reaction. GO films reduced for 1 h at 100 degrees C in 55% hydroiodic (HI) acid have an electrical conductivity as high as 298 S/cm and a C/O ratio above 12, both of which are much higher than films reduced by other chemical methods. The reduction maintains good integrity and flexibility, and even improves the strength and ductility, of the original GO films. Based on this reducing method, a flexible graphene-based transparent conductive film with a sheet resistance of 1.6 k Omega/sq and 85% transparency was obtained, further verifying the advantage of HI acid reduction. (C) 2010 Elsevier Ltd. All rights reserved.",10.1016/j.carbon.2010.08.006,43,yes,no,no,no,yes,no,yes,no,yes,no,yes,yes,no,no,no,yes,yes,yes,no,yes,no,no,yes,yes,yes,yes,no,yes,yes,yes,yes
J,"De, S; Higgins, TM; Lyons, PE; Doherty, EM; Nirmalraj, PN; Blau, WJ; Boland, JJ; Coleman, JN","Silver Nanowire Networks as Flexible, Transparent, Conducting Films: Extremely High DC to Optical Conductivity Ratios","We have used aqueous dispersions of silver nanowires to prepare thin, flexible, transparent, conducting films. The nanowires are of length and diameter close to 6.5 mu m and 85 nm, respectively. At low thickness, the films consist of networks but appear to become bulk-like for mean film thicknesses above similar to 160 nm. These films can be very transparent with optical transmittance reaching as high as 92% for low thickness. The transmittance (550 nm) decreases with increasing thickness, consistent with an optical conductivity of 6472 S/m. The films are also very uniform; the transmittance varies spatially by typically <2%. The sheet resistance decreases with increasing thickness, falling below 1 Omega/square for thicknesses above 300 nm. The DC conductivity increases from 2 x 101 S/m for very thin films before saturating at 5 X 106 S/m for thicker films. Similarly, the ratio of DC to optical conductivity increases with increasing thickness from 25 for the thinnest films, saturating at similar to 500 for thicknesses above similar to 160 nm. We believe this Is the highest conductivity ratio ever observed for nanostructured films and is matched only by doped metal oxide films. These nanowire films are electromechanically very robust, with all but the thinnest films showing no change in sheet resistance when flexed over >1000 cycles. Such results make these films ideal as replacements for indium tin oxide as transparent electrodes. We have prepared films with optical transmittance and sheet resistance of 85% and 13 Omega/square, respectively. This is very close to that displayed by commercially available indium tin oxide.",10.1021/nn900348c,44,yes,no,no,no,yes,no,no,no,yes,no,yes,yes,yes,no,no,yes,yes,yes,no,yes,no,no,yes,yes,yes,yes,yes,yes,yes,yes,yes
J,"Feng, L; Zhang, ZY; Mai, ZH; Ma, YM; Liu, BQ; Jiang, L; Zhu, DB",A super-hydrophobic and super-oleophilic coating mesh film for the separation of oil and water,,10.1002/anie.200353381,45,,,,,,,,,,,,,,,,,,,,,,,,,,,,,,,
J,"Niu, SM; Wang, SH; Lin, L; Liu, Y; Zhou, YS; Hu, YF; Wang, ZL",Theoretical study of contact-mode triboelectric nanogenerators as an effective power source,"A theoretical model for contact-mode TENGs was constructed in this paper. Based on the theoretical model, its real-time output characteristics and the relationship between the optimum resistance and TENG parameters were derived. The theory presented here is the first in-depth interpretation of the contact-mode TENG, which can serve as important guidance for rational design of the TENG structure in specific applications.",10.1039/c3ee42571a,46,yes,yes,no,no,yes,no,yes,no,yes,yes,yes,yes,no,no,no,no,yes,yes,no,yes,no,no,no,no,yes,no,no,yes,yes,yes,
J,"Guex, N; Peitsch, MC; Schwede, T",Automated comparative protein structure modeling with SWISS-MODEL and Swiss-PdbViewer: A historical perspective,"SWISS-MODEL pioneered the field of automated modeling as the first protein modeling service on the Internet. In combination with the visualization tool Swiss-PdbViewer, the Internet-based Workspace and the SWISS-MODEL Repository, it provides a fully integrated sequence to structure analysis and modeling platform. This computational environment is made freely available to the scientific community with the aim to hide the computational complexity of structural bioinformatics and encourage bench scientists to make use of the ever-increasing structural information available. Indeed, over the last decade, the availability of structural information has significantly increased for many organisms as a direct consequence of the complementary nature of comparative protein modeling and experimental structure determination. This has a very positive and enabling impact on many different applications in biomedical research as described in this paper.",10.1002/elps.200900140,47,yes,yes,no,yes,no,no,no,no,yes,no,yes,yes,no,no,no,no,no,no,no,yes,no,no,no,no,no,yes,yes,no,yes,yes,no
J,"Kay, A; Cesar, I; Grätzel, M",New benchmark for water photooxidation by nanostructured α-Fe<sub>2</sub>O<sub>3</sub> films,"Thin films of silicon-doped Fe2O3 were deposited by APCVD (atmospheric pressure chemical vapor deposition) from Fe(CO)(5) and TEOS (tetraethoxysilane) on SnO2-coated glass at 415 degrees C. HRSEM reveals a highly developed dendritic nanostructure of 500 nm thickness having a feature size of only 1020 nm at the surface. Real surface area determination by dye adsorption yields a roughness factor of 21. XRD shows the films to be pure hematite with strong preferential orientation of the [110] axis vertical to the substrate, induced by silicon doping. Under illumination in 1 M NaOH, water is oxidized at the Fe2O3 electrode with higher efficiency (IPCE = 42% at 370 nm and 2.2 mA/cm(2) in AM 1.5 G sunlight of 1000 W/m(2) at 1.23 V-RHE) than at the best reported single crystalline Fe2O3 electrodes. This unprecedented efficiency is in part attributed to the dendritic nanostructure which minimizes the distance photogenerated holes have to diffuse to reach the Fe2O3/electrolyte interface while still allowing efficient light absorption. Part of the gain in efficiency is obtained by depositing a thin insulating SiO2 interfacial layer between the SnO2 substrate and the Fe2O3 film and a catalytic cobalt monolayer on the Fe2O3 surface. A mechanistic model for water photooxidation is presented, involving stepwise accumulation of four holes by two vicinal iron or cobalt surface sites.",10.1021/ja064380l,48,yes,no,no,yes,no,no,no,no,yes,no,yes,yes,no,yes,no,yes,yes,yes,yes,no,no,no,yes,yes,yes,yes,yes,yes,yes,yes,no
J,"Barone, V",Anharmonic vibrational properties by a fully automated second-order perturbative approach,"This paper describes the implementation of a fully automated code for the building of anharmonic force constants and their use in a second-order perturbative evaluation of vibrorotational parameters. Next, a number of test applications are discussed, which show the strengths and limits of various computational levels. (C) 2005 American Institute of Physics.",10.1063/1.1824881,49,no,no,no,no,yes,no,yes,no,yes,no,yes,yes,no,no,no,no,yes,yes,no,yes,no,no,no,yes,yes,yes,no,no,no,yes,no
J,"Zhao, ZM; Zhao, JW; Hu, ZL; Li, JD; Li, JJ; Zhang, YJ; Wang, C; Cui, GL",Long-life and deeply rechargeable aqueous Zn anodes enabled by a multifunctional brightener-inspired interphase,"Aqueous Zn anodes have been revisited for their intrinsic safety, low cost, and high volumetric capacity; however, deep-seated issues of dendrite growth and intricate side-reactions hindered their rejuvenation. Herein, a ""brightener-inspired'' polyamide coating layer which elevates the nucleation barrier and restricts Zn2+ 2D diffusion is constructed to effectively regulate the aqueous Zn deposition behavior. Importantly, serving as a buffer layer that isolates active Zn from bulk electrolytes, this interphase also suppresses free water/O2-induced corrosion and passivation. With this synergy effect, the polymermodified Zn anode produces reversible, dendrite-free plating/stripping with a 60-fold enhancement in running lifetime (over 8000 hours) compared to the bare Zn, and even at an ultrahigh areal capacity of 10 mA h cm(-2) (10 mA cm(-2) for 1 h, 85% depth of discharge). This efficient rechargeability for Zn anodes enables a substantially stable full-cell paired with a MnO2 cathode. The strategy presented here is straightforward and scalable, representing a stark, but promising approach to solve the anode issues in advanced Zn batteries.",10.1039/c9ee00596j,50,yes,no,no,no,yes,no,yes,no,yes,yes,yes,yes,no,no,no,yes,yes,yes,yes,no,no,no,yes,yes,yes,yes,yes,yes,yes,yes,no
J,"Ohno, T; Hasegawa, T; Tsuruoka, T; Terabe, K; Gimzewski, JK; Aono, M",Short-term plasticity and long-term potentiation mimicked in single inorganic synapses,"Memory is believed to occur in the human brain as a result of two types of synaptic plasticity: short-term plasticity (STP) and long-term potentiation (LTP; refs 1-4). In neuromorphic engineering(5,6), emulation of known neural behaviour has proven to be difficult to implement in software because of the highly complex interconnected nature of thought processes. Here we report the discovery of a Ag2S inorganic synapse, which emulates the synaptic functions of both STP and LTP characteristics through the use of input pulse repetition time. The structure known as an atomic switch(7,8), operating at critical voltages, stores information as STP with a spontaneous decay of conductance level in response to intermittent input stimuli, whereas frequent stimulation results in a transition to LTP. The Ag2S inorganic synapse has interesting characteristics with analogies to an individual biological synapse, and achieves dynamic memorization in a single device without the need of external preprogramming. A psychological model related to the process of memorizing and forgetting is also demonstrated using the inorganic synapses. Our Ag2S element indicates a breakthrough in mimicking synaptic behaviour essential for the further creation of artificial neural systems that emulate characteristics of human memory.",10.1038/NMAT3054,51,yes,no,yes,yes,yes,no,yes,yes,no,no,yes,no,no,no,no,no,yes,yes,yes,no,no,no,no,yes,yes,yes,yes,yes,yes,yes,
J,"Valenzano, L; Civalleri, B; Chavan, S; Bordiga, S; Nilsen, MH; Jakobsen, S; Lillerud, KP; Lamberti, C",Disclosing the Complex Structure of UiO-66 Metal Organic Framework: A Synergic Combination of Experiment and Theory,"Through a combined use of experimental and theoretical approaches such as XRPD, EXAFS, IR, and UV- vis spectroscopies and ab initio periodic DFT calculations, we report a detailed characterization of structural, vibrational, and electronic properties of UiO-66 (Zr-BDC MOF) in its hydroxylated and dehydroxylated forms. The stability of the materials with respect to the most common solvents, acids, and bases is determined by combining XRPD and TGA/MS techniques. The structures of the two forms of UiO-66 are refined through an interactive XRPD/EXAFS approach and validated by ab initio calculations. Experimental and calculated IR spectra are reported and compared to enlighten the nature of vibrational modes upon dehydroxylation and to show the complete reversibility of the dehydration/hydration phenomenon. Experimental and calculated band gaps are also reported and compared. In this work, we show the necessity to combine, in a synergic way, different experimental techniques and periodic ab initio approaches to disclose and fully understand the nature of complex novel materials such as UiO-66 on structural, vibrational, and electronic grounds. The correct structure refinement could not be possible using one of these three approaches alone, in particular, XRPD data were unable to detect an important distortion of the Zr6O6 units of the dehydrated material that was, however, foreseen in the ab initio calculations and measured in the EXAFS spectra.",10.1021/cm1022882,52,yes,no,no,no,yes,no,yes,yes,no,yes,yes,yes,no,yes,no,no,yes,yes,no,yes,yes,yes,no,yes,yes,yes,yes,yes,yes,yes,yes
J,"Farha, OK; Eryazici, I; Jeong, NC; Hauser, BG; Wilmer, CE; Sarjeant, AA; Snurr, RQ; Nguyen, ST; Yazaydin, AÖ; Hupp, JT",Metal-Organic Framework Materials with Ultrahigh Surface Areas: Is the Sky the Limit?,"We have synthesized, characterized, and computationally simulated/validated the behavior of two new metal organic framework (MOF) materials displaying the highest experimental Brunauer-Emmett-Teller (BET) surface areas of any porous materials reported to date (similar to 7000 m(2)/g). Key to evacuating the initially solvent-filled materials without pore collapse, and thereby accessing the ultrahigh areas, is the use of a supercritical CO2 activation technique. Additionally, we demonstrate computationally that by shifting from phenyl groups to ""space efficient"" acetylene moieties as linker expansion units, the hypothetical maximum surface area for a MOF material is substantially greater than previously envisioned (similar to 14600 m(2)/g (or greater) versus similar to 10500 m(2)/g).",10.1021/ja3055639,53,,,,,,,,,,,,,,,,,,,,,,,,,,,,,,,
