Publication Type,Authors,Title,Abstract,DOI,ID,rule1,rule2,rule3,rule4,rule5,rule6,rule7,rule8,rule9,rule10,rule11,rule12,rule13,rule14,rule15,rule16,rule17,rule18,rule19,rule20,rule21,rule22,rule23,rule24,rule25,rule26,rule27,rule28,rule29,rule30,rule31
J,"Ronquist, F; Huelsenbeck, JP",MrBayes 3: Bayesian phylogenetic inference under mixed models,"MrBayes 3 performs Bayesian phylogenetic analysis combining information from different data partitions or subsets evolving under different stochastic evolutionary models. This allows the user to analyze heterogeneous data sets consisting of different data types-e.g. morphological, nucleotide, and protein- and to explore a wide variety of structured models mixing partition-unique and shared parameters. The program employs MPI to parallelize Metropolis coupling on Macintosh or UNIX clusters.",10.1093/bioinformatics/btg180,22,yes,yes,no,no,yes,yes,yes,yes,no,no,yes,no,yes,yes,no,no,no,no,no,no,no,no,no,no,no,no,no,no,yes,yes,no
J,"Kumar, S; Stecher, G; Li, M; Knyaz, C; Tamura, K",MEGA X: Molecular Evolutionary Genetics Analysis across Computing Platforms,"The Molecular Evolutionary Genetics Analysis (MEGA) software implements many analytical methods and tools for phylogenomics and phylomedicine. Here, we report a transformation of MEGA to enable cross -platform use on Microsoft Windows and Linux operating systems. MEGA X does not require virtualization or emulation software and provides a uniform user experience across platforms. MEGA X has additionally been upgraded to use multiple computing cores for many molecular evolutionary analyses. MEGA X is available in two interfaces (graphical and command line) and can be downloaded from www.megasof-tware.net free of charge.",10.1093/molbev/msy096,23,yes,yes,no,no,yes,no,yes,yes,no,no,yes,yes,no,no,no,no,no,no,yes,no,no,no,no,no,no,no,yes,no,no,yes,yes
J,"Emsley, P; Lohkamp, B; Scott, WG; Cowtan, K",Features and development of <i>Coot</i>,"Coot is a molecular-graphics application for model building and validation of biological macromolecules. The program displays electron-density maps and atomic models and allows model manipulations such as idealization, real-space refinement, manual rotation/translation, rigid-body fitting, ligand search, solvation, mutations, rotamers and Ramachandran idealization. Furthermore, tools are provided for model validation as well as interfaces to external programs for refinement, validation and graphics. The software is designed to be easy to learn for novice users, which is achieved by ensuring that tools for common tasks are 'discoverable' through familiar user-interface elements (menus and toolbars) or by intuitive behaviour (mouse controls). Recent developments have focused on providing tools for expert users, with customisable key bindings, extensions and an extensive scripting interface. The software is under rapid development, but has already achieved very widespread use within the crystallographic community. The current state of the software is presented, with a description of the facilities available and of some of the underlying methods employed.",10.1107/S0907444910007493,24,yes,yes,no,no,yes,no,no,yes,no,no,yes,no,no,no,no,no,yes,yes,no,yes,no,no,no,no,yes,yes,no,no,no,yes,
J,"Schmittgen, TD; Livak, KJ",Analyzing real-time PCR data by the comparative <i>C</i><sub>T</sub> method,Two different methods of presenting quantitative gene expression exist: absolute and relative quantification. Absolute quantification calculates the copy number of the gene usually by relating the PCR signal to a standard curve. Relative gene expression presents the data of the gene of interest relative to some calibrator or internal control gene. A widely used method to present relative gene expression is the comparative C-T method also referred to as the 2(-Delta Delta CT) method. This protocol provides an overview of the comparative CT method for quantitative gene expression studies. Also presented here are various examples to present quantitative gene expression data using this method.,10.1038/nprot.2008.73,25,yes,no,yes,yes,yes,no,yes,yes,no,no,yes,no,no,no,no,no,no,no,yes,no,no,no,no,no,no,yes,yes,no,no,yes,yes
J,"Kanehisa, M; Goto, S",KEGG: Kyoto Encyclopedia of Genes and Genomes,"KEGG (Kyoto Encyclopedia of Genes and Genomes) is a knowledge base for systematic analysis of gene functions, linking genomic information with higher order functional information, The genomic information is stored in the GENES database, which is a collection of gene catalogs for all the completely sequenced genomes and some partial genomes with up-to-date annotation of gene functions, The higher order functional information is stored in the PATHWAY database, which contains graphical representations of cellular processes, such as metabolism, membrane transport, signal transduction and cell cycle. The PATHWAY database is supplemented by a set of ortholog group tables for the information about conserved subpathways (pathway motifs), which are often encoded by positionally coupled genes on the chromosome and which are especially useful in predicting gene functions. A third database in KEGG is LIGAND for the information about chemical compounds, enzyme molecules and enzymatic reactions. KEGG provides Java graphics tools for browsing genome maps, comparing two genome maps and manipulating expression maps, as well as computational tools for sequence comparison, graph comparison and path computation. The KEGG databases are daily updated and made freely available (http://www.genome.ad.jp/kegg/).",10.1093/nar/28.1.27,26,yes,yes,no,no,no,no,no,no,no,no,yes,no,yes,no,no,no,no,no,no,no,no,no,no,no,no,yes,yes,no,yes,yes,no
J,"Li, H; Ding, GH; Xie, L; Li, YX",PAnnBuilder: an R package for assembling proteomic annotation data,"PAnnBuilder is an R package to automatically assemble protein annotation information from public resources to provide uniform annotation data for large-scale proteomic studies. Sixteen public databases have been parsed and 54 annotation packages have been constructed based on R environment or SQLite database. These ready-to-use packages cover most frequently needed protein annotation for three model species including human, mouse and rat. Several extended applications such as annotation based on protein sequence similarity are also provided. Sophisticated users can develop their own packages using PAnnBuilder. PAnnBuilder may become an important tool for proteomic research.",10.1093/bioinformatics/btp100,27,yes,yes,no,yes,yes,yes,yes,yes,no,no,yes,yes,yes,no,yes,no,yes,yes,yes,no,no,no,yes,yes,yes,yes,yes,no,yes,yes,yes
J,"Takahashi, K; Yamanaka, S",Induction of pluripotent stem cells from mouse embryonic and adult fibroblast cultures by defined factors,"Differentiated cells can be reprogrammed to an embryonic-like state by transfer of nuclear contents into oocytes or by fusion with embryonic stem (ES) cells. Little is known about factors that induce this reprogramming. Here, we demonstrate induction of pluripotent stem cells from mouse embryonic or adult fibroblasts by introducing four factors, Oct3/4, Sox2, c-Myc, and Klf4, under ES cell culture conditions. Unexpectedly, Nanog was dispensable. These cells, which we designated iPS (induced pluripotent stem) cells, exhibit the morphology and growth properties of ES cells and express ES cell marker genes. Subcutaneous transplantation of iPS cells into nude mice resulted in tumors containing a variety of tissues from all three germ layers. Following injection into blastocysts, iPS cells contributed to mouse embryonic development. These data demonstrate that pluripotent stem cells can be directly generated from fibroblast cultures by the addition of only a few defined factors.",10.1016/j.cell.2006.07.024,28,yes,no,yes,yes,yes,no,yes,no,yes,yes,yes,yes,yes,yes,no,yes,yes,yes,yes,no,no,no,no,yes,yes,yes,yes,yes,yes,yes,
J,"Adams, PD; Afonine, PV; Bunkóczi, G; Chen, VB; Davis, IW; Echols, N; Headd, JJ; Hung, LW; Kapral, GJ; Grosse-Kunstleve, RW; McCoy, AJ; Moriarty, NW; Oeffner, R; Read, RJ; Richardson, DC; Richardson, JS; Terwilliger, TC; Zwart, PH",<i>PHENIX</i>: a comprehensive Python-based system for macromolecular structure solution,"Macromolecular X-ray crystallography is routinely applied to understand biological processes at a molecular level. However, significant time and effort are still required to solve and complete many of these structures because of the need for manual interpretation of complex numerical data using many software packages and the repeated use of interactive three-dimensional graphics. PHENIX has been developed to provide a comprehensive system for macromolecular crystallographic structure solution with an emphasis on the automation of all procedures. This has relied on the development of algorithms that minimize or eliminate subjective input, the development of algorithms that automate procedures that are traditionally performed by hand and, finally, the development of a framework that allows a tight integration between the algorithms.",10.1107/S0907444909052925,29,yes,yes,no,yes,yes,no,yes,no,yes,no,yes,yes,no,no,no,no,no,no,no,yes,no,no,no,no,no,no,no,no,no,yes,yes
J,"McKenna, A; Hanna, M; Banks, E; Sivachenko, A; Cibulskis, K; Kernytsky, A; Garimella, K; Altshuler, D; Gabriel, S; Daly, M; DePristo, MA",The Genome Analysis Toolkit: A MapReduce framework for analyzing next-generation DNA sequencing data,"Next-generation DNA sequencing (NGS) projects, such as the 1000 Genomes Project, are already revolutionizing our understanding of genetic variation among individuals. However, the massive data sets generated by NGS the 1000 Genome pilot alone includes nearly five terabases-make writing feature-rich, efficient, and robust analysis tools difficult for even computationally sophisticated individuals. Indeed, many professionals are limited in the scope and the ease with which they can answer scientific questions by the complexity of accessing and manipulating the data produced by these machines. Here, we discuss our Genome Analysis Toolkit (GATK), a structured programming framework designed to ease the development of efficient and robust analysis tools for next-generation DNA sequencers using the functional programming philosophy of MapReduce. The GATK provides a small but rich set of data access patterns that encompass the majority of analysis tool needs. Separating specific analysis calculations from common data management infrastructure enables us to optimize the GATK framework for correctness, stability, and CPU and memory efficiency and to enable distributed and shared memory parallelization. We highlight the capabilities of the GATK by describing the implementation and application of robust, scale-tolerant tools like coverage calculators and single nucleotide polymorphism (SNP) calling. We conclude that the GATK programming framework enables developers and analysts to quickly and easily write efficient and robust NGS tools, many of which have already been incorporated into large-scale sequencing projects like the 1000 Genomes Project and The Cancer Genome Atlas.",10.1101/gr.107524.110,30,yes,no,yes,yes,yes,no,yes,yes,no,yes,yes,no,yes,no,no,no,yes,yes,yes,no,no,no,no,yes,yes,yes,yes,yes,yes,yes,
J,"Callahan, BJ; McMurdie, PJ; Rosen, MJ; Han, AW; Johnson, AJA; Holmes, SP",DADA2: High-resolution sample inference from Illumina amplicon data,"We present the open-source software package DADA2 for modeling and correcting Illumina-sequenced amplicon errors (https://github.com/benjjneb/dada2). DADA2 infers sample sequences exactly and resolves differences of as little as 1 nucleotide. In several mock communities, DADA2 identified more real variants and output fewer spurious sequences than other methods. We applied DADA2 to vaginal samples from a cohort of pregnant women, revealing a diversity of previously undetected Lactobacillus crispatus variants.",10.1038/NMETH.3869,31,yes,yes,no,yes,yes,yes,yes,yes,no,no,yes,no,yes,no,no,yes,yes,yes,no,yes,no,no,no,yes,yes,no,yes,no,yes,yes,
J,"Evanno, G; Regnaut, S; Goudet, J",Detecting the number of clusters of individuals using the software STRUCTURE: a simulation study,"The identification of genetically homogeneous groups of individuals is a long standing issue in population genetics. A recent Bayesian algorithm implemented in the software STRUCTURE allows the identification of such groups. However, the ability of this algorithm to detect the true number of clusters (K) in a sample of individuals when patterns of dispersal among populations are not homogeneous has not been tested. The goal of this study is to carry out such tests, using various dispersal scenarios from data generated with an individual-based model. We found that in most cases the estimated 'log probability of data' does not provide a correct estimation of the number of clusters, K. However, using an ad hoc statistic Delta K based on the rate of change in the log probability of data between successive K values, we found that STRUCTURE accurately detects the uppermost hierarchical level of structure for the scenarios we tested. As might be expected, the results are sensitive to the type of genetic marker used (AFLP vs. microsatellite), the number of loci scored, the number of populations sampled, and the number of individuals typed in each sample.",10.1111/j.1365-294X.2005.02553.x,32,yes,no,yes,yes,yes,no,yes,no,yes,yes,yes,yes,yes,no,no,yes,yes,yes,no,yes,yes,yes,no,yes,yes,no,yes,no,yes,yes,yes
J,"Bankevich, A; Nurk, S; Antipov, D; Gurevich, AA; Dvorkin, M; Kulikov, AS; Lesin, VM; Nikolenko, SI; Pham, S; Prjibelski, AD; Pyshkin, AV; Sirotkin, AV; Vyahhi, N; Tesler, G; Alekseyev, MA; Pevzner, PA",SPAdes: A New Genome Assembly Algorithm and Its Applications to Single-Cell Sequencing,"The lion's share of bacteria in various environments cannot be cloned in the laboratory and thus cannot be sequenced using existing technologies. A major goal of single-cell genomics is to complement gene-centric metagenomic data with whole-genome assemblies of uncultivated organisms. Assembly of single-cell data is challenging because of highly non-uniform read coverage as well as elevated levels of sequencing errors and chimeric reads. We describe SPAdes, a new assembler for both single-cell and standard (multicell) assembly, and demonstrate that it improves on the recently released E+V-SC assembler (specialized for single-cell data) and on popular assemblers Velvet and SoapDeNovo (for multicell data). SPAdes generates single-cell assemblies, providing information about genomes of un-cultivatable bacteria that vastly exceeds what may be obtained via traditional metagenomics studies. SPAdes is available online (http://bioinf.spbau.ru/spades). It is distributed as open source software.",10.1089/cmb.2012.0021,33,yes,yes,no,yes,yes,no,yes,no,no,yes,yes,no,no,no,no,no,yes,yes,yes,no,no,no,no,yes,yes,yes,yes,yes,yes,yes,yes
J,"Delorme, A; Makeig, S",EEGLAB: an open source toolbox for analysis of single-trial EEG dynamics including independent component analysis,"We have developed a toolbox and graphic user interface, EEGLAB, running under the crossplatform MATLAB environment(The Math-works, Inc.) for processing collections of single-trial and/or averaged EEG data of any number of channels. Available functions include EEG data, channel and event information importing, data visualization (scrolling, scalp map and dipole model plotting, plus multi-trial ERP-image plots), preprocessing (including artifact rejection, filtering, epoch selection, and averaging), independent component analysis (ICA) and time/frequency decompositions including channel and component cross-coherence supported by bootstrap statistical methods based on data resampling. EEGLAB functions are organized into three layers. Top-layer functions allow users to interact with the data through the graphic interface without needing to use MATLAB syntax. Menu options allow users to tune the behavior of EEGLAB to available memory. Middle-layer functions allow users to customize data processing using command history and interactive 'pop' functions. Experienced MATLAB users can use EEGLAB data structures and stand-alone signal processing functions to write custom and/or batch analysis scripts. Extensive function help and tutorial information are included. A 'plug-in' facility allows easy incorporation of new EEG modules into the main menu. EEGLAB is freely available (http://www.sccn.ucsd.edu/eeglab/) under the GNU public license for noncommercial use and open source development, together with sample data, user tutorial and extensive documentation. (C) 2003 Elsevier B.V. All rights reserved.",10.1016/j.jneumeth.2003.10.009,34,no,no,no,no,yes,no,no,no,yes,no,yes,yes,yes,yes,no,no,yes,yes,yes,no,no,no,no,no,yes,yes,no,no,yes,yes,
J,"Spek, AL",Structure validation in chemical crystallography,"Automated structure validation was introduced in chemical crystallography about 12 years ago as a tool to assist practitioners with the exponential growth in crystal structure analyses. Validation has since evolved into an easy-to-use checkCIF/PLATON web-based IUCr service. The result of a crystal structure determination has to be supplied as a CIF-formatted computer-readable file. The checking software tests the data in the CIF for completeness, quality and consistency. In addition, the reported structure is checked for incomplete analysis, errors in the analysis and relevant issues to be verified. A validation report is generated in the form of a list of ALERTS on the issues to be corrected, checked or commented on. Structure validation has largely eliminated obvious problems with structure reports published in IUCr journals, such as refinement in a space group of too low symmetry. This paper reports on the current status of structure validation and possible future extensions.",10.1107/S090744490804362X,35,yes,yes,no,yes,yes,no,yes,no,yes,no,yes,yes,yes,yes,no,no,yes,yes,no,yes,no,no,no,yes,yes,yes,yes,yes,yes,yes,yes
J,"Li, H; Handsaker, B; Wysoker, A; Fennell, T; Ruan, J; Homer, N; Marth, G; Abecasis, G; Durbin, R",The Sequence Alignment/Map format and SAMtools,"The Sequence Alignment/Map (SAM) format is a generic alignment format for storing read alignments against reference sequences, supporting short and long reads (up to 128 Mbp) produced by different sequencing platforms. It is flexible in style, compact in size, efficient in random access and is the format in which alignments from the 1000 Genomes Project are released. SAMtools implements various utilities for post-processing alignments in the SAM format, such as indexing, variant caller and alignment viewer, and thus provides universal tools for processing read alignments.",10.1093/bioinformatics/btp352,36,yes,yes,no,yes,no,no,no,yes,no,no,yes,yes,yes,no,no,no,no,no,yes,no,no,no,no,yes,yes,yes,no,no,yes,yes,
J,"Edgar, RC",Search and clustering orders of magnitude faster than BLAST,"Motivation: Biological sequence data is accumulating rapidly, motivating the development of improved high-throughput methods for sequence classification. Results: UBLAST and USEARCH are new algorithms enabling sensitive local and global search of large sequence databases at exceptionally high speeds. They are often orders of magnitude faster than BLAST in practical applications, though sensitivity to distant protein relationships is lower. UCLUST is a new clustering method that exploits USEARCH to assign sequences to clusters. UCLUST offers several advantages over the widely used program CD-HIT, including higher speed, lower memory use, improved sensitivity, clustering at lower identities and classification of much larger datasets.",10.1093/bioinformatics/btq461,37,yes,yes,no,no,yes,yes,yes,yes,no,no,yes,yes,no,no,no,no,yes,yes,yes,no,no,no,no,yes,yes,no,yes,no,yes,yes,no
J,"Quinlan, AR; Hall, IM",BEDTools: a flexible suite of utilities for comparing genomic features,"Motivation: Testing for correlations between different sets of genomic features is a fundamental task in genomics research. However, searching for overlaps between features with existing web-based methods is complicated by the massive datasets that are routinely produced with current sequencing technologies. Fast and flexible tools are therefore required to ask complex questions of these data in an efficient manner. Results: This article introduces a new software suite for the comparison, manipulation and annotation of genomic features in Browser Extensible Data (BED) and General Feature Format (GFF) format. BEDTools also supports the comparison of sequence alignments in BAM format to both BED and GFF features. The tools are extremely efficient and allow the user to compare large datasets (e. g. next-generation sequencing data) with both public and custom genome annotation tracks. BEDTools can be combined with one another as well as with standard UNIX commands, thus facilitating routine genomics tasks as well as pipelines that can quickly answer intricate questions of large genomic datasets.",10.1093/bioinformatics/btq033,38,yes,no,yes,no,yes,no,yes,yes,no,yes,yes,no,yes,no,no,no,yes,yes,yes,no,no,no,no,yes,yes,yes,no,no,yes,yes,
J,"Langfelder, P; Horvath, S",WGCNA: an R package for weighted correlation network analysis,"Background: Correlation networks are increasingly being used in bioinformatics applications. For example, weighted gene co-expression network analysis is a systems biology method for describing the correlation patterns among genes across microarray samples. Weighted correlation network analysis (WGCNA) can be used for finding clusters ( modules) of highly correlated genes, for summarizing such clusters using the module eigengene or an intramodular hub gene, for relating modules to one another and to external sample traits ( using eigengene network methodology), and for calculating module membership measures. Correlation networks facilitate network based gene screening methods that can be used to identify candidate biomarkers or therapeutic targets. These methods have been successfully applied in various biological contexts, e. g. cancer, mouse genetics, yeast genetics, and analysis of brain imaging data. While parts of the correlation network methodology have been described in separate publications, there is a need to provide a user-friendly, comprehensive, and consistent software implementation and an accompanying tutorial. Results: The WGCNA R software package is a comprehensive collection of R functions for performing various aspects of weighted correlation network analysis. The package includes functions for network construction, module detection, gene selection, calculations of topological properties, data simulation, visualization, and interfacing with external software. Along with the R package we also present R software tutorials. While the methods development was motivated by gene expression data, the underlying data mining approach can be applied to a variety of different settings. Conclusion: The WGCNA package provides R functions for weighted correlation network analysis, e. g. co-expression network analysis of gene expression data. The R package along with its source code and additional material are freely available at http://www.genetics.ucla.edu/labs/horvath/CoexpressionNetwork/Rpackages/WGCNA.",10.1186/1471-2105-9-559,39,,,,,,,,,,,,,,,,,,,,,,,,,,,,,,,
J,"Kearse, M; Moir, R; Wilson, A; Stones-Havas, S; Cheung, M; Sturrock, S; Buxton, S; Cooper, A; Markowitz, S; Duran, C; Thierer, T; Ashton, B; Meintjes, P; Drummond, A",Geneious Basic: An integrated and extendable desktop software platform for the organization and analysis of sequence data,"The two main functions of bioinformatics are the organization and analysis of biological data using computational resources. Geneious Basic has been designed to be an easy-to-use and flexible desktop software application framework for the organization and analysis of biological data, with a focus on molecular sequences and related data types. It integrates numerous industry-standard discovery analysis tools, with interactive visualizations to generate publication-ready images. One key contribution to researchers in the life sciences is the Geneious public application programming interface (API) that affords the ability to leverage the existing framework of the Geneious Basic software platform for virtually unlimited extension and customization. The result is an increase in the speed and quality of development of computation tools for the life sciences, due to the functionality and graphical user interface available to the developer through the public API. Geneious Basic represents an ideal platform for the bioinformatics community to leverage existing components and to integrate their own specific requirements for the discovery, analysis and visualization of biological data.",10.1093/bioinformatics/bts199,40,yes,yes,no,no,yes,no,yes,no,yes,no,yes,yes,no,no,no,no,yes,yes,yes,no,no,no,no,no,yes,yes,no,no,yes,yes,
