ID,Abstract,rule1,rule2,rule3,rule4,rule5,rule6,rule7,rule8,rule9,rule10,rule11,rule12,rule13,rule14,rule15,rule16,rule17,rule18,rule19,rule20,rule21,rule22,rule23,rule24,rule25,rule26,rule27,rule28,rule29,rule30,rule31,rule32,rule33
18,"Antimicrobial peptides are essential components of innate defense mechanisms and make promising candidates for novel anti-infective agents. The advantages of these peptides in clinical applications include their potential for broad-spectrum and rapid bactericidal activities, and low propensity for resistance development, whereas possible disadvantages include their high cost, limited stability, and unknown toxicology and pharmacokinetics. Granulysin (Gr) is a cytolytic and proinflammatory molecule expressed by activated human cytotoxic T lymphocytes and natural killer (NK) cells. This paper aims to study bacteriostatic and bactericidal activity against Mycobacterium tuberculosis by synthetic analogues of human Gr between 12 and 26 amino acids (AA) and their acyl derivatives. Considering results of previous studies, five new peptides were designed: a cyclic of 20 AA (Gr-SL1); one of 21 AA (linear) (Gr-SL2), another of 12 AA (cyclic) (Gr-SL3) and two lipopeptides (Gr-SL3-lauric and Gr-SL3-palmitic). Peptides were manually synthesized as C-terminal carboxamides by the solid-phase method following Fmoc chemistry. Gr synthetic analogues were purified by reverse phase HPLC and analyzed by analytical C18RP-HPLC and Maldi Tof. The antimycobacterial activity of synthesized Gr analogues was assessed using a microdilution susceptibility test as described previously. Although peptides studied here had neither higher antimycobacterial activity nor lower toxicity than analogs of human Gr previously evaluated, fresh knowledge concerning the influence of acylation and structural aspects analyzed will optimize the design of novel peptides combining the most favorable aspects for the maintenance of antimycobacterial activity with minimum toxicity.",,,,,,,,,,,,,,,,,,,,,,,,,,,,,,,,,
19,"We have demonstrated the use of a simple single ion trap mass spectrometer to identify classes of compounds as well as individual components in complex mixtures. First, a neutral reagent was used to mass tag oxygen-containing analytesusing a gas-phase ion/molecule reaction. Then, a neutral loss scan was used to indicate the carboxylic acids. The lack of unit mass selectivity in the neutral loss scan required subsequent product ion scans to confirm the presence and identity of the individual carboxylic acids. The neutral loss scan technique reduced the number of data-dependent MS/MS scans required to confirm identification of signals as protonated carboxylic acids. The method was demonstrated on neat mixtures of standard carboxylic acids as well as on solutions of relevant pharmaceutical tablets and may be generalizable to other ion/molecule reactions.",,,,,,,,,,,,,,,,,,,,,,,,,,,,,,,,,
20,"Cross-modal learning refers to learning that involves obtaining information from multiple modalities and then integrating and utilizing it. Multisensory integration is an important basis of cross-modal learning. Although cross-modal conditions are more like the real-life environment of human learning, most studies still use single-modal stimuli, and the results of cross-modal learning are still somewhat messy and unsystematic. In order to better summarize the characteristics of cross-modal learning and its related mechanisms, the current review first introduces multisensory integration effects and the factors that influence them, as well as the experimental and theoretical researches on the modality non-specificity of primary cortexes. Then, we sum up the researches on consciousness, representation type, and transfer effect in cross-modal learning, and research progress for neural mechanism of cross-modal learning by adopting the techniques such as neuronal recording, ERP and fMRI. Finally, we summarize the current research results of cross-modal learning, and examine prospects for the potential applications of these research findings and future research issues in this area.",,,,,,,,,,,,,,,,,,,,,,,,,,,,,,,,,
21,"Severe placental abruption is associated with high maternal and perinatal morbidity and mortality. Prompt delivery is usually mandatory in this situation. We report a case of a 33-year-old woman, gravida 5, para 3 + 1, at 26 weeks + 3 days' gestation who had severe placental abruption involving 40% of the placental surface complicated with maternal moderate anaemia and thrombocytopenia. In view of the extreme foetal prematurity and stable condition of both mother and foetus, expectant management was undertaken. The pregnancy was further complicated by foetal growth restriction detected 2 weeks later. At 30 weeks of gestation, an emergency caesarean section was performed for foetal distress. The surgery was uneventful and she delivered a live baby with good Apgar scores. This case report illustrates an atypically satisfactory pregnancy outcome of severe placental abruption. Conservative management of severe placental abruption is possible in rare cases, taking into consideration the gestational week as well as the maternal haemodynamic condition and foetal well-being. When severe placental abruption is confounded by severe prematurity, a decision on whether to prolong the pregnancy to improve the perinatal outcome and neonatal survival needs to be carefully weighed against the usual management option of immediate delivery.",,,,,,,,,,,,,,,,,,,,,,,,,,,,,,,,,
22,"A simple, straightforward, for the peptide bond formation employing corresponding carboxylic acids and amines derived from amino acids via N-protected diacyldiselenide is delineated. The key step of the synthesis is the in situ generation of N-protected diacyldiselenide using NaBH2Se3 as selenating reagent, followed by trapping with an amino acid ester leading to the peptide. The formation of N-protected diacyldiselenide was confirmed through TLC and HRMS analysis using crude sample. The reaction is clean and all the products were obtained in moderate to good yields, including for sterically hindered amino acids. The protocol is free from racemisation, compatible with Fmoc, Cbz and Boc groups. [GRAPHICS] .",,,,,,,,,,,,,,,,,,,,,,,,,,,,,,,,,
23,"Anillin is an actin binding protein and plays crucial roles during mitotic cell cycle progression in metazoan. However, the sequence and functions of the Anillin gene have not been yet characterized in the silkworm, Bombyx mori. In this study, we cloned the full-length cDNA sequence of the silkworm Anillin (BmAnillin) gene. The deduced amino acid sequence for BmAnillin protein comprises an Anillin homology region (AHR) covering an Anillin homology domain and a pleckstrin homology domain. Phylogenetic analysis and multiple alignments of the Anillin genes from silkworm and other organisms indicated evolutionary conservation in the AHR containing conserved phosphorylation sites. Reverse transcription-PCR experiments confirmed that the BmAnillin gene was highly expressed during larval development of gonads in which cells undergo mitotic cycles and exhibited an unexpected high expression in silk gland with endocycle during larval molting. RNA interference-mediated knockdown of the BmAnillin gene in silkworm BmN4-SID1 cells derived from ovary disrupted chromosome separation and resulted in a loss of the F-actin filament at cleavage furrow during anaphase, suggesting that the BmAnillin gene is essential for cytokinesis in silkworm.",,,,,,,,,,,,,,,,,,,,,,,,,,,,,,,,,
24,"5T4, a membrane protein, is overexpressed in many tumor tissues but rarely expressed in normal tissues. Here, CHO-5T4(+) cells were generated and served as the antigen to immunize mice. Hybridoma techniques were employed to produce monoclonal antibodies (mAbs). The recombinant protein of human IgG Fc-fused extra cellular domain of 5T4 (5T4 ECD-Fc) was obtained from transient expression in HEK293F cells. The fusion protein 5T4 ECD-Fc and CHO-5T4(+) cells were respectively utilized to screen anti-5T4 antibodies that could bind to the native antigen. In preliminary screening, three hundred and fifty mAbs were obtained. Via surface plasmon resonance and flow cytometry screening, seven anti-5T4 mAbs stood out. Among them, H6 showed a high affinity (K-D = 1.6 x 10(-11) M) and internalization percentage (36% for 1 h and 80% for 4 h). The molecular weight and isoelectric point of H6 were determined by LC-MS and iCIEF. Moreover, the specific reactivity of H6 was demonstrated by western blotting, flow cytometry, and immunohistochemistry, respectively. In conclusion, we produced human recombinant protein of 5T4 extracellular domain and developed high-affinity internalizing monoclonal antibodies which may be applied in the 5T4-targeting ADC therapy and basic research.",,,,,,,,,,,,,,,,,,,,,,,,,,,,,,,,,
25,"Endocytic organelles maintain their acidic pH using the V-type ATPase proton pump. However, proton accumulation across the membrane generates a voltage and requires the movement of an additional ion, known as a counterion, to dissipate charge buildup. The role of counterion movement in endosomes is not clear, but a subpopulation of early endosomes, clathrin-coated vesicles (CCVs), has previously been shown to use external chloride (Cl-) to allow V-ATPase-dependent acidification. We aimed to determine the identity and function of this presumed Cl- transporting protein. Our sample of highly enriched bovine brain CCVs exhibited V-type ATPase-facilitated acidification in the presence of external Cl-, independent of the monovalent cations present. While unsuccessful at identifying the mechanism of anion transport, we used glutamate-facilitated acidification, density gradients, and mass spectrometry to show that most brain CCVs are synaptic vesicles, complementing results from earlier studies that argued similarity only on the basis on protein content. The source of Cl--dependent acidification in brain CCVs may be vGLUT1, a synaptic vesicle glutamate transporter with known Cl- permeability, although CCVs in other tissues are likely to utilize different proteins to facilitate acidification.",,,,,,,,,,,,,,,,,,,,,,,,,,,,,,,,,
26,"In this paper our previous chemical study of the anti-dengue active species Faramea bahiensis, Faramea hyacinthina and Faramea truncata (synonym of Faramea caudata) (Rubiaceae) is complemented by isolating from their stems, through a combination of silica gel and Sephadex LH-20 column chromatography and reversed phase solid-phase extraction, the known iridoid glucosides monotropein (1), monotropein methyl ester (2) and 10-deacetylasperulosidic acid (3). The structures were established by HPLC-DAD-MS/MS analysis, NMR spectroscopy and comparison with literature data. This is the first report on the occurrence of these compounds in the genus Faramea Aubl. This work contributes to expand the knowledge of the chemical diversity of this botanical genus, of which a limited number of identified compounds have been reported.",,,,,,,,,,,,,,,,,,,,,,,,,,,,,,,,,
27,"Cardosin A is an aspartic protease present in large amount in the pistils of cardoon flowers. This protease is known to contain an -Arg-Gly-Asp- (RGD) motif located on the molecular surface. In this study, we found that isolated recombinant cardosin A attached to human epithelial cells A549, mediated by the binding of its RGD motif to cell surface integrins. The cell bound cardosin A was internalized to endosomes and lysosomes and triggered the permeability of lysosomal membrane leading to apoptosis of the epithelial cells. These events are identical to those observed for three RGD-containing aspartic proteases, Saps 4-6, secreted by Candida albicans. Such a process, which has been called the Trojan Horse mechanism, is believed to benefit the invasion of C. albican into the epithelium of the host. The location of the RGD motifs of cardosin A and Saps 4-6 are on the opposite ends of the homologous three-dimensional structures, suggesting that the Trojan Horse mechanism is insensitive to the RGD position. Current finding also suggests that cardosin A may have a defensive function against the ingestion of cardoon flowers by human, insects, and other herbivores.",,,,,,,,,,,,,,,,,,,,,,,,,,,,,,,,,
28,"Caldibacillus debilis strains GB1 and Tf display distinct phenotypes. Caldibacillus debilis GB1 is capable of anaerobic growth and can synthesize ethanol while C. debilis Tf cannot. Comparison of the GB1 and Tf genome sequences revealed that the genomes were highly similar in gene content and showed a high level of synteny. At the genome scale, there were several large sections of DNA that appeared to be from lateral gene transfer into the GB1 genome. Tf did have unique genetic content but at a much smaller scale: 300 genes in Tf verses 857 genes in GB1 that matched at <= 90% sequence similarity. Gene complement and copy number of genes for the glycolysis, tricarboxylic acid cycle, and electron transport chain pathways were identical in both strains. While Tf is an obligate aerobe, it possesses the gene complement for an anaerobic lifestyle (ldh, ak, pta, adhE, pfl). As a species, other strains of C. debilis should be expected to have the potential for anaerobic growth. Assaying the whole cell lysate for alcohol dehydrogenase activity revealed an approximately 2-fold increase in the enzymatic activity in GB1 when compared with Tf.",,,,,,,,,,,,,,,,,,,,,,,,,,,,,,,,,
29,"Poly(A) binding protein (PABP) family is commonly considered a protective barrier for the mRNA poly(A) tail. As a member of PABP family, cytoplasmic poly(A) binding protein-1(PABPC1) binds to A-rich mRNA sequences with high affinity and plays an important role in the post-transcriptional regulation. In addition, PABPC1 also participates in many metabolic pathways of mRNA, including polyadenylation / deadenylation, mRNA transport, mRNA translation, degradation and microRNA-associated regulation. Recently, numerous studies demonstrate that PABPC1 associated with the growth of germ cells, the hypertrophy of myocardium and the development of tumors, suggesting a close relationship between PABPC1 and the growth and development of cells. In this review, we will mainly summarize the structure, expression regulation, function and biological function of PABPC1.",,,,,,,,,,,,,,,,,,,,,,,,,,,,,,,,,
30,"Selective determination of peptides in mixtures or biological samples requires specific techniques for analysis. Herein, we report 3-methylcatechol (3-MC) as a novel fluorogenic reagent for the selective determination of dipeptides by a simple fluorescence (FL) derivatization reaction. After extensive screening of 31 different catechol analogues, 3-MC was found to generate FL with peptides. The reaction was performed at 100 degrees C for 10min in the presence of borate buffer (pH 7) and sodium periodate. The resulting FL intensities were measured by spectrofluorometer at excitation wavelengths of 380nm and emission wavelengths of 500nm. Different reaction conditions such as concentration of sodium periodate, reaction time and pH of the borate buffer were studied to determine the optimum reaction conditions. Linearity was obtained between FL intensity and peptide concentrations from 10 to 160 mu M with a lower detection limit of 10 mu M (S/N=3). Dipeptides containing Ala, Phe, Leu and Val at the N-termini generated significant FL in comparison to the reagent blank (**p<0.005, ***p<0.0005). The reaction is simple, rapid, selective and sensitive which can be applied for the determination of the dipeptides as biomarkers or to determine enzyme activity.",,,,,,,,,,,,,,,,,,,,,,,,,,,,,,,,,
31,"Fusion between cells of different organisms (i.e., xenogeneic hybrids) can occur, and for humans this may occur in the course of tissue transplantation, animal handling, and food production. Previous work shows that conferred advantages are rare in xenogeneic hybrids, whereas risks of cellular dysregulation are high. Here, we explore the transcriptome of individual xenogeneic hybrids of human mesenchymal stem cells and murine cardiomyocytes soon after fusion and ask whether the process is stochastic or involves conserved pathway activation. Toward this end, single-cell RNA sequencing was used to analyze the transcriptomes of hybrid cells with respect to the human and mouse genomes. Consistent with previous work, hybrids possessed a unique transcriptome distinct from either fusion partner but were dominated by the cardiomyocyte transcriptome. New in this work is the documentation that a few genes that were latent in both fusion partners were consistently expressed in hybrids. Specifically, human growth hormone 1, murine ribosomal protein S27, and murine ATP synthase H+ transporting, mitochondrial Fo complex subunit C2 were expressed in nearly all hybrids. The consistent activation of latent genes between hybrids suggests conserved signaling mechanisms that either cause or are the consequence of fusion of these 2 cell types and might serve as a target for limiting unwanted xenogeneic fusion in the future.-Yuan, C., Freeman, B. T., McArdle, T. J., Jung, J. P., Ogle, B. M. Conserved pathway activation following xenogeneic, heterotypic fusion.",,,,,,,,,,,,,,,,,,,,,,,,,,,,,,,,,
32,"Primary Sjogren's syndrome (pSS) is a prototypic autoimmune disease characterized by immune injury to the salivary and lacrimal glands with other systemic manifestations. Recent studies showed the adaptive autoimmune responses induced by muscarinic acetylcholine 3 receptor (M3R) contribute to the dysfunction of exocrine glands in the pathogenesis of pSS. Although the M3R-induced mononuclear cells infiltration are observed in exocrine glands in pSS patients and animal models, the role of M3R in lymphatic vessels formation has not been explored. In current study, we found the expression of lymphatic vessel endothelial hyaluronan receptor 1 (LYVE-1) increased in intestine of the M3R immunized mice and epidermal growth factor receptor (EGFR) mimotope could inhibit this behavior. Our results suggested that the M3R/EGFR transactivation signaling may help mononuclear cells infiltrate in exocrine glands by promoting lymphangiogenesis.",,,,,,,,,,,,,,,,,,,,,,,,,,,,,,,,,
33,"We propose a high-dynamic optical angiography(HDOA) method to obtain blood flow images of a small biological specimen in vivo. High dynamic range exposure time is set to achieve high-dynamic integrated time modulation, which involves dynamic integrated effect and absorption effect. With this method, each-level vessels can be imaged with similar clarity. Moreover, the vessels in locations with different thickness and absorption coefficient can be reconstructed in the same image. Experiments on phantom and in vivo Gold Pristella Tetra were performed to demonstrate that HDOA can achieve each-level vessels imaging based on dynamic integrated effect and absorption effect.",,,,,,,,,,,,,,,,,,,,,,,,,,,,,,,,,
34,"Evidence indicated that key changes in macrophage uptake of oxidized low density lipoprotein (oxLDL) and macrophage polarization in atherosclerotic plaques are closely related to dysfunctional autophagy. Wnt5a (wingless-type MMTV integration site family member 5a) is highly expressed in the macrophage-rich region of atherosclerosis (AS) lesions. However, whether Wnt5a is involved in macrophages autophagy is not clear. In this study, we established macrophages-derived foam cell induced by ox-LDL to explore the effects of Wnt5a/PKC delta pathway on autophagy. RAW 264.7 macrophages were incubated with 60 mg/L ox-LDL for 6h. The expression of autophagy marker, LC3 II / I was significantly increased and p62 was decreased obviously. Moreover, the expressions of Wnt5a, PCK delta and STAT3 were also elevated. Knockdown of Wnt5a reduced the expressions of LC3/ I and PKC delta, induced the expression of p62, inhibited cellular lipid accumulation. Furthermore, PKC delta inhibitor (Rottlerin) was downregulated the levels of LC3 II / I and STAT3, upregulated p62 level, inhibited cellular lipid accumulation. Therefore, ox-LDL induces autophagy in macrophages may be associated with Wnt5a/PKC delta signaling pathway. The present study indicates that Wnt5a/PKC delta signaling pathway may be underlying target for autophagy and drug intervention.",,,,,,,,,,,,,,,,,,,,,,,,,,,,,,,,,
35,"This study aimed to elucidate the precise mechanisms underlying the protective effects of phosphoseryl-tRNA kinase (PSTK) against cisplatin-induced podocyte injury. PSTK overexpression and knockdown vectors were generated and transfected into murine podocyte cells-5. PSTK levels were measured, and transcriptome sequencing was conducted. Differential expression analysis was performed to identify messenger RNAs (mRNAs) that were positively and negatively correlated with PSTK. We selected 10 candidate genes identified via real-time quantitative polymerase chain reaction and Western blot analysis for further analysis. As expected, PSTK levels were significantly higher in PSTK-overexpressing podocytes and significantly lower in PSTK-knockdown podocytes. PSTK overexpression resulted in the upregulation of 122 genes and downregulation of 372 genes in podocytes. On the other hand, PSTK knockdown resulted in the upregulation of 231 genes and downregulation of 445 genes. Furthermore, the analysis revealed that 11 genes were positively correlated with PSTK, whereas 20 genes were negatively correlated with PSTK. The obtained PSTK-regulated genes were primarily involved in molecular function, biological process, and cellular component, as well as the angiogenesis pathway. The Wnt family member 10A levels were significantly higher after PSTK overexpression, but were significantly lower after PSTK knockdown. In addition, Na+/K+ ATPase subunit -2 and matrix metalloproteinase 9 levels were significantly downregulated after PSTK overexpression, but significantly upregulated upon PSTK knockdown. Cell proliferation was significantly increased upon PSTK overexpression, but significantly decreased upon PSTK suppression. The results of this study not only identified several significant PSTK-regulated genes for further validation, but also provided insights into the mechanisms underlying the protective effects of PSTK on podocytes.",,,,,,,,,,,,,,,,,,,,,,,,,,,,,,,,,
36,"BackgroundThe quantity of documents being published requires researchers to specialize to a narrower field, meaning that inferable connections between publications (particularly from different domains) can be missed. This has given rise to automatic literature based discovery (LBD). However, unless heavily filtered, LBD generates more potential new knowledge than can be manually verified and another form of selection is required before the results can be passed onto a user. Since a large proportion of the automatically generated hidden knowledge is valid but generally known, we investigate the hypothesis that non trivial, interesting, hidden knowledge can be treated as an anomaly and identified using anomaly detection approaches.ResultsTwo experiments are conducted: (1) to avoid errors arising from incorrect extraction of relations, the hypothesis is validated using manually annotated relations appearing in a thesaurus, and (2) automatically extracted relations are used to investigate the hypothesis on publication abstracts. These allow an investigation of a potential upper bound and the detection of limitations yielded by automatic relation extraction.ConclusionWe apply one-class SVM and isolation forest anomaly detection algorithms to a set of hidden connections to rank connections by identifying outlying (interesting) ones and show that the approach increases the F-1 measure by a factor of 10 while greatly reducing the quantity of hidden knowledge to manually verify. We also demonstrate the statistical significance of this result.",,,,,,,,,,,,,,,,,,,,,,,,,,,,,,,,,
37,"Based on an official standard method of lutein analysis, an improved high performance liquid chromatography (HPLC) method for simultaneously detecting lutein and zeaxanthin was developed as focusing on the sample preparation protocol. The optimal pretreatment conditions included a saponification in a water bath for 15 min at a constant temperature of 50 degrees C, using a 10 mL 60% (w/v) potassium hydroxide solution, followed by extraction using 100 mL mixture of n-hexane, ethyl ether and cyclohexane (40: 40: 20, v/v/v). A mixture of dichloromethane, acetonitrile and methanol (20: 30: 50, v/v/v) was validated to elute lutein and zeaxanthin on a C-30 column (4.6 x 250 mm, 5 mu m). The resolution between lutein and zeaxanthin is >= 2.5. A millet sample was used for methodological verification and the results showed that the linear relations for lutein and zeaxanthin were good in ranges of 0.23-9.37 mu g/mL and 0.30-12.02 mu g/mL, respectively. The relative standard deviations of lutein and zeaxanthin were 1.40% and 5.09%, respectively, and their spiked recoveries were between 86.60% and 98.75%. The lutein and zeaxanthin results from this modified HPLC method are superior to those from the Chinese official method and ultrasonic extraction method. [GRAPHICS] .",,,,,,,,,,,,,,,,,,,,,,,,,,,,,,,,,
