Publication Type,Authors,Title,Abstract,DOI,ID,rule1,rule2,rule3,rule4,rule5,rule6,rule7,rule8,rule9,rule10,rule11,rule12,rule13,rule14,rule15,rule16,rule17,rule18,rule19,rule20,rule21,rule22,rule23,rule24,rule25,rule26,rule27,rule28,rule29,rule30,rule31
J,"Takahashi, K; Tanabe, K; Ohnuki, M; Narita, M; Ichisaka, T; Tomoda, K; Yamanaka, S",Induction of pluripotent stem cells from adult human fibroblasts by defined factors,"Successful reprogramming of differentiated human somatic cells into a pluripotent state would allow creation of patient- and disease-specific stem cells. We previously reported generation of induced pluripotent stem (iPS) cells, capable of germline transmission, from mouse somatic cells by transduction of four defined transcription factors. Here, we demonstrate the generation of iPS cells from adult human dermal fibroblasts with the same four factors: Oct3/4, Sox2, Klf4, and c-Myc. Human iPS cells were similar to human embryonic stem (ES) cells in morphology, proliferation, surface antigens, gene expression, epigenetic status of pluripotent cell-specific genes, and telomerase activity. Furthermore, these cells could differentiate into cell types of the three germ layers in vitro and in teratomas. These findings demonstrate that iPS cells can be generated from adult human fibroblasts.",10.1016/j.cell.2007.11.019,41,yes,yes,no,yes,yes,no,yes,yes,no,no,yes,yes,no,no,no,yes,yes,yes,no,yes,no,no,no,yes,yes,yes,no,no,yes,yes,yes
J,"Quast, C; Pruesse, E; Yilmaz, P; Gerken, J; Schweer, T; Yarza, P; Peplies, J; Glöckner, FO",The SILVA ribosomal RNA gene database project: improved data processing and web-based tools,"SILVA (from Latin silva, forest, http://www.arb-silva.de) is a comprehensive web resource for up to date, quality-controlled databases of aligned ribosomal RNA (rRNA) gene sequences from the Bacteria, Archaea and Eukaryota domains and supplementary online services. The referred database release 111 (July 2012) contains 3 194 778 small subunit and 288 717 large subunit rRNA gene sequences. Since the initial description of the project, substantial new features have been introduced, including advanced quality control procedures, an improved rRNA gene aligner, online tools for probe and primer evaluation and optimized browsing, searching and downloading on the website. Furthermore, the extensively curated SILVA taxonomy and the new non-redundant SILVA datasets provide an ideal reference for high-throughput classification of data from next-generation sequencing approaches.",10.1093/nar/gks1219,42,yes,no,no,yes,no,no,no,no,yes,no,yes,yes,yes,no,no,no,yes,yes,no,yes,no,no,yes,yes,yes,yes,yes,no,yes,yes,no
J,"Kim, D; Landmead, B; Salzberg, SL",HISAT: a fast spliced aligner with low memory requirements,"HISAT (hierarchical indexing for spliced alignment of transcripts) is a highly efficient system for aligning reads from RNA sequencing experiments. HISAT uses an indexing scheme based on the Burrows-Wheeler transform and the Ferragina-Manzini (FM) index, employing two types of indexes for alignment: a whole-genome FM index to anchor each alignment and numerous local FM indexes for very rapid extensions of these alignments. HISAT's hierarchical index for the human genome contains 48,000 local FM indexes, each representing a genomic region of similar to 64,000 bp. Tests on real and simulated data sets showed that HISAT is the fastest system currently available, with equal or better accuracy than any other method. Despite its large number of indexes, HISAT requires only 4.3 gigabytes of memory. HISAT supports genomes of any size, including those larger than 4 billion bases.",10.1038/NMETH.3317,43,yes,no,no,yes,yes,no,yes,yes,no,no,yes,no,yes,no,no,yes,yes,yes,yes,no,no,no,yes,yes,yes,yes,yes,yes,yes,yes,yes
J,"Liao, Y; Smyth, GK; Shi, W",featureCounts: an efficient general purpose program for assigning sequence reads to genomic features,"Motivation: Next-generation sequencing technologies generate millions of short sequence reads, which are usually aligned to a reference genome. In many applications, the key information required for downstream analysis is the number of reads mapping to each genomic feature, for example to each exon or each gene. The process of counting reads is called read summarization. Read summarization is required for a great variety of genomic analyses but has so far received relatively little attention in the literature. Results: We present featureCounts, a read summarization program suitable for counting reads generated from either RNA or genomic DNA sequencing experiments. featureCounts implements highly efficient chromosome hashing and feature blocking techniques. It is considerably faster than existing methods (by an order of magnitude for gene-level summarization) and requires far less computer memory. It works with either single or paired-end reads and provides a wide range of options appropriate for different sequencing applications.",10.1093/bioinformatics/btt656,44,yes,no,yes,yes,no,no,no,no,yes,no,yes,yes,no,no,no,no,yes,yes,yes,no,no,no,yes,yes,yes,no,no,yes,no,yes,yes
J,"Anders, S; Pyl, PT; Huber, W",HTSeq-a Python framework to work with high-throughput sequencing data,"Motivation: A large choice of tools exists for many standard tasks in the analysis of high-throughput sequencing (HTS) data. However, once a project deviates from standard workflows, custom scripts are needed. Results: We present HTSeq, a Python library to facilitate the rapid development of such scripts. HTSeq offers parsers for many common data formats in HTS projects, as well as classes to represent data, such as genomic coordinates, sequences, sequencing reads, alignments, gene model information and variant calls, and provides data structures that allow for querying via genomic coordinates. We also present htseq-count, a tool developed with HTSeq that preprocesses RNA-Seq data for differential expression analysis by counting the overlap of reads with genes.",10.1093/bioinformatics/btu638,45,yes,no,yes,no,yes,no,yes,yes,no,no,yes,yes,no,no,no,no,yes,yes,yes,no,no,no,no,no,no,no,no,no,yes,yes,yes
J,"Stamatakis, A",RAxML-VI-HPC: Maximum likelihood-based phylogenetic analyses with thousands of taxa and mixed models,"RAxML-VI-HPC (randomized axelerated maximum likelihood for high performance computing) is a sequential and parallel program for inference of large phylogenies with maximum likelihood (ML). Low-level technical optimizations, a modification of the search algorithm, and the use of the GTR+CAT approximation as replacement for GTR+Gamma yield a program that is between 2.7 and 52 times faster than the previous version of RAxML. A large-scale performance comparison with GARLI, PHYML, IQPNNI and MrBayes on real data containing 1000 up to 6722 taxa shows that RAxML requires at least 5.6 times less main memory and yields better trees in similar times than the best competing program (GARLI) on datasets up to 2500 taxa. On datasets >= 4000 taxa it also runs 2-3 times faster than GARLI. RAxML has been parallelized with MPI to conduct parallel multiple bootstraps and inferences on distinct starting trees. The program has been used to compute ML trees on two of the largest alignments to date containing 25 057 (1463 bp) and 2182 (51 089 bp) taxa, respectively.",10.1093/bioinformatics/btl446,46,yes,no,no,yes,yes,no,yes,no,yes,no,yes,yes,yes,no,no,yes,yes,yes,yes,no,no,no,yes,yes,yes,yes,yes,yes,yes,yes,no
J,"Li, B; Dewey, CN",RSEM: accurate transcript quantification from RNA-Seq data with or without a reference genome,"Background: RNA-Seq is revolutionizing the way transcript abundances are measured. A key challenge in transcript quantification from RNA-Seq data is the handling of reads that map to multiple genes or isoforms. This issue is particularly important for quantification with de novo transcriptome assemblies in the absence of sequenced genomes, as it is difficult to determine which transcripts are isoforms of the same gene. A second significant issue is the design of RNA-Seq experiments, in terms of the number of reads, read length, and whether reads come from one or both ends of cDNA fragments. Results: We present RSEM, an user-friendly software package for quantifying gene and isoform abundances from single-end or paired-end RNA-Seq data. RSEM outputs abundance estimates, 95% credibility intervals, and visualization files and can also simulate RNA-Seq data. In contrast to other existing tools, the software does not require a reference genome. Thus, in combination with a de novo transcriptome assembler, RSEM enables accurate transcript quantification for species without sequenced genomes. On simulated and real data sets, RSEM has superior or comparable performance to quantification methods that rely on a reference genome. Taking advantage of RSEM's ability to effectively use ambiguously-mapping reads, we show that accurate gene-level abundance estimates are best obtained with large numbers of short single-end reads. On the other hand, estimates of the relative frequencies of isoforms within single genes may be improved through the use of paired-end reads, depending on the number of possible splice forms for each gene. Conclusions: RSEM is an accurate and user-friendly software tool for quantifying transcript abundances from RNA-Seq data. As it does not rely on the existence of a reference genome, it is particularly useful for quantification with de novo transcriptome assemblies. In addition, RSEM has enabled valuable guidance for cost-efficient design of quantification experiments with RNA-Seq, which is currently relatively expensive.",10.1186/1471-2105-12-323,47,yes,no,yes,yes,yes,no,yes,yes,no,yes,yes,yes,yes,no,no,no,yes,yes,yes,no,no,no,no,yes,yes,yes,yes,yes,yes,yes,yes
J,"Kabsch, W",XDS,"The usage and control of recent modifications of the program package XDS for the processing of rotation images are described in the context of previous versions. New features include automatic determination of spot size and reflecting range and recognition and assignment of crystal symmetry. Moreover, the limitations of earlier package versions on the number of correction/scaling factors and the representation of pixel contents have been removed. Large program parts have been restructured for parallel processing so that the quality and completeness of collected data can be assessed soon after measurement.",10.1107/S0907444909047337,48,yes,yes,no,yes,no,no,no,no,yes,no,yes,yes,no,no,no,no,no,no,no,yes,no,no,no,no,no,no,no,no,no,yes,yes
J,"Librado, P; Rozas, J",DnaSP v5: a software for comprehensive analysis of DNA polymorphism data,"Motivation: DnaSP is a software package for a comprehensive analysis of DNA polymorphism data. Version 5 implements a number of new features and analytical methods allowing extensive DNA polymorphism analyses on large datasets. Among other features, the newly implemented methods allow for: (i) analyses on multiple data files; (ii) haplotype phasing; (iii) analyses on insertion/deletion polymorphism data; (iv) visualizing sliding window results integrated with available genome annotations in the UCSC browser.",10.1093/bioinformatics/btp187,49,yes,yes,no,yes,no,no,no,yes,no,no,yes,yes,no,no,no,no,no,no,yes,no,no,no,no,no,no,no,no,no,no,no,no
J,"Excoffier, L; Lischer, HEL",Arlequin suite ver 3.5: a new series of programs to perform population genetics analyses under Linux and Windows,"We present here a new version of the Arlequin program available under three different forms: a Windows graphical version (Winarl35), a console version of Arlequin (arlecore), and a specific console version to compute summary statistics (arlsumstat). The command-line versions run under both Linux and Windows. The main innovations of the new version include enhanced outputs in XML format, the possibility to embed graphics displaying computation results directly into output files, and the implementation of a new method to detect loci under selection from genome scans. Command-line versions are designed to handle large series of files, and arlsumstat can be used to generate summary statistics from simulated data sets within an Approximate Bayesian Computation framework.",10.1111/j.1755-0998.2010.02847.x,50,yes,yes,no,yes,yes,yes,yes,yes,no,no,yes,no,yes,no,no,no,no,no,yes,no,no,no,no,yes,yes,yes,no,no,yes,yes,
J,"Camacho, C; Coulouris, G; Avagyan, V; Ma, N; Papadopoulos, J; Bealer, K; Madden, TL",BLAST plus : architecture and applications,"Background: Sequence similarity searching is a very important bioinformatics task. While Basic Local Alignment Search Tool (BLAST) outperforms exact methods through its use of heuristics, the speed of the current BLAST software is suboptimal for very long queries or database sequences. There are also some shortcomings in the user-interface of the current command-line applications. Results: We describe features and improvements of rewritten BLAST software and introduce new command-line applications. Long query sequences are broken into chunks for processing, in some cases leading to dramatically shorter run times. For long database sequences, it is possible to retrieve only the relevant parts of the sequence, reducing CPU time and memory usage for searches of short queries against databases of contigs or chromosomes. The program can now retrieve masking information for database sequences from the BLAST databases. A new modular software library can now access subject sequence data from arbitrary data sources. We introduce several new features, including strategy files that allow a user to save and reuse their favorite set of options. The strategy files can be uploaded to and downloaded from the NCBI BLAST web site. Conclusion: The new BLAST command-line applications, compared to the current BLAST tools, demonstrate substantial speed improvements for long queries as well as chromosome length database sequences. We have also improved the user interface of the command-line applications.",10.1186/1471-2105-10-421,51,yes,no,yes,yes,no,no,no,no,yes,yes,yes,yes,no,no,no,no,yes,yes,yes,yes,no,no,no,yes,yes,yes,yes,yes,no,yes,yes
J,"Barrett, JC; Fry, B; Maller, J; Daly, MJ",Haploview: analysis and visualization of LD and haplotype maps,"Research over the last few years has revealed significant haplotype structure in the human genome. The characterization of these patterns, particularly in the context of medical genetic association studies, is becoming a routine research activity. Haploview is a software package that provides computation of linkage disequilibrium statistics and population haplotype patterns from primary genotype data in a visually appealing and interactive interface.",10.1093/bioinformatics/bth457,52,yes,yes,no,yes,no,no,no,no,no,no,yes,no,no,no,no,no,no,no,no,no,no,no,no,no,no,no,no,no,no,yes,yes
J,"Szklarczyk, D; Gable, AL; Lyon, D; Junge, A; Wyder, S; Huerta-Cepas, J; Simonovic, M; Doncheva, NT; Morris, JH; Bork, P; Jensen, LJ; Mering, C","STRING v11: protein-protein association networks with increased coverage, supporting functional discovery in genome-wide experimental datasets","Proteins and their functional interactions form the backbone of the cellular machinery. Their connectivity network needs to be considered for the full understanding of biological phenomena, but the available information on protein-protein associations is incomplete and exhibits varying levels of annotation granularity and reliability. The STRING database aims to collect, score and integrate all publicly available sources of protein-protein interaction information, and to complement these with computational predictions. Its goal is to achieve a comprehensive and objective global network, including direct (physical) as well as indirect (functional) interactions. The latest version of STRING (11.0) more than doubles the number of organisms it covers, to 5090. The most important new feature is an option to upload entire, genome-wide datasets as input, allowing users to visualize subsets as interaction networks and to perform gene-set enrichment analysis on the entire input. For the enrichment analysis, STRING implements well-known classification systems such as Gene Ontology and KEGG, but also offers additional, new classification systems based on high-throughput text-mining as well as on a hierarchical clustering of the association network itself. The STRING resource is available online at https://string-db.org/.",10.1093/nar/gky1131,53,yes,no,yes,yes,yes,no,yes,yes,no,no,yes,no,yes,no,yes,no,yes,yes,yes,no,yes,no,yes,yes,yes,yes,yes,no,yes,no,no
J,"Edgar, RC",UPARSE: highly accurate OTU sequences from microbial amplicon reads,"Amplified marker-gene sequences can be used to understand microbial community structure, but they suffer from a high level of sequencing and amplification artifacts. The UPARSE pipeline reports operational taxonomic unit (OTU) sequences with <= 1% incorrect bases in artificial microbial community tests, compared with >3% incorrect bases commonly reported by other methods. The improved accuracy results in far fewer OTUs, consistently closer to the expected number of species in a community.",10.1038/NMETH.2604,54,yes,yes,no,yes,no,no,no,no,no,no,yes,yes,yes,no,no,yes,yes,yes,yes,no,no,no,yes,yes,no,no,no,no,yes,yes,
J,"Nguyen, LT; Schmidt, HA; von Haeseler, A; Minh, BQ",IQ-TREE: A Fast and Effective Stochastic Algorithm for Estimating Maximum-Likelihood Phylogenies,"Large phylogenomics data sets require fast tree inference methods, especially for maximum-likelihood (ML) phylogenies. Fast programs exist, but due to inherent heuristics to find optimal trees, it is not clear whether the best tree is found. Thus, there is need for additional approaches that employ different search strategies to find ML trees and that are at the same time as fast as currently available ML programs. We show that a combination of hill-climbing approaches and a stochastic perturbation method can be time-efficiently implemented. If we allow the same CPU time as RAxML and PhyML, then our software IQ-TREE found higher likelihoods between 62.2% and 87.1% of the studied alignments, thus efficiently exploring the tree-space. If we use the IQ-TREE stopping rule, RAxML and PhyML are faster in 75.7% and 47.1% of the DNA alignments and 42.2% and 100% of the protein alignments, respectively. However, the range of obtaining higher likelihoods with IQ-TREE improves to 73.3-97.1%. IQ-TREE is freely available at http://www.cibiv.at/software/iqtree.",10.1093/molbev/msu300,55,yes,no,yes,yes,yes,no,yes,no,yes,yes,yes,yes,no,no,no,yes,yes,yes,no,yes,no,no,yes,yes,yes,yes,yes,yes,yes,yes,yes
J,"Chen, SF; Zhou, YQ; Chen, YR; Gu, J",fastp: an ultra-fast all-in-one FASTQ preprocessor,"Motivation: Quality control and preprocessing of FASTQ files are essential to providing clean data for downstream analysis. Traditionally, a different tool is used for each operation, such as quality control, adapter trimming and quality filtering. These tools are often insufficiently fast as most are developed using high-level programming languages (e.g. Python and Java) and provide limited multi-threading support. Reading and loading data multiple times also renders preprocessing slow and I/O inefficient. Results: We developed fastp as an ultra-fast FASTQ preprocessor with useful quality control and data-filtering features. It can perform quality control, adapter trimming, quality filtering, per-read quality pruning and many other operations with a single scan of the FASTQ data. This tool is developed in Cthornthorn and has multi-threading support. Based on our evaluation, fastp is 2-5 times faster than other FASTQ preprocessing tools such as Trimmomatic or Cutadapt despite performing far more operations than similar tools.",10.1093/bioinformatics/bty560,56,yes,no,no,yes,yes,no,yes,no,yes,no,yes,yes,no,no,no,no,yes,yes,yes,no,no,no,no,yes,no,no,yes,no,no,yes,yes
J,"Edgar, RC; Haas, BJ; Clemente, JC; Quince, C; Knight, R",UCHIME improves sensitivity and speed of chimera detection,"Motivation: Chimeric DNA sequences often form during polymerase chain reaction amplification, especially when sequencing single regions (e.g. 16S rRNA or fungal Internal Transcribed Spacer) to assess diversity or compare populations. Undetected chimeras may be misinterpreted as novel species, causing inflated estimates of diversity and spurious inferences of differences between populations. Detection and removal of chimeras is therefore of critical importance in such experiments. Results: We describe UCHIME, a new program that detects chimeric sequences with two or more segments. UCHIME either uses a database of chimera-free sequences or detects chimeras de novo by exploiting abundance data. UCHIME has better sensitivity than ChimeraSlayer (previously the most sensitive database method), especially with short, noisy sequences. In testing on artificial bacterial communities with known composition, UCHIME de novo sensitivity is shown to be comparable to Perseus. UCHIME is > 100x faster than Perseus and > 1000x faster than ChimeraSlayer.",10.1093/bioinformatics/btr381,57,yes,no,yes,yes,yes,no,yes,no,yes,yes,yes,yes,yes,no,no,yes,yes,yes,yes,no,no,no,yes,yes,yes,yes,no,yes,no,yes,yes
J,"Katoh, K; Misawa, K; Kuma, K; Miyata, T",MAFFT: a novel method for rapid multiple sequence alignment based on fast Fourier transform,"A multiple sequence alignment program, MAFFT, has been developed. The CPU time is drastically reduced as compared with existing methods. MAFFT includes two novel techniques. (i) Homologous regions are rapidly identified by the fast Fourier transform (FFT), in which an amino acid sequence is converted to a sequence composed of volume and polarity values of each amino acid residue. (ii) We propose a simplified scoring system that performs well for reducing CPU time and increasing the accuracy of alignments even for sequences having large insertions or extensions as well as distantly related sequences of similar length. Two different heuristics, the progressive method (FFT-NS-2) and the iterative refinement method (FFT-NS-i), are implemented in MAFFT. The performances of FFT-NS-2 and FFT-NS-i were compared with other methods by computer simulations and benchmark tests; the CPU time of FFT-NS-2 is drastically reduced as compared with CLUSTALW with comparable accuracy. FFT-NS-i is over 100 times faster than T-COFFEE, when the number of input sequences exceeds 60, without sacrificing the accuracy.",10.1093/nar/gkf436,58,yes,yes,no,yes,yes,no,yes,no,yes,no,yes,yes,no,no,no,yes,yes,yes,no,yes,yes,yes,no,yes,yes,no,yes,yes,no,yes,yes
J,"Chen, VB; Arendall, WB; Headd, JJ; Keedy, DA; Immormino, RM; Kapral, GJ; Murray, LW; Richardson, JS; Richardson, DC",<i>MolProbity</i>: all-atom structure validation for macromolecular crystallography,"MolProbity is a structure-validation web service that provides broad-spectrum solidly based evaluation of model quality at both the global and local levels for both proteins and nucleic acids. It relies heavily on the power and sensitivity provided by optimized hydrogen placement and all-atom contact analysis, complemented by updated versions of covalent-geometry and torsion-angle criteria. Some of the local corrections can be performed automatically in MolProbity and all of the diagnostics are presented in chart and graphical forms that help guide manual rebuilding. X-ray crystallography provides a wealth of biologically important molecular data in the form of atomic three-dimensional structures of proteins, nucleic acids and increasingly large complexes in multiple forms and states. Advances in automation, in everything from crystallization to data collection to phasing to model building to refinement, have made solving a structure using crystallography easier than ever. However, despite these improvements, local errors that can affect biological interpretation are widespread at low resolution and even high-resolution structures nearly all contain at least a few local errors such as Ramachandran outliers, flipped branched protein side chains and incorrect sugar puckers. It is critical both for the crystallographer and for the end user that there are easy and reliable methods to diagnose and correct these sorts of errors in structures. MolProbity is the authors' contribution to helping solve this problem and this article reviews its general capabilities, reports on recent enhancements and usage, and presents evidence that the resulting improvements are now beneficially affecting the global database.",10.1107/S0907444909042073,59,,,,,,,,,,,,,,,,,,,,,,,,,,,,,,,
J,"Peakall, R; Smouse, PE",GENALEX 6: genetic analysis in Excel. Population genetic software for teaching and research,"GENALEX is a user-friendly cross-platform package that runs within Microsoft Excel, enabling population genetic analyses of codominant, haploid and binary data. Allele frequency-based analyses include heterozygosity, F statistics, Nei's genetic distance, population assignment, probabilities of identity and pairwise relatedness. Distance-based calculations include AMOVA, principal coordinates analysis (PCA), Mantel tests, multivariate and 2D spatial autocorrelation and TWOGENER. More than 20 different graphs summarize data and aid exploration. Sequence and genotype data can be imported from automated sequencers, and exported to other software. Initially designed as tool for teaching, GENALEX 6 now offers features for researchers as well. Documentation and the program are available at http://www.anu.edu.au/BoZo/GenAlEx/",10.1111/j.1471-8286.2005.01155.x,60,yes,yes,no,no,yes,yes,yes,yes,no,no,yes,no,yes,no,no,yes,no,no,yes,no,no,no,no,yes,yes,yes,no,no,yes,yes,
