Publication Type,Authors,Title,Abstract,DOI,ID,rule1,rule2,rule3,rule4,rule5,rule6,rule7,rule8,rule9,rule10,rule11,rule12,rule13,rule14,rule15,rule16,rule17,rule18,rule19,rule20,rule21,rule22,rule23,rule24,rule25,rule26,rule27,rule28,rule29,rule30,rule31
J,"Livak, KJ; Schmittgen, TD",Analysis of relative gene expression data using real-time quantitative PCR and the 2<SUP>-ΔΔ<i>C</i></SUP><sub>T</sub> method,"The two most commonly used methods to analyze data from real-time, quantitative PCR experiments are absolute quantification and relative quantification. Absolute quantification determines the input copy number, usually by relating the PCR signal to a standard curve. Relative quantification relates the PCR signal of the target transcript in a treatment group to that of another sample such as an untreated control. The 2(-DeltaDeltaCr) method is a convenient way to analyze the relative changes in gene expression from real-time quantitative PCR experiments. The purpose of this report is to present the derivation, assumptions, and applications of the 2(-DeltaDeltaCr) method. In addition, we present the derivation and applications of two variations of the 2(-DeltaDeltaCr) method that may be useful in the analysis of real-time, quantitative PCR data. (C) 2001 Elsevier science.",10.1006/meth.2001.1262,0,yes,no,yes,yes,yes,no,yes,yes,no,no,yes,no,no,no,no,no,no,no,no,no,no,no,no,no,no,no,no,no,yes,yes,yes
J,"Schneider, CA; Rasband, WS; Eliceiri, KW",NIH Image to ImageJ: 25 years of image analysis,"For the past 25 years NIH Image and ImageJ software have been pioneers as open tools for the analysis of scientific images. We discuss the origins, challenges and solutions of these two programs, and how their history can serve to advise and inform other software projects.",10.1038/nmeth.2089,1,yes,yes,no,yes,no,no,no,no,no,no,yes,no,no,no,no,no,no,no,no,no,no,no,no,no,no,no,no,no,yes,yes,
J,"Schindelin, J; Arganda-Carreras, I; Frise, E; Kaynig, V; Longair, M; Pietzsch, T; Preibisch, S; Rueden, C; Saalfeld, S; Schmid, B; Tinevez, JY; White, DJ; Hartenstein, V; Eliceiri, K; Tomancak, P; Cardona, A",Fiji: an open-source platform for biological-image analysis,Fiji is a distribution of the popular open-source software I ImageJ focused on biological-image analysis. Fiji uses modern software engineering practices to combine powerful software libraries with a broad range of scripting languages to enable rapid prototyping of image-processing algorithms. Fiji facilitates the transformation of new algorithms into I ImageJ plugins that can be shared with end users through an integrated update system. We propose Fiji as a platform for productive collaboration between computer science and biology research communities.,10.1038/NMETH.2019,2,yes,yes,no,yes,yes,no,yes,yes,no,no,yes,no,no,no,no,no,no,no,yes,no,no,no,no,no,no,no,yes,no,yes,yes,yes
J,"Bolger, AM; Lohse, M; Usadel, B",Trimmomatic: a flexible trimmer for Illumina sequence data,"Motivation: Although many next-generation sequencing (NGS) read preprocessing tools already existed, we could not find any tool or combination of tools that met our requirements in terms of flexibility, correct handling of paired-end data and high performance. We have developed Trimmomatic as a more flexible and efficient preprocessing tool, which could correctly handle paired-end data. Results: The value of NGS read preprocessing is demonstrated for both reference-based and reference-free tasks. Trimmomatic is shown to produce output that is at least competitive with, and in many cases superior to, that produced by other tools, in all scenarios tested.",10.1093/bioinformatics/btu170,3,yes,no,yes,yes,yes,no,yes,no,yes,yes,yes,yes,no,no,no,no,yes,yes,yes,no,no,no,no,yes,yes,no,no,no,yes,yes,
J,"Tamura, K; Stecher, G; Peterson, D; Filipski, A; Kumar, S",MEGA6: Molecular Evolutionary Genetics Analysis Version 6.0,"We announce the release of an advanced version of the Molecular Evolutionary Genetics Analysis (MEGA) software, which currently contains facilities for building sequence alignments, inferring phylogenetic histories, and conducting molecular evolutionary analysis. In version 6.0, MEGA now enables the inference of timetrees, as it implements the RelTime method for estimating divergence times for all branching points in a phylogeny. A new Timetree Wizard in MEGA6 facilitates this timetree inference by providing a graphical user interface (GUI) to specify the phylogeny and calibration constraints step-by-step. This version also contains enhanced algorithms to search for the optimal trees under evolutionary criteria and implements a more advanced memory management that can double the size of sequence data sets to which MEGA can be applied. Both GUI and command-line versions of MEGA6 can be downloaded from www.megasoftware.net free of charge.",10.1093/molbev/mst197,4,yes,yes,no,yes,yes,no,yes,yes,no,no,yes,yes,no,no,no,no,no,no,no,no,no,no,no,no,no,yes,yes,no,yes,yes,yes
J,"Edgar, RC",MUSCLE: multiple sequence alignment with high accuracy and high throughput,"We describe MUSCLE, a new computer program for creating multiple alignments of protein sequences. Elements of the algorithm include fast distance estimation using kmer counting, progressive alignment using a new profile function we call the log-expectation score, and refinement using tree-dependent restricted partitioning. The speed and accuracy of MUSCLE are compared with T-Coffee, MAFFT and CLUSTALW on four test sets of reference alignments: BAliBASE, SABmark, SMART and a new benchmark, PREFAB. MUSCLE achieves the highest, or joint highest, rank in accuracy on each of these sets. Without refinement, MUSCLE achieves average accuracy statistically indistinguishable from T-Coffee and MAFFT, and is the fastest of the tested methods for large numbers of sequences, aligning 5000 sequences of average length 350 in 7 min on a current desktop computer. The MUSCLE program, source code and PREFAB test data are freely available at http://www.drive5. com/muscle.",10.1093/nar/gkh340,5,yes,yes,no,yes,yes,yes,yes,yes,no,no,yes,no,yes,yes,no,yes,yes,yes,yes,no,no,no,yes,yes,yes,yes,yes,yes,yes,yes,yes
J,"Kumar, S; Stecher, G; Tamura, K",MEGA7: Molecular Evolutionary Genetics Analysis Version 7.0 for Bigger Datasets,"We present the latest version of the Molecular Evolutionary Genetics Analysis (MEGA) software, which contains many sophisticated methods and tools for phylogenomics and phylomedicine. In this major upgrade, MEGA has been optimized for use on 64-bit computing systems for analyzing larger datasets. Researchers can now explore and analyze tens of thousands of sequences in MEGA. The new version also provides an advanced wizard for building timetrees and includes a new functionality to automatically predict gene duplication events in gene family trees. The 64-bitMEGA is made available in two interfaces: graphical and command line. The graphical user interface (GUI) is a native Microsoft Windows application that can also be used on Mac OS X. The command line MEGA is available as native applications for Windows, Linux, and Mac OS X. They are intended for use in high-throughput and scripted analysis. Both versions are available from www.megasoftware.net free of charge.",10.1093/molbev/msw054,6,yes,yes,no,yes,yes,no,no,yes,no,no,yes,no,yes,no,no,no,yes,yes,yes,no,no,no,no,yes,yes,yes,no,no,yes,yes,
J,"Langmead, B; Salzberg, SL",Fast gapped-read alignment with Bowtie 2,"As the rate of sequencing increases, greater throughput is demanded from read aligners. The full-text minute index is often used to make alignment very fast and memory-efficient, but the approach is ill-suited to finding longer, gapped alignments. Bowtie 2 combines the strengths of the full-text minute index with the flexibility and speed of hardware-accelerated dynamic programming algorithms to achieve a combination of high speed, sensitivity and accuracy.",10.1038/NMETH.1923,7,yes,no,yes,yes,yes,no,yes,yes,no,no,yes,no,no,no,no,yes,no,no,no,no,no,no,no,no,no,no,no,no,no,yes,no
J,"Shannon, P; Markiel, A; Ozier, O; Baliga, NS; Wang, JT; Ramage, D; Amin, N; Schwikowski, B; Ideker, T",Cytoscape: A software environment for integrated models of biomolecular interaction networks,"Cytoscape is an open source software project for integrating biomolecular interaction networks with high-throughput expression data and other Molecular states into a unified conceptual framework. Although applicable to any system of molecular components and interactions, Cytoscape is most powerful when used in Conjunction with large databases of protein-protein, protein-DNA, and genetic interactions that are increasingly available for humans and model organisms. Cytoscape's software Core provides basic functionality to layout and query the network; to Visually integrate the network with expression profiles, phenotypes, and other molecular states; and to link the network to databases of functional annotations. The Core is extensible through a straightforward plug-in architecture, allowing rapid development of additional Computational analyses and features. Several case Studies of Cytoscape plug-ins are Surveyed, including a search for interaction pathways correlating with changes in gene expression, a Study of protein complexes involved in cellular recovery to DNA damage, inference of a combined physical/functional interaction network for Halobacterium, and an interface to detailed stochastic/kinetic gene regulatory models.",10.1101/gr.1239303,8,yes,yes,no,yes,yes,no,yes,yes,no,no,yes,no,yes,no,no,no,yes,yes,yes,no,no,no,no,no,no,no,no,no,yes,yes,no
J,"Li, H; Durbin, R",Fast and accurate short read alignment with Burrows-Wheeler transform,"Motivation: The enormous amount of short reads generated by the new DNA sequencing technologies call for the development of fast and accurate read alignment programs. A first generation of hash table-based methods has been developed, including MAQ, which is accurate, feature rich and fast enough to align short reads from a single individual. However, MAQ does not support gapped alignment for single-end reads, which makes it unsuitable for alignment of longer reads where indels may occur frequently. The speed of MAQ is also a concern when the alignment is scaled up to the resequencing of hundreds of individuals. Results: We implemented Burrows-Wheeler Alignment tool (BWA), a new read alignment package that is based on backward search with Burrows-Wheeler Transform (BWT), to efficiently align short sequencing reads against a large reference sequence such as the human genome, allowing mismatches and gaps. BWA supports both base space reads, e. g. from Illumina sequencing machines, and color space reads from AB SOLiD machines. Evaluations on both simulated and real data suggest that BWA is similar to 10-20 x faster than MAQ, while achieving similar accuracy. In addition, BWA outputs alignment in the new standard SAM (Sequence Alignment/Map) format. Variant calling and other downstream analyses after the alignment can be achieved with the open source SAMtools software package.",10.1093/bioinformatics/btp324,9,,,,,,,,,,,,,,,,,,,,,,,,,,,,,,,
J,"Tamura, K; Peterson, D; Peterson, N; Stecher, G; Nei, M; Kumar, S","MEGA5: Molecular Evolutionary Genetics Analysis Using Maximum Likelihood, Evolutionary Distance, and Maximum Parsimony Methods","Comparative analysis of molecular sequence data is essential for reconstructing the evolutionary histories of species and inferring the nature and extent of selective forces shaping the evolution of genes and species. Here, we announce the release of Molecular Evolutionary Genetics Analysis version 5 (MEGA5), which is a user-friendly software for mining online databases, building sequence alignments and phylogenetic trees, and using methods of evolutionary bioinformatics in basic biology, biomedicine, and evolution. The newest addition in MEGA5 is a collection of maximum likelihood (ML) analyses for inferring evolutionary trees, selecting best-fit substitution models (nucleotide or amino acid), inferring ancestral states and sequences (along with probabilities), and estimating evolutionary rates site-by-site. In computer simulation analyses, ML tree inference algorithms in MEGA5 compared favorably with other software packages in terms of computational efficiency and the accuracy of the estimates of phylogenetic trees, substitution parameters, and rate variation among sites. The MEGA user interface has now been enhanced to be activity driven to make it easier for the use of both beginners and experienced scientists. This version of MEGA is intended for the Windows platform, and it has been configured for effective use on Mac OS X and Linux desktops. It is available free of charge from http://www.megasoftware.net.",10.1093/molbev/msr121,10,yes,yes,no,yes,yes,no,yes,yes,no,no,yes,yes,no,no,no,yes,yes,yes,no,yes,no,no,no,yes,yes,yes,yes,yes,yes,yes,yes
J,"Berman, HM; Westbrook, J; Feng, Z; Gilliland, G; Bhat, TN; Weissig, H; Shindyalov, IN; Bourne, PE",The Protein Data Bank,"The Protein Data Bank (PDB; http://www.rcsb.org/pdb/) is the-single worldwide archive of structural data of biological macromolecules. This paper describes the goals of the PDB, the systems in place for data deposition and access, how to obtain further information, and near-term plans for the future development of the resource.",10.1093/nar/28.1.235,11,yes,yes,no,no,yes,no,yes,yes,no,no,no,no,no,no,no,no,no,no,no,no,no,no,no,no,no,no,no,no,yes,no,no
J,"Dobin, A; Davis, CA; Schlesinger, F; Drenkow, J; Zaleski, C; Jha, S; Batut, P; Chaisson, M; Gingeras, TR",STAR: ultrafast universal RNA-seq aligner,"Motivation: Accurate alignment of high-throughput RNA-seq data is a challenging and yet unsolved problem because of the non-contiguous transcript structure, relatively short read lengths and constantly increasing throughput of the sequencing technologies. Currently available RNA-seq aligners suffer from high mapping error rates, low mapping speed, read length limitation and mapping biases. Results: To align our large (> 80 billon reads) ENCODE Transcriptome RNA-seq dataset, we developed the Spliced Transcripts Alignment to a Reference (STAR) software based on a previously undescribed RNA-seq alignment algorithm that uses sequential maximum mappable seed search in uncompressed suffix arrays followed by seed clustering and stitching procedure. STAR outperforms other aligners by a factor of > 50 in mapping speed, aligning to the human genome 550 million 2 x 76 bp paired-end reads per hour on a modest 12-core server, while at the same time improving alignment sensitivity and precision. In addition to unbiased de novo detection of canonical junctions, STAR can discover non-canonical splices and chimeric (fusion) transcripts, and is also capable of mapping full-length RNA sequences. Using Roche 454 sequencing of reverse transcription polymerase chain reaction amplicons, we experimentally validated 1960 novel intergenic splice junctions with an 80-90% success rate, corroborating the high precision of the STAR mapping strategy.",10.1093/bioinformatics/bts635,12,yes,no,yes,no,yes,no,yes,no,yes,no,yes,yes,yes,yes,no,yes,yes,yes,yes,no,no,no,yes,yes,yes,no,yes,yes,yes,yes,yes
J,"Huang, DW; Sherman, BT; Lempicki, RA",Systematic and integrative analysis of large gene lists using DAVID bioinformatics resources,"DAVID bioinformatics resources consists of an integrated biological knowledgebase and analytic tools aimed at systematically extracting biological meaning from large gene/protein lists. This protocol explains how to use DAVID, a high-throughput and integrated data-mining environment, to analyze gene lists derived from high-throughput genomic experiments. The procedure first requires uploading a gene list containing any number of common gene identifiers followed by analysis using one or more text and pathway-mining tools such as gene functional classification, functional annotation chart or clustering and functional annotation table. By following this protocol, investigators are able to gain an in-depth understanding of the biological themes in lists of genes that are enriched in genome-scale studies.",10.1038/nprot.2008.211,13,yes,yes,no,no,yes,no,yes,yes,no,no,yes,no,yes,no,no,no,no,yes,yes,no,no,no,no,no,no,no,no,no,no,yes,yes
J,"Pfaffl, MW",A new mathematical model for relative quantification in real-time RT-PCR,"Use of the real-time polymerase chain reaction (PCR) to amplify cDNA products reverse transcribed from mRNA is on the way to becoming a routine took in molecular biology to study low abundance gene expression. Real-time PCR is easy to perform, provides the necessary accuracy and produces reliable as well as rapid quantification results. But accurate quantification of nucleic acids requires a reproducible methodology and an adequate mathematical model for data analysis. This study enters into the particular topics of the relative quantification in real-time RT-PCR of a target gene transcript in comparison to a reference gene transcript. Therefore, a new mathematical model is presented. The relative expression ratio is calculated only from the real-time PCR efficiencies and the crossing point deviation of an unknown sample versus a control. This model needs no calibration curve. Control levels were included in the model to standardise each reaction run with respect to RNA integrity, sample loading and inter-PCR variations. High accuracy and reproducibility (<2.5% variation) were reached in LightCycler PCR using the established mathematical model.",10.1093/nar/29.9.e45,14,yes,no,yes,yes,yes,no,yes,yes,yes,yes,yes,yes,no,yes,no,yes,yes,yes,no,yes,no,no,yes,yes,no,no,no,no,yes,no,
J,"Robinson, MD; McCarthy, DJ; Smyth, GK",edgeR: a Bioconductor package for differential expression analysis of digital gene expression data,"It is expected that emerging digital gene expression (DGE) technologies will overtake microarray technologies in the near future for many functional genomics applications. One of the fundamental data analysis tasks, especially for gene expression studies, involves determining whether there is evidence that counts for a transcript or exon are significantly different across experimental conditions. edgeR is a Bioconductor software package for examining differential expression of replicated count data. An overdispersed Poisson model is used to account for both biological and technical variability. Empirical Bayes methods are used to moderate the degree of overdispersion across transcripts, improving the reliability of inference. The methodology can be used even with the most minimal levels of replication, provided at least one phenotype or experimental condition is replicated. The software may have other applications beyond sequencing data, such as proteome peptide count data.",10.1093/bioinformatics/btp616,15,yes,yes,no,yes,yes,no,yes,yes,no,no,yes,no,no,no,no,no,no,no,no,no,no,no,no,no,no,no,no,no,yes,yes,no
J,"Huelsenbeck, JP; Ronquist, F",MRBAYES: Bayesian inference of phylogenetic trees,The program MRBAYES performs Bayesian inference of phylogeny using a variant of Markov chain Monte Carlo.,10.1093/bioinformatics/17.8.754,16,no,no,no,no,no,no,no,no,no,no,yes,yes,no,no,no,no,no,no,no,no,no,no,no,no,no,no,no,no,yes,yes,no
J,"Tamura, K; Dudley, J; Nei, M; Kumar, S",MEGA4: Molecular evolutionary genetics analysis (MEGA) software version 4.0,"We announce the release of the fourth version of MEGA software, which expands on the existing facilities for editing DNA sequence data from autosequencers, mining Web-databases, performing automatic and manual sequence alignment, analyzing sequence alignments to estimate evolutionary distances, inferring phylogenetic trees, and testing evolutionary hypotheses. Version 4 includes a unique facility to generate captions, written in figure legend format, in order to provide natural language descriptions of the models and methods used in the analyses. This facility aims to promote a better understanding of the underlying assumptions used in analyses, and of the results generated. Another new feature is the Maximum Composite Likelihood (MCL) method for estimating evolutionary distances between all pairs of sequences simultaneously, with and without incorporating rate variation among sites and substitution pattern heterogeneities among lineages. This MCL method also can be used to estimate transition/transversion bias and nucleotide substitution pattern without knowledge of the phylogenetic tree. This new version is a native 32-bit Windows application with multi-threading and multi-user supports, and it is also available to run in a Linux desktop environment (via the Wine compatibility layer) and on Intel-based Macintosh computers under the Parallels program. The current version of MEGA is available free of charge at http://www.megasoftware.net.",10.1093/molbev/msm092,17,yes,yes,no,yes,yes,no,yes,yes,no,no,yes,no,no,yes,no,no,no,no,no,no,no,no,no,no,no,yes,yes,no,no,yes,yes
J,"Stamatakis, A",RAxML version 8: a tool for phylogenetic analysis and post-analysis of large phylogenies,"Motivation: Phylogenies are increasingly used in all fields of medical and biological research. Moreover, because of the next-generation sequencing revolution, datasets used for conducting phylogenetic analyses grow at an unprecedented pace. RAxML (Randomized Axelerated Maximum Likelihood) is a popular program for phylogenetic analyses of large datasets under maximum likelihood. Since the last RAxML paper in 2006, it has been continuously maintained and extended to accommodate the increasingly growing input datasets and to serve the needs of the user community. Results: I present some of the most notable new features and extensions of RAxML, such as a substantial extension of substitution models and supported data types, the introduction of SSE3, AVX and AVX2 vector intrinsics, techniques for reducing the memory requirements of the code and a plethora of operations for conducting postanalyses on sets of trees. In addition, an up-to-date 50-page user manual covering all new RAxML options is available.",10.1093/bioinformatics/btu033,18,yes,no,yes,yes,no,no,no,no,yes,no,yes,yes,no,no,no,no,yes,yes,yes,no,no,no,no,no,yes,yes,no,no,yes,yes,
J,"Larkin, MA; Blackshields, G; Brown, NP; Chenna, R; McGettigan, PA; McWilliam, H; Valentin, F; Wallace, IM; Wilm, A; Lopez, R; Thompson, JD; Gibson, TJ; Higgins, DG",Clustal W and clustal X version 2.0,"Summary: The Clustal W and Clustal X multiple sequence alignment programs have been completely rewritten in C. This will facilitate the further development of the alignment algorithms in the future and has allowed proper porting of the programs to the latest versions of Linux, Macintosh and Windows operating systems.",10.1093/bioinformatics/btm404,19,yes,yes,no,yes,no,no,no,no,yes,no,yes,yes,no,no,no,no,no,no,no,yes,no,no,no,no,no,no,no,yes,yes,no,yes
J,"Ritchie, ME; Phipson, B; Wu, D; Hu, YF; Law, CW; Shi, W; Smyth, GK",<i>limma</i> powers differential expression analyses for RNA-sequencing and microarray studies,"limma is an R/Bioconductor software package that provides an integrated solution for analysing data from gene expression experiments. It contains rich features for handling complex experimental designs and for information borrowing to overcome the problem of small sample sizes. Over the past decade, limma has been a popular choice for gene discovery through differential expression analyses of microarray and high-throughput PCR data. The package contains particularly strong facilities for reading, normalizing and exploring such data. Recently, the capabilities of limma have been significantly expanded in two important directions. First, the package can now perform both differential expression and differential splicing analyses of RNA sequencing (RNA-seq) data. All the downstream analysis tools previously restricted to microarray data are now available for RNA-seq as well. These capabilities allow users to analyse both RNA-seq and microarray data with very similar pipelines. Second, the package is now able to go past the traditional gene-wise expression analyses in a variety of ways, analysing expression profiles in terms of co-regulated sets of genes or in terms of higher-order expression signatures. This provides enhanced possibilities for biological interpretation of gene expression differences. This article reviews the philosophy and design of the limma package, summarizing both new and historical features, with an emphasis on recent enhancements and features that have not been previously described.",10.1093/nar/gkv007,20,yes,no,yes,yes,yes,no,yes,yes,no,no,yes,yes,yes,no,no,no,no,no,no,no,no,no,no,yes,yes,yes,yes,no,yes,yes,no
J,"Katoh, K; Standley, DM",MAFFT Multiple Sequence Alignment Software Version 7: Improvements in Performance and Usability,"We report a major update of the MAFFT multiple sequence alignment program. This version has several new features, including options for adding unaligned sequences into an existing alignment, adjustment of direction in nucleotide alignment, constrained alignment and parallel processing, which were implemented after the previous major update. This report shows actual examples to explain how these features work, alone and in combination. Some examples incorrectly aligned by MAFFT are also shown to clarify its limitations. We discuss how to avoid misalignments, and our ongoing efforts to overcome such limitations.",10.1093/molbev/mst010,21,yes,yes,no,yes,yes,no,no,no,yes,no,yes,yes,yes,no,no,no,yes,yes,no,yes,no,no,no,yes,yes,yes,no,yes,yes,yes,
