ID,Abstract,rule1,rule2,rule3,rule4,rule5,rule6,rule7,rule8,rule9,rule10,rule11,rule12,rule13,rule14,rule15,rule16,rule17,rule18,rule19,rule20,rule21,rule22,rule23,rule24,rule25,rule26,rule27,rule28,rule29,rule30,rule31,rule32,rule33
27,"A prototype filter design for FBMC/OQAM systems is proposed in this study. The influence of both the channel estimation and the stop-band energy is taken into account in this method. An efficient preamble structure is proposed to improve the performance of channel estimation and save the frequency spectral efficiency. The reciprocal of the signal-to-interference plus noise ratio (RSINR) is derived to measure the influence of the prototype filter on channel estimation. After that, the process of prototype filter design is formulated as an optimization problem with constraint on the RSINR. To accelerate the convergence and obtain global optimal solution, an improved genetic algorithm is proposed. Especially, the History Network and pruning operator are adopted in this improved genetic algorithm. Simulation results demonstrate the validity and efficiency of the prototype filter designed in this study.",,,,,,,,,,,,,,,,,,,,,,,,,,,,,,,,,
28,"These days, tunneling field effect transistors (TFET) for their ability in decrease of off-current transistors and also for electronic device power consumption, it is best point out for a scientist to research on this kind of transistors. By reducing off-current, on-current decreases too in compare to MOSFET transistors. Researchers are trying to reduce-off-current so that a minimum decrease in on-current occurs. One of the methods is to select a suitable oxide for the gate electrode. This paper presents an analytical model for the potential distribution of ZrO2, HfO2 and SiO2 effect over TFET. Using the potential distribution, the tunneling drain current is derived analytically by integrating the band-to-band tunneling generation rate over the device volume. The all-clear proposed that analytical models are validated via numerical results obtained from device simulations in SILVACO ATLAS software based on a non-local band-to-band tunneling model. Then results were ompared together. The results show the optimized on-current against off-current ratio and subthreshold swing.",,,,,,,,,,,,,,,,,,,,,,,,,,,,,,,,,
29,"Few research articles discussed the issue of fault location for partial coupling four-circuit overhead lines with different voltages. In this work, a fault location method is proposed for partial coupling untransposed four-circuit overhead line with different voltages on the same tower using synchronized current data. The distributed-parameter model of the line and the mutual couplings between all circuits are considered. The faulty circuits are initially recognized, and the deduced analytical equation for fault location does not depend on fault type or fault resistance. In addition, the locations of normal-shunt faults, cross-circuit faults and cross-voltage faults between different voltage levels are estimated precisely. Emulation studies are conducted by DIgSILENT Power Factory and MATLAB software to validate the proposed method under various fault resistances, fault locations and fault inception angles. In addition, the effect of estimation errors in line parameters as well as measurement and synchronization errors is tested.",,,,,,,,,,,,,,,,,,,,,,,,,,,,,,,,,
30,"In order to quickly suppress voltage fluctuations at the point of common coupling (PCC) caused by the doubly fed induction generator, a closed-loop control method of the static synchronous compensator (STATCOM) is proposed, through which proportional integral (PI) parameters of the current inner loop can be adjusted online. The core aim is to derive quantitative relationships between the PI parameters and the output current of the STATCOM based on combining mathematical mechanization theory (MMT) with digital signal processing. Due to the reduction and quasidivision of the MMT, this original control method can be used to adjust the PI parameters of the STATCOM online according to the actual sampling voltage and sampling current data. The simulation and experimental results show that this control method can make a quick PCC voltage recovery within 10 ms, which satisfies the Chinese standard GB/T-14549-93. It can provide a solution for large-scale wind power curtailment that should be solved imperatively. (c) 2019 Institute of Electrical Engineers of Japan. Published by John Wiley & Sons, Inc.",,,,,,,,,,,,,,,,,,,,,,,,,,,,,,,,,
31,"This study proposes the design of broad-band microstrip loop antennas with less-dispersive group velocity of radiation patterns for accurate direction of arrival (DoA) estimation. The proposed structure consists of radiating and feeding microstrip loops, and the radiating loop is electromagnetically coupled to the feeding loop. This feeding mechanism helps to suppress phase variations of radiating patterns by avoiding dual resonances within a wide frequency band over 60 MHz, which allows to obtain the less-dispersive group velocity for accurate DoA estimation. The effectiveness of the less-dispersive behaviour is validated by implementing the proposed structure into a four-element array to estimate vertical and horizontal placements using dual-axis phase interferometry. The results confirm that the proposed antenna has less-dispersive group velocity compared to a conventional microstrip patch antenna and is more suitable for accurate DoA estimation.",,,,,,,,,,,,,,,,,,,,,,,,,,,,,,,,,
32,"This paper presents an investigation of the influence on the shear force distribution and on the displacements of reinforced concrete bracing walls continuous through a basement, when modelling these walls. The shear forces and displacements are compared with those obtained when simplifying the wall by a cantilever with full fixity at the top of the basement, ignoring the transfer of shear force and bending moment into the basement. First, the influence of the basement is modelled by hinged connections between the wall and the base slab and the floor diaphragm above the basement, respectively. This will result in an unrealistically large wall shear force in the basement. Then, the flexural restraint of the wall by the base plate, and the lateral compliance of the floor diaphragm are modelled by a rotational spring and a lateral spring at those levels. Recommendations are given for reasonable values of the spring constants for practical design purposes. Special attention is given to the way in which including the basement in the mechanical model of such walls will influence aspects of their seismic design. Such aspects are the rigidity of the bracing system which influences the lateral earthquake loads, and the displacement ductility factor which influences the maximum admissible behaviour factor q.",,,,,,,,,,,,,,,,,,,,,,,,,,,,,,,,,
33,"A time-domain inverse scattering algorithm for determining unknown plasma resonance frequency and electron collision frequency of unmagnetized plasma media object has been proposed. Finite-difference time-domain (FDTD) method in conjunction with Lagrange multipliers and gradient-based minimization method are used in the proposed algorithm. The reconstruction of the parameters is based on the minimization of a cost function that describes the discrepancy between simulation and measured data of the electric field at the observation points. In order to obtain the gradient value of the unknown plasma parameters, an augmented cost function has been given by means of Lagrange multipliers with the Maxwell curl equations and constitutive relation of the unmagnetized plasma media. Then, the gradient value could be obtained after a series of transformations. At last, the Ploak-Ribiere conjugate gradient algorithm has been applied to update the plasma parameters iteratively. The effectiveness of the proposed algorithm has been validated through the simulation test.",,,,,,,,,,,,,,,,,,,,,,,,,,,,,,,,,
34,"Lattice Boltzmann Method is used to simulate mixed convection between two horizontal cylinders. This geometry is created using Smoothed Profile Method which produces proper fluid-solid interaction force as well as heat exchange. A two dimensional double distribution function lattice Boltzmann method is employed to simulate fluid flow and heat transfer simultaneously. In order to implement the velocity and temperature boundary conditions, the force term and heat source/sink are included in the evolution equations. While fixed Eulerian lattice nodes are employed, while different eccentricities are considered for inner cylinder. In order to simulate mixed convection, the radius ratio is set to be 2.5. Furthermore, the effect of Richardson number by choosing 0.01, 1, 100 and Prandtl number of 0.716 for air and 6.2 for water are investigated. Isotherms, streamlines and mean Nusselt numbers are given for each case. The results are in good agreement with previous related publications.",,,,,,,,,,,,,,,,,,,,,,,,,,,,,,,,,
35,"This paper presents an empirical study to determine whether alterations to graphical features (colour and size) of automatically generated LineSets improve task performance. LineSets are used to visualise sets and networks. The increasingly common nature of such data suggests that having effective visualisations is important. Unlike many approaches to set and network visualisation, which often use concave or convex shapes to represent sets alongside graphs, LineSets use lines overlaid on a graph. LineSets have been shown to be advantageous over shape-based approaches. However, the graphical properties of LineSets have not been fully explored. Our results suggest that automatically drawn LineSets can be significantly improved for certain tasks through the considered use of colour alongside size variations applied to their graphical elements. In particular, we show that perceptually distinguishable colours, lines of varying width, and nodes of varying diameter lead to improved task performance in automatically laid-out LineSets.",,,,,,,,,,,,,,,,,,,,,,,,,,,,,,,,,
36,"A robust private sector in space can be instrumental in achieving major space policy goals, such as those promoted by the U.S. Government: fostering private space markets and reducing the cost and time required for the government to develop and procure space systems. Meeting these goals will likely require increased government attention to the challenges facing the private sector, as well as potential implementation of new or underutilized regulatory, policy, and economic mechanisms. This article focuses on a government strategic investment fund as a potential economic mechanism, which would make equity investments in companies pursuing activities of interest to the government, and offers examples of past and current funds both in the United States and internationally. This article then assesses the utility of such a fund in addressing the challenges with meeting these 2 policy goals; these challenges were identified through a literature review and interviews with >60 space experts, economists, and other stakeholders. We identified 5 major challenges to fostering the growth of private space markets and 4 challenges to reducing government costs and accelerating the development and procurement of space systems. Our analysis concludes that although a government strategic investment fund may be useful in select scenarios, it will not most effectively address the current challenges.",,,,,,,,,,,,,,,,,,,,,,,,,,,,,,,,,
37,"Copper(II) oxide powder manufacture from H2O2 type etching waste is proposed. The basic copper carbonate, the intermediate product, is depends on the reaction mole ratio of sodium carbonate to copper hydroxide. The optimum reaction mole ratio is 2.64 at 80 degrees C under copper content of 57.5 wt.%. The optimum usage of NaOH is 120 g for Copper(II) oxide. The Copper(II) oxide yield and chlorine ion concentration, are 97.0 wt.% and 9.0 mg L, respectively. The physical properties, such as mean particle size, dissolution time, and angle of repose are 20.0 mu m, 60s, and 34.1 degrees, respectively. The via-hole filling thickness is 9.4 mu m, which satisfies general electroplating criteria, 15 mu m. (C) 2019 The Korean Society of Industrial and Engineering Chemistry. Published by Elsevier B.V. All rights reserved.",,,,,,,,,,,,,,,,,,,,,,,,,,,,,,,,,
38,"The monopoly electricity market in Indonesia uses flat tariffs but is being encouraged to change to dynamic pricing. Dynamic pricing scenarios have been implemented in many Western countries with various types of schemes. This paper discusses dynamic pricing scenarios based on residential load and generation in the Java-Bali system. The tariff scheme is a combination of critical peak pricing (CPP) and time-of-use (TOU). The CPP runs for only a few hours each year depending on the gas power plant operation. TOU will be used with peak and off-peak schedules as determined based on residential load characteristics. The gas power plant is a reference in designing the CPP rates because it is used to meet peak loads if other plants are unable to meet requirements and its cost of generating electricity is high compared to other power plants. The dynamic pricing scheme is simulated for a residential load. Then, the load reduction during peak times and the impact of reducing electricity consumption in the Java-Bali system is analyzed.",,,,,,,,,,,,,,,,,,,,,,,,,,,,,,,,,
39,"Catalytic CO oxidation on platinum group metals can exhibit nonlinear behaviors like catastrophe, bistability, and hysteresis, which are indicative of self-organizing processes occurring in the course of the oxidation reaction. As a result, the system demonstrates a multi-branch nonlinear input/output relationship for which the output value depends not only on the instantaneous input values, but also on the history of operations. Traditional linear control approaches may cause unstable operation in the CO oxidation reaction. In this paper, a nonlinear control strategy is proposed to solve the control problem. The control strategy incorporates a PI controller and a switching control strategy by which the control system can maintain a high regulating performance while preventing unstable operation. It may be applied to control operations in industrial processes of catalytic CO oxidation.",,,,,,,,,,,,,,,,,,,,,,,,,,,,,,,,,
40,"This paper considers the structural modeling of reinforced concrete beam-column (RCBC) joints of unbraced framed structures. The main objective is to establish a formula that determines, for each particular situation, if the centreline joint model may be used or if an explicit model, which although more accurate is also more complex, is required. Accordingly, in order to circumvent the need to analyze the full frame and to avoid the shortcomings of empirical procedures we derive simplified classification criteria (SCC) based on the stiffness of the joint components. By applying these SCC to a given RCBC joint, it is classified either as semi-rigid, meaning that an explicit model is required, or as nominally rigid otherwise. The determination of the parameters that are required by the SCC is fully discussed. The presented example illustrates the application of the developed SSC to particular RCBC joints, showing that its results are mainly confirmed by the analysis of the full frame to which they pertain.",,,,,,,,,,,,,,,,,,,,,,,,,,,,,,,,,
41,"Pakistan is one of the coal rich countries but only adds 10% of electricity to the national grid from coal fired power plants while major sources are, Hydel, LNG, Furnace oil, and natural gas. Prior to the discovery of Thar coal reservoirs, Lakhra was the largest coal field of Brown Lignite coal with high ash and sulfur contents, i.e. 30% and 7%, respectively. The power generation capacity of the plant is 150 MW. Study conducted revealed that all the existing values of un-washed coal found (High Ash, Low Moisture, Low Fixed Carbon, High Sulfur, and Low Calorific value) while the washed coal values found (Low Ash, Low Moisture, High Fixed Carbon, Low Sulfur, and High Heating value). The emission of hazardous gases and particles by using unwashed coal adversely affect the environment and human health whereas washed coal exhibited relatively low level emissions of these pollutants. It was observed that the washed coal of Lakhra is more feasible to save the environment as well as Cost Benefit for production of electricity.",,,,,,,,,,,,,,,,,,,,,,,,,,,,,,,,,
42,"In this paper, simultaneous wireless information and power transfer (SWIPT) transmissions with multiple-input single-output transceiver pairs are considered. In each pair, a multi-antenna transmitter sends data and energy to a single-antenna receiver with a signal-splitting structure and a non-linear energy harvesting model. Each transceiver pair tries to achieve high individual harvested energy efficiency, and uses artificial noise (AN) to protect the information from being overheard by other users that cooperate like a virtual eavesdropper. The weighted sum user-centric harvested energy-efficiency maximisation problem is formulated under constraints on the required signal-to-interference-plus-noise ratio (SINR) at each receiver, plus a limited SINR for virtual eavesdroppers and limited transmit power at each transmitter. The optimal precoding beamforming, AN, and signal-splitting factors are obtained by two proposed algorithms. The first solution exploits semidefinite relaxation and sequential parametric convex approximation techniques to convert the non-convex problem to a series of convex subproblems with matrix variables. We obtain optimal beamforming vectors along with an optimal covariance matrix for AN. The second solution directly utilizes beamforming approximation and obtains a low complexity solution for the convex subproblem. Moreover, we need to apply the feasible point pursuit method. Finally, numerical evaluations are provided in comparison with some benchmark schemes.",,,,,,,,,,,,,,,,,,,,,,,,,,,,,,,,,
43,"In this article, five particle size fractions such as +0.500 mm, 0.500-0.250 mm, 0.250-0.125 mm, 0.125-0.074 mm, and -0.074 mm were used to investigate the synergistic effect of particle heterogeneity and size on the hydrophobicity characterization of low rank coal surfaces using induction time and wetting thermodynamic measurements. The high induction time result of +0.500 mm size fraction with low ash content proved that the physical property, especially particle size, has a significant effect on induction time and wetting thermodynamic measurements. Moreover, LHR value and combustible recovery of 0.250-0.125 mm size fraction were higher than that of 0.125-0.074 mm size fraction, which indicated that the induction time measurement was greatly affected by the chemical property, i.e. heterogeneity. Furthermore, wetting thermodynamic measurements can be used as the supplement of induction time measurements while the ash content of the particle size fractions is close.",,,,,,,,,,,,,,,,,,,,,,,,,,,,,,,,,
44,"Occupational Applications This article describes techniques to evaluate combinations of percentile values when only the nominal percentile level and percentile values are known, but not the underlying data. The methods described can be employed to estimate anthropometric accommodation. One application is that of estimating accommodation from the sum of two or more percentile values when a desired dimension has not been directly measured, but can be estimated by combining the percentile values of two or more known percentile values (e.g. the percentile for seated eye height above the floor as the sum of 90th percentile values of seat height and eye height above the seat). A second application is to estimate the joint accommodation on multiple variables when two or more percentile values have been used to define dimensions (e.g. what is the joint accommodation for a chair seat when the height, depth, and width are defined by their respective 90th percentile values?). Technical Abstract Background: Several authors have noted the utility of combining percentile values, for example as sums of server response times, or as the proportion of cases in the intersection of sets of percentile-based parameters of objects, such as furniture dimensions. Purpose: This article describes methods to estimate unknown variances and correlations as a function of the percentages or quantiles of a distribution. Methods: Two methods are presented with which unknown variances and correlation values can be estimated. Variances are found by converting percentiles or quantiles to indicator function variables. As a result, the variance can be expressed as a function of the quantile. Similarly, there are limits on the range of correlation values, which are a function of the percentile or quantile. The midpoint of the range of possible correlation values can be used to estimate combinations of percentiles, as it minimizes the possible error due to estimates of the correlation value. Finally, estimates of combinations of percentiles are made using the derived variance and estimated correlation values. These estimates are compared with observed combinations. Results: The maximum possible error using these methods of estimating variances and correlations for combinations of two variables are illustrated for a selected range of quantiles. The maximum possible error is least at the extremes of the quantile range (e.g. for quantiles greater than the 90th or less than the 10th). Conclusions: In some instances where only limited data are available, such as a single pair of percentile values, it may be useful to draw some conclusions regarding the general population. The techniques described in this article allow for estimating the proportion of the population whose measurement values are concurrently less than or equal to the specified percentile values; or, to estimate the proportion of the population whose summed measurements are less than or equal to the sum of the known percentile values.",,,,,,,,,,,,,,,,,,,,,,,,,,,,,,,,,
45,"BACKGROUND Materials from renewable sources are in great demand to reduce carbon fingerprint. Olive pomace is a waste with high lignin content (>25%) and generated in high volumes. Therefore lignin from olive pomace is susceptible to be transformed into added value chemicals such as monomeric phenols through its catalytic depolymerization combining hydrogen donors (i.e. molecular hydrogen, polar protic solvents and formic acid) and catalysts based on transition metals (i.e. palladium and ruthenium supported on carbon, and SHVO catalyst, also ruthenium-based). RESULTS The reaction conditions for the nitrogen and hydrogen experiments were temperatures of 250 and 200 degrees C and initial pressures of 4 and 20 bar respectively. The bio-oil obtained after the catalytic process was approximately half of the initial sample weight, although somewhat lower under hydrogen conditions. The SHVO catalyst yielded 15 and 10% of monomeric phenols under nitrogen and hydrogen conditions respectively, while the other two catalysts yielded between 6 and 9% irrespective of the gas. CONCLUSION Overall, the SHVO catalyst provided a richer mixture of phenolic compounds owing to its milder hydrogenation activity compared with the other catalysts, although at the end of the reaction the catalyst did not preserve its native form. The use of formic acid under nitrogen atmosphere was advantageous to increase the yields of phenols. The most abundant monomers in the experiments using SHVO catalyst under both atmospheres were 4-propylguaiacol, (Z)-propenylguaiacol, 4-propylsyringol, dihydroconiferyl alcohol, (Z)-propenylsyringol and dihydrosinapyl alcohol. (c) 2019 Society of Chemical Industry",,,,,,,,,,,,,,,,,,,,,,,,,,,,,,,,,
46,"Salient object segmentation is an important computer vision problem having applications in numerous areas such as video surveillance, scene parsing, autonomous navigation etc. For images, this task is quite challenging due to clutter/texture present in the background, low resolution and/or low contrast of the object(s) of interest etc. In case of videos, additional issues such as object deformation, camera motion and presence of multiple moving objects make the foreground object segmentation a significantly difficult and open problem. However, motion pattern can also act as an important cue to identify the foreground objects against the background. This is exploited by the recent approaches via aggregation of temporally perturbed information from a series of consecutive frames. Unfortunately for images, this additional cue is not available. In this paper, we propose to emulate the effect of such perturbations by constructing a bag of multiple augmentations applied on a single input image. Saliency features are estimated independently from each perturbed image in this bag, which are further combined using a novel aggregation strategy based on a convolutional gated recurrent encoder-decoder unit. Through extensive experiments on the benchmark datasets, we show better or very competitive performance when compared with the state-of-the-art methods. We further observe that even with a bag constructed using simple affine transformations, we achieve impressive performances, proving the robustness of the proposed framework.",,,,,,,,,,,,,,,,,,,,,,,,,,,,,,,,,
