ID,Abstract,rule1,rule2,rule3,rule4,rule5,rule6,rule7,rule8,rule9,rule10,rule11,rule12,rule13,rule14,rule15,rule16,rule17,rule18,rule19,rule20,rule21,rule22,rule23,rule24,rule25,rule26,rule27,rule28,rule29,rule30,rule31,rule32,rule33
70,"In asynchronous duty-cycled wireless sensor networks (WSNs), each node has its own sleep schedule that is independent of the schedules of neighboring nodes. Since each node follows its own independent sleep schedule, the probability that a node's neighbors will wake up concurrently is quite low. For this reason, each single hop broadcast must be completed through multiple unicast transmissions, and the sender node must remain awake until all of its neighboring nodes have received the broadcast packet. In this paper, we present two energy efficient broadcast protocols, namely Broadcast Progress-based Efficient Multihop Broadcast (BPEMB) protocol and Tree-based Efficient Multihop Broadcast (TEMB) protocol, for asynchronous duty-cycled WSNs. In both of the proposed protocols, the decision of whether to transmit the broadcast packet is based on the link quality information and without any forwarder's guidance list. The redundant transmissions and collisions are avoided effectively with cooperation among the neighbors, so that the node with the best link quality to the receiver node takes responsibility to forward the packet to the receiver node. With this approach, nodes that are not involved in transmitting the broadcast packet can go to sleep and save their energy. In the BPEMB protocol, the forwarding decision of transmitting the broadcast packet is also influenced by the broadcast progress information, which is piggybacked in the broadcast packet. Through extensive simulations, we demonstrate that the proposed protocols can significantly improve the broadcast efficiency through reducing the energy consumption and minimizing the broadcast latency. The evaluation results also show that both the BPEMB and TEMB protocols can substantially reduce the collisions and redundant transmissions in asynchronous duty-cycled WSNs.",,,,,,,,,,,,,,,,,,,,,,,,,,,,,,,,,
71,"At the launch time, the engines of aircrafts emit electromagnetic signals uniquely described by a set of characteristics called signature. The simulators of signatures of the actual thermal objects are often used in testing the aircraft equipment. We analyze the main causes of errors appearing in the simulation of signatures on the bases of synthesizing of a three-dimensional function that describes the directivity pattern, spectral composition, and shape of the startup pulse. The computational relations for the error of the simulated parameter are presented. The error of the simulated parameter of the simulator is estimated according to the results of experimental investigations.",,,,,,,,,,,,,,,,,,,,,,,,,,,,,,,,,
72,Hydrocracking residue meeting physicochemical and chemical composition requirements for hydrocracking oil feedstock was studied. The optimal scheme for producing API group HI base oils was determined.,,,,,,,,,,,,,,,,,,,,,,,,,,,,,,,,,
73,"Stable detonation flame arresters with nominal diameters from DN50 to DN300 were tested in accordance with the ISO 16852 standard, and the criteria for determining steady detonation were studied. According to the results of flame arrester tests, using the inner diameter of the pipeline as the basis for the pressure division yielded more accurate results, which was not clearly described in ISO 16852 standard. The target values of P-md/P-TB for the DN50 flame arrester were too small. Further studies are needed to determine appropriate ratios of P-md/P-TB for flame arresters with different pipe diameters. The run-up distance required to form stable detonation was beyond L = 120 D, which is commonly believed to be the required distance for stable detonation to establish. Therefore, it is important to evaluate the conditions where flame arresters to be used and the conditions under which the flame arresters were tested.",,,,,,,,,,,,,,,,,,,,,,,,,,,,,,,,,
74,"A vertical caisson breakwater on soft intercalated ground (sand replacement in the upper layer) is highly susceptible to catastrophic failure when subjected to excessive cyclic loadings. In this paper, the cyclic stability of a caisson-rubble-ground system under different sand replacement conditions is investigated via finite element methods. Structure-soil interfaces and undrained strength degradation of the soft intercalated layer are two key considerations. The latter is implemented by modifying the Yasuhara model to quantify the strength degradation in terms of the number of cycles and stress level. Cyclic responses with different replacement ratios r (i.e., the ratio of backfilled sand layer thickness to initial total soft layer thickness) are presented in terms of pore pressure and strength degradation. Failure modes and safety factors are also investigated. Numerical results show that the pore pressure and strength degradation of the soft layer mainly occurred underneath the rubble mound, and were evident at small replacement ratios. The failure modes could be caisson sliding (r <= 0.35), soft ground bearing capacity failure (r > 0.50), or a combination thereof (0.35<r <= 0.50). The safety factor first increased and then approached a constant value with increasing replacement ratios. The findings herein provide a practical implication for safety evaluation and structural design.",,,,,,,,,,,,,,,,,,,,,,,,,,,,,,,,,
75,"Repairing concrete structures with carbon reinforced textile concrete under wet conditions or even underwater is not yet taken in to account according to the German abZ. Nonetheless, it can be assumed that there is a high potential for application in outdoor areas /facilities like channels or sewers which are fully exposed to weathering or even partially flooded with water. Recent research already shows that there are possibilities of applying textile reinforced carbon concrete under such conditions, which finally led to the entitled pilot project that has already successfully been completed. This project was a highly damaged duct liable to collapse in the centre of Feldafingen. The repair must be performed as quickly as possible while traffic and thus access to the adjacent properties must be granted. To meet these requirements, it was necessary to combine the standardised shotcrete method with still developing carbon concrete technology and perform extensive underwater tests prior to the project itself. It was possible to restore the duct with an additional layer of only 70 mm thickness. Furthermore, the flow speed of the water was improved by the seamless and smooth surface of the carbon concrete.",,,,,,,,,,,,,,,,,,,,,,,,,,,,,,,,,
76,"A Holling-Tanner system with Beddington-DeAngelis functional response and prey refuge takes the form x' (t) = x(t)(1 - x(x) - (1 - m)x(t)y(t)/a(1) + b(1 - m)x(t) + c(1)y(t), y' (t) = y(t) [delta - beta y(t)/ (1 - m)x(t)] is investigated in this paper, where a(1), b, c(1) , delta, and beta are all positive constants, m is a nonnegative constant which satisfies 0 <= m < 1. For the system without prey refuge, i.e., m = 0 case, by developing the new analysis technique, we show that C-1 >= 2 is enough to ensure the global attractivity of the positive equilibrium of the system, such a result seems amazing since it is independent of the parameter a(1), b, delta and beta. Consequently, we can draw the conclusion that for the most of the parameters, system admits a unique globally attractive positive equilibrium. For 0 < c(1) < 2, we also investigate the stability property of the positive equilibrium. Two examples together with their numerical simulations show the feasibility of the main results. For the system with prey refuge, we show that there exists a m*, such that for all m > m*, the system always admits a unique positive equilibrium, which means that enough large prey refuge can improve the coexistence of the species. Refuge plays important role on the persistent property of the system.",,,,,,,,,,,,,,,,,,,,,,,,,,,,,,,,,
77,"In this paper, some exact nonlocal boundary conditions are derived on an elliptical arc artificial boundary, and they are applied to solving the exterior anisotropic problems in concave angle domains. Based on the above artificial boundary conditions, the Schwarz alternating algorithm is presented. The convergence of this algorithm is examined. Finally, some numerical examples are given to show the effectiveness of our methods.",,,,,,,,,,,,,,,,,,,,,,,,,,,,,,,,,
78,"To deal with the large error of burst height measurement for novel optional burst height millimeter wave proximity fuses in new-generation long-range projectiles, a ground object recognition strategy based on echo polarization is proposed in this paper. In the height measurement process, there are many factors, including the flight condition of the projectile, tall objects, ground clutter, interference signals, etc. restricting measurement accuracy. Therefore, a novel measurement scheme is urgently needed to enhance the accuracy of height measurements. The method mainly distinguishes the surface and ground objects within the range of the detected beam, under the condition that the detection area has apparent divisions. The polarimetric rotation-invariant parameters are used to analyze the features of ground objects. On the other hand, when the detection area does not have apparent divisions, the polarimetric echo reconstruction technology is used to determine the surface. Simulation experiments show the feasibility and superiority of the proposed method compared with the traditional height measurement system. Even in the presence of extensive interference, the method allows the accurate measurement of the projectile's height above the ground.",,,,,,,,,,,,,,,,,,,,,,,,,,,,,,,,,
79,"In the present paper some aspects of the global dynamical behavior of a new SEIRS epidemic model with nonlinear incidence rate, non-permanent immunity and an additional epidemic-induced death rate are presented. More specifically, a point-to-point homoclinic connecting orbit to an endemic saddle equilibrium is numerically located, as a bifurcation with respect to the active parameter. Moreover, we compute members of the families of different types of heteroclinic connections, be them point-to-cycle, as well as, point-to-point connecting orbits. The physical meaning of these orbits in relation to the physical system is also discussed.",,,,,,,,,,,,,,,,,,,,,,,,,,,,,,,,,
80,"In this paper two different water flood scenarios at Volga-Kama river in Russia are presented. First scenario is based on the existing water management approach that has been implemented in the period from 23 August 2013 until 22 August 2014. The second scenario is based on the original management approach aimed at mitigation of flood impact to the populated areas. The flood propagation has been modelled in HEC-RAS software, while post-processing and impact analysis were performed in QGIS 3.0. The results show that proposed original management approach allows to decrease the impact caused by inundation at Volga-Kama river basin by two times compared to the one implemented by the operator management approach. This result is achieved due to mitigation of the flood in highly populated areas and allowing additional water discharge among water management facilities in the areas with low population.",,,,,,,,,,,,,,,,,,,,,,,,,,,,,,,,,
81,"In this paper, we propose to use inverse Gaussian distribution for modeling the tensile strength and fatigue life data of Sn-3.0Ag-0.5-0.5Cu solder joint. The Kolmogorov-smirnov statistic with its p-value and quantile-quantile plots show the inverse Gaussian fits these data well. Inverse Gaussian model may statistically analyze on the thermal aging effect of tensile and fatigue SAC305 solder joints.",,,,,,,,,,,,,,,,,,,,,,,,,,,,,,,,,
82,"The H-infinity synchronization problem of coupled delay partial differential systems (PDSs) with hybrid coupling is addressed in this paper. By using the nonsingular transformation method and pinning control, the coupled PDSs is decoupled to simplify the complex H-infinity synchronization problem, several H-infinity synchronization criteria are obtained. Furthermore, the asymptotical synchronization problem is studied when the external disturbances disappear. The relationship between the H-infinity synchronization and the asymptotical synchronization is also presented. Finally, an example of digital simulation elucidates the practicability and validity of the theoretical results.",,,,,,,,,,,,,,,,,,,,,,,,,,,,,,,,,
83,"An optimized primary structure for CubeSat 1U for QKD application is presented. Several proposals are shown where each one was analyzed regarding the mass quantity, natural frequency, thermal distribution and static forces based on the finite element computational method. The simulation results show that the optimized structure presents a mass of 155.43 gr using Al 7075 T6 (meaning a reduction of 50% compared to the initial model), natural frequency of 1204.9Hz, amplitude variations of 16.5 mm and that the general thermal distribution remain constant approximate to 79 degrees C under extreme thermal range, -13 degrees C - 136 degrees C. These results allow an adequate internal environment for a particular performance of an optical payload for QKD applications based on a reduced thermal noise.",,,,,,,,,,,,,,,,,,,,,,,,,,,,,,,,,
84,"In this paper, an effective multiuser detection (MUD) is proposed for direct sequence ultrawideband- (DS-UWB-) based space formation flying systems. The proposed method called GMM-MUD is based on Gaussian mixture models (GMMs) to suppress multiple access interference. The GMM describes probability distributions of the hypothesis testing problem which is used for bit classification. To reveal the difference between correct bits and error bits, the preprocessing operation applies a mapping function based on optimal multiuser detection. The parameters of GMM are estimated by using expectation-maximization (EM) algorithm. EM algorithm employs iterative operation to simplify the complexity of maximum likelihood estimation method and considers the mapping values of received bits as the observations. Simulation results demonstrate that the proposed GMM-MUD algorithm achieves good performances in terms of bit error rate performance, user capacity, and near-far resistance. Moreover, the computational complexity is low enough for space formation flying applications.",,,,,,,,,,,,,,,,,,,,,,,,,,,,,,,,,
85,"The proliferation of digital radiography (DR) has led to a re-evaluation of exposure parameters and image quality. Currently, there is a move towards reducing X-ray tube voltage (kVp) in paediatric exposures down to 40 kVp to achieve better images. However, the effect on patient dose of these modifications is uncertain. The main aims of this phantom study were to evaluate the effect of reducing the kVp in paediatric limb DR exposures on contrast-to-noise ratio (CNR) and patient dose. For this purpose, Monte Carlo simulations of radiographic exposures on a paediatric limb phantom were performed. The phantom included muscle tissue and bone segments of five different densities in the range of 1.12 to 1.48 g/cm(3). The overall thickness of the phantom varied between 1 and 12 cm. Dependence of the CNR at constant limb phantom muscle and bone doses and dependence of the CNR per unit of muscle and bone dose at constant detector dose on radiographic exposure factors and limb thickness were calculated. X-ray tube current-time product (mAs) values required to achieve equal detector dose versus limb thickness for different kVp were calculated, as well as muscle and bone doses for the limb phantom of varying thickness. Present work has shown that reducing the kVp in paediatric radiography of the extremities can result in a significant increase in radiation dose, particularly for thicker limbs. Low kVp radiography requires justification for use on the extremities.",,,,,,,,,,,,,,,,,,,,,,,,,,,,,,,,,
86,"LDMOS devices with grounded gate shield structures variations were simulated and tested, aiming to address hot carrier immunity and robustness concurrently. Optimal configuration of grounded gate shield structure was found to reduce local electrical field strength at gate-to-drain overlap for better hot carrier immunity, and to achieve uniform E-field distribution on drain side for robustness as well. Design trade off of hot carrier immunity (HCI) and robustness is analyzed by simulation and silicon data.",,,,,,,,,,,,,,,,,,,,,,,,,,,,,,,,,
87,"This paper investigates the adaptive control of fractional-order nonlinear system. The system is fluctuated by unmodeled dynamics and external disturbances, and the bounds of these uncertainties are unknown in advance. The effects of input saturation and unknown system parameters are taken into account in this paper. To deal with these unknown parameters, a robust adaptive control strategy is proposed. Then a fractional-order version of Lyapunov function is given to verify the stability of uncertain fractional-order nonlinear system. Simulation results are given to prove the feasibility and effectiveness of the given control strategy.",,,,,,,,,,,,,,,,,,,,,,,,,,,,,,,,,
88,"This study proposes a novel model-free robot manipulator joint position and velocity tracking controller with a simple structure for controlling a robotic manipulator with human-like reaching motion according to human movement characteristics. The proposed design guarantees the responses of the tracking error within preset bounds using velocity feedback. A structurally and computationally natural logarithmic controller is designed to achieve joint position and velocity tracking of a desired trajectory of a reaching motion profile with prescribed performance (PP) bounds. Simulations of a three-degree-of-freedom spatial manipulator with the PP controller confirm the conclusions even in case of typical input disturbances. Results show that the PP controller outperforms the traditional position and derivative (PD) trajectory tracking controller without requiring excessive control effort. The proposed controller that uses sole velocity feedback achieves the control objective with bell-shaped joint velocity profiles and joint consistency. Thus, the proposed controller outperforms the traditional PD trajectory tracking controller that uses position and velocity feedback with comparable control effort. The experiment with a KURA robot manipulator demonstrates that the control algorithm of sole velocity feedback can be used to achieve smooth reaching movements within a short travelling time of less than 1 s. The movements are characterised by bell-shaped joint velocity profiles and joint position consistency similar to human movements.",,,,,,,,,,,,,,,,,,,,,,,,,,,,,,,,,
89,"As an engineering software for calculating the aerodynamic parameters of aircraft, Missile DATCOM is widely used in the design and demonstration stage of aircraft research. In this paper, a 2-dimensional (2D) trajectory correction projectile is taken as the research object, and the DATCOM calculation accuracy is analyzed. The results show that in the software parameter setting, although method 1 describes the body is not accurate enough, its own geometry generators can accurately describe the body contour. The aerodynamic parameters calculated by this method are more accurate than method 2. The aerodynamic parameters of the 2D trajectory correction projectile calculated by DATCOM have a large system error compared with the wind tunnel test data. This paper proposes a system error compensation method (SECM) to compensate the calculated data, which can greatly reduce the system error. After the error compensation correction, the axial force coefficient (C-A) error is reduced to less than 3%, and the normal force coefficient (C-N) error and the pressure center position (XCP) error are generally reduced to within 10% and 5%, when the sideslip angle is 0 degrees. When the sideslip angle is less than 4 degrees, the C-A error is less than 5%, and when the sideslip angle (beta) is less than 1 degrees, the main data error of C-N is less than 15%, and the main data error of XCP is less than 25% These errors meet the engineering calculation accuracy requirements. This method cannot completely replace wind tunnel tests and computational fluid dynamics (CFD) simulation calculations, but it can greatly reduce the number of wind tunnel tests and the CFD simulations, and has strong application value.",,,,,,,,,,,,,,,,,,,,,,,,,,,,,,,,,
90,"The network densification is one of the key components of 5G to satisfying high data traffic. However, dense deployment of small cells introduces numerous challenges. Such as frequent handovers, inconsistent, interfaces, and so on. The software-defined 5G network is one important technique to solve these problems. Due to the separation of control plane and data plane, the handover management also should be redesigned in layers. In the paper, we have proposed a handover management strategy based on Multiple Attribute Decision Making (MADM) in Software-defined 5G network. The handover operations are managed by the handover controller in control plane. According to the simulation results, the proposed handover management strategy has the less delays and handover failure ratios than the conventional LTE1.",,,,,,,,,,,,,,,,,,,,,,,,,,,,,,,,,
91,"To improve the performance of the identification speed and the reliability in RFID system with large intensive tags, an improved tag anti-collision algorithm based on CSMA is proposed in this paper. The proposed model adopts the principle of the first arrival tag occupies channel and transmits packets in the next idle slot when the detected channel is idle, otherwise, adjusts the back-off time according to the collision times. Hence, the channel conflict caused by listening misjudgment is eased and propagation delay is reduced efficiently. Based on the Markov chain analysis, the simulation results show that the anti-collision algorithm proposed in this paper has higher recognition precision than the traditional algorithm.",,,,,,,,,,,,,,,,,,,,,,,,,,,,,,,,,
92,"This paper analyzes the influence of different static limits representation of generators on the load margins in voltage stability studies. Usually, a static representation of reactive power limits sets the reactive power generation at a machine to its maximum (or minimum) capacity. In this paper, an approach that considers the internal voltage of generators is presented, so both models are compared. These procedures are established using conventional bus type and the remote control bus type representations (PQV, P and theta bus type). These models are applied to a multi-machine system under different operating conditions. This knowledge aggregates crucial information to the analysis of the operating limits of the system. Thus, the main contribution of this paper is the accurate determination of load margin when different generator reactive power limits models are considered. Hence, the role of the overexcitation of generators is highlighted as a function of the reactive power margin.",,,,,,,,,,,,,,,,,,,,,,,,,,,,,,,,,
93,"Wireless sensor networks (WSNs) have been extensively studied in the literature. However, in hostile environments where node connectivity is severely compromised, the system performance can be greatly affected. In this work, we consider such a hostile environment where sensor nodes cannot directly communicate to some neighboring nodes. Building on this, we propose a distributed data gathering scheme where data packets are stored in different nodes throughout the network instead to considering a single sink node. As such, if nodes are destroyed or damaged, some information can still be retrieved. To evaluate the performance of the system, we consider the properties of different graphs that describe the connections among nodes. It is shown that the degree distribution of the graph has an important impact on the performance of the system. A teletraffic analysis is developed to study the average buffer size and average packet delay. To this end, we propose a reference node approach, which entails an approximation for the mathematical modeling of these networks that effectively simplifies the analysis and approximates the overall performance of the system.",,,,,,,,,,,,,,,,,,,,,,,,,,,,,,,,,
94,"Assuming all states are unavailable in a class of Takagi-Sugeno (T-S) fuzzy models with uncertainty, this article consists of designs of observers and controllers. Unlike the traditional state observer that is usually designed for the whole state once and for all, this article partitions the whole state into two parts: one is independent of the input and the uncertainty, and the other is not. Following some unique matrix transformations, an observer of the former part is first developed, based on which observers of the latter part and the uncertainty are derived. Using the observers, a controller that guarantees an asymptotically stable closed-loop control system is proposed. Moreover, in order to determine the relevant design parameters more simply, it makes clear that the separate property is held in this case. (c) 2019 Institute of Electrical Engineers of Japan. Published by John Wiley & Sons, Inc.",,,,,,,,,,,,,,,,,,,,,,,,,,,,,,,,,
