ID,Abstract,rule1,rule2,rule3,rule4,rule5,rule6,rule7,rule8,rule9,rule10,rule11,rule12,rule13,rule14,rule15,rule16,rule17,rule18,rule19,rule20,rule21,rule22,rule23,rule24,rule25,rule26,rule27,rule28,rule29,rule30,rule31,rule32,rule33
0,"This paper is dedicated to Prof. Reinhardt for excellent supervision and exciting research. He was about 20 years my supervisor and mentor. On the occasion of the 80(th) birthday of Prof. Hans-Wolf Reinhardt, one of the most important modern measuring techniques for concrete quality control is discussed. It was developed under his guidance and facilitates the ultrasound technique for monitoring and analyzing fresh concrete and mortar properties during setting and hardening. To stress Prof. Reinhardt's merits, the developments at the University of Stuttgart are summarized. They culminated in one of the first commercially available modern test device that was the blueprint for other devices. The paper is giving also an introduction into the capabilities of the technique along with some more recent example of applications and a brief overview about standardization activities. The author's hope is that more scientists and practitioners are stimulated to use and further develop this technique establishing it on a broader range in the area of building constructions.",yes,no,no,yes,no,no,no,no,no,no,yes,yes,no,no,no,no,yes,yes,no,yes,no,no,yes,no,yes,yes,no,yes,no,yes,no,yes,yes
1,"Realkalization potential of drinking water reservoir coatings The realkalizing effect of mineral mortars is known from the repair of carbonated concrete in building construction. The application there is limited to the use of an ordinary Portland cement (CEM I) based repair material and to an average carbonation depth of less than 20 mm beyond the reinforcement. Concerning the repair of drinking water reservoirs, special boundary conditions must also be considered from both a hygienic and a technical point of view. According to the DVGW Code of Practice W 300-3, cement-bonded coatings are classified according to their ability to realkalize leached or carbonated concrete. The realkalization depot of the mortar and the existing residual alkalinity of the substrate are decisive for the choice of the cement-bonded coating. The relationship between the alkalinity depot and resistance to an reoccurring leaching attack of repair mortars as well as the simultaneous realkalization of the concrete substrate are not sufficiently known. In a DVGW funded research project, the performance of repair mortars is being investigated. The necessary boundary conditions for a successful realkalisation are determined and a more detailed description of the realkalisation depot is developed, aiding planners and users in their endeavor to estimate and improve durability of structures.",yes,no,no,yes,yes,no,yes,no,no,no,yes,yes,no,no,no,no,yes,yes,no,yes,no,yes,no,no,yes,yes,yes,yes,no,yes,yes,yes,no
2,"It is very difficult to plan the maintenance requirements of concrete pavements with alkali-silica reaction. Up to now, the necessary assessment has been carried out via visual appearance, AKR-provoking concrete investigations as well as polarization microscopic investigations on thin sections. With these investigations a forecast for the damage development is not possible. It is only possible to assess whether damage is no longer to be expected or whether there is still further potential for residual damage. The often significant deterioration of concrete pavement can be traced back to an undetected horizontal crack formation. In the context of an alkali-silica reaction (ASR), horizontal cracks can be found in the area of the joint crosses, the transverse joints and the longitudinal joints, which then extend several centimeters into the carriageway slab. The article illustrates the consequences of a damaging ASR and other loads in a carriageway slab. For the first time, it establishes a systematic relationship between a damaging ASR in a carriageway slab and the horizontal cracks in the area of the joints.",yes,no,no,no,no,no,no,happy,happy,no,yes,yes,no,no,no,no,yes,yes,yes,no,no,no,no,yes,yes,yes,happy,happy,no,no,yes,yes,
3,"This work presents a multi-chamber and multi-compartment model of a horizontal fluidized bed apparatus for layering granulation, coating, and drying. Each chamber is designed individually and process conditions, such as spray rate, particle feed or gas temperature, can be adjusted for each chamber separately. Particle growth is described by population balance modeling. The characteristics of the particle exchange rates between the individual process chambers are determined by separation functions to account for different weir configurations. Additionally a drying model is presented that takes initial droplet size and contact angle as well as partial wetting of the particle surface into account. Because of the great variety of parameters that influence this model, a parametric study is carried out to identify how construction or process parameters affect the product quality. The influence of different separation functions, thermal process conditions, and initial droplet properties on key product quality features such as particle size distribution, product moisture content, and degree of surface wetting are presented and discussed. The developed model can be used to describe product quality and particle transport in complex horizontal fluidized bed apparatuses.",yes,no,no,no,no,no,yes,no,yes,yes,yes,yes,no,yes,no,yes,yes,yes,yes,yes,yes,yes,yes,yes,yes,yes,yes,yes,no,no,no,yes,yes
4,"The compressive strength of concrete under biaxial dynamic compression The compressive strength of two concretes under biaxial dynamic compressive stress was investigated. A biaxial split Hopkinson bar was used, that applied the dynamic load to the test specimen in the form of two load waves perpendicular to each other. For reference, the static compressive strengths under biaxial load with different stress ratios of the two load axes were determined in a triaxial testing machine. The results indicate a partially superposition of the two strength-increasing effects of multi-axial compressive stress and increased strain rate. In particular, clear differences can be seen in the fracture and crack pattern for the different load types.",yes,no,no,no,no,no,yes,no,yes,yes,yes,yes,no,yes,no,no,yes,yes,yes,yes,no,no,yes,yes,yes,yes,no,yes,no,no,no,yes,yes
5,"Three-dimensional (3D) microwave imaging in very dispersive media using a phase shift and sum (PSAS) algorithm is presented. The phase shift and amplitude attenuation within the dispersive media are compensated individually for each frequency component and then integrated to calculate the pixel values in the region of interest (ROI). Therefore, the multi-speed and multipath issue when an ultra-wide band (UWB) signal propagates in the dispersive media is overcome. The current approach is validated by lab-collected data using our self-developed 3-D UWB microwave measurement system. Image results are compared with prior arts at the end of this paper.",,,,,,,,,,,,,,,,,,,,,,,,,,,,,,,,,
6,"In the combined transportation of multiple girder transport vehicles, the lifting of multiple hydraulic cylinders must ensure a certain synchronization accuracy, otherwise the bridge structure will be damaged, and even serious construction accidents will occur. The synchronous lifting of a large prefabricated bridge is studied. According to the requirements of synchronous lifting of the bridge, the appropriate control strategy is selected and the hydraulic system of synchronous lifting device is designed. The mathematical model of the synchronous lifting hydraulic system is established, and the fuzzy PID controller is applied. The simulation of the fuzzy adaptive PID control system for the synchronous lifting device is carried out by using MATLAB simulation software, and the simulation results indicate that the rationality of the control system is verified. The experimental results show that the control of the system is convenient and the synchronization accuracy is high, which can provide a reference for the synchronous lifting control.",,,,,,,,,,,,,,,,,,,,,,,,,,,,,,,,,
7,"This paper reveals various constraints in digital way of estimating the age of human facial image. The age estimation involves analyzing the facial features and classifying the age in accordance to the extracted feature values. The biometric features such as the facial parts (eye, mouth, chin, forehead, hair), texture, color and shape provide essential aging details. In the proposed method, the fractal features are extracted using fractal directional code method to retain the significant details present in the input image. The fractal features along with the local features are used to train the system. The deep neural network with three layers is used to train the system. The scaled conjugate gradient back propagation trains the system and the age is classified into seven age groups (0-10, 11-19, 20-29, 30-39, 40-49, 50-59 and 60-69). Higher accuracy is achieved by concocting the biometric features and the fractal features.",,,,,,,,,,,,,,,,,,,,,,,,,,,,,,,,,
8,"Workers in power supply systems are exposed to electromagnetic fields. These fields must not exceed the limit values set out in EU Directive 2013/35/EU (minimum health and safety requirements for workers with regard to exposure to the risk of physical agents (electromagnetic fields)) in order to protect workers against health risks. In Austria, a group of experts from the National Standardization Committee (OVE) has drawn up a national guideline (OVE guideline R 27) in order to prevent the diversity of assessment procedures. In addition, the guide aims to reduce time and effort in evaluation and documentation of electric and magnetic fields. This article provides an overview of the procedure and an assessment of the evaluated distances determined in accordance with OVE guideline R 27 for the protection of workers with regard to electric fields in substations.",,,,,,,,,,,,,,,,,,,,,,,,,,,,,,,,,
9,The energy saving and optimal operation of energy networks are essential issues in today's system management studies. A kind of natural gas (NG) storages called NG tank is presented in this Letter. The NG tank is modelled and formulated in the integrated energy network in a way that it can improve the optimal operation of an energy network as well.,,,,,,,,,,,,,,,,,,,,,,,,,,,,,,,,,
10,"An efficient design algorithm for local quantisers at nodes that optimises the global metric (i.e. estimation error) for distributed estimation systems is proposed. Noting that the quantisation partitions constructed to minimise the estimation error are not independently encodable at each node, a novel technique of compressing the partitions into sets of codewords while ensuring a perfect independent encoding is presented, leading to the sets with reasonable cardinality, which enables transmission of multiple codewords at nodes for estimation. Experiments demonstrate a significantly improved performance over various quantiser designs while achieving about 26% reduction in the size of codeword sets compared with a recent design.",,,,,,,,,,,,,,,,,,,,,,,,,,,,,,,,,
11,"Satisfaction evaluation of postgraduate scientific research training is an important basis to improve the quality of postgraduate education, and is also the key to improve the quality of postgraduate training. Firstly, based on Harman's single factor analysis method, the homologous deviation test was carried out on the satisfaction degree of postgraduate scientific research training in five universities of science and engineering in Anhui Province. The reliability and effectiveness of variables were analyzed from the reliability, content validity and structure validity. Secondly, using the multiple linear regression method, the paper modeled and processed the data of scientific research resources, scientific research atmosphere, tutor satisfaction, scientific research training satisfaction and so on. Finally, the ways of scientific research training and ability training for science and engineering postgraduates are put forward, which include abundant scientific research resources, appropriate scientific research subsidies, sincere tutors' help and harmonious scientific research atmosphere.",,,,,,,,,,,,,,,,,,,,,,,,,,,,,,,,,
12,"Acquiring data from biogas plants can be done by accessing the data stored in the programmable logic controller (PLC) of the biogas plant, which is responsible for issuing control commands to the hardware of the plant. Eight plants of three different manufacturers, with a total of 1370 data points, were analyzed to find similarities which could lead to a reliable but manufacturer-independent readout of sensor and control values. The expectation was plants of the same vendor being very similar but analysis showed that only minor similarities exist between plants of the same manufacturer. Even less similarities are found when it comes to plants from different manufacturers.",,,,,,,,,,,,,,,,,,,,,,,,,,,,,,,,,
13,"A varactor-less cross-coupled voltage-controlled oscillator based on triple frequency is presented in this paper, which is optimized for a low phase noise and low power at the high frequency. The VCO consists a voltage to current, a triple frequency, and a mixer with band-pass filter. The varactor-less VCO adjusts the frequency with the current and voltage of transconductance cell. A network R-F-C-F-R-F is applied to filter out the noise of current source at 2. The proposed circuit was simulated in a 0.18 mu m CMOS RF technology with a 1.5 V supply voltage. The designed VCO demonstrates an oscillation frequency range from 11.59 to 13.96 GHz with the triple frequency from 35.8 to 40.3 GHz. The simulated VCO presents a phase noise of -110.1 dBc/Hz at 1 MHz offset from a 40.3 GHz carrier frequency. The total figure of merit (FOMT) is -193.113 and -190.83 dBc/Hz with a DC power of 11.32 and 19.56 mW for VCO and total structure, respectively. The layout of the VCO occupies an area of 695.10 mu m 627.80 mu m.",,,,,,,,,,,,,,,,,,,,,,,,,,,,,,,,,
14,"In this paper a position sensorless controlled synchronous-reluctance machine is optimised with regard to efficient operation. The operation of the motor is divided into a low and a high speed range with consideration of the sensorless control method. At low speed range the INFORM method is used, which is based on the magnetical anisotropy of the rotor. A suitable selection of the rotor geometry can have a considerable effect on the sensorless properties and furthermore on the achievable efficiency. At higher speeds, the back-EMF model is compared to the short-circuit model. The implementation of a suitable sensorless method can lead to a significant efficiency improvement of the drive. Finally, the proposed sensorless control methods discussed in this paper are verified by measurements.",,,,,,,,,,,,,,,,,,,,,,,,,,,,,,,,,
15,"Forensic HFE attempts to understand and explain factors that may have contributed to specific human-system failures or injury events. It involves, by definition, after-the-fact review of available evidence as well as activity analysis of all involved parties and possibly site inspection, when warranted. An often-overlooked explanation for road crashes is visual misperception and illusions, which come in a variety of forms. The possible involvement of visual misperception in crash causation can be evaluated during a comprehensive site inspection under conditions that correspond as much as reasonably possible to the actual conditions that existed at the time of the crash. Two case studies are described that illustrate the value of site inspection in uncovering the possible contribution of visual misperception in these nighttime fatal crashes; case 1 involving visual illusion, and case 2 involving signal ambiguity. These cases demonstrate that site visits at night can be helpful in uncovering important visual phenomena that might not otherwise be apparent.",,,,,,,,,,,,,,,,,,,,,,,,,,,,,,,,,
16,,,,,,,,,,,,,,,,,,,,,,,,,,,,,,,,,,
17,"Random variation in buried oxide thickness strongly affects the digital performance of ultra-thin body germanium-on-insulator MOSFETs. Dependencies of threshold voltage, ON-current, OFF-current and subthreshold slope of ultra-thin body germanium-on-insulator MOSFETs on three different BOX dielectrics are examined by employing well-calibrated Synopsys TCAD. The variation of threshold voltage and ON-current becomes less sensitive with high-k BOX dielectrics whereas smaller variation of OFF-current is observed for the device with low-k BOX dielectrics. The subthreshold slope remains almost unaltered for all BOX dielectrics. Furthermore, a positive substrate bias is found to suppress variability of digital performance parameters of GeOI p-MOSFETs.",,,,,,,,,,,,,,,,,,,,,,,,,,,,,,,,,
18,"Since the development of nanoelectronics is at its early stage, a lot of different devices have been proposed. Accompanying the increasing research interests in nanodevices, developing effective design automation algorithms in different abstraction levels becomes an urgent need. However, the prosperity in the device aspect results a unique difficulty in the algorithm aspect, i.e. it is hard to provide a common object model, data structure used in design automation algorithms, for a specific nanodevice. To freeing algorithm researchers from developing different object models with only minor differences in different algorithms, the authors propose a method of creating object model automatically through C++ template meta programming. A concrete object model for quantum-dot cellular automata is illustrated as an example.",,,,,,,,,,,,,,,,,,,,,,,,,,,,,,,,,
19,"In a recent study, Li et al. proposed an algorithm for the decoding of binary quadratic residue codes with tiny memory requirements. In this Letter, this algorithm is modified in order to dramatically improve the decoding speed. The case of the (89, 45, 17) binary quadratic residue code is used to illustrate the new algorithm.",,,,,,,,,,,,,,,,,,,,,,,,,,,,,,,,,
20,"This letter investigates the energy efficiency (EE) optimisation of a distributed multiple-input single-output (D-MISO) system, and a suboptimal power allocation (PA) scheme with low complexity is developed for D-MISO system with beamforming. Different from the existing optimal PA scheme that needs iterative calculation, the developed scheme can provide closed-form PA and no iteration is required. Using the Cauchy-Schwarz inequality, the upper bound of EE is first obtained, and then the optimised objective function is formulated subject to a set of power budget constraints. By maximising this upper bound, a suboptimal PA scheme for the system is derived, and closed-form PA coefficients are attained. Interestingly, it is found that the proposed scheme has the same general form of PA as the optimal scheme. Numerical results verify the effectiveness of the proposed scheme, it can achieve the EE performance very close to that of the existing optimal scheme due to better approximation, but it has lower complexity than the latter.",,,,,,,,,,,,,,,,,,,,,,,,,,,,,,,,,
21,"A novel technology based on aluminium gallium nitride (AlGaN)/GaN hybrid-anode diode (HAD) for precise modulation of turn-on voltage is proposed and experimentally demonstrated. By delicately tailoring the as-grown barrier thickness, the turn-on voltage of the HAD and yet the non-linearity at zero bias (i.e. 0 V) for efficient microwave detection can be flexibly modulated. An AlGaN/GaN ultra-thin-barrier HAD (UTB-HAD) was designed and fabricated for zero-bias microwave detection. The AlGaN-barrier thickness was optimised to be 5 nm by TCAD simulation, which yields a strong non-linearity at zero bias featuring a high-curvature coefficient (gamma) of 27 V-1 in the fabricated UTB-HAD. The first-order voltage sensitivity beta(V) is projected to be as high as 2.7 mV/mu W. The proposed approach of precise sensitivity modulation is of great interests for high-efficient zero-bias microwave detection applications.",,,,,,,,,,,,,,,,,,,,,,,,,,,,,,,,,
22,The present work is depend upon a different data structure to perform the network reliability estimation efficiently. Zero suppressed binary decision diagram (ZBDD) is an well ordered and effective method of representing not only the boolean functions but also the sets of combinations than the conventional binary decision diagrams (BDD). This paper proposes new algorithm to manipulate the ZBDDs the variant of BDD on some benchmark networks. The 2-terminal network reliability problem has been studied extensively and effective results have been obtained.,,,,,,,,,,,,,,,,,,,,,,,,,,,,,,,,,
23,"In this study, the third harmonic injection method based on analogue circuit is applied in the interleaving parallel three-phase four-leg (3P4L) inverter, the adverse effects of injected signals on the circulating current are found, and the corresponding control strategy solution is proposed. At the beginning of this study, by using the large-signal model of leg, it is proved that four legs can be decoupled, on the basis of this conclusion, the current sharing control strategy based on dual-loop scheme and third harmonic injection can be applied in paralleled 3P4L inverter, however, peak value of circulating current is increased by zero-sequence component which is caused by injected signals. Therefore, output impedance analysis method is applied, and the control strategy including zero-sequence component feedforward loop is proposed, which can be implemented with analogue circuit, and is suitable for the 400 Hz synchronous/interleaving paralleled inverter systems. Finally, the effectiveness of the control strategy is verified by simulation and experiment.",,,,,,,,,,,,,,,,,,,,,,,,,,,,,,,,,
24,"This paper presents a discrete-time Geo/G/1 retrial queue with two waiting buffers to model an ATM network, in which the server begins a single vacation in cases where the system is empty at the instant of a service completion. New arriving customer who finds the server being on vacation can decide to either enter the retrial buffer with some probability p or leave the system with complementary probability 1-p. But the new arriving customer can begin its service immediately if he finds the server idle and join the original buffer if he finds the server busy. We first carry out an extensive analysis of the model by using the supplementary variable method and the generating function approach, and give some performance measures, such as server's state probabilities and mean queue lengths in the original buffer, retrial buffer, and in the system. Secondly, we give the generating function of the sojourn time of a customer in the system and prove that Little's law still holds in our model. Sensitivity analysis and cost optimization are finally given for illustrative purposes.",,,,,,,,,,,,,,,,,,,,,,,,,,,,,,,,,
25,"This paper analyzed the drying process of the household gas clothes dryer (GCD) based on the principle of heat and mass transfer. The drying models in three scenarios were established: natural gas burned in combustion chamber, ambient air mixed with exhausted gas in hot gas duct, and clothes were dried in the drying drum. The simulation of the drying process was performed on MATLAB software. And the effectiveness of the drying model was verified by comparison with experiment results. The effects of gas flow rate, dry mass of clothes, ambient temperature, ambient humidity, textile type, and moisture extraction rate (MER) on the performance of dryers were studied. This paper provided a theoretical basis for the design and optimization of GCDs. It was found that the drying time of the gas clothes dryer was mostly affected by the gas flow and dry mass of clothes, and the specific moisture extraction rate (SMER) was mostly affected by the ambient temperature and relative humidity. The nylon clothes have the fastest MER and the smallest SMER. Moreover, reducing operating time in falling-rate drying period can improve energy efficiency.",,,,,,,,,,,,,,,,,,,,,,,,,,,,,,,,,
26,"A new architecture for a thin (2-cm depth) rear projection display is described. In order to achieve this small depth, a very high density of rear projectors is used. Three prototype displays using rear projectors on both 5- and 2-cm pitch arrays are described. The displays can achieve an effective screen pixel pitch of as small as 0.5 mm, which makes this technology competitive in terms of resolution with fine pitch LED displays; however, orders of magnitude fewer LEDs are required: Each rear projector requires only one white LED and a color liquid crystal light modulator. In the three prototypes, the projector light modulators utilize 101-cm (40 in.), 80-cm (31.5 in.), and 60-cm (24 in.) diagonal liquid crystal display glass. To minimize cost, no lenses are utilized for the rear projectors. An RGB LED array may augment the projector array, which provides a low resolution component of the image onto which the high resolution component is superimposed by the projector array. Edge gaps between active areas on adjacent LCD glass units are completely eliminated by the rear projection approach enabling low profile wall-size seamless displays. Display contrast depends on rear projection screen design.",,,,,,,,,,,,,,,,,,,,,,,,,,,,,,,,,
