ID,Abstract,rule1,rule2,rule3,rule4,rule5,rule6,rule7,rule8,rule9,rule10,rule11,rule12,rule13,rule14,rule15,rule16,rule17,rule18,rule19,rule20,rule21,rule22,rule23,rule24,rule25,rule26,rule27,rule28,rule29,rule30,rule31,rule32,rule33,rule34
79,"In this paper we extend the ""network theory of aging,"" and we argue that a global reduction in the capacity to cope with a variety of stressors and a concomitant progressive increase in proinflammatory status are major characteristics of the aging process. This phenomenon, which we will refer to as ""inflamm-aging,"" is provoked by a continuous antigenic load and stress, On the basis of evolutionary studies, we also argue that the immune and the stress responses are equivalent and that antigens are nothing other than particular types of stressors, We also propose to return macrophage to its rightful place as central actor not only in the inflammatory response and immunity, but also in the stress response, The rate of reaching the threshold of proinflammatory status over which diseases/disabilities ensue and the individual capacity to cope with and adapt to stressors are assumed to be complex traits with a genetic component. Finally, we argue that the persistence of inflammatory stimuli over time represents the biologic background (first hit) favoring the susceptibility to age-related diseases/disabilities. A second hit (absence of robust gene variants and/or presence of frail gene variants) is likely necessary to develop overt organ specific age-related diseases having an inflammatory pathopenesis, such as atherosclerosis, Alzheimer's disease, osteoporosis, and diabetes, Following this perspective, several paradoxes of healthy centenarians (Increase of plasma levels of inflammatory cytokines, acute phase proteins, and coagulation factors) are illustrated and explained, In conclusion, the beneficial effects of inflammation devoted to the neutralization of dangerous/harmful agents early in life and in adulthood become detrimental late in life in a period largely not foreseen by evolution, according to the antagonistic pleiotropy theory of aging.",no,no,no,no,no,no,no,no,no,no,yes,yes,no,no,no,no,yes,yes,yes,no,no,no,no,no,yes,yes,yes,yes,no,yes,no,yes,yes,
80,"We describe the landscape of somatic genomic alterations based on multidimensional and comprehensive characterization of more than 500 glioblastoma tumors (GBMs). We identify several novel mutated genes as well as complex rearrangements of signature receptors, including EGFR and PDGFRA. TERT promoter mutations are shown to correlate with elevated mRNA expression, supporting a role in telomerase reactivation. Correlative analyses confirm that the survival advantage of the proneural subtype is conferred by the G-CIMP phenotype, and MGMT DNA methylation may be a predictive biomarker for treatment response only in classical subtype GBM. Integrative analysis of genomic and proteomic profiles challenges the notion of therapeutic inhibition of a pathway as an alternative to inhibition of the target itself. These data will facilitate the discovery of therapeutic and diagnostic target candidates, the validation of research and clinical observations and the generation of unanticipated hypotheses that can advance our molecular understanding of this lethal cancer.",no,no,no,no,no,no,no,no,no,no,no,no,yes,no,no,no,yes,yes,yes,no,no,no,yes,yes,yes,yes,yes,yes,yes,yes,yes,yes,yes,
81,"Determining the structure and function of a novel protein is a cornerstone of many aspects of modern biology. Over the past decades, a number of computational tools for structure prediction have been developed. It is critical that the biological community is aware of such tools and is able to interpret their results in an informed way. This protocol provides a guide to interpreting the output of structure prediction servers in general and one such tool in particular, the protein homology/analogy recognition engine (Phyre). New profile-profile matching algorithms have improved structure prediction considerably in recent years. Although the performance of Phyre is typical of many structure prediction systems using such algorithms, all these systems can reliably detect up to twice as many remote homologies as standard sequence-profile searching. Phyre is widely used by the biological community, with 4150 submissions per day, and provides a simple interface to results. Phyre takes 30 min to predict the structure of a 250-residue protein.",yes,no,no,yes,no,no,no,no,yes,no,yes,yes,no,no,no,no,yes,yes,yes,no,no,no,no,yes,yes,yes,yes,no,yes,no,no,yes,yes,
82,"A flexible statistical framework is developed for the analysis of read counts from RNA-Seq gene expression studies. It provides the ability to analyse complex experiments involving multiple treatment conditions and blocking variables while still taking full account of biological variation. Biological variation between RNA samples is estimated separately from the technical variation associated with sequencing technologies. Novel empirical Bayes methods allow each gene to have its own specific variability, even when there are relatively few biological replicates from which to estimate such variability. The pipeline is implemented in the edgeR package of the Bioconductor project. A case study analysis of carcinoma data demonstrates the ability of generalized linear model methods (GLMs) to detect differential expression in a paired design, and even to detect tumour-specific expression changes. The case study demonstrates the need to allow for gene-specific variability, rather than assuming a common dispersion across genes or a fixed relationship between abundance and variability. Genewise dispersions de-prioritize genes with inconsistent results and allow the main analysis to focus on changes that are consistent between biological replicates. Parallel computational approaches are developed to make non-linear model fitting faster and more reliable, making the application of GLMs to genomic data more convenient and practical. Simulations demonstrate the ability of adjusted profile likelihood estimators to return accurate estimators of biological variability in complex situations. When variation is gene-specific, empirical Bayes estimators provide an advantageous compromise between the extremes of assuming common dispersion or separate genewise dispersion. The methods developed here can also be applied to count data arising from DNA-Seq applications, including ChIP-Seq for epigenetic marks and DNA methylation analyses.",no,no,no,no,no,no,no,no,no,no,yes,yes,yes,no,no,no,yes,yes,yes,yes,yes,yes,yes,yes,yes,yes,yes,yes,yes,yes,no,yes,yes,
83,"As genomes evolve, they undergo large-scale evolutionary processes that present a challenge to sequence comparison not posed by short sequences. Recombination causes frequent genome rearrangements, horizontal transfer introduces new sequences into bacterial chromosomes, and deletions remove segments of the genome. Consequently, each genome is a mosaic Of unique lineage-specific segments, regions shared with a subset of other genomes and segments conserved among all the genomes under consideration. Furthermore, the linear order of these segments may be shuffled among genomes. We present methods for identification and alignment of conserved genomic DNA in the presence of rearrangements and horizontal transfer. Our methods have been implemented in a software package called Mauve. Mauve has been applied to align nine enterobacterial genomes and to determine global rearrangement structure in three mammalian genomes. We have evaluated the quality of Mauve alignments and drawn comparison to other methods through extensive simulations of genome evolution.",no,happy,happy,no,no,happy,happy,happy,no,no,yes,yes,no,no,no,no,yes,yes,yes,yes,no,no,yes,no,no,yes,yes,happy,happy,no,no,yes,yes,
84,"The in vitro scratch assay is an easy, low-cost and well-developed method to measure cell migration in vitro. The basic steps involve creating a ""scratch'' in a cell monolayer, capturing the images at the beginning and at regular intervals during cell migration to close the scratch, and comparing the images to quantify the migration rate of the cells. Compared to other methods, the in vitro scratch assay is particularly suitable for studies on the effects of cell - matrix and cell - cell interactions on cell migration, mimic cell migration during wound healing in vivo and are compatible with imaging of live cells during migration to monitor intracellular events if desired. Besides monitoring migration of homogenous cell populations, this method has also been adopted to measure migration of individual cells in the leading edge of the scratch. Not taking into account the time for transfection of cells, in vitro scratch assay per se usually takes from several hours to overnight.",no,no,no,no,no,no,no,happy,happy,no,yes,yes,no,no,yes,no,yes,yes,yes,yes,no,no,yes,yes,yes,yes,yes,happy,happy,no,no,yes,yes,no
85,"The transcription factors OCT4, SOX2, and NANOG have essential roles in early development and are required for the propagation of undifferentiated embryonic stem (ES) cells in culture. To gain insights into transcriptional regulation of human ES cells, we have identified OCT4, SOX2, and NANOG target genes using genome-scale location analysis. We found, surprisingly, that OCT4, SOX2, and NANOG co-occupy a substantial portion of their target genes. These target genes frequently encode transcription factors, many of which are developmentally important homeodomain proteins. Our data also indicate that OCT4, SOX2, and NANOG collaborate to form regulatory circuitry consisting of autoregulatory and feedforward loops. These results provide new insights into the transcriptional regulation of stem cells and reveal how OCT4, SOX2, and NANOG contribute to pluripotency and self-renewal.",no,happy,happy,no,no,happy,happy,happy,no,no,yes,yes,yes,no,no,no,yes,yes,yes,no,no,no,no,yes,yes,yes,yes,happy,happy,no,no,yes,yes,yes
86,"Noncoding RNAs (ncRNA) participate in epigenetic regulation but are poorly understood. Here we characterize the transcriptional landscape of the four human HOX loci at five base pair resolution in 11 anatomic sites and identify 231 HOX ncRNAs that extend known transcribed regions by more than 30 kilobases. HOX ncRNAs are spatially expressed along developmental axes and possess unique sequence motifs, and their expression demarcates broad chromosomal domains of differential histone methylation and RNA polymerase accessibility. We identified a 2.2 kilobase ncRNA residing in the HOXC locus, termed HOTAIR, which represses transcription in trans across 40 kilobases of the HOXD locus. HOTAIR interacts with Polycomb Repressive Complex 2 (PRC2) and is required for PRC2 occupancy and histone H3 lysine-27 trimethylation of HOXD locus. Thus, transcription of ncRNA may demarcate chromosomal domains of gene silencing at a distance; these results have broad implications for gene regulation in development and disease states.",yes,no,no,yes,yes,no,yes,yes,no,no,yes,yes,yes,no,no,no,yes,yes,yes,no,no,no,yes,yes,yes,yes,yes,yes,yes,yes,yes,yes,yes,
87,"The number of sequenced plant genomes and associated genomic resources is growing rapidly with the advent of both an increased focus on plant genomics from funding agencies, and the application of inexpensive next generation sequencing. To interact with this increasing body of data, we have developed Phytozome (http://www.phytozome.net), a comparative hub for plant genome and gene family data and analysis. Phytozome provides a view of the evolutionary history of every plant gene at the level of sequence, gene structure, gene family and genome organization, while at the same time providing access to the sequences and functional annotations of a growing number (currently 25) of complete plant genomes, including all the land plants and selected algae sequenced at the Joint Genome Institute, as well as selected species sequenced elsewhere. Through a comprehensive plant genome database and web portal, these data and analyses are available to the broader plant science research community, providing powerful comparative genomics tools that help to link model systems with other plants of economic and ecological importance.",yes,no,no,no,no,no,no,happy,happy,no,yes,yes,yes,no,no,no,yes,yes,yes,yes,no,no,yes,yes,yes,yes,yes,happy,happy,no,yes,yes,yes,yes
88,"Interactive Tree Of Life (http://itol.embl.de) is a webbased tool for the display, manipulation and annotation of phylogenetic trees. It is freely available and open to everyone. The current version was completely redesigned and rewritten, utilizing current web technologies for speedy and streamlined processing. Numerous new features were introduced and several new data types are now supported. Trees with up to 100,000 leaves can now be efficiently displayed. Full interactive control over precise positioning of various annotation features and an unlimited number of datasets allow the easy creation of complex tree visualizations. iTOL 3 is the first tool which supports direct visualization of the recently proposed phylogenetic placements format. Finally, iTOL's account system has been redesigned to simplify the management of trees in user-defined workspaces and projects, as it is heavily used and currently handles already more than 500,000 trees from more than 10,000 individual users.",no,no,no,no,no,no,no,happy,happy,no,no,happy,no,no,no,no,yes,yes,happy,happy,no,no,yes,yes,yes,yes,yes,happy,happy,no,no,yes,yes,no
89,"Skyline is a Windows client application for targeted proteomics method creation and quantitative data analysis. It is open source and freely available for academic and commercial use. The Skyline user interface simplifies the development of mass spectrometer methods and the analysis of data from targeted proteomics experiments performed using selected reaction monitoring (SRM). Skyline supports using and creating MS/MS spectral libraries from a wide variety of sources to choose SRM filters and verify results based on previously observed ion trap data. Skyline exports transition lists to and imports the native output files from Agilent, Applied Biosystems, Thermo Fisher Scientific and Waters triple quadrupole instruments, seamlessly connecting mass spectrometer output back to the experimental design document. The fast and compact Skyline file format is easily shared, even for experiments requiring many sample injections. A rich array of graphs displays results and provides powerful tools for inspecting data integrity as data are acquired, helping instrument operators to identify problems early. The Skyline dynamic report designer exports tabular data from the Skyline document model for in-depth analysis with common statistical tools.",no,happy,happy,no,no,no,no,happy,happy,no,no,happy,no,no,no,no,yes,yes,yes,happy,no,no,yes,yes,yes,yes,yes,yes,yes,no,no,yes,yes,no
90,"Protein quantification without isotopic labels has been a long-standing interest in the proteomics field. However, accurate and robust proteome-wide quantification with label-free approaches remains a challenge. We developed a new intensity determination and normalization procedure called MaxLFQ that is fully compatible with any peptide or protein separation prior to LC-MS analysis. Protein abundance profiles are assembled using the maximum possible information from MS signals, given that the presence of quantifiable peptides varies from sample to sample. For a benchmark dataset with two proteomes mixed at known ratios, we accurately detected the mixing ratio over the entire protein expression range, with greater precision for abundant proteins. The significance of individual label-free quantifications was obtained via a t test approach. For a second benchmark dataset, we accurately quantify fold changes over several orders of magnitude, a task that is challenging with label-based methods. MaxLFQ is a generic label-free quantification technology that is readily applicable to many biological questions; it is compatible with standard statistical analysis workflows, and it has been validated in many and diverse biological projects. Our algorithms can handle very large experiments of 500+ samples in a manageable computing time. It is implemented in the freely available MaxQuant computational proteomics platform and works completely seamlessly at the click of a button.",yes,no,no,yes,yes,no,yes,yes,no,no,yes,yes,yes,no,no,yes,yes,yes,yes,no,yes,yes,yes,yes,yes,yes,yes,yes,yes,yes,yes,yes,yes,
91,"Unsupervised class discovery is a highly useful technique in cancer research, where intrinsic groups sharing biological characteristics may exist but are unknown. The consensus clustering (CC) method provides quantitative and visual stability evidence for estimating the number of unsupervised classes in a dataset. ConsensusClusterPlus implements the CC method in R and extends it with new functionality and visualizations including item tracking, item-consensus and cluster-consensus plots. These new features provide users with detailed information that enable more specific decisions in unsupervised class discovery.",yes,no,no,yes,yes,no,yes,yes,no,no,yes,yes,no,no,no,no,yes,yes,yes,no,no,no,no,yes,yes,yes,yes,yes,no,no,no,yes,yes,
92,"Heterogeneity and latent variables are now widely recognized as major sources of bias and variability in high-throughput experiments. The most well-known source of latent variation in genomic experiments are batch effects-when samples are processed on different days, in different groups or by different people. However, there are also a large number of other variables that may have a major impact on high-throughput measurements. Here we describe the sva package for identifying, estimating and removing unwanted sources of variation in high-throughput experiments. The sva package supports surrogate variable estimation with the sva function, direct adjustment for known batch effects with the ComBat function and adjustment for batch and latent variables in prediction problems with the fsva function.",yes,no,no,yes,no,no,no,no,no,no,yes,yes,no,no,no,no,yes,yes,yes,no,no,no,no,no,no,yes,yes,no,yes,no,no,yes,yes,
93,"PowerMarker delivers a data-driven, integrated analysis environment (IAE) for genetic data. The IAE integrates data management, analysis and visualization in a user-friendly graphical user interface. It accelerates the analysis lifecycle and enables users to maintain data integrity throughout the process. An ever-growing list of more than 50 different statistical analyses for genetic markers has been implemented in PowerMarker.",no,happy,happy,no,no,no,no,happy,happy,no,no,happy,no,no,no,no,no,no,happy,happy,no,no,no,no,no,no,happy,happy,no,no,no,yes,yes,no
94,"Cancer is a disease driven by genetic variation and mutation. Exome sequencing can be utilized for discovering these variants and mutations across hundreds of tumors. Here we present an analysis tool, VarScan 2, for the detection of somatic mutations and copy number alterations (CNAs) in exome data from tumor normal pairs. Unlike most current approaches, our algorithm reads data from both samples simultaneously; a heuristic and statistical algorithm detects sequence variants and classifies them by somatic status (germline, somatic, or LOH); while a comparison of normalized read depth delineates relative copy number changes. We apply these methods to the analysis of exome sequence data from 151 high-grade ovarian tumors characterized as part of the Cancer Genome Atlas (TCGA). We validated some 7790 somatic coding mutations, achieving 93% sensitivity and 85% precision for single nucleotide variant (SNV) detection. Exome-based CNA analysis identified 29 large-scale alterations and 619 focal events per tumor on average. As in our previous analysis of these data, we observed frequent amplification of oncogenes (e.g., CCNE1, MYC) and deletion of tumor suppressors (NF1, PTEN, and CDKN2A). We searched for additional recurrent focal CNAs using the correlation matrix diagonal segmentation (CMDS) algorithm, which identified 424 significant events affecting 582 genes. Taken together, our results demonstrate the robust performance of VarScan 2 for somatic mutation and CNA detection and shed new light on the landscape of genetic alterations in ovarian cancer.",yes,no,no,no,no,no,no,no,yes,no,yes,yes,yes,no,no,yes,yes,yes,yes,yes,no,no,yes,yes,yes,yes,yes,yes,yes,yes,yes,yes,yes,
95,"Following integration of the observed diffraction spots, the process of 'data reduction' initially aims to determine the point-group symmetry of the data and the likely space group. This can be performed with the program POINTLESS. The scaling program then puts all the measurements on a common scale, averages measurements of symmetry-related reflections (using the symmetry determined previously) and produces many statistics that provide the first important measures of data quality. A new scaling program, AIMLESS, implements scaling models similar to those in SCALA but adds some additional analyses. From the analyses, a number of decisions can be made about the quality of the data and whether some measurements should be discarded. The effective 'resolution' of a data set is a difficult and possibly contentious question (particularly with referees of papers) and this is discussed in the light of tests comparing the data-processing statistics with trials of refinement against observed and simulated data, and automated model-building and comparison of maps calculated with different resolution limits. These trials show that adding weak high-resolution data beyond the commonly used limits may make some improvement and does no harm.",no,happy,happy,no,no,happy,happy,happy,happy,happy,yes,yes,no,no,no,yes,yes,yes,yes,yes,yes,yes,yes,yes,yes,yes,yes,happy,happy,no,no,yes,yes,happy
96,"Validation is a crucial aspect of any quantitative structure-activity relationship (QSAR) modeling. This paper examines one of the most popular validation criteria, leave-one-out cross-validated R-2 (LOO q(2)). Often, a high value of this statistical characteristic (q(2) > 0.5) is considered as a proof of the high predictive ability of the model. In this paper, we show that this assumption is generally incorrect. In the case of 3D QSAR, the lack of the correlation between the high LOO q(2) and the high predictive ability of a QSAR model has been established earlier [Pharm. Acta Heiv. 70 (1995) 149; J. Chemomet. 10 (1996) 95; J. Med. Chem. 41 (1998) 2553]. In this paper, we use two-dimensional (2D) molecular descriptors and k nearest neighbors (kNN) QSAR method for the analysis of several datasets. No correlation between the values of q(2) for the training set and predictive ability for the test set was found for any of the datasets. Thus, the high value of LOO q(2) appears to be the necessary but not the sufficient condition for the model to have a high predictive power. We argue that this is the general property of QSAR models developed using LOO cross-validation. We emphasize that the external validation is the only way to establish a reliable QSAR model. We formulate a set of criteria for evaluation of predictive ability of QSAR models. (C) 2002 Elsevier Science Inc. All rights reserved.",yes,no,no,yes,yes,no,no,no,yes,no,yes,yes,yes,no,no,yes,yes,yes,yes,yes,no,yes,yes,yes,yes,yes,yes,yes,yes,yes,yes,yes,yes,
97,"The gastrointestinal tract of mammals is inhabited by hundreds of distinct species of commensal microorganisms that exist in a mutualistic relationship with the host. How commensal microbiota influence the host immune system is poorly understood. We show here that colonization of the small intestine of mice with a single commensal microbe, segmented filamentous bacterium (SFB), is sufficient to induce the appearance of CD4(+) T helper cells that produce IL-17 and IL-22 (Th17 cells) in the lamina propria. SFB adhere tightly to the surface of epithelial cells in the terminal ileum of mice with Th17 cells but are absent from mice that have few Th17 cells. Colonization with SFB was correlated with increased expression of genes associated with inflammation and antimicrobial defenses and resulted in enhanced resistance to the intestinal pathogen Citrobacter rodentium. Thus, manipulation of this commensal-regulated pathway may provide new opportunities for enhancing mucosal immunity and treating autoimmune disease.",yes,no,no,no,no,no,no,no,yes,no,no,yes,no,no,no,no,yes,yes,yes,no,no,no,yes,yes,yes,yes,yes,yes,yes,yes,yes,yes,yes,
98,"Adiponectin (Ad) is a hormone secreted by adipocytes that regulates energy homeostasis and glucose and lipid metabolism. However, the signaling pathways that mediate the metabolic effects of Ad remain poorly identified. Here we show that phosphorylation and activation of the 5'-AMP-activated protein kinase (AMPK) are stimulated with globular and full-length Ad in skeletal muscle and only with full-length Ad in the liver. In parallel with its activation of AMPK, Ad stimulates phosphorylation of acetyl coenzyme A carboxylase (ACC), fatty-acid oxidation, glucose uptake and lactate production in myocytes, phosphorylation of ACC and reduction of molecules involved in gluconeogenesis in the liver, and reduction of glucose levels in vivo. Blocking AMPK activation by dominant-negative mutant inhibits each of these effects, indicating that stimulation of glucose utilization and fatty-acid oxidation by Ad occurs through activation of AMPK. Our data may provide a novel paradigm that an adipocyte-derived antidiabetic hormone, Ad, activates AMPK, thereby directly regulating glucose metabolism and insulin sensitivity in vitro and in vivo.",yes,no,no,no,no,no,no,no,no,no,yes,yes,no,no,no,no,yes,yes,yes,no,yes,no,yes,no,yes,yes,yes,yes,yes,yes,yes,yes,yes,
