ID,Abstract,rule1,rule2,rule3,rule4,rule5,rule6,rule7,rule8,rule9,rule10,rule11,rule12,rule13,rule14,rule15,rule16,rule17,rule18,rule19,rule20,rule21,rule22,rule23,rule24,rule25,rule26,rule27,rule28,rule29,rule30,rule31,rule32,rule33,rule34
40,"Gene co-expression networks are increasingly used to explore the system-level functionality of genes. The network construction is conceptually straightforward: nodes represent genes and nodes are connected if the corresponding genes are significantly co-expressed across appropriately chosen tissue samples. In reality, it is tricky to define the connections between the nodes in such networks. An important question is whether it is biologically meaningful to encode gene co-expression using binary information (connected=1, unconnected=0). We describe a general framework for 'soft' thresholding that assigns a connection weight to each gene pair. This leads us to define the notion of a weighted gene co-expression network. For soft thresholding we propose several adjacency functions that convert the co-expression measure to a connection weight. For determining the parameters of the adjacency function, we propose a biologically motivated criterion (referred to as the scale-free topology criterion). We generalize the following important network concepts to the case of weighted networks. First, we introduce several node connectivity measures and provide empirical evidence that they can be important for predicting the biological significance of a gene. Second, we provide theoretical and empirical evidence that the 'weighted' topological overlap measure ( used to define gene modules) leads to more cohesive modules than its 'unweighted' counterpart. Third, we generalize the clustering coefficient to weighted networks. Unlike the unweighted clustering coefficient, the weighted clustering coefficient is not inversely related to the connectivity. We provide a model that shows how an inverse relationship between clustering coefficient and connectivity arises from hard thresholding. We apply our methods to simulated data, a cancer microarray data set, and a yeast microarray data set.",yes,no,no,yes,no,no,no,happy,happy,no,yes,yes,yes,no,no,no,yes,yes,yes,yes,no,no,yes,no,yes,yes,yes,yes,yes,yes,no,yes,yes,
41,"Adiponectin is an adipocyte-derived hormone. Recent genome-wide scans have mapped a susceptibility locus for type 2 diabetes and metabolic syndrome to chromosome 3q27, where the gene encoding adiponectin is located. Here we show that decreased expression of adiponectin correlates with insulin resistance in mouse models of altered insulin sensitivity. Adiponectin decreases insulin resistance by decreasing triglyceride content in muscle and liver in obese mice. This effect results from increased expression of molecules involved in both fatty-acid combustion and energy dissipation in muscle. Moreover, insulin resistance in lipoatrophic mice was completely reversed by the combination of physiological doses of adiponectin and leptin, but only partially by either adiponectin or leptin alone. We conclude that decreased adiponectin is implicated in the development of insulin resistance in mouse models of both obesity and lipoatrophy. These data also indicate that the replenishment of adiponectin might provide a novel treatment modality for insulin resistance and type 2 diabetes.",no,no,no,no,no,no,no,no,no,no,no,yes,no,no,no,no,yes,yes,yes,yes,no,no,yes,no,yes,yes,yes,yes,no,yes,no,yes,yes,
42,"We describe an update of the miRBase database (http://www.mirbase.org/), the primary microRNA sequence repository. The latest miRBase release (v20, June 2013) contains 24 521 microRNA loci from 206 species, processed to produce 30 424 mature microRNA products. The rate of deposition of novel microRNAs and the number of researchers involved in their discovery continue to increase, driven largely by small RNA deep sequencing experiments. In the face of these increases, and a range of microRNA annotation methods and criteria, maintaining the quality of the microRNA sequence data set is a significant challenge. Here, we describe recent developments of the miRBase database to address this issue. In particular, we describe the collation and use of deep sequencing data sets to assign levels of confidence to miRBase entries. We now provide a high confidence subset of miRBase entries, based on the pattern of mapped reads. The high confidence microRNA data set is available alongside the complete microRNA collection at http://www.mirbase.org/. We also describe embedding microRNA-specific Wikipedia pages on the miRBase website to encourage the microRNA community to contribute and share textual and functional information.",no,no,no,no,no,no,no,no,no,no,yes,yes,yes,no,no,no,yes,yes,yes,yes,no,no,yes,no,yes,yes,yes,yes,no,yes,no,yes,yes,
43,"The human genome contains many thousands of long noncoding RNAs (IncRNAs). While several studies have demonstrated compelling biological and disease roles for individual examples, analytical and experimental approaches to investigate these genes have been hampered by the lack of comprehensive IncRNA annotation. Here, we present and analyze the most complete human IncRNA annotation to date, produced by the GENCODE consortium within the framework of the ENCODE project and comprising 9277 manually annotated genes producing 14,880 transcripts. Our analyses indicate that IncRNAs are generated through pathways similar to that of protein-coding genes, with similar histone-modification profiles, splicing signals, and exon /intron lengths. In contrast to protein-coding genes, however, IncRNAs display a striking bias toward two-exon transcripts, they are predominantly localized in the chromatin and nucleus, and a fraction appear to be preferentially processed into small RNAs. They are under stronger selective pressure than neutrally evolving sequences-particularly in their promoter regions, which display levels of selection comparable to protein-coding genes. Importantly, about one-third seem to have arisen within the primate lineage. Comprehensive analysis of their expression in multiple human organs and brain regions shows that IncRNAs are generally lower expressed than protein-coding genes, and display more tissue-specific expression patterns, with a large fraction of tissue-specific IncRNAs expressed in the brain. Expression correlation analysis indicates that IncRNAs show particularly striking positive correlation with the expression of antisense coding genes. This GENCODE annotation represents a valuable resource for future studies of IncRNAs.",yes,no,no,yes,yes,no,yes,yes,no,no,no,yes,yes,no,no,no,yes,yes,yes,no,yes,no,yes,yes,yes,yes,yes,yes,yes,yes,yes,yes,yes,
44,"The specificities of 28 commercially available compounds reported to be relatively selective inhibitors of particular serine/threonine-specific protein kinases have been examined against a large panel of protein kinases. The compounds KT 5720, Rottlerin and quercetin were found to inhibit many protein kinases, sometimes much more potently than their presumed targets, and conclusions drawn from their use in cell-based experiments are likely to be erroneous. Ro 318220 and related bisindoylmaleimides, as well as H89, HA1077 and Y 27632, were more selective inhibitors, but still inhibited two or more protein kinases with similar potency. LY 294002 was found to inhibit casein kinase-2 with similar potency to phosphoinositide (phosphatidylinositol) 3-kinase. The compounds with the most impressive selectivity profiles were KN62, PD 98059, U0126, PD 184352, rapamycin, wortmannin, SB 203580 and SB 202190. U0126 and PD 184352, like PD 98059, were found to block the mitogen-activated protein kinase (MAPK) cascade in cell-based assays by preventing the activation of MAPK kinase (MKK1), and not by inhibiting MKK1 activity directly. Apart from rapamycin and PD 184352, even the most selective inhibitors affected at least one additional protein kinase. Our results demonstrate that the specificities of protein kinase inhibitors cannot be assessed simply by studying their effect on kinases that are closely related in primary structure. We propose guidelines for the use of protein kinase inhibitors in cell-based assays.",no,no,no,no,no,no,no,no,no,no,no,yes,yes,no,no,no,yes,yes,yes,yes,no,no,yes,yes,yes,yes,no,no,no,yes,yes,yes,yes,
45,"The ExPASy (the Expert Protein Analysis System) World Wide Web server (http://www.expasy.org), is provided as a service to the life science community by a multidisciplinary team at the Swiss Institute of Bioinformatics (SIB). It provides access to a variety of databases and analytical tools dedicated to proteins and proteomics. ExPASy databases include SWISS-PROT and TrEMBL, SWISS-2DPAGE, PROSITE, ENZYME and the SWISS-MODEL repository. Analysis tools are available for specific tasks relevant to proteomics, similarity searches, pattern and profile searches, post-translational modification prediction, topology prediction, primary, secondary and tertiary structure analysis and sequence alignment. These databases and tools are tightly interlinked: a special emphasis is placed on integration of database entries with related resources developed at the SIB and elsewhere, and the proteomics tools have been designed to read the annotations in SWISS-PROT in order to enhance their predictions. ExPASy started to operate in 1993, as the first WWW server in the field of life sciences. In addition to the main site in Switzerland, seven mirror sites in different continents currently serve the user community.",no,happy,happy,no,no,happy,happy,happy,happy,happy,no,happy,no,no,no,no,no,no,happy,happy,no,no,no,no,no,no,happy,happy,no,no,yes,yes,no,
46,"For aligning DNA sequences that differ only by sequencing errors, or by equivalent errors from other sources, a greedy algorithm can be much faster than traditional dynamic programming approaches and Set produce an alignment that is guaranteed to be theoretically optimal. We introduce a nem greedy alignment algorithm with particularly good performance and show that it computes the same alignment as does a certain dynamic programming algorithm, while executing over 10 times faster on appropriate data. An implementation of this algorithm is currently used in a program that assembles the UniGene database at the National Center for Biotechnology Information.",no,happy,happy,no,no,happy,happy,happy,no,happy,yes,yes,no,no,no,yes,yes,yes,yes,no,no,no,yes,yes,no,yes,yes,happy,happy,no,no,no,yes,yes
47,"The Ribosomal Database Project (RDP) provides researchers with quality-controlled bacterial and archaeal small subunit rRNA alignments and analysis tools. An improved alignment strategy uses the Infernal secondary structure aware aligner to provide a more consistent higher quality alignment and faster processing of user sequences. Substantial new analysis features include a new Pyrosequencing Pipeline that provides tools to support analysis of ultra high-throughput rRNA sequencing data. This pipeline offers a collection of tools that automate the data processing and simplify the computationally intensive analysis of large sequencing libraries. In addition, a new Taxomatic visualization tool allows rapid visualization of taxonomic inconsistencies and suggests corrections, and a new class Assignment Generator provides instructors with a lesson plan and individualized teaching materials. Details about RDP data and analytical functions can be found at http://rdp.cme.msu.edu/.",no,no,no,no,no,no,no,happy,happy,no,yes,yes,no,no,no,no,yes,yes,yes,yes,no,no,yes,no,no,yes,yes,happy,happy,no,no,yes,yes,no
48,In-gel digestion of proteins isolated by gel electrophoresis is a cornerstone of mass spectrometry (MS)-driven proteomics. The 10-year-old recipe by Shevchenko et al. has been optimized to increase the speed and sensitivity of analysis. The protocol is for the in-gel digestion of both silver and Coomassie-stained protein spots or bands and can be followed by MALDI-MS or LC-MS/MS analysis to identify proteins at sensitivities better than a few femtomoles of protein starting material.,no,happy,happy,no,no,happy,happy,happy,happy,happy,no,happy,no,no,no,no,yes,yes,happy,happy,no,no,yes,no,no,yes,yes,happy,happy,no,no,yes,yes,happy
49,"MCScan is an algorithm able to scan multiple genomes or subgenomes in order to identify putative homologous chromosomal regions, and align these regions using genes as anchors. The MCScanX toolkit implements an adjusted MCScan algorithm for detection of synteny and collinearity that extends the original software by incorporating 14 utility programs for visualization of results and additional downstream analyses. Applications of MCScanX to several sequenced plant genomes and gene families are shown as examples. MCScanX can be used to effectively analyze chromosome structural changes, and reveal the history of gene family expansions that might contribute to the adaptation of lineages and taxa. An integrated view of various modes of gene duplication can supplement the traditional gene tree analysis in specific families. The source code and documentation of MCScanX are freely available at http://chibba.pgml.uga.edu/mcscan2/.",no,no,no,no,no,no,no,happy,happy,no,yes,yes,no,no,no,no,yes,yes,yes,yes,no,no,yes,no,yes,yes,yes,happy,happy,no,yes,yes,yes,
50,"Simulated gastro-intestinal digestion is widely employed in many fields of food and nutritional sciences, as conducting human trials are often costly, resource intensive, and ethically disputable. As a consequence, in vitro alternatives that determine endpoints such as the bioaccessibility of nutrients and non-nutrients or the digestibility of macronutrients (e. g. lipids, proteins and carbohydrates) are used for screening and building new hypotheses. Various digestion models have been proposed, often impeding the possibility to compare results across research teams. For example, a large variety of enzymes from different sources such as of porcine, rabbit or human origin have been used, differing in their activity and characterization. Differences in pH, mineral type, ionic strength and digestion time, which alter enzyme activity and other phenomena, may also considerably alter results. Other parameters such as the presence of phospholipids, individual enzymes such as gastric lipase and digestive emulsifiers vs. their mixtures (e. g. pancreatin and bile salts), and the ratio of food bolus to digestive fluids, have also been discussed at length. In the present consensus paper, within the COST Infogest network, we propose a general standardised and practical static digestion method based on physiologically relevant conditions that can be applied for various endpoints, which may be amended to accommodate further specific requirements. A frameset of parameters including the oral, gastric and small intestinal digestion are outlined and their relevance discussed in relation to available in vivo data and enzymes. This consensus paper will give a detailed protocol and a line-by-line, guidance, recommendations and justifications but also limitation of the proposed model. This harmonised static, in vitro digestion method for food should aid the production of more comparable data in the future.",yes,no,no,yes,no,no,no,no,no,no,yes,yes,no,no,no,no,yes,yes,yes,no,no,no,no,no,yes,yes,yes,yes,no,yes,yes,yes,yes,
51,"Motivation: Fast and accurate quality control is essential for studies involving next-generation sequencing data. Whilst numerous tools exist to quantify QC metrics, there is no common approach to flexibly integrate these across tools and large sample sets. Assessing analysis results across an entire project can be time consuming and error prone; batch effects and outlier samples can easily be missed in the early stages of analysis. Results: We present MultiQC, a tool to create a single report visualising output from multiple tools across many samples, enabling global trends and biases to be quickly identified. MultiQC can plot data from many common bioinformatics tools and is built to allow easy extension and customization.",no,happy,happy,no,no,happy,happy,happy,happy,no,yes,yes,no,no,no,no,yes,yes,yes,yes,no,no,yes,no,yes,yes,yes,yes,yes,no,no,yes,yes,
52,Structural genomics seeks to expand rapidly the number of protein structures in order to extract the maximum amount of information from genomic sequence databases. The advent of several large-scale projects worldwide leads to many new challenges in the field of crystallographic macromolecular structure determination. A novel software package called PHENIX (Python-based Hierarchical ENvironment for Integrated Xtallography) is therefore being developed. This new software will provide the necessary algorithms to proceed from reduced intensity data to a refined molecular model and to facilitate structure solution for both the novice and expert crystallographer.,no,no,no,no,no,no,no,no,no,no,yes,yes,no,no,no,no,yes,yes,no,yes,no,no,no,no,no,yes,yes,no,yes,no,no,yes,yes,
53,"In the last two years the Pfam database (http://pfam.xfam.org) has undergone a substantial reorganisation to reduce the effort involved in making a release, thereby permitting more frequent releases. Arguably the most significant of these changes is that Pfam is now primarily based on the UniProtKB reference proteomes, with the counts of matched sequences and species reported on the website restricted to this smaller set. Building families on reference proteomes sequences brings greater stability, which decreases the amount of manual curation required to maintain them. It also reduces the number of sequences displayed on the website, whilst still providing access to many important model organisms. Matches to the full UniProtKB database are, however, still available and Pfam annotations for individual UniProtKB sequences can still be retrieved. Some Pfam entries (1.6%) which have no matches to reference proteomes remain; we are working with UniProt to see if sequences from them can be incorporated into reference proteomes. Pfam-B, the automatically-generated supplement to Pfam, has been removed. The current release (Pfam 29.0) includes 16 295 entries and 559 clans. The facility to view the relationship between families within a clan has been improved by the introduction of a new tool.",no,happy,happy,no,no,happy,happy,happy,no,happy,no,no,yes,no,no,no,yes,yes,happy,no,no,no,yes,yes,yes,yes,yes,happy,happy,no,no,yes,yes,no
54,"The transient gene expression system using Arabidopsis mesophyll protoplasts has proven an important and versatile tool for conducting cell-based experiments using molecular, cellular, biochemical, genetic, genomic and proteomic approaches to analyze the functions of diverse signaling pathways and cellular machineries. A well-established protocol that has been extensively tested and applied in numerous experiments is presented here. The method includes protoplast isolation, PEG-calcium transfection of plasmid DNA and protoplast culture. Physiological responses and high-throughput capability enable facile and cost-effective explorations as well as hypothesis-driven tests. The protoplast isolation and DNA transfection procedures take 6-8 h, and the results can be obtained in 2-24 h. The cell system offers reliable guidelines for further comprehensive analysis of complex regulatory mechanisms in whole-plant physiology, immunity, growth and development.",no,no,no,no,no,no,no,happy,happy,no,yes,yes,no,no,yes,no,yes,yes,yes,yes,no,no,yes,yes,yes,yes,yes,happy,happy,no,no,no,yes,no
55,"HMMER is a software suite for protein sequence similarity searches using probabilistic methods. Previously, HMMER has mainly been available only as a computationally intensive UNIX command-line tool, restricting its use. Recent advances in the software, HMMER3, have resulted in a 100-fold speed gain relative to previous versions. It is now feasible to make efficient profile hidden Markov model (profile HMM) searches via the web. A HMMER web server (http://hmmer.janelia.org) has been designed and implemented such that most protein database searches return within a few seconds. Methods are available for searching either a single protein sequence, multiple protein sequence alignment or profile HMM against a target sequence database, and for searching a protein sequence against Pfam. The web server is designed to cater to a range of different user expertise and accepts batch uploading of multiple queries at once. All search methods are also available as RESTful web services, thereby allowing them to be readily integrated as remotely executed tasks in locally scripted workflows. We have focused on minimizing search times and the ability to rapidly display tabular results, regardless of the number of matches found, developing graphical summaries of the search results to provide quick, intuitive appraisement of them.",no,happy,happy,no,no,happy,happy,happy,happy,no,yes,yes,no,no,no,yes,yes,yes,yes,yes,no,no,yes,yes,yes,yes,yes,yes,yes,no,yes,yes,yes,
56,,,,,,,,,,,,,,,,,,,,,,,,,,,,,,,,,,,
57,"B7-H1, a recently described member of the B7 family of costimulatory molecules, is thought to be involved in the regulation of cellular and humoral immune responses through the PD-1 receptor on activated T and B cells. We report here that, except for cells of the macrophage lineage, normal human tissues do not express B7-H1. In contrast, B7-H1 is abundant in human carcinomas of lung, ovary and colon and in melanomas. The pro-inflammatory cytokine interferon. upregulates B7-H1 on the surface of tumor cell lines. Cancer cell - associated B7-H1 increases apoptosis of antigen-specific human T-cell clones in vitro, and the apoptotic effect of B7-H1 is mediated largely by one or more receptors other than PD-1. In addition, expression of B7-H1 on mouse P815 tumor increases apoptosis of activated tumor-reactive T cells and promotes the growth of highly immunogenic B7-1(+) tumors in vivo. These findings have implications for the design of T cell - based cancer immunotherapy.",no,no,no,no,no,no,no,no,no,no,no,no,no,no,no,no,yes,yes,yes,yes,no,no,yes,yes,yes,yes,yes,yes,yes,no,no,yes,yes,
58,"Cytoscape is a popular bioinformatics package for biological network visualization and data integration. Version 2.8 introduces two powerful new features-Custom Node Graphics and Attribute Equations-which can be used jointly to greatly enhance Cytoscape's data integration and visualization capabilities. Custom Node Graphics allow an image to be projected onto a node, including images generated dynamically or at remote locations. Attribute Equations provide Cytoscape with spreadsheet-like functionality in which the value of an attribute is computed dynamically as a function of other attributes and network properties.",no,no,no,no,no,no,no,happy,happy,no,yes,yes,no,no,no,no,yes,yes,yes,yes,no,no,yes,no,no,yes,yes,happy,happy,no,no,yes,yes,no
59,"Motivation: Prior biological knowledge greatly facilitates the meaningful interpretation of gene-expression data. Causal networks constructed from individual relationships curated from the literature are particularly suited for this task, since they create mechanistic hypotheses that explain the expression changes observed in datasets. Results: We present and discuss a suite of algorithms and tools for inferring and scoring regulator networks upstream of gene-expression data based on a large-scale causal network derived from the Ingenuity Knowledge Base. We extend the method to predict downstream effects on biological functions and diseases and demonstrate the validity of our approach by applying it to example datasets.",no,happy,happy,no,no,happy,happy,happy,happy,happy,yes,yes,no,no,no,no,yes,yes,yes,yes,no,no,yes,no,no,yes,yes,yes,yes,no,no,happy,yes,
60,"The effect of simulated acid rain (AR) (pH 1.8) on H2O2 and malonyldialdehyde (MDA) levels and activities of peroxidase and catalase in bean plants were investigated. The influence of exogenous polyamines spermidine and spermine on these parameters was also studied. AR treatment induced lipid peroxidation and increased level of H2O2 in leaves. Pretreatment with spermidine and spermine prevented these changes. The protective effect of spermine was higher than that of spermidine. The impact of polyamines could be attributed to their acid neutralizing and antioxidant effects, as well as to their ability to stabilize membranes by associating with negatively charged phospholipids. It was also found that AR significantly increased peroxidase and decreased catalase activities at the first hours after treatment. Later, both enzyme activities were enhanced that could contribute to the scavenging and detoxification of active oxygen species. (C) 2000 Published by Elsevier Science Ireland Ltd. All rights reserved.",no,no,no,no,no,no,no,no,yes,no,no,yes,no,no,no,no,yes,yes,yes,yes,no,no,yes,yes,yes,yes,yes,no,no,no,no,yes,yes,
