ID,Abstract,rule1,rule2,rule3,rule4,rule5,rule6,rule7,rule8,rule9,rule10,rule11,rule12,rule13,rule14,rule15,rule16,rule17,rule18,rule19,rule20,rule21,rule22,rule23,rule24,rule25,rule26,rule27,rule28,rule29,rule30,rule31,rule32,rule33,rule34
0,"We have developed a new software package, Molecular Evolutionary Genetics Analysis version 2 (MEGA2), for exploring and analyzing aligned DNA or protein sequences from an evolutionary perspective. MEGA2 vastly extends the capabilities of MEGA version 1 by: (1) facilitating analyses of large datasets; (2) enabling creation and analyses of groups of sequences; (3) enabling specification of domains and genes; (4) expanding the repertoire of statistical methods for molecular evolutionary studies; and (5) adding new modules for visual representation of input data and output results on the Microsoft Windows platform.",no,no,no,no,no,no,no,no,yes,no,yes,yes,no,no,no,no,yes,yes,yes,yes,no,no,yes,no,no,yes,yes,no,yes,no,yes,yes,yes,
1,"Background: System-wide profiling of genes and proteins in mammalian cells produce lists of differentially expressed genes/proteins that need to be further analyzed for their collective functions in order to extract new knowledge. Once unbiased lists of genes or proteins are generated from such experiments, these lists are used as input for computing enrichment with existing lists created from prior knowledge organized into gene-set libraries. While many enrichment analysis tools and gene-set libraries databases have been developed, there is still room for improvement. Results: Here, we present Enrichr, an integrative web-based and mobile software application that includes new gene-set libraries, an alternative approach to rank enriched terms, and various interactive visualization approaches to display enrichment results using the JavaScript library, Data Driven Documents (D3). The software can also be embedded into any tool that performs gene list analysis. We applied Enrichr to analyze nine cancer cell lines by comparing their enrichment signatures to the enrichment signatures of matched normal tissues. We observed a common pattern of up regulation of the polycomb group PRC2 and enrichment for the histone mark H3K27me3 in many cancer cell lines, as well as alterations in Toll-like receptor and interlukin signaling in K562 cells when compared with normal myeloid CD33+ cells. Such analyses provide global visualization of critical differences between normal tissues and cancer cell lines but can be applied to many other scenarios. Conclusions: Enrichr is an easy to use intuitive enrichment analysis web-based tool providing various types of visualization summaries of collective functions of gene lists. Enrichr is open source and freely available online at: http://amp.pharm.mssm.edu/Enrichr.",yes,no,no,yes,no,no,no,happy,happy,no,yes,yes,no,no,no,no,yes,yes,yes,no,no,no,yes,yes,yes,yes,yes,happy,happy,no,yes,yes,yes,yes
2,"DrugBank (www.drugbank.ca) is a web-enabled database containing comprehensivemolecular information about drugs, their mechanisms, their interactions and their targets. First described in 2006, DrugBank has continued to evolve over the past 12 years in response to marked improvements to web standards and changing needs for drug research and development. This year's update, DrugBank 5.0, represents the most significant upgrade to the database in more than 10 years. In many cases, existing data content has grown by 100% or more over the last update. For instance, the total number of investigational drugs in the database has grown by almost 300%, the number of drug-drug interactions has grown by nearly 600% and the number of SNP-associated drug effects has grown more than 3000%. Significant improvements have been made to the quantity, quality and consistency of drug indications, drug binding data as well as drug-drug and drug-food interactions. A great deal of brand new data have also been added to DrugBank 5.0. This includes information on the influence of hundreds of drugs on metabolite levels (pharmacometabolomics), gene expression levels (pharmacotranscriptomics) and protein expression levels (pharmacoprotoemics). New data have also been added on the status of hundreds of newdrug clinical trials and existing drug repurposing trials. Many other important improvements in the content, interface and performance of the DrugBank website have been made and these should greatly enhance its ease of use, utility and potential applications in many areas of pharmacological research, pharmaceutical science and drug education.",no,happy,happy,no,no,no,no,happy,happy,no,no,happy,yes,no,no,no,yes,yes,yes,happy,no,no,yes,yes,yes,yes,yes,happy,happy,no,yes,yes,yes,no
3,"Single-particle electron cryomicroscopy (cryo-EM) is a powerful method for determining the structures of biological macromolecules. With automated microscopes, cryo-EM data can often be obtained in a few days. However, processing cryo-EM image data to reveal heterogeneity in the protein structure and to refine 3D maps to high resolution frequently becomes a severe bottleneck, requiring expert intervention, prior structural knowledge, and weeks of calculations on expensive computer clusters. Here we show that stochastic gradient descent (SGD) and branch-and-bound maximum likelihood optimization algorithms permit the major steps in cryo-EM structure determination to be performed in hours or minutes on an inexpensive desktop computer. Furthermore, SGD with Bayesian marginalization allows ab initio 3D classification, enabling automated analysis and discovery of unexpected structures without bias from a reference map. These algorithms are combined in a user-friendly computer program named cryoSPARC (http://www.cryosparc.com).",yes,no,no,yes,no,no,no,no,no,no,yes,yes,no,no,no,no,yes,yes,yes,no,no,no,yes,yes,yes,yes,yes,yes,yes,yes,yes,yes,yes,
4,"Genotypes are frequently used to identify parentage. Such analysis is notoriously vulnerable to genotyping error, and there is ongoing debate regarding how to solve this problem. Many scientists have used the computer program CERVUS to estimate parentage, and have taken advantage of its option to allow for genotyping error. In this study, we show that the likelihood equations used by versions 1.0 and 2.0 of CERVUS to accommodate genotyping error miscalculate the probability of observing an erroneous genotype. Computer simulation and reanalysis of paternity in Rum red deer show that correcting this error increases success in paternity assignment, and that there is a clear benefit to accommodating genotyping errors when errors are present. A new version of CERVUS (3.0) implementing the corrected likelihood equations is available at www.fieldgenetics.com.",no,happy,happy,yes,no,happy,happy,happy,no,no,yes,yes,no,no,no,yes,yes,yes,yes,no,no,yes,yes,yes,yes,yes,yes,happy,happy,yes,yes,no,yes,yes
5,"KEGG (http://www.kegg.jp/or http://www.genome.jp/kegg/) is an integrated database resource for biological interpretation of genome sequences and other high-throughput data. Molecular functions of genes and proteins are associated with ortholog groups and stored in the KEGG Orthology (KO) database. The KEGG pathway maps, BRITE hierarchies and KEGG modules are developed as networks of KO nodes, representing high-level functions of the cell and the organism. Currently, more than 4000 complete genomes are annotated with KOs in the KEGG GENES database, which can be used as a reference data set for KO assignment and subsequent reconstruction of KEGG pathways and other molecular networks. As an annotation resource, the following improvements have been made. First, each KO record is re-examined and associated with protein sequence data used in experiments of functional characterization. Second, the GENES database now includes viruses, plasmids, and the addendum category for functionally characterized proteins that are not represented in complete genomes. Third, new automatic annotation servers, BlastKOALA and GhostKOALA, are made available utilizing the non-redundant pangenome data set generated from the GENES database. As a resource for translational bioinformatics, various data sets are created for antimicrobial resistance and drug interaction networks.",no,happy,happy,no,no,happy,happy,happy,happy,no,yes,yes,yes,no,no,no,yes,yes,yes,yes,no,no,yes,no,yes,yes,yes,yes,no,yes,yes,yes,yes,
6,"Background: Recent advances in proteomics technologies such as two-hybrid, phage display and mass spectrometry have enabled us to create a detailed map of biomolecular interaction networks. Initial mapping efforts have already produced a wealth of data. As the size of the interaction set increases, databases and computational methods will be required to store, visualize and analyze the information in order to effectively aid in knowledge discovery. Results: This paper describes a novel graph theoretic clustering algorithm, ""Molecular Complex Detection"" (MCODE), that detects densely connected regions in large protein-protein interaction networks that may represent molecular complexes. The method is based on vertex weighting by local neighborhood density and outward traversal from a locally dense seed protein to isolate the dense regions according to given parameters. The algorithm has the advantage over other graph clustering methods of having a directed mode that allows fine-tuning of clusters of interest without considering the rest of the network and allows examination of cluster interconnectivity, which is relevant for protein networks. Protein interaction and complex information from the yeast Saccharomyces cerevisiae was used for evaluation. Conclusion: Dense regions of protein interaction networks can be found, based solely on connectivity data, many of which correspond to known protein complexes. The algorithm is not affected by a known high rate of false positives in data from high-throughput interaction techniques. The program is available from ftp://ftp.mshri.on.ca/pub/BIND/Tools/MCODE.",yes,no,no,no,no,no,no,happy,happy,no,yes,yes,yes,no,no,no,yes,yes,yes,yes,no,no,yes,yes,yes,yes,yes,happy,happy,no,yes,yes,yes,no
7,"We present version 6 of the DNA Sequence Polymorphism (DnaSP) software, a new version of the popular tool for performing exhaustive population genetic analyses on multiple sequence alignments. This major upgrade incorporates novel functionalities to analyze large data sets, such as those generated by high-throughput sequencing technologies. Among other features, DnaSP 6 implements: 1) modules for reading and analyzing data from genomic partitioning methods, such as RADseq or hybrid enrichment approaches, 2) faster methods scalable for high-throughput sequencing data, and 3) summary statistics for the analysis of multi-locus population genetics data. Furthermore, DnaSP 6 includes novel modules to perform single- and multi-locus coalescent simulations under a wide range of demographic scenarios. The DnaSP 6 program, with extensive documentation, is freely available at http://www.ub.edu/dnasp.",no,no,no,no,no,no,no,no,no,no,yes,yes,no,no,no,no,yes,yes,yes,yes,no,no,yes,no,no,yes,yes,yes,yes,no,yes,yes,yes,
8,"PartitionFinder 2 is a program for automatically selecting best-fit partitioning schemes and models of evolution for phylogenetic analyses. PartitionFinder 2 is substantially faster and more efficient than version 1, and incorporates many new methods and features. These include the ability to analyze morphological datasets, new methods to analyze genome-scale datasets, new output formats to facilitate interoperability with downstream software, and many new models of molecular evolution. PartitionFinder 2 is freely available under an open source license and works on Windows, OSX, and Linux operating systems. It can be downloaded from www.robertlanfear.com/partitionfinder. The source code is available at https://github.com/brettc/partitionfinder.",no,happy,happy,no,no,happy,happy,happy,happy,happy,yes,yes,no,no,no,no,yes,yes,happy,happy,no,no,yes,no,no,yes,yes,happy,happy,no,yes,yes,yes,no
9,"Background: Choosing appropriate primers is probably the single most important factor affecting the polymerase chain reaction (PCR). Specific amplification of the intended target requires that primers do not have matches to other targets in certain orientations and within certain distances that allow undesired amplification. The process of designing specific primers typically involves two stages. First, the primers flanking regions of interest are generated either manually or using software tools; then they are searched against an appropriate nucleotide sequence database using tools such as BLAST to examine the potential targets. However, the latter is not an easy process as one needs to examine many details between primers and targets, such as the number and the positions of matched bases, the primer orientations and distance between forward and reverse primers. The complexity of such analysis usually makes this a time-consuming and very difficult task for users, especially when the primers have a large number of hits. Furthermore, although the BLAST program has been widely used for primer target detection, it is in fact not an ideal tool for this purpose as BLAST is a local alignment algorithm and does not necessarily return complete match information over the entire primer range. Results: We present a new software tool called Primer-BLAST to alleviate the difficulty in designing target-specific primers. This tool combines BLAST with a global alignment algorithm to ensure a full primer-target alignment and is sensitive enough to detect targets that have a significant number of mismatches to primers. Primer-BLAST allows users to design new target-specific primers in one step as well as to check the specificity of pre-existing primers. Primer-BLAST also supports placing primers based on exon/intron locations and excluding single nucleotide polymorphism (SNP) sites in primers. Conclusions: We describe a robust and fully implemented general purpose primer design tool that designs target-specific PCR primers. Primer-BLAST offers flexible options to adjust the specificity threshold and other primer properties. This tool is publicly available at http://www.ncbi.nlm.nih.gov/tools/primer-blast.",yes,no,no,yes,no,no,no,happy,happy,no,yes,yes,no,no,no,no,yes,yes,yes,no,no,no,yes,yes,yes,yes,yes,happy,happy,yes,yes,yes,yes,yes
10,"Picante is a software package that provides a comprehensive set of tools for analyzing the phylogenetic and trait diversity of ecological communities. The package calculates phylogenetic diversity metrics, performs trait comparative analyses, manipulates phenotypic and phylogenetic data, and performs tests for phylogenetic signal in trait distributions, community structure and species interactions.",no,no,no,no,no,no,no,happy,happy,no,no,happy,no,no,no,no,no,no,happy,happy,no,no,no,no,no,no,happy,happy,no,no,no,yes,yes,
11,"Dominant markers such as amplified fragment length polymorphisms (AFLPs) provide an economical way of surveying variation at many loci. However, the uncertainty about the underlying genotypes presents a problem for statistical analysis. Similarly, the presence of null alleles and the limitations of genotype calling in polyploids mean that many conventional analysis methods are invalid for many organisms. Here we present a simple approach for accounting for genotypic ambiguity in studies of population structure and apply it to AFLP data from whitefish. The approach is implemented in the program STRUCTURE version 2.2, which is available from http:// pritch. bsd. uchicago. edu/ structure. html.",no,happy,happy,no,no,happy,happy,happy,happy,no,yes,yes,yes,no,no,no,yes,yes,yes,yes,no,no,yes,no,no,yes,yes,happy,happy,no,no,yes,yes,no
12,"MicroRNAs (miRNAs) can play important gene regulatory roles in nematodes, insects, and plants by base-pairing to mRNAs to specify posttranscriptional repression of these messages. However, the mRNAs regulated by vertebrate miRNAs are all unknown. Here we predict more than 400 regulatory target genes for the conserved vertebrate miRNAs by identifying mRNAs with conserved pairing to the 5' region of the miRNA and evaluating the number and quality of these complementary sites. Rigorous tests using shuffled miRNA controls supported a majority of these predictions, with the fraction of false positives estimated at 31% for targets identified in human, mouse, and rat and 22% for targets identified in pufferfish as well as mammals. Eleven predicted targets (out of 15 tested) were supported experimentally using a HeLa cell reporter system. The predicted regulatory targets of mammalian miRNAs were enriched for genes involved in transcriptional regulation but also encompassed an unexpectedly broad range of other functions.",yes,no,no,yes,yes,no,yes,yes,no,no,yes,yes,yes,no,no,yes,yes,yes,yes,no,yes,yes,yes,yes,yes,yes,yes,yes,yes,yes,yes,yes,yes,
13,"In analysis of multilocus genotypes from structured populations, individual coefficients of membership in subpopulations are often estimated using programs such as STRUCTURE. DISTRUCT provides a general method for visualizing these estimated membership coefficients. Subpopulations are represented as colours, and individuals are depicted as bars partitioned into coloured segments that correspond to membership coefficients in the subgroups. DISTRUCT, available at www.cmb.usc.edu/-noahr/distruct.html, can also be used to display subpopulation assignment probabilities when individuals are assumed to have ancestry in only one group.",no,happy,happy,no,no,happy,happy,happy,happy,happy,no,happy,no,no,no,no,no,no,happy,happy,no,no,no,no,no,no,happy,happy,no,no,no,happy,happy,
14,"A novel microRNA (miRNA) quantification method has been developed using stem-loop RT followed by TaqMan PCR analysis. Stem-loop RT primers are better than conventional ones in terms of RT efficiency and specificity. TaqMan miRNA assays are specific for mature miRNAs and discriminate among related miRNAs that differ by as little as one nucleotide. Furthermore, they are not affected by genomic DNA contamination. Precise quantification is achieved routinely with as little as 25 pg of total RNA for most miRNAs. In fact, the high sensitivity, specificity and precision of this method allows for direct analysis of a single cell without nucleic acid purification. Like standard TaqMan gene expression assays, TaqMan miRNA assays exhibit a dynamic range of seven orders of magnitude. Quantification of five miRNAs in seven mouse tissues showed variation from less than 10 to more than 30 000 copies per cell. This method enables fast, accurate and sensitive miRNA expression profiling and can identify and monitor potential biomarkers specific to tissues or diseases. Stem-loop RT-PCR can be used for the quantification of other small RNA molecules such as short interfering RNAs (siRNAs). Furthermore, the concept of stem-loop RT primer design could be applied in small RNA cloning and multiplex assays for better specificity and efficiency.",no,no,no,no,no,no,no,no,no,no,yes,yes,yes,no,no,yes,yes,yes,yes,yes,no,no,yes,yes,yes,yes,yes,yes,yes,no,yes,yes,yes,
15,"Motivation: The processing of the Affymetrix GeneChip data has been a recent focus for data analysts. Alternatives to the original procedure have been proposed and some of these new methods are widely used. Results: The affy package is an R package of functions and classes for the analysis of oligonucleotide arrays manufactured by Affymetrix. The package is currently in its second release, affy provides the user with extreme flexibility when carrying out an analysis and make it possible to access and manipulate probe intensity data. In this paper, we present the main classes and functions in the package and demonstrate how they can be used to process probe-level data. We also demonstrate the importance of probe-level analysis when using the Affymetrix GeneChip platform.",no,happy,happy,no,no,happy,happy,happy,happy,happy,yes,yes,no,no,no,no,yes,yes,yes,yes,no,no,yes,no,yes,yes,yes,happy,happy,no,no,yes,yes,
16,"In molecular mechanics (MM) studies, atom types and/or bond types of molecules are needed to determine prior to energy calculations. We present here an automatic algorithm of perceiving atom types that are defined in a description table, and an automatic algorithm of assigning bond types just based on atomic connectivity. The algorithms have been implemented in a new module of the AMBER packages. This auxiliary module, antechamber (roughly meaning ""before AMBER""), can be applied to generate necessary inputs of leap-the AMBER program to generate topologies for minimization, molecular dynamics, etc., for most organic molecules. The algorithms behind the manipulations may be useful for other molecular mechanical packages as well as applications that need to designate atom types and bond types. (c) 2005 Elsevier Inc. All rights reserved.",no,happy,happy,no,no,no,no,happy,happy,no,yes,yes,no,no,no,no,yes,yes,yes,yes,no,no,yes,no,no,yes,yes,happy,happy,no,no,yes,yes,yes
17,"The Interactive Tree Of Life (https://itol.embl.de) is an online tool for the display, manipulation and annotation of phylogenetic and other trees. It is freely available and open to everyone. The current version introduces four new dataset types, together with numerous new features. Annotation options have been expanded and new control options added for many display elements. An interactive spreadsheet-like editor has been implemented, providing dataset creation and editing directly in the web interface. Font support has been rewritten with full support for UTF-8 character encoding throughout the user interface. Google Web Fonts are now fully supported in the tree text labels. iTOL v4 is the first tool which supports direct visualization of Qiime 2 trees and associated annotations. The user account system has been streamlined and expanded with new navigation options, and currently handles >700 000 trees from more than 40 000 individual users. Full batch access has been implemented allowing programmatic upload and export of trees and annotations.",no,happy,happy,no,no,happy,happy,happy,happy,happy,no,happy,yes,no,no,no,yes,yes,happy,happy,no,no,yes,yes,yes,yes,yes,happy,happy,no,no,yes,yes,happy
18,"The aim of broth and agar dilution methods is to determine the lowest concentration of the assayed antimicrobial agent (minimal inhibitory concentration, MIC) that, under defined test conditions, inhibits the visible growth of the bacterium being investigated. MIC values are used to determine susceptibilities of bacteria to drugs and also to evaluate the activity of new antimicrobial agents. Agar dilution involves the incorporation of different concentrations of the antimicrobial substance into a nutrient agar medium followed by the application of a standardized number of cells to the surface of the agar plate. For broth dilution, often determined in 96-well microtiter plate format, bacteria are inoculated into a liquid growth medium in the presence of different concentrations of an antimicrobial agent. Growth is assessed after incubation for a defined period of time (16-20 h) and the MIC value is read. This protocol applies only to aerobic bacteria and can be completed in 3 d.",no,happy,happy,no,yes,yes,yes,yes,no,no,yes,yes,no,no,yes,yes,yes,yes,yes,no,no,no,yes,no,no,yes,yes,yes,yes,no,no,yes,yes,
19,"The Clustal series of programs are widely used in molecular biology for the multiple alignment of both nucleic acid and protein sequences and for preparing phylogenetic trees. The popularity of the programs depends on a number of factors, including not only the accuracy of the results, but also the robustness, portability and user-friendliness of the programs. New features include NEXUS and FASTA format output, printing range numbers and faster tree calculation. Although, Clustal was originally developed to run on a local computer, numerous Web servers have been set up, notably at the EBI (European Bioinformatics Institute) (http://www.ebi.ac.uk/clustalw/).",no,happy,happy,no,no,happy,happy,happy,happy,happy,no,happy,no,no,no,no,yes,yes,happy,happy,no,no,yes,no,yes,yes,happy,happy,no,no,no,yes,yes,no
20,"IL-17-producing T lymphocytes have been recently shown to comprise a distinct lineage of proinflammatory T helper cells, termed Th17 cells, that are major contributors to autoimmune disease. We show here that the orphan nuclear receptor ROR gamma t is the key transcription factor that orchestrates the differentiation of this effector cell lineage. ROR gamma t induces transcription of the genes encoding IL-17 and the related cytokine IL-17F in naive CD4(+) T helper cells and is required for their expression in response to IL-6 and TGF-beta, the cytokines known to induce IL-17. Th17 cells are constitutively present throughout the intestinal lamina propria, express ROR gamma t, and are absent in mice deficient for ROR gamma t or IL-6. Mice with ROR gamma t-deficient T cells have attenuated autoimmune disease and lack tissue-infiltrating Th17 cells. Together, these studies suggest that ROR gamma t is a key regulator of immune homeostasis and highlight its potential as a therapeutic target in inflammatory diseases.",no,no,no,no,no,no,no,no,no,no,yes,yes,no,no,no,no,yes,yes,yes,yes,no,no,yes,no,yes,yes,yes,yes,yes,yes,no,yes,yes,
