Publication Type,Authors,Title,Abstract,DOI,ID,rule1,rule2,rule3,rule4,rule5,rule6,rule7,rule8,rule9,rule10,rule11,rule12,rule13,rule14,rule15,rule16,rule17,rule18,rule19,rule20,rule21,rule22,rule23,rule24,rule25,rule26,rule27,rule28,rule29,rule30,rule31
J,"Liu, SB; Qiao, YB; Zou, ZF; Yu, CM; Guo, XJ; Chung, TC",Improvement of off-axis color shift on hybrid viewing-angle device using dual <i>γ</i>-voltage method,"We have mass production on one kind of liquid crystal display (LCD) device with hybrid viewing-angle (HVA), which can be switched between the wide viewing-angle (WVA) and narrow viewing-angle (NVA) by one button. This device adopts the single cell design that with lower cost, and utilizes the optical properties of electrically tilted LC to achieve the function of NVA display. An issue has received less attention in the past and been indeed found in the production process. It is that the off-axis color shift will appear in NVA mode. We put forward one method to improve this issue here, which is combined with the concepts of Gray Frame Insertion (GFI) and Impulse-type driving. By switching the voltage between two different gamma values, the color shift will be perfected on the produce.",10.1002/jsid.850,0,yes,yes,no,no,yes,no,yes,yes,no,no,yes,no,no,no,no,no,no,no,no,no,no,no,no,no,yes,yes,no,no,yes,yes,
J,"Wu, QM; Punter, MTJJM; Kodger, TE; Arnaudov, L; Mulder, BM; Stoyanov, S; Van der Gucht, J",Gravity-driven syneresis in model low-fat mayonnaise,"Low-fat food products often contain natural, edible polymers to retain the desired mouth feel and elasticity of their full-fat counterparts. This type of product, however, can suffer from syneresis: densification due to the expulsion of fluid. Gaining insight into the physical principles governing syneresis in such soft hybrid dispersions remains a challenge from a theoretical perspective, as experimental data are needed to establish a basis. We record non-accelerated syneresis in a model system for low-fat mayonnaise: a colloid polymer mixture, consisting of oil in water emulsion with starch in the aqueous phase. We find the flow rate of expelled fluid to be proportional to the difference in hydrostatic pressure over the system. The osmotic pressure of the added starch, while being higher than the hydrostatic pressure, does not prevent syneresis because the soluble starch is lost to the expelled fluid. From these findings, we conclude that forced syneresis in these systems can be described as a gravity-driven porous flow through the densely packed emulsion, explainable with a model based on Darcy's law.",10.1039/c9sm01097a,1,yes,no,yes,no,yes,no,yes,no,yes,no,yes,yes,yes,no,no,no,yes,yes,yes,no,no,no,no,yes,yes,yes,yes,no,no,yes,yes
J,"Hao, ZX; Chen, J; Yuan, LX; Bing, QM; Liu, JY; Chen, WL; Li, Z; Wang, FR; Huang, YH",Advanced Li<sub>2</sub>S/Si Full Battery Enabled by TiN Polysulfide Immobilizer,"Lithium sulfide (Li2S) is a promising cathode material with high capacity, which can be paired with1 nonlithium metal anodes such as silicon or tin so that the safety issues caused by the Li anode can be effectively avoided. However, the Li2S full cell suffers from rapid capacity degradation due to the dissolution of intermediate polysulfides. Herein, a Li2S/Si full cell is designed with a Li2S cathode incorporated by titanium nitride (TiN) polysulfide immobilizer within parallel hollow carbon (PHC). This full cell delivers a high initial reversible capacity of 702 mAh g(Li2S)(-1) (1007 mAh g(sulfur)(-1)) at 0.5 C rate and excellent cyclability with only 0.4% capacity fade per cycle over 200 cycles. The long cycle stability is ascribed to the strong polysulfide anchor effect of TiN and highly efficient electron/ion transport within the interconnected weblike architecture of PHC. Theoretical calculations, self-discharge measurements, and anode stability experiments further confirm the strong adsorption of polysulfides on the TiN surface. The present work demonstrates that the flexible Li2S cathode and paired Si anode can be used to achieve highly efficient Li-S full cells.",,2,yes,no,yes,no,yes,no,yes,yes,no,no,yes,yes,no,no,no,yes,yes,yes,yes,no,yes,no,yes,yes,yes,yes,yes,yes,yes,yes,no
J,"Song, DS; Liu, HJ; Kovács, A; Dunin-Borkowski, RE; Chu, YH; Zhu, J",Observation of oxygen pyramid tilting induced polarization rotation in strained BiFeO<sub>3</sub> thin film,"Oxygen octahedral tilting has been recognized to strongly interact with spin, charge, orbital, and lattice degrees of freedom in perovskite oxides. Here, we observe a strain-driven stripe-like morphology of two supertetragonal (monoclinic Cc and Cm) phases in the strained BiFeO3/LaAlO3 thin films. The two supertetragonal phases have a similar giant axial ratio but differences in oxygen pyramid tilting mode. Especially, the competition between polar instability and oxygen pyramid tilting is identified using atomically resolved scanning transmission electron microscopy, leading to the polarization rotation across the phase boundary. In addition, microtwins are observed in the Cc phase. Our findings provide new insights of the coupling between ferroelectric polarization and oxygen pyramid tilting in oxide thin films and will help to design novel phase morphology with desirable ferroelectric polarization and properties for new applications in perovskite oxides.",10.1111/jace.16937,3,yes,no,no,no,no,no,yes,no,no,no,yes,yes,no,yes,no,no,yes,yes,yes,no,no,no,no,yes,yes,yes,no,yes,yes,yes,yes
J,"Sharma, B; Hu, LY; Raghavendra, A; Gregory, W; Podila, R",Silver Nanodiscs for Enhanced Fluorescence Emission,"Here, we used a novel method to deform silver nanoparticles (Ag NPs) into nanodiscs through the application of a transverse mechanical force using a homebuilt Teflon puncher. The application of different forces (16, 33, and 50 N) resulted in the formation of Ag nanodiscs with different heights (106, 99, and 88 nm) from polyhedral Ag NPs (similar to 114 nm). We observed a clear red-shift in the plasmonic resonance for completely deformed Ag nanodiscs produced using 50 N force. We show that the fluorescence emission from Rhodamine B (RhB) is enhanced by >30 fold (with respect to RhB on bare glass) in the presence of Ag nanodiscs due to a simultaneous increase in the excitation intensity and photonic mode density. The observed increase in RhB emission on Ag nanodiscs is explained in terms of the nanodisc's scattering spectrum red-shifting toward the RhB emission wavelength, which results in an increased local electric field and higher photonic mode density for Ag nanodiscs.",10.1021/acs.jpcc.9b04642,4,no,no,no,no,yes,no,no,no,yes,no,yes,yes,no,yes,no,no,yes,yes,no,yes,no,no,yes,yes,yes,no,no,no,yes,yes,
J,"Neto, MBS; Pinheiro, FA",Controlling spontaneous emission via electronic correlations and temperature in transparent oxides,"We study spontaneous emission of two-level quantum emitter agglomerates embedded in transparent oxides. The two levels correspond to the splitting between vacancy impurity states F, F+, and V- color centers, whereas correlations are due to narrow bands in transition-metal oxides with ABO(3) perovskite structures. For these systems, we put forward a mechanism to control light emission in which micrometer-size vacancy-rich regions play the role of cavity resonators for the emitted radiation with normal frequencies mode volumes, and emission linewidths determined by their size and material properties. We argue that a physical scenario in which the emitter's natural frequency and linewidth can be fine-tuned via electronic correlations or temperature explains unusual features in the experimental photoluminescence spectra of Ar-irradiated SrTiO3. By unveiling the role of electronic correlations on spontaneous emission in transparent oxides, we hope our findings help set the basis for the design of controllable engineered solid-state single-photon sources.",10.1103/PhysRevB.100.235119,5,yes,yes,no,yes,yes,no,yes,yes,no,yes,yes,no,yes,no,no,no,no,no,no,yes,no,no,no,no,no,yes,yes,yes,yes,yes,yes
J,"Song, DT; Xie, Z; Zhang, XG; Qu, W; Wang, QP",A Mathematical Model of a Molten Carbonate Direct Carbon Fuel Cell,"A one-dimensional (1D) homogeneous unit cell model was developed to study the performance of the molten carbonate direct carbon fuel cell (DCFC), which uses solid carbon as fuel and molten carbonate as electrolyte. It is the first unit cell model for the molten carbonate DCFC in which both 4-electron carbon oxidation and 2-electron CO oxidation reactions, as well as the reverse Boudouard reaction, are considered. The simulation results verify that, besides the relatively sluggish kinetics of the anodic reactions, cell performance is mainly limited by ohmic losses in the anode. Further modeling exploration reveals that a minimum effective electronic conductivity of around 0.56 S/cm is required to facilitate proper electrical conduction in the cathode to attain high DCFC performance. It was found that there are optimal volume fractions for the carbon fuel and liquid electrolyte in the anode. If the effective electronic conductivity of the cathode falls to 0.56 S/cm, optimal volume fractions also exist for the solid material and liquid electrolyte in the cathode. The detailed modeling analysis showed that performance improvement at high operating temperature was mainly attributed to improvement of anodic kinetics and reduction of ohmic loss in the electrolyte of electrodes and electrolyte-matrix. (C) The Author(s) 2019. Published by ECS.",10.1149/2.0262001JES,6,yes,yes,no,yes,yes,no,yes,no,yes,no,yes,yes,no,no,no,yes,yes,yes,no,yes,yes,yes,no,yes,yes,yes,no,yes,no,yes,no
J,"Xu, QW; Guo, YF; Xu, TT; Fang, M; Zhu, WJ; Li, C",AIE-active fluorescent polymeric nanoparticles about dextran derivative: preparation and bioimaging application,"Aggregation-induced emission (AIE), as a special phenomenon of fluorescence, can elegantly overcome the fluorescence quenching caused by common fluorescent materials under high concentration conditions and has attracted interest of researchers in many fields. Particularly AIE-active polymer nanoparticles have been widely utilized in a modern biomedical research. In this work, we prepared a novel kind of AIE-active fluorescent polymeric nanoparticals (Dex-OH-CHO) through a facile esterification between a new hydrophobic AIE-active 1, 8-naphthalimide derivative and the hydrophilic dextran. The structure and optical properties of Dex-OH-CHO were characterized in detail by FTIR, H-1 NMR, XPS, TEM and fluorescence spectra. The results showed that Dex-OH-CHO emitted light-blue fluorescence in aqueous solution with high fluorescent quantum yield (phi = 24.43%, concentration is 20 mu g/mL), low CMC (5 mu g/mL), good photostability, high water solubility and well dispersivity. Moreover, good biocompatibility and ideal cell uptake made Dex-OH-CHO had a great application potential in biological imaging.",10.1080/09205063.2019.1702277,7,yes,yes,no,yes,yes,no,yes,no,yes,no,yes,yes,no,yes,no,yes,yes,yes,no,yes,no,no,yes,yes,yes,no,no,no,yes,yes,
J,"Fu, YM; Li, H; Wei, TY; Huang, L; Hidayati, F; Song, AM",Sputtered Electrolyte-Gated Transistor with Temperature- Modulated Synaptic Plasticity Behaviors,"Temperature has always been considered as an essential factor for almost all kinds of semiconductor-based electronic components. In this work, temperature-dependent synaptic plasticity behaviors, which are mimicked by the indium-gallium-zinc oxide thin-film transistors gated with sputtered SiO2 electrolytes, have been studied. With the temperature increasing from 303 to 323 K, the electrolyte capacitance decreases from 0.42 to 0.11 mu F cm(-2). The mobility increases from 1.4 to 3.7 cm(2) V-1 s(-1), and the threshold voltage negatively shifts from -0.23 to -0.51 V. Synaptic behaviors under both a single pulse and multiple pulses are employed to study the temperature dependence. With the temperature increasing from 303 to 323 K, the post-synaptic current (PSC) at the resting state increases from 1.8 to 7.3 mu A. Under a single gate pulse of 1 V and 1 s, the PSC signal altitude and the PSC retention time decrease from 2.0 to 0.7 mu A and 5.1 x 10(2) to 2.5 ms, respectively. A physical model based on the electric field-induced ion drifting, ionic-electronic coupling, and gradient-coordinated ion diffusion is proposed to understand these temperature-dependent synaptic behaviors. Based on the experimental data on individual transistors, temperature-modulated pattern learning and memorizing behaviors are conceptually demonstrated. The in-depth investigation of the temperature dependence helps pave the way for further electrolyte-gated transistor-based neuromorphic applications.",,8,yes,no,no,no,yes,no,yes,no,yes,no,yes,yes,no,yes,no,yes,yes,yes,no,yes,no,yes,yes,yes,no,yes,yes,no,yes,yes,yes
J,"Breslavs'kyi, DV; Metel'yov, VO; Morachkovs'kyi, OK; Tatarinova, OA",Short-Term Creep of St3 Steel Under Low-Frequency Cyclic Loading,"Creep constitutive equations have been derived for the materials that exhibit the properties of orthotropy (transversal isotropy) and transient creep under cyclic loading. A low-frequency case is considered. The paper provides results of experimental studies of the short-term creep of St3 steel under static and stepwise cyclic loading at room temperature. The results of calculations by the proposed constitutive equations are compared with the experimental data. A good agreement has been found for the number of cycles above 4 or 5, which demonstrates the applicability of the proposed constitutive equation to the low-frequency creep calculations for sheet materials.",10.1007/s11223-019-00124-2,9,yes,yes,no,no,yes,no,yes,no,yes,no,yes,yes,yes,no,no,no,yes,yes,yes,no,yes,no,yes,yes,yes,yes,yes,no,no,yes,no
J,"Cui, H; Shi, C; Ji, ZY; Duan, JM; Han, M","Study on Biochemical Degumming Process of Mulberry Fiber, Part 2: Orthogonal Optimization Analysis","The mulberry fiber is extracted from the mulberry bast by biochemical degumming method. Based on the single factor experiment, the orthogonal experiment is further designed. The optimal process parameters for biochemical combined degumming are as follows: pretreatment stage, sulfuric acid solution concentration 2.5g/L, time 1h, temperature 60 degrees C, bath ratio 1:20; alkaline pectinase treatment stage, alkaline pectinase solution concentration 46g/L, time 8h, temperature 50 degrees C, bath ratio 1:20, solution pH = 9; alkali boiling stage, sodium hydroxide solution concentration 10g/L, alkali boiling time 3h, sodium silicate 30g/L, temperature 100 degrees C, bath ratio 1:20; xylanase treatment stage, the concentration of xylanase solution 9g/L, the time 4h, the temperature 50 degrees C, the bath ratio 1:20, and the solution pH = 4.8. By comparing the properties of mulberry fiber obtained by biochemical degumming and chemical degumming, it is found that the biochemical degumming process has less damage to fibers and more effective removal of lignin and hemicellulose.",10.1080/15440478.2019.1697983,10,yes,yes,no,no,no,no,no,no,yes,no,yes,yes,no,no,no,yes,yes,yes,no,yes,no,no,no,yes,yes,no,no,no,no,no,no
J,"Hachkevych, OR; Solodyak, MT; Terlets'kyi, RF; Ivas'ko, RO",Three-Dimensional Magnetostatic Waves Caused by Electromagnetic Fields in Metallized Ferrite Plates,"By using a well-known technique for finding the characteristics of magnetic fields based on the method of decomposition of unknown quantities in a series in small parameter (chosen as the ratio of amplitude of the tangential harmonic field to the amplitude of normal constant field) and restricting ourselves to the first two terms of decomposition, we establish the conditions of excitation and study the regularities of propagation of three-dimensional magnetostatic waves in metallized normally magnetized ferrite plates depending on the character of the external electromagnetic field and electrophysical characteristics of the material.",10.1007/s11003-019-00306-y,11,yes,yes,no,no,yes,no,no,no,yes,no,yes,yes,no,no,no,no,no,no,no,yes,no,no,no,no,no,no,no,no,no,yes,yes
J,"Wang, JY; Sheng, Y; Sun, HB; Gao, F; Zhang, DK; Zheng, YD; Shi, Y",Enhanced polarization photodetection of metallic cavity ensemble through spontaneously configured lateral electrodes,"Metallic cavities show substantial advantages in light confinement, providing opportunities to modulate the optical resonances and absorption. Here, we report on the configuration of horizontally aligned ZnO-nanowires-based metallic cavity ensemble with a light to dark current ratio of similar to 1000. An enhanced polarization photodetection ratio of transverse electric (TE) to transverse magnetic (TM) was experimentally observed compared to the single ZnO nanowire photodetector. Finite difference time domain simulation was performed on the metallic cavities, showing the distinct resonance behaviors under TE and TM light. The confinement by the multi-reflection and optical resonances between the metallic claddings contribute to the high anisotropy ratio. Furthermore, the polarized light absorption in the metallic cavity was studied as well as in the naked nanowire, which reveal a significant dependence on the cavity diameter and wavelength. For the metallic cavities, the absorption ratio of TE to TM show an enhanced value in the range of 300-500 nm wavelength and 85-150 diameter and a reversed value in the range of 400-500 nm wavelength and 17-50 diameter. While for the naked nanowires, the ratio show an apparently opposite value in these two regions. The presented metallic cavities demonstrate a specific paradigm of optical engineering in nanoscale and potentially helps the development of optoelectronic devices.",10.1088/1361-6528/ab4245,12,yes,no,no,no,yes,no,yes,no,yes,no,yes,yes,no,no,no,yes,yes,yes,yes,no,yes,yes,yes,yes,yes,yes,yes,yes,yes,yes,yes
J,"Zhao, F; Wang, CY; Liu, XJ; Luo, QY; Zhu, L",Purification of fuel ethanol engine exhaust with platinum-loaded Ce<sub>0.5</sub>Zr<sub>0.5</sub>O<sub>2</sub> catalyst,"This work aimed at exploring a new kind of purification catalysts for fuel ethanol engine exhaust. Platinum loaded on Ce0.5Zr0.5O2 was prepared by impregnation method and characterized by X-ray diffraction, Brunner-Emmet-Teller measurements (BET), temperature-programmed reduction of hydrogen, scanning electron microscope, and X-ray photoelectron spectra. The three-way catalyst platinum/ceria-zirconia/fw is prepared with the paste ball mill coating technique. And the catalytic performance is evaluated under simulated fuel ethanol engine exhaust gas condition. The catalysts not only show excellent low-temperature performances and several-way catalytic activities for carbon monoxide, hydrocarbons, nitrogen oxides, and acetaldehyde but also have better high-temperature resistance. The addition of sulfur dioxide to feedstream degrades the performances of the catalysts.",10.1177/1847980419886673,13,yes,yes,no,no,yes,yes,yes,no,yes,no,yes,yes,no,yes,no,yes,yes,yes,yes,no,no,no,no,yes,yes,no,no,no,yes,yes,no
J,"Bleszynski, M; Kumosa, M",New approach to moisture accumulation assessment,"We suggest an innovative approach to simulate moisture buildup on structures with arbitrary geometries and different surface adhesion characteristics. Using 3D particle physics, rain, snow and freezing rain buildup on flat and cylindrical surfaces was assessed. The numerically simulated moisture accumulations were subsequently successfully verified experimentally through a series of outdoor and indoor moisture accumulation experiments. We also conducted molecular dynamics simulations to assess how hydrogen bonds influence snow and rain adhesion on high and low energy substrates. The simulations supported the experimental observations, namely that freezing rain results in increased moisture adhesion and accumulation due to the spreading of the water droplets, resulting in more hydrogen bonds between water droplets and substrates than snow. (C) 2019 The Authors. Published by Elsevier Ltd.",10.1016/j.matdes.2019.108162,14,yes,yes,no,no,yes,yes,yes,no,yes,no,yes,yes,no,no,yes,no,yes,yes,yes,yes,no,no,no,yes,yes,no,no,no,no,yes,yes
J,"Chepil', OY; Shtoiko, IP",Distribution of Hydrogen Concentration in a Compact Specimen Under the Conditions of Electrolytic Hydrogenation,"We propose a computational model for the evaluation of the distribution of hydrogen concentration in a compact specimen under the conditions of its electrolytic hydrogenation. The compact specimen is modeled by a parallelepiped whose surface opposite to the crack tip is immersed in the electrolyte down to a certain depth. The specimen is hydrogenated through this surface. The applied mathematical model is based on the Fick equation with initial and boundary conditions. A constant hydrogen concentration is assigned on the immersed surface of the parallelepiped; on the other surface, this concentration is set equal to zero. The mathematical model is realized by the finite-element method and the distribution of hydrogen concentration over the parallelepiped is determined in the form of a function of geometry and time.",10.1007/s11003-019-00315-x,15,yes,yes,no,no,yes,yes,yes,yes,no,no,yes,no,no,no,no,no,yes,no,yes,no,yes,no,no,no,no,no,no,no,no,yes,yes
J,"Mel'nyk, IV",Stiffness of Monolithic Reinforced-Concrete Slab Structures,"It is shown that the numerical analyses of slab reinforced concrete structures are, as a rule, based on the classical theory of bending of elastic plates. According to the results of theoretical analysis performed by using the finite-element method and shell theory, it was established that the flexural stiffnesses of slab elements with tubular inserts in both directions are different. Simulating the operation of slabs with inserts of square, rectangular, and circular cross sections and applying the finite-element method, we determine the values of flexural stiffness for the plates with geometric parameters typical of actual slab structures.",10.1007/s11003-019-00311-1,16,yes,yes,no,yes,no,no,no,no,yes,no,yes,yes,no,no,no,no,yes,yes,no,yes,yes,yes,no,no,yes,no,no,no,no,yes,yes
J,"Moghadam, MGE; Shahmardan, MM; Norouzi, M",Investigation on surface roughness of piston in mini-magnetorheological damper using dissipative particle dynamics modeling,"Mini-magnetorheological damper is modeled using dissipative particle dynamics method, as a molecular modeling technique by applying various arrangement patterns of rough sections on the surface area of piston as four proposed scenarios of A, B, C, and D to obtain optimal damper performance. Modeling is developed to achieve 10-N damping force utilized in micro-machines and compared to experimental results that show good conformity. Weierstrass-Mandelbrot function is used to apply rough surface profile on the piston, and bounce back boundary condition is utilized as no-slip boundary condition. Results of modeling show that 140-CG magnetorheological fluid is suitable as the agent fluid. Also, it is observed that by increasing fractal dimension of roughness profile, damping force has an initial enhancement and then trends to a constant value. Results shown by utilizing Bouc-Wen model and genetic algorithm method and fractal dimension of roughness profile of 1.5 using at the beginning and the end of the piston as presented in scenario B; by applying 20% magnetic field strength, considered damping force of 10 N is achieved within 2 s, while under conventional conditions, using the smooth surface area of piston, more damping time is needed and more electrical energy is used than the developed model.",10.1177/1045389X19888797,17,yes,no,no,no,yes,no,no,no,yes,no,yes,yes,yes,no,no,yes,yes,yes,no,yes,yes,yes,yes,yes,yes,yes,yes,yes,no,no,no
J,"Pohrelyuk, IM; Fedirko, VM; Proskurnyak, RV",Influence of the Range of Particle Sizes of the Powder Component of Saturating Medium on the Carbooxidation of Titanium Alloys,"We present the results of carbooxidation of VT1-0 and OT4 titanium alloys performed with the use of a powder carbon component of saturating medium with solid fractions whose sizes vary within the range 45-300 mu m (saturation from soot, graphite, and charcoal). The results of metallographic, durometric, and profilometric investigations and the X-ray phase diffraction analysis reveal certain differences between the characteristics of the newly formed modified layers. The data of corrosion and electrochemical tests carried out in an 80% solution of sulfuric acid demonstrate that the efficiency of the carbooxidation increases as the sizes of solid fractions of the powder carbon component of the saturating medium decrease.",10.1007/s11003-019-00290-3,18,no,no,no,no,yes,no,yes,no,yes,no,yes,yes,yes,no,yes,yes,yes,yes,yes,no,yes,no,no,yes,yes,yes,no,no,yes,yes,
J,"Savruk, MP; Kazberuk, A; Chornen'kyi, AB",Stressed State of a Quasiorthotropic Half Plane with Curvilinear Edge,"By the method of singular integral equations, we consider a plane periodic problem of the theory of elasticity for a quasiorthotropic half plane containing an infinite row of edge angular rounded notches. By using the unified approach to the solution of the problems of stress concentration near notches with sharp and rounded vertices, we determine the stress intensity factors at the sharp tips of the corresponding edge notches. The same method is used for the solution of the problem of stress distribution in a quasiorthotropic half plane with sinusoidal edge.",10.1007/s11003-019-00294-z,19,yes,yes,no,yes,yes,no,yes,no,yes,no,yes,yes,no,no,no,no,yes,no,no,yes,no,no,no,no,no,no,no,no,no,yes,yes
