Publication Type,Authors,Title,Abstract,DOI,ID,rule1,rule2,rule3,rule4,rule5,rule6,rule7,rule8,rule9,rule10,rule11,rule12,rule13,rule14,rule15,rule16,rule17,rule18,rule19,rule20,rule21,rule22,rule23,rule24,rule25,rule26,rule27,rule28,rule29,rule30,rule31
J,"Simsek, I; Özyürek, D",Investigation of Wear and Corrosion Behaviors of Ti15Mo Alloy Produced by Mechanical Alloying Method in SBF Environment,"This study aims to examine the wear performance and electrochemical corrosion properties of Ti15Mo alloy produced by mechanical alloying (MA) in simulated body fluid (SBF) environment. Ti15Mo alloy was produced by milling in a mechanical alloying device for 120 min. The alloys produced are examined using SEM, X-ray diffraction, hardness and density measurements. Three different loads, four different sliding distances and 1 m center dot sec(-1) sliding speed were used in the tests performed in SBF environment. Corrosion tests were carried out using potentiodynamic polarization technique, cyclic polarization measurement at 37 degrees C body temperature, in SBF, with a scan interval of +/- 750 mV and scan rate of 1 mV/sec. Density and hardness measurement results of MA'ed Ti15Mo alloy are 4.93 g/cm(3) and 299.5 HV, respectively. As a result of increasing the load applied during the wear tests, the resistance of the samples against wear has decreased and the amount of wear has increased. Corrosion tests showed that the potentiodynamic polarization parameters were 36.969 mA/cm(2) for I-corr value and 0.54448 mmpy for corrosion rate. Corrosion tests made in the environment of SBF and at body temperature revealed that there was very little pitting corrosion observed in MA'ed Ti15Mo alloy.",10.1007/s11106-019-00094-9,20,,,,,,,,,,,,,,,,,,,,,,,,,,,,,,,
J,"Trapezon, AG",Residual Stress Effect on the Strength Estimate of Base-Coating Systems,"The effect of manufacturing-induced residual stresses in layered isotropic composites of basecoating type on the latter strength is studied. The conventional method, based on the principle of additivity of the initial properties of layers of a symmetric composite, is applicable to uniaxial tension or compression, but not to bending, where the latter principle is not valid. Therefore, in the latter case, stress calculation has to be based on the method of equivalent bending stiffness linking the derived strength characteristic with operating stresses in the composite layers. Residual stresses in strength assessment are taken into account by substituting their analytical expressions into respective calculation models. The reliability of mostly used relationships for determining residual stresses is analyzed. To this purpose, an independent derivation of engineering formulas for axial residual stresses was carried out, varying elastic parameters, thickness, and number of layers of the composite. The substitution of the above formulas into the additivity relation for an isotropic symmetric system under uniaxial loading does not change the latter form, due to self-balancing of residual stresses and, therefore, residual stresses do not affect the strength estimate. As an example, the axial tensile strength of an aluminum alloy clad with corrosion-resistant steel was calculated for various ratios of cladding layer-to-steel layer thickness. The results on the composite hardening are presented. It is shown that, in contrast to the uniaxial tension of a composite, residual stresses in bending loading, significantly affect the strength assessment results. Numerical results on such an assessment are presented for a case study. A scheme for determining the endurance limit under cyclic bending was elaborated based on the Goodman hypothesis and experimentally verified. All analytical derivations implied the assumptions of homogeneity and isotropy of the physicomechanical properties of the composite constituents, their ideal adhesion, and elastic stress-strain state described by Hooke's law.",10.1007/s11223-019-00125-1,21,yes,no,yes,yes,yes,no,yes,no,yes,yes,yes,yes,yes,no,no,no,yes,yes,yes,no,yes,no,no,yes,yes,yes,yes,yes,no,no,no
J,"Wu, YL; Chen, GD; Yu, JY; Wang, D; Ma, C; Li, C; Pennycook, SJ; Yan, YF; Wei, SH",Hole-Induced Spontaneous Mutual Annihilation of Dislocation Pairs,"Dislocations are always observed during crystal growth, and it is usually desirable to reduce the dislocation density in high-quality crystals. Here, the annihilation process of the 30 degrees Shockley partial dislocation pairs in CdTe is studied by first-principles calculations. We found that the dislocations can glide relatively easily due to the weak local bonding. Our systematic study of the slipping mechanism of the dislocations suggests that the energy barrier for the annihilation process is low. Band structure calculations reveal that the band bending caused by the charge transfer between the two dislocation cores depends on the core-core distance. A simple linear model is proposed to describe the mechanism of formation of the dislocation pair. More importantly, we demonstrate that hole injection can affect the core structure, increase the mobility, and eventually trigger a spontaneous mutual annihilation, which could be employed as a possible facile way to reduce the dislocation density.",10.1021/acs.jpclett.9b02918,22,yes,yes,no,no,yes,no,yes,yes,no,no,yes,yes,no,no,no,no,yes,yes,yes,no,yes,no,no,yes,yes,no,no,no,yes,yes,yes
J,"Zinkovskii, AP; Kabannik, SN; Stel'makh, AL",Rapid method of Predicting the Subsonic Flutter Stability of AGTE Axial-Flow Compressor Blade Cascades. Part 2. Mathematical Implementation of Method and its Potentional Application,"The paper considers the implementation of the rapid method of predicting the dynamic stability of the compressor blade assemblies against subsonic flutter. The first flexural mode of blade vibrations is analyzed at the design stage for a wide range of the angle of attack based on the developed database of the critical values of the reduced vibration frequency in straight cascades of blade airfoils. The multiple regression equation is developed that depends on the relative blade spacing and stagger angle of the straight cascade of blade airfoils, coefficient of the flexural-torsional coupling of the blade, and angle of attack with the correlation factor of the studied parameters in the range of 0.92-0.98. Using the obtained equation, the numerical program has been developed for the determination of the dynamic stability limit against subsonic flutter for the first flexural mode of the blade vibrations. The program allows one to find the numerical values of critical reduced frequencies as the characteristics of its dynamic stability and determine their dependence on the angle of attack. The results of practical application of the developed program are presented using the assessment of the dynamic stability of the flexural mode of axial compressors in four modern aircraft gas-turbine engines. It is shown that at the design engine stage it is possible to select the reduced vibration frequencies of the blade assembly for the specified geometry of its peripheral sections and angle of attack of the inflow upon the condition of the occurrence of subsonic flutter.",10.1007/s11223-019-00117-1,23,yes,yes,no,no,yes,yes,yes,no,yes,no,yes,yes,yes,no,no,yes,yes,yes,no,yes,no,no,yes,no,yes,yes,yes,no,no,yes,yes
J,"Ibrahem, R; Narin, P; Lisesivdin, SB; Ozbay, E",Investigation of electronic and optical properties of wurtzite MgZnO using GGA plus U formalism,"In this study, the electronic and optical properties of wurtzite MgxZn1-xO structures for different Mg mole fractions (x) are studied using Density Functional Theory (DFT). In calculations, the generalised gradient approximation (GGA + U) formalism is used with the Hubbard parameters (U) are applied to Zn-3d and O-2p electrons of ZnO. The calculated electronic band structures show that the band gap energies of the investigated structures increase linearly with increasing Mg mole fraction from 0 to 31.25% which is also quantitatively consistent with the previous experimental results. In addition, the electron effective masses of investigated MgxZn1-xO structures are calculated. The electron effective masses of investigated structures show an increment linearly with increasing Mg mole fractions. The optical results show that the absorption edges of the structures move toward the higher energies region as the Mg mole fractions increase.",10.1080/09500839.2019.1696998,24,yes,no,no,no,yes,yes,yes,yes,no,no,yes,yes,no,no,no,no,yes,yes,yes,no,yes,yes,yes,yes,no,no,no,no,yes,no,no
J,"Kolesnikov, SA; Kim, LV; Dudin, VR",Experimental and Numerical Study of the Formation of Thermophysical Characteristics of Carbon Composite Materials. Part 1. Formation of the thermophysical Characteristics of a Carbon Composite Material,"The analysis of a heat transfer mechanism in the bulk of carbon-carbon composite materials was performed. It was experimentally determined that a homogeneous thermal condition is established at a depth of up to twenty structural cells of the composite. A characteristic layered porosity structure of the material formed by crack-like pores was revealed, and the extent of reduction in thermal conductivity upon splitting the samples into parts was determined. It was found that the process of cooling of the hot reinforcement rod in the carbon substance of the composite is less dependent on the effective thermal conductivity in the direction transversal to a bundle of parallel fibers in a 1D-reinforcement rod, and more dependent on the contact thermal resistance along the boundaries of the crack-like pores filled with air having a thermal conductivity of about 0.3 W/(m center dot K).",10.1007/s11148-019-00362-6,25,yes,yes,no,no,no,no,no,no,yes,no,yes,yes,no,no,no,no,yes,yes,no,yes,no,no,yes,yes,no,no,no,no,no,yes,no
J,"Korobko, EV; Zhurauski, MA; Bateer, B; Novikova, ZA; Kuzmin, VA",Modeling of strain kinetics of damping viscoelastic magnetically controlled materials in creep mode,"The results of experimental studies of strain kinetics of composite magnetically controlled materials in the creep mode with preliminary exposure and without exposure are described by the Burgers model with two elastic and two viscous parameters, which is a combination of viscoelastic Kelvin-Voigt and Maxwell models connected in series. The dependence of the model parameters on the magnetic field induction is determined. The values of elastic and viscous parameters increase with increasing magnetic field induction in the range up to 500 mT by one or two orders of magnitude. It was determined that the value of the viscous Maxwell parameter does not change after preliminary exposure in the field. The values of the other two elastic and viscous Kelvin-Voigt parameters increase with exposure in a magnetic field.",10.1177/1045389X19888785,26,no,no,no,no,yes,no,yes,no,yes,no,yes,yes,no,no,no,no,yes,yes,no,yes,no,no,yes,yes,yes,no,no,no,no,yes,no
J,"Ma, HD; Yin, ZP; Liu, J; Zheng, B; Wang, F; Xiao, JH; Zheng, ZH; Meng, JY; Luo, J",Optimization of Etch Process for Ultra-Narrow Via in 3D NAND Flash Memory by DOE Method,"With the increase of storage density in three-dimensional NAND flash memory, technical challenges become more and more severe. Specifically, the etch process of ultra-narrow via is one of the most intricate technical challenges. The critical dimension (CD) of ultra-narrow via is sensitively affected by this process. In this paper, a Design of Experiment (DOE) was presented to develop an optimized etch process. Various statistical correlations between factors and measured results were analyzed by statistical software. Tail phenomenon and cliff effect were explicated by wafer level analysis. A process regression model was employed for process window check and process optimization. Based on data analysis, modeling, and supplementary experiments, the ratio of CxFy to CxHyFz during the etching of anti-reflective coating (ARC) was identified as the most significant factor for the etch process of ultra-narrow via. DOE method is also helpful in developing advanced etch process in state-of-the-art 3D NAND flash memory. (C) 2019 The Electrochemical Society.",10.1149/2.0171912jss,27,yes,no,yes,no,yes,no,yes,no,yes,no,yes,yes,no,no,no,yes,yes,yes,no,yes,yes,yes,no,yes,yes,yes,yes,no,yes,yes,yes
J,"Malezhyk, MP; Pidhurs'kyi, MI; Rudyak, YA; Fedyshyn, NO; Pidhurs'kyi, IM; Voitovych, LV",Investigation of the Fracture of an Orthotropic Plate with Circular Hole and Two Edge Cracks Under Pulsed Loading by the Method of Dynamic Photoelasticity,"By the method of dynamic photoelasticity, we study the dynamic fracture of structural elements in the form of plates made of transparent composites and weakened by a hole and two contour symmetric cracks under pulsed loading. The time dependences of the stress intensity factors and the rate of crack-tip propagation are analyzed.",10.1007/s11003-019-00297-w,28,yes,yes,no,no,yes,no,yes,no,yes,no,yes,yes,no,yes,no,yes,yes,no,no,yes,no,no,no,no,no,no,no,no,no,yes,yes
J,"Maslyuk, VA; Karaimchuk, ES; Alekseev, VI; Verkhovlyuk, AM","Production, Structurization, and Properties of Wear-Resistant 'Iron-Carbon Alloy-Granular Hardmetal Reinforcement' Materials","The production, structurization, and resultant properties of metal matrix 'iron-carbon alloy-granular hardmetal reinforcement' materials are studied. The vacuum suction method ensures almost complete filling of interparticle voids with molten metals and results in composites containing hardmetal reinforcement with 0.17-0.7 mm particles. The composites show the microstructure that has no pronounced transition zone at the hardmetal-metal interface and has a 'granular' austenitic cast iron matrix and a significant amount of lamellar graphite. The mechanical properties and abrasive impact wear resistance of the white cast iron and carbon steel materials are examined. The optimum combination of properties is exhibited by the composite consisting of steel 45 and 60 vol.% KKhNF15 hardmetal.",10.1007/s11106-019-00092-x,29,yes,yes,no,no,yes,no,yes,no,yes,no,yes,yes,no,no,no,yes,yes,yes,no,yes,no,no,no,yes,yes,yes,no,no,no,yes,no
J,"García, LN; Carazo, FD; Boeri, RE",Ferrite Growth During Cooling Through the Ferrite-Austenite-Graphite Field in SGI,"This investigation examines the growth of ferrite during the cooling of spheroidal graphite cast irons through the ferrite-austenite-graphite phase field as conditioned by the partitioning of Silicon. Two different melts are examined. Ferrite growth was assumed to take place under paraequilibrium conditions. The study involves the measurement of the temperature of ferrite precipitation start under slow cooling conditions by DSC. Thermo-Calc was used to calculate the equilibrium concentration of Si at the ferrite precipitation start temperature. Calculated Si concentrations are compared to microsegregation profiles measured on the same alloys in a previous study. The results led to conclude that partitioning of Silicon does not represent a constraint for ferrite to grow between the upper and lower limits of the three-phase field, contradicting some of the existing literature.",10.1007/s11661-019-05571-9,30,yes,yes,no,yes,yes,yes,yes,no,yes,no,yes,yes,yes,yes,yes,no,yes,yes,no,yes,yes,yes,no,yes,yes,yes,no,yes,no,no,no
J,"Tang, X; Li, J; Zeng, M; Huang, YJ; Guo, JQ",The preparation and electrochemical study of LiNi<sub>0.6</sub>Co<sub>0.2</sub>Mn<sub>0.2</sub>O<sub>2</sub> cathode material for lithium-ion battery,"To improve the cycling performance of nickel-rich layered LiNi0.6Co0.2Mn0.2O2 material, many methods have been studied to reduce cation mixing degree, improve layered structure and modify particle morphology, including doping elements, coating metal oxides and morphology control (spherical, nanoflower, core-shell structure, etc.). In this paper, a new gradient calcination process through four-step temperature gradients is applied to synthesize LiNi0.6Co0.2Mn0.2O2 material. The LiNi0.6Co0.2Mn0.2O2 material synthesized by gradient calcination shows more excellent electrochemical performance than traditional method. The XRD results indicate that the LiNi0.6Co0.2Mn0.2O2 material produced by four-step calcination shows lower cation mixing degree and better crystallinity. In addition, the LiNi0.6Co0.2Mn0.2O2 cathode produced by gradient calcination presents the highest initial capacity (177.9 mAh g(-1)) and a retention of 82.07% after 100 cycles at 0.2C. And the material shows the best electrochemical properties when the final temperature in these steps is 820 degrees C. Our results explain the reason why the thermal stability and electrochemical performance could be improved by gradient calcination from the aspect of material crystallinity, crystal defects, cation mixing degree and the completeness of the layered structure.",10.1007/s10854-019-02600-6,31,yes,no,no,yes,yes,yes,yes,yes,no,no,yes,yes,no,no,no,yes,yes,yes,yes,no,yes,yes,yes,yes,yes,yes,yes,yes,yes,yes,yes
J,"Zhuravel, IM",Computer Analysis of the Distribution of Grain Sizes in the Structure of 12Kh1MF Steel After Operation,"We propose a method for the computer-aided evaluation of the distribution of grains in sizes performed by analyzing metallographic images of the microstructure of 12Kh1MF steam-pipeline steel after operation. The samples of steel were cut out from the straight part and from the zone of tension in the bend of the main steam pipeline of a thermal power plant. It is shown that the degree of heterogeneity of the distribution of grain sizes in the straight part is lower than in the tensile zone of the bend. In approaching the outer and inner surfaces of the pipe, this characteristic decreases in the straight part but increases in the tensile zone of the bend, which is caused by the intense degradation of the material under severe operating conditions.",10.1007/s11003-019-00287-y,32,yes,yes,no,no,yes,yes,yes,yes,no,no,yes,no,yes,no,yes,no,yes,yes,yes,no,no,no,no,yes,yes,no,no,no,yes,yes,
J,"Zhuravl'ov, OY; Shyyan, OV; Semenov, MO; Strygunovs'kyi, SV; Levenets', VV; Shyrokov, BM",Deposition of Coatings Based on Boron Carbide by the Gas-Phase Method,We present the results of investigation of the production of boron carbide by the method of hydrogen reduction of boron trichloride BCl3 in a vapor of toluene C7H8. The thermodynamics and kinetic features of the deposition of boron carbides in the BCl3-C7H8-H-2 system are investigated.,10.1007/s11003-019-00289-w,33,yes,yes,no,no,yes,no,no,no,yes,no,yes,yes,no,no,no,no,yes,no,no,yes,no,no,no,no,no,no,no,no,yes,yes,
J,"Chepkov, IB; Hurnovych, AV; Lapyts'kyi, SV; Trofymenko, VG; Kuchyns'ka, OB; Kuchyns'kyi, AV",Method of Measuring the Ballistic Coefficient of Bullets,"The method, employing universal expressions, was examined to determine the ballistic coefficient of a bullet by the G7 standard (air drag law for the flight of a long boat tail tangent ogive G7 bullet in view of its muzzle velocity and flight trajectory descent within a 100-200-m range). The method permits of measuring the ballistic coefficient of a bullet without a specialized measuring laboratory, i.e., under unequipped shooting-ground conditions. The only metrological equipment is a mobile unit for evaluating the muzzle velocity. The relation is derived based on the experimental design by the central alternate that describes the range of point values for an examined process since the range of nonexistent ones does not permit of employing the uniform alternate. The range of initial bullet velocities is divided into the three subranges to include all points of the central alternate into the range of existent values. The above ballistic coefficient-based approach can be used to compute the bullet velocity at an arbitrary distance in the tests of armored targets under field conditions without bulky equipment. The reliability of describing the examined process is provided by the approved mathematical model of the bullet flight in air as the motion of a solid body based on the system of four differential equations of first order. Adequacy of empirical description of the relation between the ballistic coefficient and muzzle velocity and flight trajectory descent within 100-200 m is verified by determining the standard deviation for the values based on the mathematical model of the bullet flight and the polynomial and their comparison with the accuracy of the ballistic coefficient measurement (no more than 10(-3)).",10.1007/s11223-019-00120-6,34,yes,yes,no,no,yes,no,yes,no,yes,no,yes,yes,no,yes,no,yes,yes,no,no,yes,no,no,yes,yes,yes,yes,yes,no,no,yes,no
J,"Köhler, S; Husmann, H; Corbean, D; Groche, P",Analytical modelling of buckling in stringer sheet forming,"Stringer sheet forming enables an efficient production of branched sheet metal structures. Compared to conventional sheet metal components, stringer sheets show a significant increase in stiffness and therefore offer new possibilities for lightweight design. A challenge in stringer sheet forming is the failure due to instability, which appears in the buckling of the stringer in concave curvatures. The prediction of this failure mode is so far only possible by complex numerical simulations. This work introduces an analytical model for the prediction of the buckling failure during forming of concave stringer sheet curvatures under different process boundary conditions. It is derived from Kirchhoff's plate theory. A detailed sensitivity analysis of all influencing parameters is shown and extends the process understanding. The model is validated by means of a 4-point bending test and a stamping process. It can be used for a conservative estimation of the buckling failure limit in stringer sheet forming.",10.1007/s12289-019-01518-y,35,yes,no,yes,yes,yes,no,yes,yes,no,yes,yes,no,no,yes,yes,yes,yes,yes,yes,no,no,no,no,yes,yes,yes,yes,yes,no,yes,no
J,"Lepikhin, PP; Romashchenko, VA; Beiner, OS; Tarasovskaya, SA",Computational Investigation of the Effect of Reinforcement Schemes and Angles on the Stress-Strain State and Strength of Composite Cylinders Under Axisymmetric Internal Explosion. Part 3. Results of Calculations for Two-Layer Cylinders with Orthogonal and Combined Reinforcement of the Layers,"The effect of reinforcement patterns and angles on the stress-strain state and strength of two-layer wound composite cylinders of finite length with orthogonal reinforcement and two types of combined reinforcement of the layers under axisymmetric internal explosion has been numerically investigated. Using the data presented in Part 2, a comparative analysis of the effect of winding angles on strength for five different reinforcement patterns has been performed according to three failure criteria for an anisotropic material. The obtained results allow one to choose reinforcement patterns and angles, which ensure the highest and lowest initial strengths of the cylinder, according to the maximum stress and strain criteria and the generalized von Mises criterion, as well as circumferential stiffness.",10.1007/s11223-019-00118-0,36,,,,,,,,,,,,,,,,,,,,,,,,,,,,,,,
J,"Li, XB; Long, JB; Zhong, YC; Zhu, WJ",Structural Study of Vanadium Substituted Mo<sub>2</sub>NiB<sub>2</sub>,"Vanadium substituted Mo2-xNi1-xV2xB2 (x = 0 and 0.45) was prepared by reaction boronizing sintering and investigated using X-ray powder diffraction. Structure of Vanadium substituted Mo2-xNi1-xV2xB2 was determined using the Rietveld method. The results show that the crystal structure of vanadium substituted Mo2NiB2 has changed from orthorhombic to tetragonal. The crystal structure of Mo2NiB2 belongs to the structure type W2CoB2 with space group Immm (No. 71). The unit-cell lattice parameters are a = 7.0914(2) angstrom, b = 4.5639(9) angstrom, c = 3.1787(8) angstrom. The reliability factor for the refinement is R-p = 6.74% and R-wp = 8.52%. The crystal structure of vanadium substituted Mo2NiB2 belongs to space group P4/mbm (No. 127). The lattice parameters are a = b = 5.8244(5) angstrom, c = 3.1239(6) angstrom. The reliability factor is R-p = 5.69% and R-wp = 7.41%.",10.1007/s11106-019-00085-w,37,yes,yes,no,no,no,no,no,no,yes,no,yes,yes,no,yes,no,yes,yes,yes,no,yes,yes,yes,yes,yes,yes,no,no,no,no,yes,no
J,"Liu, LQ; Shi, L; Guo, XF; Li, AJ; Zhang, FZ",The friction and wear properties of RGO/3Y-TZP composites under dry sliding,"The graphene oxide (GO)/yttria-stabilized tetragonal zirconia polycrystal (3Y-TZP) composites were fabricated by impregnating the GO dispersion into the zirconium oxide ceramic and sintered by microwave method. The wear and friction properties of the composites were tested by pan-on-disk method, and the results showed that the coefficient of friction and the wear rate decreased and the wear rate of silicon carbide ball was nearly similar with the increase of GO volume fraction. The microstructure of wear surface of the reduced graphene oxide (RGO)/3Y-TZP composite and the 3Y-TZP were investigated by using scanning electron microscopy, respectively. It was indicated that plastic deformation was occurred and the carbon-rich tribofilm was formed in the RGO/3Y-TZP composite, and the tribofilm of the RGO/3Y-TZP composite showed better wear performance than the 3Y-TZP.",10.1177/2633366X19890626,38,no,no,no,no,no,no,no,no,yes,no,yes,yes,no,yes,no,yes,yes,yes,no,yes,yes,no,yes,yes,no,no,no,no,yes,no,no
J,"Naidich, YV; Adamovsky, AA; Zhuravlev, VS; Zyukin, NS",Wetting and Brazing of Superhard Materials,The wetting of superhard materials produced from cubic boron nitride and chemical vapor deposition diamond with metallic fillers is studied. The filler compositions developed previously are specified. The samples of tool (cutters) and structural (shaft-bush) articles are produced.,10.1007/s11106-019-00099-4,39,yes,yes,no,yes,no,no,no,no,yes,no,yes,yes,no,no,no,no,no,no,no,yes,no,no,no,no,no,no,no,no,no,yes,no
