Publication Type,Authors,Title,Abstract,DOI,ID,rule1,rule2,rule3,rule4,rule5,rule6,rule7,rule8,rule9,rule10,rule11,rule12,rule13,rule14,rule15,rule16,rule17,rule18,rule19,rule20,rule21,rule22,rule23,rule24,rule25,rule26,rule27,rule28,rule29,rule30,rule31
J,"Root, LO; Il'in, AP; Konovchuk, TV","On the Synthesis Mechanism of TiN, ZrN, and HfN During Combustion of Mixtures of Aluminum Nanopowder with TiO<sub>2</sub>, ZrO<sub>2</sub>, and HfO<sub>2</sub>","The technology for synthesizing TiN, ZrN, and HfN involves combustion in air of mixtures of aluminum nanopowder (NPAl) and the corresponding dioxides and contradicts thermodynamic calculations. Nitrides should be oxidized in the presence of air and converted to the oxides. The synthesis of nitrides in air is a new direction in the technology of refractory nitrides. Nitrogen from air is used in the proposed technology. The synthesis occurs at atmospheric pressure with free access of air. Complicated equipment is not required. Energy consumption is minimal. The synthesis proceeds spontaneously (exo-effect) after initiation. Mixtures of NPAl and the dioxides are reduced to the metals (Ti, Zr, Hf) or suboxides during combustion in air. Subsequent nitriding proceeds if the oxygen chemical activity is diminished.",10.1007/s11148-019-00374-2,40,yes,no,yes,yes,yes,no,no,no,no,yes,yes,yes,no,no,no,no,no,no,no,no,no,no,no,no,no,no,no,no,no,yes,no
J,"Sazonov, R; Kholodnaya, G; Ponomarev, D; Sivkov, A; Shanenkov, I; Zhirkov, I",Synthesis of multicomponent nanocomposites containing filamentary carbon nanostructures,"In this work, the multicomponent nanocomposites containing filamentary carbon nanostructures were synthesized using materials based on iron oxides with a predominant content of the epsilon phase (epsilon-Fe2O3). These iron oxide-based materials were obtained by a direct plasma-dynamic synthesis with supersonic outflow of an iron-containing electric discharge plasma into an oxygen atmosphere. Subsequently, they were used as an initial precursor and placed in the plasma-chemical reactor, where the multicomponent C/SixOy/Fe2O3 nanostructures were synthesized under the influence of the pulsed electron beam. This method was based on the volume excitation of the reaction gas by a pulsed electron beam in such a way as to control the uniform process implementation in the entire excitation region. The morphology and phase composition of the synthesized C/SixOy/Fe2O3 nanocomposites were studied. A typical morphological feature of the C/SixOy/Fe2O3 samples was found to be the formation of filamentary nanostructures. Their diameter does not exceed 10-20 nm, while their length varies up to 1 mu m.",10.1080/1536383X.2019.1699534,41,yes,yes,no,no,no,no,no,no,yes,no,yes,yes,no,yes,no,no,yes,yes,no,yes,no,no,yes,yes,no,no,no,no,yes,yes,
J,"Svetashkov, AA; Fok, SC; Kupriyanov, NA; Manabaev, KK; Pavlov, MS; Vakurov, AA",Modification of the Time-Effective Moduli of Viscoelastic Bodies,"The problem on constructing new time-effective characteristics of a linear viscoelastic body is considered. The initial medium is modeled as a viscoelastic composite. One its part has properties determined by time-effective moduli of the Lagrangian type, but the other part has properties determined by moduli of the Castigliano type. This model makes it possible to employ the methods of mechanics of composite materials, for example, to formulate the effective Voigt and Reuss moduli and to construct iterative transformations narrowing the Voigt and Reuss fork. These transformations are constructed in such a way that, at each iteration, the inequalities following from the minimum total potential energy principle and the theorem of complementary work are satisfied for the effective moduli. It is shown that, at each moment of time t, the sequences of iteratively transformed Voigt and Reuss moduli converge to the same limit, equal to the geometric mean of their initial values. By the example of the problem on bending of a viscoelastic plate, the approximate solutions obtained on the basis of the new time-effective characteristics found, are compared with an analytical solution. Their good agreement points to a high accuracy of the approximate solutions.",10.1007/s11029-019-09843-8,42,yes,yes,no,yes,yes,no,yes,no,yes,no,yes,yes,no,no,no,no,yes,yes,no,yes,yes,yes,no,yes,yes,yes,no,yes,no,no,no
J,"Abdrakhimov, VZ",Study of the Limiting Shear Stress of Pyrophyllite - Clay Component - Water Composition at Elevated Temperature,"A sharp reduction in the ultimate shear stress in the range of 20 - 80 degrees C is observed during preparation of specimens of a clay component without thinners that facilitates development of cracks and defects. Use of pyrophyllite in ceramic mixes during specimen preparation provides a gradual reduction in the ultimate shear stress P-m in the range of 20 - 80 degrees C. It is shown that in order to improve specimen drying properties a pyrophyllite - clay - water composition is more homogeneous than a clay - water composition Analysis of specimen P-m under hot forming conditions shows that the relationship Pm = f(t) is not as important as the relationship P-m = f(W,t), where t is temperature, and W is humidity.",10.1007/s11148-019-00370-6,43,yes,yes,no,no,yes,no,no,no,yes,yes,yes,yes,no,no,no,yes,yes,yes,no,yes,no,no,yes,yes,no,no,no,no,no,yes,no
J,"Abdullah, NH; Mustaffa, MS; Hamidon, MN; Azis, RS; Chachuli, SAM",Structural transformations of mechanically alloyed polycrystalline YMnO<sub>3</sub>-based material for gas sensing application,"The structural transformation via sintering temperature towards yttrium manganese oxide (YMnO3) behavior will be investigated in this research work. The samples were prepared via mechanical alloying for 12 h using a SPEX8000D mill. The pelletized samples were sintered from 600 to 1250 degrees C with 50 degrees C increments respectively. The phase analysis reveals an enhancement of crystallinity with increasing grain size. Orthorhombic YMn2O5 phase was observed to be existing in the as-milled powder, and only hexagonal YMnO3 peaks were observed for >= 1000 degrees C. FESEM micrographs showed a variation starting at 49 nm up to 2.1 mu m at largest grain size with sintering temperature increment. The activation energy was explained based on the changes on the event observed in phase analysis. For polarization-electric field (PE) hysteresis reveals YMnO3 is highly leaky ferroelectrics. The remanent polarization (Pr) was observed at 0.13 to 7.12 mu C/cm(2) and as for electric field (Ec), the value increased from 69.81 to 2742 V/cm generally with increasing grain size. The capacitance values were increased from 20.2 to 435 pF parallel to grain size increment. The behavior of YMnO3 samples series behave based on their difference of crystallinity, microstructure data, and phase purity changes.",10.1007/s41779-019-00313-x,44,yes,no,no,no,yes,no,yes,no,yes,no,yes,yes,yes,yes,yes,yes,yes,yes,no,yes,no,yes,yes,yes,yes,yes,no,no,no,no,no
J,"Adlparvar, S; Haghani, SF; Kiai, SMS",Study Cherenkov radiation by production of positrons and its annihilation in dense plasma focus,"The purpose of the current study was to evaluate the production of positrons through Ne-nat (D-2 He-4) F-18, nuclear reactions and its possible Cherenkov radiation (CR) before annihilating in the hot and dense plasma medium (pinch) of a Mather type dense plasma focus device (DPF). Numerical computations of dispersion relation in the pinch plasma medium showed that CR started at approximately E = 0.0645 MeV with the relativistic velocity of 0.46 (m/s). Furthermore, the positron loses its energy by collision with the background plasma at a rate approximated by Bethe-Bloch equation through the pinch plasma diameter of 3 cm and annihilates after traveling a distance of about 1 cm.",10.1016/j.rinp.2019.102747,45,no,no,no,no,yes,yes,yes,no,yes,no,yes,yes,no,yes,no,no,yes,yes,no,yes,no,yes,no,yes,yes,no,no,no,yes,no,no
J,"Al-Naddaf, M; Tannoury, GA; Han, J; Parsons, RL; Zhang, C",Development of Laboratory Procedure for Evaluating Microcracking Technology on Cement-Modified Soil Subgrade,"Cement modification of soils has been widely practiced for the last few decades. Recently, cement has become a more economical binder to modify in situ subgrade soil because other binders, such as fly ash, have become less available and therefore their prices have gone up significantly. In addition, a much higher percentage of fly ash needs be used when compared with cement to achieve the same subgrade strength and stiffness. However, cement-modified subgrade may have an issue with shrinkage cracking, which can eventually reflect through the asphalt pavement layers to the surface after construction. For some subgrade soils, a high cement content is needed to meet the unconfined compressive strength requirement without jeopardizing durability. A higher cement content will result in higher shrinkage cracking potential. To overcome this problem, microcracking technology has been developed and adopted in the field. This technology involves recompaction of cement-modified soil (CMS) with a roller 24-48 h after initial compaction to induce microcracks in the CMS and minimize the potential for large shrinkage cracks. Microcracking of CMS is not expected to significantly reduce the strength and stiffness of CMS, but it is expected to increase its permeability and reduce the potential for large shrinkage cracks. Unfortunately, the procedure to simulate microcracking of CMS in the laboratory and evaluate its effect on properties of CMS has not been established yet. This note documents the development of such a procedure and discusses the effect of microcracking on the properties (strength and modulus) of CMS specimens.",10.1061/(ASCE)MT.1943-5533.0002982,46,,,,,,,,,,,,,,,,,,,,,,,,,,,,,,,
J,"Amiri, IS; Mohammadi, H",Analytical Study of Carrier Generation Rate in Graphene Nanoscroll,"Graphene nanoscroll introduced recently is another form of a graphene-based two-dimensional material, which is especially attractive in nanoelectronic applications. As carriers can travel ballistically or semi-ballistically, they can reach high-speed and energy if the channel length is enough. Therefore, they can collide and result in an excessive current called ionisation current. As a result, it is important to study this mechanism carefully. In this paper, we propose an analytical approach to calculate an ionisation coefficient.",10.1007/s11468-019-00964-3,47,yes,no,no,no,yes,no,yes,yes,no,yes,yes,no,no,no,no,no,no,no,no,no,no,no,no,no,no,no,no,no,no,yes,yes
J,"Arrotin, B; Libioulle, C; Issakova, T; Mespouille, L; Dubois, P; Delhalle, J; Mekhalif, Z",A Comparative Study of the Electro-Assisted Grafting of Mono- and Bi-Phosphonic Acids on Nitinol,"Over the last few years, Nitinol (NiTi) has become one of the most attractive alloy materials for industrial applications. However, its implementation is still problematic due to its surface nickel content, making it sensitive to pitting corrosion. In applications, it is often necessary to modify NiTi surfaces by using organic coatings, which provides new physico-chemical properties as well as functionalities and often contributes to a reinforcement of the alloy corrosion resistance. In this work, we assess the differences between the molecular layers made out of methylphosphonic acid (C1P) and the bi-phosphonic acid derivatives: (methylimino)dimethylene-bisphophonic acid (MIP2) and 1-hydroxyethylidene-1,1-diphosphonic acid (HEP2) using conventional (CG) and electro-assisted (EG) graftings. The surface modifications with the bi-phosphonic derivatives (MIP2) and (HEP2) carried out with the EG process lead to denser layers and a reinforced NiTi corrosion resistance.",10.3390/surfaces2040038,48,yes,no,yes,no,yes,no,yes,yes,no,no,yes,yes,no,no,no,no,yes,yes,yes,no,no,no,no,no,yes,yes,no,no,yes,yes,
J,"Arvhult, CM; Guéneau, C; Gossé, S; Selleby, M",Thermodynamic assessment of the Fe-Ni-Te system,"For the purpose of modeling internal corrosion of the stainless steel fuel pins in fast nuclear reactors, the present work presents a thermodynamic description of the Fe-Ni-Te system modeled via the Calphad method. The liquid phase was modeled using the ionic 2-sublattice liquid model. Only binary parameters were optimized in the beta 2, delta and tau solid phases, to fit the isothermal section at 600 degrees C. The liquid did not require much adjustment from the extrapolation from the binary Fe-Te, Ni-Te and Fe-Ni systems. The paper presents a re-optimization of the Fe-Te liquid description in order to remove inverted liquid miscibility gaps at high temperatures. The resulting phase diagrams reproduce experimental isothermal sections well, and fits liquidus and solidus data very well. The description will be incorporated into the Thermodynamics of Advanced Fuels - International Database (TAF-ID). This will then be coupled with the Germinal system code to model the fission-product induced corrosion in nuclear fuel pins.",10.1016/j.calphad.2019.101672,49,yes,yes,no,yes,yes,yes,yes,yes,no,yes,yes,yes,no,no,no,no,yes,yes,yes,no,yes,no,yes,yes,yes,yes,yes,yes,yes,yes,no
J,"Baidu, KAO; Essuman, EK; Asubonteng, K; Boahin, JOB",The Suitability of Leather as an Alternative Material for Sustaining Vessel Production in Ghana,"Anecdotal evidence and a further report from leather experts show that there is close to no enlightenment of the production of leather vessels in Ghanaian leather industries. This study was, therefore, conducted as a result of the need to add leather as supplementary material to the traditional materials such as clay, metal, wood and half-gourd used for producing vessels in Ghana. The purpose of the study was to find out how Ghanaian indigenous leather could be used in the production of leather vessels. The qualitative study employed three key techniques, namely: 'Cuir bouilli' leather hardening methods, the sand pounding technique, and assemblage and construction technique. Based on the results, the baking and hot wax methods adversely affected the indigenous leather positively in the hardening of the leather. The results also show that using only one part of the leather (the back, belly or butt) affected the quality of the leather vessels, but incorporating the various parts of the hide helped improve the quality and durability of the leather vessels. The implications of the results and future research directions are also presented. This study has, therefore, expanded the usefulness of the Ghanaian indigenous vegetable tanned leather apart from the conventional usage for making shoes, bags and belts.",,50,yes,no,yes,no,yes,no,yes,no,yes,yes,yes,yes,no,no,no,no,yes,yes,no,yes,no,no,no,yes,yes,no,yes,yes,no,no,no
J,"Barbosa, EF; Peixoto, RCA; Silva, LP",Microscopic and Spectroscopic Characterization of Nanostructured Topographical Surface of Rattlesnake Rattle,"Rattlesnakes are easily recognized by a rattle on the tail. Despite the advances in molecular, morphological, and evolutionary studies about several aspects of rattles, there are no studies elucidating these nanoscale topographical features using high-resolution techniques. Here we propose a set of approaches to show these micro/nano surface features searching for patterns or hidden signatures. The results showed that the older rattle ring (segment 8) presented higher roughness values when compared to other segments. Cluster analysis allowed the observation of similarities/differences among some groups, which reinforced the strong discrepancy of the segment 8 when compared to the others and enable possible topographical transitions among each segment features, considering their linkages and Euclidean distances. Attractive forces and surface hardness were also significant increased on segment 8, while adhesion was significantly decreased on the segments 5, 6, and 7 compared to segment 1 (P < 0.05). Fourier transform infrared spectroscopy showed typical profiles of keratin spectra considering the amino acids present in this protein structure. Energy dispersive spectroscopy results indicated possible different molecular composition on each segment. These set of approaches applied on the present study represents an array of new possibilities towards the qualitative and quantitative analyses of this type of biomaterials enabling to address several structural, chemical and mechanical questions ongoing on scientific world.",10.1166/jnn.2019.16746,51,yes,yes,no,yes,yes,no,yes,yes,no,no,yes,yes,no,no,no,yes,yes,yes,no,yes,yes,yes,yes,yes,yes,yes,yes,yes,yes,yes,yes
J,"Bariska, M; Pásztory, Z; Börcsök, Z",On tylosis ultrastructure in <i>Quercus cerris</i> L<i>.</i>,"A study of tylosis in European Turkey oak (Quercus cerris L.) shows correspondences in the formation of tyloses and of regular cell walls. The outer tylosis wall has a smooth, granular surface with simple perforations analogous to that of the primary wall of ordinary cells. The underlying wall stratum shows parallel oriented macro-fibrils, normally found in the secondary walls of regular cells. At the contact areas of tyloses, stabilizing seams can be observed. Various types of wall openings such as simple pits, blind pits and vestured pits were present. Also tylosis division was detected. The characteristics of parenchyma cell walls can be re-discovered in tyloses.",10.1515/hf-2019-0028,52,yes,yes,no,no,no,no,no,no,yes,no,yes,yes,yes,no,no,no,yes,yes,yes,yes,no,no,no,yes,yes,yes,no,no,yes,yes,
J,"Boucheham, A; ElAmrani, A; Timlelt, H; Nasraoui, C; Saibi, A",Investigation of p plus emitter formation for n-type silicon solar cells application,"This work reports on the study of boron diffusion in n-type silicon from preform source for p+ emitter formation. Using quartz tube furnace, three main parameters are investigated that are: drive-in temperature, drive-in time and temperature ramp-up time. It is found that the sheet resistance as measured by the four point probe method (4-pp) decreases from 93 ?/? to 24 ?/? as the drive-in temperature increases from 850 ;C to 950 ;C, likewise, it decreases from 57 ?/? to 38 ?/? as the drive-in time increases from 20 min to 40 min. The electrically active boron dopant profiles as measured by the electrochemical capacitance voltage technique (ECV) exhibit surface concentrations below the solid-solubility limit of boron in silicon for all the studied emitters, the maximum surface and peak boron concentrations of 1.30;;10(20) and 1.58;;10(20) atoms cm(?3) were measured respectively on the emitter which is formed at a drive-in temperature of 950 ;C. Furthermore, it is revealed from the secondary ion mass spectroscopy measurements (SIMS) the presence of the boron rich layer (BRL) on its surface. The Hall Effect measurement method is used for measuring sheet resistance and sheet charge carrier concentration.",10.1088/2053-1591/ab582e,53,yes,no,no,no,no,no,no,no,yes,no,yes,yes,no,yes,no,yes,yes,yes,no,yes,yes,yes,yes,yes,yes,yes,no,no,no,yes,no
J,"Cao, FH; Chen, C; Wang, ZY",Effect of heat treatment on microstructure and corrosion resistance of extruded ZK80 Mg alloy,"The corrosion characteristics and corrosion mechanism of the extruded ZK80 alloy with different states soaking in 3.5% NaCl solution at room temperature were analyzed via OM, SEM, EDS, XRD and static weightlessness method and other experimental analysis methods. The results show that when the aging temperature is constant, and the corrosion rate decreases with the lengthen of aging time, while when the corrosion time is constant, the corrosion rate increases with the increase in aging time. Appropriate aging treatment not only refines the grain of the alloy, but also precipitates the Mg-Zn phase which can effectively prevent the corrosion process and improve the anti-corrosion properties of the alloy. The main corrosion characteristics of the alloy are filamentary corrosion and pitting corrosion.",10.1166/mex.2019.1585,54,yes,yes,no,no,no,no,no,no,yes,no,yes,yes,no,yes,no,yes,yes,yes,yes,no,no,no,no,yes,yes,no,no,no,yes,yes,no
J,"Cao, XS",Phonon properties of multiferroic <i>BiFeO</i><sub>3</sub>,"The phonon properties of BiFeO3 have been studied by using the specific heat. It is found that the specific heat of BiFeO3 exhibits two peaks. The first peak appears at the magnetic phase transition temperature T-N = 650 K. This anomaly in specific heat can be interpreted as antiferromagnetic transition. The values of the specific heat (at the magnetic phase transition temperature T-N) increase with the increasing of the J(1), vertical bar J(2)vertical bar, I and g. Another abnormal peak of specific heat appears at nearly 550 K, which is associated with the onset of structural changes. Note that the second peak shifts to lower temperature as the J(1), vertical bar J(2)vertical bar, I and g decrease. It is considered that the main reason of leading to the structure distortion increases is due to the increase of the J(1), vertical bar J(2)vertical bar, I and g. Those calculation conclusions are in accordance with the experimental results of other researchers.",10.1016/j.mseb.2019.114446,55,yes,yes,no,yes,no,no,no,no,yes,no,yes,yes,no,no,no,no,yes,yes,no,yes,no,no,yes,yes,yes,no,no,no,no,yes,no
J,"Chaudhari, AK; Singh, VB","Impact of ZrO<sub>2</sub> reinforcement on the surface roughness, electrical and magnetic properties of the nano-permalloy","Ni-Fe alloy and Ni-Fe/ZrO2 nanocomposite, electro co-deposited from ethylene glycol bath, were evaluated in terms of magnetic, electrical, surface roughness and corrosion resistant properties. The properties of the nanocomposite coating were found to mainly depend on the ZrO2 particle content of the coatings. The surface of the Ni-Fe/ZrO2 nanocomposite coating was found to be smoother and more resistant to corrosion than the alloy because of the inert nature of the embedded ceramic particles. The electrical resistivity of the electro deposits increased with the increasing content of the ZrO2 particles in the coating. Magnetic studies revealed that the composite coatings have very small magnetic remanence and coercivity. Saturation magnetization (M-s) of the composite was reduced after incorporation of nonmagnetic ZrO2 nanoparticles in the Ni-Fe alloy matrix.",10.1088/2631-6331/ab5570,56,yes,yes,no,no,no,no,yes,no,yes,no,yes,yes,no,no,no,yes,yes,yes,no,yes,no,no,yes,yes,yes,no,no,no,no,yes,no
J,"Chaudhary, PK; Parmar, G; Sikander, A",Single phase standalone photovoltaic micro system with six level inverter topology,The work deals with six-level inverter topology for single phase standalone photovoltaic (PV) based micro system with reduced device count. Fundamental switching scheme has been presented using selective harmonic elimination-pulse width modulation (SHE-PWM) method to calculate the switching angles for optimization of harmonics and to eliminate the lowest order harmonic from the system. The Perturb and Observe algorithm is used for tracking the maximum power point for the triggering of DC-DC boost regulator conversion stage. Complete control scheme has been given with different modes of operation. The PV micro system has been simulated and tested in Matlab simulink environment. Total harmonic distortion analysis for the output voltage and current without and with filter has also been carried out for the system under test.,10.1007/s00542-019-04403-5,57,,,,,,,,,,,,,,,,,,,,,,,,,,,,,,,
J,"Chen, LL; Wang, ZX; Dou, BX; Han, K; Li, W; Xin, JY",Preparation of Electrode Modified with Methanobactin Functionalized Gold Nanoparticle and Mimic Superoxide Dismutase Activity,"Using a mixed self-assembly method, this research utilized modified Mb-functionalized gold nanoparticles (Mb-AuNPs-MPA) on the gold electrode surface to prepare a biosensor which was applied to detect superoxide anion-free electron mediators. Together with the study on the performance of the sensor, the characteristics of modified nanoclusters were investigated by UV-Vis and FTIR and the electrochemical characteristics of the electrode surface were investigated using electrochemical impedance spectroscopy (EIS) and cyclic voltammetry (CV), respectively. It was demonstrated that the charge transfer resistance (Rct) of the modified electrode (Mb-MPA-AuNPs/Au) was 7862 ft, the exchange current density (i0) was 32.7 pA/cm(2). And a pair of reversible and symmetrical redox peaks appeared after the coordination of Cu2+, and the electrical signal response of Cue /Mb-AuNPs-MPA/Au reached the highest. The superoxide anion generated in the basic DMSO system was determined by CV using the modified electrode Cu2+ Mb-AuNPs-MPA/Au. It was discovered that the superoxide anion had a strong disproportionation effect.",10.1166/jnn.2019.16939,58,no,no,no,no,yes,no,no,no,yes,no,yes,yes,no,yes,yes,yes,yes,yes,no,yes,yes,yes,no,yes,yes,no,no,no,yes,yes,no
