ID,Abstract,rule1,rule2,rule3,rule4,rule5,rule6,rule7,rule8,rule9,rule10,rule11,rule12,rule13,rule14,rule15,rule16,rule17,rule18,rule19,rule20,rule21,rule22,rule23,rule24,rule25,rule26,rule27,rule28,rule29,rule30,rule31,rule32,rule33
50,"We analyze the coupling between the ferroelectric and magnetic order parameters in the magnetoelectric multiferroic BiFeO(3) using density functional theory within the local spin density approximation (LSDA) and the LSDA+U method. We show that weak ferromagnetism of the Dzyaloshinskii-Moriya type occurs in this material, and we analyze the coupling between the resulting magnetization and the structural distortions. We explore the possibility of electric-field-induced magnetization reversal and show that, although it is unlikely to be realized in BiFeO(3), it is not in general impossible. Finally, we outline the conditions that must be fulfilled to achieve switching of the magnetization using an electric field.",,,,,,,,,,,,,,,,,,,,,,,,,,,,,,,,,
51,"We have recently demonstrated an approach based on the polyol process for the large-scale synthesis of silver nanowires with uniform diameters (see Sun, Y.; Gates, B.; Mayers, B.; Xia, Y. Nano Leff. 2002, 2,165. Sun, Y.; Xia, Y. Adv. Mater. 2002, 14,833. Sun, Y.; Yin, Y.; Mayers, B. T.; Herricks, T.; Xia, Y. Chem. Mater. 2002, 149 4736). Although the capability and feasibility of this method have been successfully illustrated with the production of silver nanowires 30-60 nm in diameter and 1-50 mum in length, the growth mechanism of this process is yet to be elucidated. Here we report some progress on this matter: First, electron microscopy studies on microtomed samples indicated that the cross sections of such silver nanowires had a pentagonal shape, together with a 5-fold twinned crystal structure. Second, the side surfaces (bounded by {100} facets) and the ends (bounded by {111} facets) of each nanowire were shown to have significant difference in reactivity toward dithoil molecules, with the side surfaces being completely passivated by poly(vinyl pyrrolidone) (PVP) and the ends being partially passivated (or essentially uncovered) by PVP. This result implied that the PVP macromolecules interacted more strongly with the {100} planes than with the {111} planes of silver. On the basis of these new results, we proposed that each silver nanowire evolved from a multiply twinned nanoparticle (MTP) of silver with the assistance of PVP at the initial stage of the Ostwald ripening process. The anisotropic growth was maintained by selectively covering the {100} facets with PVP while leaving the {111} facets largely uncovered by PVP and thus highly reactive.",,,,,,,,,,,,,,,,,,,,,,,,,,,,,,,,,
52,"A search for <(<nu>)over bar>(mu) --><(<nu>)over bar>(e) oscillations was conducted by the Liquid Scintillator Neutrino Detector at the Los Alamos Neutron Science Center using <(<nu>)over bar>(mu) from mu (+) decay at rest. A total excess of 87.9+/-22.4+/-6.0 events consistent with <(<nu>)over bar>(e)p-->e(+) n scattering was observed above the expected background. This excess corresponds to an oscillation probability of (0.264+/-0.067+/-0.045)%, which is consistent with an earlier analysis. In conjunction with other known limits on neutrino oscillations, the LSND data suggest that neutrino oscillations occur in the 0.2-10 eV(2)/c(4) Deltam(2) range, indicating a neutrino mass greater than 0.4 eV/c(2).",,,,,,,,,,,,,,,,,,,,,,,,,,,,,,,,,
53,"We present a fully three-dimensional theoretical study of the extraordinary transmission of light through subwavelength hole arrays in optically thick metal films. Good agreement is obtained with experimental data. An analytical minimal model is also developed, which conclusively shows that the enhancement of transmission is due to tunneling through surface plasmons formed on each metal-dielectric interface. Different regimes of tunneling (resonant through a ""surface plasmon molecule,"" or sequential through two isolated surface plasmons) are found depending on the geometrical parameters defining the system.",,,,,,,,,,,,,,,,,,,,,,,,,,,,,,,,,
54,"Thermoelectric generators (TEGs) transform a heat flow into electricity. Thermoelectric materials are being investigated for electricity production from waste heat (co-generation) and natural heat sources. For temperatures below 200 degrees C, the best commercially available inorganic semiconductors are bismuth telluride (Bi2Te3)-based alloys, which possess a figure of merit ZT close to one(1). Most of the recently discovered thermoelectric materials with ZT > 2 exhibit one common property, namely their low lattice thermal conductivities(2,3). Nevertheless, a high ZT value is not enough to create a viable technology platform for energy harvesting. To generate electricity from large volumes of warm fluids, heat exchangers must be functionalized with TEGs. This requires thermoelectric materials that are readily synthesized, air stable, environmentally friendly and solution processable to create patterns on large areas. Here we show that conducting polymers might be capable of meeting these demands. The accurate control of the oxidation level in poly(3,4-ethylenedioxythiophene) (PEDOT) combined with its low intrinsic thermal conductivity (lambda = D 0.37W m(-1) K-1) yields a ZT = 0.25 at room temperature that approaches the values required for efficient devices.",,,,,,,,,,,,,,,,,,,,,,,,,,,,,,,,,
55,"Microporous activated carbon originating from coconut shell, as received or oxidized with nitric acid, is treated with melamine and urea and heated to 950 degrees C in an inert atmosphere to modify the carbon surface with nitrogen- and oxygen-containing groups for a systematic investigation of their combined effect on electrochemical performance in 1 m H2SO4 supercapacitors. The chemistry of the samples is characterized using elemental analysis, Boehm titration, potentiometric titration, and X-ray photoelectron spectroscopy. Sorption of nitrogen and carbon dioxide is used to determine the textural properties. The results show that the surface chemistry is affected by the type of nitrogen precursor and the specific groups present on the surface before the treatment leading to the incorporation of nitrogen. Analysis of the electrochemical behavior of urea- and melamine-treated samples reveal pseudocapacitance from both the oxygen and the nitrogen containing functional groups located in the pores larger than 10 angstrom. On the other hand, pores between 5 angstrom and 6 angstrom are most effective in a double-layer formation, which correlates well with the size of hydrated ions. Although the quaternary and pyridinic-N-oxides nitrogen groups have enhancing effects on capacitance due to the positive charge, and thus an improved electron transfer at high current loads, the most important functional groups affecting energy storage performance are pyrrolic and pyridinic nitrogen along with quinone oxygen.",,,,,,,,,,,,,,,,,,,,,,,,,,,,,,,,,
56,"Following the first experimental realization of graphene, other ultrathin materials with unprecedented electronic properties have been explored, with particular attention given to the heavy group-IV elements Si, Ge and Sn. Two-dimensional buckled Si-based silicene has been recently realized by molecular beam epitaxy growth, whereas Ge-based germanene was obtained by molecular beam epitaxy and mechanical exfoliation. However, the synthesis of Sn-based stanene has proved challenging so far. Here, we report the successful fabrication of 2D stanene by molecular beam epitaxy, confirmed by atomic and electronic characterization using scanning tunnelling microscopy and angle-resolved photoemission spectroscopy, in combination with first-principles calculations. The synthesis of stanene and its derivatives will stimulate further experimental investigation of their theoretically predicted properties, such as a 2D topological insulating behaviour with a very large bandgap, and the capability to support enhanced thermoelectric performance, topological superconductivity and the near-room-temperature quantum anomalous Hall effect.",,,,,,,,,,,,,,,,,,,,,,,,,,,,,,,,,
57,"Two-dimensional (2D) transition metal dichalcogenides (TMDs) are emerging as a new platform for exploring 2D semiconductor physics(1-9). Reduced screening in two dimensions results in markedly enhanced electron-electron interactions, which have been predicted to generate giant bandgap renormalization and excitonic effects(10-13). Here we present a rigorous experimental observation of extraordinarily large exciton binding energy in a 2D semiconducting TMD. We determine the single-particle electronic bandgap of single-layer MoSe2 by means of scanning tunnelling spectroscopy (STS), as well as the two-particle exciton transition energy using photoluminescence (PL) spectroscopy. These yield an exciton binding energy of 0.55 eV for monolayer MoSe2 on graphene-orders of magnitude larger than what is seen in conventional 3D semiconductors and significantly higher than what we see for MoSe2 monolayers in more highly screening environments. This finding is corroborated by our ab initio GW and Bethe-Salpeter equation calculations(14,15) which include electron correlation effects. The renormalized bandgap and large exciton binding observed here will have a profound impact on electronic and optoelectronic device technologies based on single-layer semiconducting TMDs.",,,,,,,,,,,,,,,,,,,,,,,,,,,,,,,,,
58,"Given two snapshots of an atomistic system, taken at different stages of the deformation process, one can compute the incremental deformation gradient field, F, as defined by continuum mechanics theory, from the displacements of atoms. However, such a kinematic analysis of the total deformation does not reveal the respective contributions of elastic and plastic deformation. We develop a practical technique to perform the multiplicative decomposition of the deformation field, F = (FFp)-F-e, into elastic and plastic parts for the case of crystalline materials. The described computational analysis method can be used to quantify plastic deformation in a material due to crystal slip-based mechanisms in molecular dynamics and molecular statics simulations. The knowledge of the plastic deformation field, F-p, and its variation with time can provide insight into the number, motion and localization of relevant crystal defects such as dislocations. The computed elastic field, F-e, provides information about inhomogeneous lattice strains and lattice rotations induced by the presence of defects.",,,,,,,,,,,,,,,,,,,,,,,,,,,,,,,,,
59,"The great variability in the electrical properties of multinary oxide materials, ranging from insulating, through semiconducting to metallic behaviour, has given rise to the idea of modulating the electronic properties on a nanometre scale for high-density electronic memory devices. A particularly promising aspect seems to be the ability of perovskites to provide bistable switching of the conductance between non-metallic andmetallic behaviour by the application of an appropriate electric field. Here we demonstrate that the switching behaviour is an intrinsic feature of naturally occurring dislocations in single crystals of a prototypical ternary oxide, SrTiO3. The phenomenon is shown to originate from local modulations of the oxygen content and to be related to the self-doping capability of the early transition metal oxides. Our results show that extended defects, such as dislocations, can act as bistable nanowires and hold technological promise for terabit memory devices.",,,,,,,,,,,,,,,,,,,,,,,,,,,,,,,,,
60,"The thermal properties of a suspended metallic single-wall carbon nanotube (SWNT) are extracted from its high-bias (l-V) electrical characteristics over the 300-800 K temperature range, achieved by Joule self-heating. The thermal conductance is approximately 2.4 nW/K, and the thermal-conductivity is nearly 3500 Wm(-1)K(-1) at room temperature for a SWNT of length 2.6 mu m and diameter 1.7 nm. A subtle decrease in thermal conductivity steeper than 1/T is observed at the upper end of the temperature range, which is attributed to second-order three-phonon scattering between two acoustic modes and one optical mode. We discuss sources of uncertainty and propose a simple analytical model for the SWNT thermal conductivity including length and temperature dependence.",,,,,,,,,,,,,,,,,,,,,,,,,,,,,,,,,
61,"We report that homogeneous colloidal suspensions of chemically modified graphene sheets were readily produced in a wide variety of organic solvent systems. Two different sets of solubility parameters are used to rationalize when stable colloidal suspensions of graphene oxide sheets and, separately, of reduced graphene oxide sheets in a given solvent type are possible and when they are not. As an example of the utility of such colloidal suspensions, ""paperlike"" materials generated by very simple filtration of the reduced graphene oxide sheets had electrical conductivity values as high as 16 000 S/m.",,,,,,,,,,,,,,,,,,,,,,,,,,,,,,,,,
62,"Ultrathin molybdenum disulphide (MoS2) has emerged as an interesting layered semiconductor because of its finite energy bandgap and the absence of dangling bonds. However, metals deposited on the semiconducting 2H phase usually form high-resistance (0.7 k Omega mu m-10 k Omega mu m) contacts, leading to Schottky-limited transport. In this study, we demonstrate that the metallic 1T phase of MoS2 can be locally induced on semiconducting 2H phase nanosheets, thus decreasing contact resistances to 200-300 Omega mu m at zero gate bias. Field-effect transistors (FETs) with 1T phase electrodes fabricated and tested in air exhibit mobility values of similar to 50 cm(2)V(-1)s(-1), subthreshold swing values below 100mV per decade, on/of ratios of >10(7), drive currents approaching similar to 100 mu A mu m(-1), and excellent current saturation. The deposition of different metals has limited influence on the FET performance, suggesting that the 1T/2H interface controls carrier injection into the channel. An increased reproducibility of the electrical characteristics is also obtained with our strategy based on phase engineering of MoS2.",,,,,,,,,,,,,,,,,,,,,,,,,,,,,,,,,
63,"Boltzmann codes are used extensively by several groups for constraining cosmological parameters with Cosmic Microwave Background and Large Scale Structure data. This activity is computationally expensive, since a typical project requires from 104 to 105 Boltzmann code executions. The newly released code CLASS (Cosmic Linear Anisotropy Solving System) incorporates improved approximation schemes leading to a simultaneous gain in speed and precision. We describe here the three approximations used by CLASS for basic Lambda CDM models, namely: a baryon-photon tight-coupling approximation which can be set to first order, second order or to a compromise between the two; an ultra-relativistic fluid approximation which had not been implemented in public distributions before; and finally a radiation streaming approximation taking reionisation into account.",,,,,,,,,,,,,,,,,,,,,,,,,,,,,,,,,
64,"Individual single-walled carbon nanotubes (SWNTs) have been suspended in aqueous media using various anionic, cationic, nonionic surfactants and polymers. The surfactants are compared with respect to their ability to suspend individual SWNTs and the quality of the absorption and fluorescence spectra. For the ionic surfactants, sodium dodecylbenzene sulfonate (SDBS) gives the most well resolved spectral features. For the nonionic systems, surfactants with higher molecular weight suspend more SWNT material and have more pronounced spectral features.",,,,,,,,,,,,,,,,,,,,,,,,,,,,,,,,,
65,"A large class of topological orders can be understood and classified using the string-net condensation picture. These topological orders can be characterized by a set of data (N, d(i), F-lmn(ijk), delta(ijk)). We describe a way to detect this kind of topological order using only the ground state wave function. The method involves computing a quantity called the ""topological entropy"" which directly measures the total quantum dimension D = Sigma(i)d(i)(2).",,,,,,,,,,,,,,,,,,,,,,,,,,,,,,,,,
66,"The thermal conductivities of individual single crystalline intrinsic Si nanowires with diameters of 22, 37, 56, and 115 nm were measured using a microfabricated suspended device over a temperature range of 20-320 K. Although the nanowires had well-defined crystalline order, the thermal conductivity observed was more than two orders of magnitude lower than the bulk value. The strong diameter dependence of thermal conductivity in nanowires was ascribed to the increased phonon-boundary scattering and possible phonon spectrum modification. (C) 2003 American Institute of Physics.",,,,,,,,,,,,,,,,,,,,,,,,,,,,,,,,,
67,"Recent advancements in morphology control and surface functionalization of mesoporous silica nanoparticles (MSNs) have enhanced the biocompatibility of these materials with high surface areas and pore volumes. Several recent reports have demonstrated that the MSNs can be efficiently internalized by animal and plant cells. The functionalization of MSNs with organic moieties or other nanostructures brings controlled release and molecular recognition capabilities to these mesoporous materials for drug/gene delivery and sensing applications, respectively. Herein, we review recent research progress on the design of functional MSN materials with various mechanisms of controlled release, along with the ability to achieve zero release in the absence of stimuli, and the introduction of new characteristics to enable the use of nonselective molecules as screens for the construction of highly selective sensor systems.",,,,,,,,,,,,,,,,,,,,,,,,,,,,,,,,,
68,"Layered MAX phases are exfoliated into 2D single layers and multilayers, so-called MXenes. Using first-principles calculations, the formation and electronic properties of various MXene systems, M2C (M = Sc, Ti, V, Cr, Zr, Nb, Ta) and M2N (M = Ti, Cr, Zr) with surfaces chemically functionalized by F, OH, and O groups, are examined. Upon appropriate surface functionalization, Sc2C, Ti2C, Zr2C, and Hf2C MXenes are expected to become semiconductors. It is also derived theoretically that functionalized Cr2C and Cr2N MXenes are magnetic. Thermoelectric calculations based on the Boltzmann theory imply that semiconducting MXenes attain very large Seebeck coefficients at low temperatures.",,,,,,,,,,,,,,,,,,,,,,,,,,,,,,,,,
69,"The electronic reconstruction at the interface between two insulating oxides can give rise to a highly conductive interface. Here we show how, in analogy to this remarkable interface-induced conductivity, magnetism can be induced at the interface between the otherwise non-magnetic insulating perovskites SrTiO3 and LaAlO3. A large negative magnetoresistance of the interface is found, together with a logarithmic temperature dependence of the sheet resistance. At low temperatures, the sheet resistance reveals magnetic hysteresis. Magnetic ordering is a key issue in solid-state science and its underlying mechanisms are still the subject of intense research. In particular, the interplay between localized magnetic moments and the spin of itinerant conduction electrons in a solid gives rise to intriguing many-body effects such as Ruderman-Kittel-Kasuya-Yosida interactions, the Kondo effect and carrier-induced ferromagnetismin diluted magnetic semiconductors. The conducting oxide interface now provides a versatile system to induce and manipulate magnetic moments in otherwise non-magnetic materials.",,,,,,,,,,,,,,,,,,,,,,,,,,,,,,,,,
70,"Despite great recent progress with carbon nanotubes and other nanoscale fillers, the development of strong, durable, and cost-efficient multifunctional nanocomposite materials has yet to be achieved. The challenges are to achieve molecule-level dispersion and maximum interfacial interaction between the nanofiller and the matrix at low loading. Here, the preparation of poly(vinyl alcohol) (PVA) nanocomposites with graphene oxide (GO) using a simple water solution processing method is reported. Efficient load transfer is found between the nanofiller graphene and matrix PVA and the mechanical properties of the graphene-based nanocomposite with molecule-level dispersion are significantly improved. A 76% increase in tensile strength and a 62% improvement of Young's modulus are achieved by addition of only 0.7 wt% of GO. The experimentally determined Young's modulus is in excellent agreement with theoretical simulation.",,,,,,,,,,,,,,,,,,,,,,,,,,,,,,,,,
71,,,,,,,,,,,,,,,,,,,,,,,,,,,,,,,,,,
72,"The four LEP Collaborations, ALEPH, DELPHI, L3 and OPAL, have collected a total of 2461 pb(-1) of e(+)e(-) collision data at centre-of-mass energies between 189 and 209 GeV. The data are used to search for the Standard Model Higgs boson. The search results of the four Collaborations are combined and examined in a likelihood test for their consistency with two hypotheses: the background hypothesis and the signal plus background hypothesis. The corresponding confidences have been computed as functions of the hypothetical Higgs boson mass. A lower bound of 114.4 GeV/c(2) is established, at the 95% confidence level, on the mass of the Standard Model Higgs boson. The LEP data are also used to set upper bounds on the HZZ coupling for various assumptions concerning the decay of the Higgs boson. (C) 2003 Elsevier B.V. All rights reserved.",,,,,,,,,,,,,,,,,,,,,,,,,,,,,,,,,
73,"We have observed condensation of fermionic atom pairs in the BCS-BEC crossover regime. A trapped gas of fermionic K-40 atoms is evaporatively cooled to quantum degeneracy and then a magnetic-field Feshbach resonance is used to control the atom-atom interactions. The location of this resonance is precisely determined from low-density measurements of molecule dissociation. In order to search for condensation on either side of the resonance, we introduce a technique that pairwise projects fermionic atoms onto molecules; this enables us to measure the momentum distribution of fermionic atom pairs. The transition to condensation of fermionic atom pairs is mapped out as a function of the initial atom gas temperature T compared to the Fermi temperature T-F for magnetic-field detunings on both the BCS and BEC sides of the resonance.",,,,,,,,,,,,,,,,,,,,,,,,,,,,,,,,,
74,"A new component of the cosmic medium, a light scalar field or ""quintessence,"" has been proposed recently to explain cosmic acceleration with a dynamical cosmological constant. Such a field is expected to be coupled explicitly to ordinary matter, unless some unknown symmetry prevents it. I investigate the cosmological consequences of a coupled quintessence (CQ) model, assuming an exponential potential and a linear coupling. This model is conformally equivalent to Brans-Dicke Lagrangians with any power-law potential. I evaluate the density perturbations on the cosmic microwave background and on the galaxy distribution at the present and derive bounds on the coupling constant from the comparison with observational data. A novel feature of CQ is that during the matter dominated era the scalar field has a finite and almost constant energy density. This epoch, denoted as phi MDE, is a saddle point in the dynamical phase space. The phi MDE is responsible of several differences with respect to uncoupled quintessence: the multipole spectrum of the microwave background is tilted at large angles, the acoustic peaks are shifted, their amplitude is changed, and the present 8 Mpc/h density variance is diminished. The present data constrain the dimensionless coupling constant to \beta\less than or equal to 0.1 assuming Omega(m)=0.3 and a primordial fluctuation slope n(s)=1.",,,,,,,,,,,,,,,,,,,,,,,,,,,,,,,,,
75,"In this work, a detailed high resolution X-ray photoelectron spectroscopy (XPS) analysis is presented for select MXenes a recently discovered family of two-dimensional (2D) carbides and carbonitrides. Given their 2D nature, understanding their surface chemistry is paramount. Herein we identify and quantify the surface groups present before, and after, sputter-cleaning as well as freshly prepared vs. aged multi layered cold pressed discs. The nominal compositions of the MXenes studied here are Ti-3 C2Tx,Ti3CNTx, Nb2CTx and Nb4C3Tx where T represents surface groups that this work attempts to quantify. In all the cases, the presence of three surface terminations, O, OH and F, in addition to OH-terminations relatively strongly bonded to H2O molecules, was confirmed. From XPS peak fits, it was possible to establish the average sum of the negative charges of the terminations for the aforementioned MXenes. Based on this work, it is now possible to quantify the nature of the surface terminations. This information can, in turn, be used to better design and tailor these novel 2D materials for various applications. Published by Elsevier B.V.",,,,,,,,,,,,,,,,,,,,,,,,,,,,,,,,,
76,"We present a short and direct derivation of Hawking radiation as a tunneling process, based on particles in a dynamical geometry. The imaginary part of the action for the classically forbidden process is related to the Boltzmann factor for emission at the Hawking temperature. Because the derivation respects conservation laws, the exact spectrum is not precisely thermal. We compare and contrast the problem of spontaneous emission of charged particles from a charged conductor.",,,,,,,,,,,,,,,,,,,,,,,,,,,,,,,,,
