Publication Type,Authors,Title,Abstract,DOI,ID,rule1,rule2,rule3,rule4,rule5,rule6,rule7,rule8,rule9,rule10,rule11,rule12,rule13,rule14,rule15,rule16,rule17,rule18,rule19,rule20,rule21,rule22,rule23,rule24,rule25,rule26,rule27,rule28,rule29,rule30,rule31
J,"Kwan, MP",Phenomenology of SUGRA extensions of the Starobinsky model,"We analyze Bl-extended model in a complete form and compare the predictions with that of Starobinsky model. Under the parameter constraints in Planck 2018, we find that the dynamics of the whole inflation process described by BI-extended and Starobinsky models are nearly the same, even though there are some differences in the regions out of inflation. We also find the scales of parameters in BI-extended model and inflaton values at the first horizon crossing required to implement inflation. The changes of (n(s), r) fingerprints of BI-extended model and that of evolutions of inflaton field due to the variations of relevant parameters are also investigated. (C) 2019 Elsevier Inc. All rights reserved.",10.1016/j.aop.2019.167991,20,yes,yes,no,no,yes,no,yes,no,yes,no,yes,yes,no,no,no,no,yes,yes,no,yes,no,no,no,yes,yes,no,no,no,yes,yes,
J,"Lan, BL; Chu, RJ",Disagreement between non-relativistic and relativistic quantum dynamics of a driven electron,"We show, both analytically and numerically, that the non-relativistic and relativistic quantum predictions for the dynamics of a prototypical driven electron - the periodically kicked rotor - do not always agree in the non-relativistic regime. The surprisingly different quantum predictions could be tested experimentally using ultra-cold fermionic atoms in a periodically-pulsed 1D optical lattice. Similar breakdown of agreement should occur for driven quantum systems in general. Since the relativistic theory should be empirically correct, it must be used instead of the approximate non-relativistic theory to correctly study the quantum dynamics of a driven system after the breakdown time, which could lead to important contributions in a wide range of fields from atomic to molecular, chemical and condensed-matter physics.",10.1016/j.rinp.2019.102654,21,yes,yes,no,no,yes,no,yes,yes,no,yes,yes,no,no,yes,no,no,yes,yes,yes,no,yes,no,no,yes,yes,yes,yes,yes,yes,yes,yes
J,"Lee, SB",Influence of quenched disorder on discontinuous absorbing phase transition,"Influence of quenched disorder on critical behavior of the deterministic conserved threshold transfer process (DCTTP) was investigated. DCTTP is a variant of the conserved threshold transfer process modified such that active-particle hopping is deterministic and has been reported to exhibit discontinuous phase transition (Lee and Lee 2009 Phys. Rev. E 80 011106) in all considered dimensions, i.e. one, two, and four dimensions. Two disorder types were considered. First, while particle hopping on ordered sites is deterministic, hopping on disordered sites is subject to be stochastic, i.e. active particles on disordered sites hop to randomly selected neighboring sites. Second, disorder is assumed to be random dilution of lattice sites, i.e. particles cannot occupy disordered sites. The order parameter was found to be continuous for disorder of stochastic hopping, i.e. the first-order transition was rounded to the second-order transition for any small amount of disorder, whereas the transition remained first order but the critical exponent associated with the power law decrease of active-site densities varied for considerable amount of lattice site dilution. These results are consistent with predictions established for equilibrium n-vector spin systems.",10.1088/1742-5468/ab4bc1,22,yes,yes,no,yes,yes,no,yes,no,yes,no,yes,yes,no,no,no,yes,yes,yes,no,yes,no,no,no,yes,yes,no,yes,no,yes,yes,no
J,"Lee, SH; Kim, JH",Magnetic Properties of YBaCuO Superconductors Fabricated Using Melt Growth,"YBa2Cu3O7-y (YBaCuO) superconductors used in energy storage devices are superconducting permanent magnets in bulk form. YBaCuO bulk superconductors are fabricated by interior seeded melt growth. Because the seed crystal growth is based on a slow diffusion reaction, long-term heat treatment is required to fabricate a single crystal in order to improve the magnetic properties of the bulk YBaCuO superconductor. We fabricated a single-grain bulk YBaCuO superconductor by controlling the distance between the seed and the upper surface of the YBaCuO bulk. The magnetic levitation force and trapped magnetic field were measured for the YBaCuO superconducting bulk. The correlation between the superconducting magnetic properties of the specimens and the microstructure of each crystallographic plane were evaluated.",10.1166/jno.2019.2670,23,yes,yes,no,yes,yes,no,no,no,yes,no,yes,yes,no,no,yes,yes,yes,no,no,yes,yes,no,no,no,no,no,no,no,yes,yes,
J,"Legorreta, JR; López-Patiño, J; Fuentes, BE; Yousif, FB; Martínez, H",Ionization and electron capture for H<SUP>+</SUP> collisions at low keV energy with a water-vapor target,"We have investigated the total relative ionization and dissociative electron capture cross section for proton collisions with water-vapor molecules within the energy range of 2.5-10 keV. Time of flight mass spectroscopy was employed in the measurements of the atomic and molecular singly charged particles H+, H-2(+), O+, OH+ and H2O+ as well as the doubly charged particles O++, H2O++, OH++, and the contribution of the different channels was evaluated. Ionization was found to be the dominant reaction channel as expected. The contribution of the singly charged particles was found to be one order of magnitude higher than that of the doubly charged particles. (C) 2019 Elsevier B.V. All rights reserved.",10.1016/j.ijms.2019.116214,24,no,no,no,no,yes,no,yes,no,yes,no,yes,yes,no,yes,no,no,yes,yes,no,yes,no,no,yes,yes,yes,no,no,no,yes,yes,
J,"Li, BQ; Ma, YL",Observation on Multiple Wrinkles for a Graphene Thermophoretic Motion System with a Variable Heat Transmission,"This study analyzes a thermophoretic motion system with a variable heat transmission which models the nonlinear wrinkle motions in substrate-supported graphene sheets. Through symbolic computation, the analytic N-soliton solutions are obtained for the system. The N-soliton solutions can be used to describe the multiple wrinkles in graphene sheets. Furthermore, wrinkle propagation and interaction are discussed. Snake-, V- and Z-like wrinkles are observed graphically by choosing the heat transmission function as three specific functions. A collision between wrinkles is elastic. Before and after the collision, wrinkle energy and propagation direction remain unchanged. But at collision points, the energy carried by the larger wrinkles will be subtracted. The research contributes to a deeper understanding to the structures, characteristics and propagation behavior of the wrinkles in the grapheme sheets, and has potential applications in graphene materials.",10.1166/jnn.2019.16772,25,yes,yes,no,no,yes,yes,yes,no,no,no,yes,yes,no,no,no,no,yes,yes,yes,no,no,no,no,yes,yes,yes,yes,no,yes,no,yes
J,"Li, MT; Li, JG; Zhu, Q; Kim, BN",Effects of tungsten source and tartrate additive on the microstructure and photoluminescence of hydrothermally crystallized ZnWO<sub>4</sub>,"Tungstate source and tartrate (Tar(2-)) additive were examined for their influences on the hydrothermal formation and characteristics of ZnWO4 nanocrystals. It was clearly shown that quasi-equiaxed nanocrystallites of similar to 50-100 nm in diameter and nanorods of similar to 40-50 nm in diameter and up to similar to 700 nm in length can be generated with (NH4)(10)W12O41 center dot 5H(2)O and K2WO4 center dot 2H(2)O as tungsten sources, respectively. Introducing Tar(2-) into the K2WO4 center dot 2H(2)O reaction system effectively transformed the primary crystallites of ZnWO4 from nanorods into quasi-equiaxed nanocrystals (similar to 20-50 nm) and then nanoplates (thickness of similar to 20 nm, lateral size of similar to 200 nm) and, meanwhile, aggregated the crystallites into spheroidal clusters (similar to 2-3 mu m in diameter) with the increasing Tar(2-)/Zn2+ molar ratio up to similar to 2. Optical spectroscopy revealed that the ZnWO4 products exhibit broad-band photoluminescence (similar to 425-700 nm) through T-3(1u) -> (1)A(1g) transition of the [WO6](6-) ligand under short ultraviolet excitation and the nanorods show the best luminescence among all tested samples. Calcination at 500 degrees C may effectively remove the adsorbed Tar(2-) species and greatly improve luminescence of the samples synthesized in the presence of Tar(2-).",10.1007/s42864-019-00030-9,26,,,,,,,,,,,,,,,,,,,,,,,,,,,,,,,
J,"Li, P; Cheng, XP",Unified derivation of reflectivity for all waves,We present a unified method to derive the reflectivity of a plane wave normally incident on an interface. The key idea is to use the flux continuity and the proposed principle of least reflection to acquire the needed generality and conciseness. The result provides a special understanding on the origin of reflection and the half-wave loss.,10.1016/j.rinp.2019.102710,27,yes,yes,no,no,yes,yes,yes,yes,no,no,yes,no,no,no,no,no,yes,yes,yes,no,no,no,no,no,yes,yes,no,no,no,yes,
J,"Li, X; Wang, ZQ; Gao, YT; Shang, ZJ; Ni, MH; Hua, JL; Li, B; Chen, Y",Excited-state relaxation processes of three newly synthesized multi-branched alkyl-triphenylamine end-capped triazines,"The excited-state relaxation processes of three newly synthesized multi-branched alkyl-triphenylamine end-capped triazines ATT-(1-3) are characterized in different solvents by steady-state and time-resolved spectroscopy. In toluene, a weakly polar solvent, the emission originates from the intramolecular charge transfer (ICT) state; in tetrahydrofuran (THF), a strongly polar solvent, the existence of a nonradiative channel from ICT to twisted intramolecular charge transfer (TICT) accelerates the relaxation rate of the ICT state. The rate of the evolution process of ATT-(1-3) increases with increasing number of donor branches, which could ascribed to enhancements in the electron donor and acceptor abilities of the triazines.",10.1016/j.cplett.2019.136800,28,yes,yes,no,no,yes,yes,yes,yes,no,no,yes,no,no,no,no,no,yes,yes,yes,no,yes,no,no,yes,yes,no,no,no,yes,yes,no
J,"Lincoln, D; Pasero, S; Thompson, R",Making Future Researchers: Internship Opportunities for Physics Students,"While the majority of students that pursue a physics education learn mostly in a classroom setting, hands-on experiences can take their appreciation of physics to the next level. Summer internships offer just that, hands-on learning experiences and a taste of what a career in physics is really like. Many research-oriented institutions offer summer internship experiences for students at all levels, from high school through graduate school. The experience and connections made during these summer programs can be transformative to a student's career and science identity.",10.1119/1.5135801,29,yes,yes,no,yes,yes,no,yes,yes,no,no,no,no,no,no,no,no,no,no,yes,no,no,no,no,no,yes,yes,no,no,no,yes,no
J,"Lisin, VN; Shegeda, AM; Samartsev, VV; Korableva, SL",Incoherent photon echo in <SUP>7</SUP>Li Y F4:167Er<SUP>3+</SUP>,"The effect of an incoherent photon echo is studied experimentally and theoretically in (LiYFEr3+)-Li-7 crystal ( transition). This is considered as a promising material for Raman optical quantum memory due to the extremely narrow optical transitions. Oscillations of the photon echo intensity versus the external static magnetic field are observed. The theory shows that the oscillation period is very sensitive to one of the parameters of the spin Hamiltonian in the excited state, thereby making the incoherent photon echo convenient for spectroscopic measurements.",10.1088/1555-6611/ab4bd4,30,yes,yes,no,yes,yes,no,no,no,yes,no,yes,yes,no,yes,no,yes,yes,yes,no,yes,no,no,no,no,no,no,no,no,no,yes,no
J,"Liu, KJ",SCATTERING BY IMPENETRABLE SCATTERER IN A STRATIFIED OCEAN WAVEGUIDE,"In this work, the direct and inverse scattering problems of wave impenetrable scatterers in the three-layered ocean waveguide are under investigation. We have established the well-posedness of forward problem and proposed a novel direct sampling method for the inverse problem. The direct recovery approach only applies the matrix-vector operations to approximate the wave impenetrable obstacle from the received partial data. The method is capable of reconstructing the objects of different shapes and locations, computationally quite cheap and easy to carry out. The theoretical analysis and the novel direct recovery algorithm are expected to have wide applications in the direct and inverse scattering problems of submerged acoustics.",10.3934/ipi.2019059,31,yes,yes,no,no,yes,yes,yes,no,yes,no,yes,yes,no,no,no,no,no,no,no,yes,no,no,no,no,yes,yes,no,yes,no,yes,
J,"Liu, K; Gao, Y; Jiang, WA; Xia, ZW",CONFORMAL INVARIANCE AND CONSERVED QUANTITIES OF NONMATERIAL VOLUMES,"This paper investigates conformal invariance and conserved quantities of nonmaterial volumes. An infinitesimal transformation group and infinitesimal transformations vectors of generators are proposed. The definition of conformal invariance and the determining equation for the systems are presented. The necessary and sufficient conditions of conformal invariance being Noether symmetrical simultaneously by the action of infinitesimal transformations are given. The conformal factor is deduced from the conformal invariance and Noether symmetry. The corresponding Noether conserved quantities are derived with the aid of a structure equation. Three examples are given to illustrate application of the method, the corresponding conserved quantities are obtained under the conformal invariance and Noether symmetry.",,32,yes,yes,no,no,yes,yes,yes,no,yes,no,yes,yes,no,no,no,no,yes,no,yes,yes,no,no,no,no,no,no,no,no,no,yes,no
J,"Liu, XL; Luo, XG; Hong, CY; Bao, Z; Ding, Y; Yao, JX; Dai, SY",Coefficient of performance at maximum cooling power of a simplified quantum dot refrigerator model with resistance,"A simplified analytical model of single-level quantum dot (QD) refrigerator was studied without considering the electron spin and Coulomb interaction. Based on the ballistic transport of electrons between two reservoirs across the QD, the Joule heat of the system was assumed to be generated from the Ohmic contacts between the QD and reservoirs. By using the transition rate equation, the performance of the QD refrigerator was studied with respect to the electron transmission probability and the partition ratio (i.e. the fraction of Joule heat generated in the system that releases into the cold reservoir). The analytical expression of the maximum coefficient of performance (COP) was obtained under the exoreversible working condition. The Carnot-bound-dependent COP at maximum cooling power of the QD system was also demonstrated numerically. The results of this work may provide some guidance for the design of mesoscopic refrigerators.",10.1088/1402-4896/ab3427,33,yes,yes,no,no,yes,no,yes,no,yes,yes,yes,yes,no,no,no,yes,yes,yes,no,yes,yes,yes,no,no,yes,yes,no,yes,,,
J,"Liu, ZY; Zhang, WP; Cui, F; Gu, LT",Micro-manufacturing technology of a three-dimensional curved surface diamond structure for gyroscope applications,"A novel three-dimensional (3D) micro-manufacturing technology of a curved surface diamond structure used for a micro birdbath resonator gyroscope (mu-BRG) with integrated curved electrodes is presented. The integrated curved electrodes with the same curvature as the birdbath shell are embedded using a self-aligned process, which avoids the extra assembly process, ensures the symmetry and improves the driving capacity of the mu-BRG. The capacitive gap is defined by the sacrificial layer, and a uniform and small gap distance (2 mu m) between the curved electrodes and the birdbath shell is obtained. The mu-BRGs with a diameter of 1.2 mm and a thickness of 2 mu m have been demonstrated by employing boron-doped microcrystalline diamond films deposited using hot filament chemical vapor deposition (HFCVD). In this paper, the device structure and basic working principle of the gyroscope are described. The key steps in the fabrication process, such as isotropic wet etching of the bulk silicon for a birdbath mold, photoresist spray-coating for patterning the curved electrodes, and deposition and etching of diamond films, are considered in detail and well solved. The radial deviation of the etched birdbath mold is about 0.31% for the similar to 560 mu m radius shell and the surface roughness of the birdbath mold is favorable (Rq = 4.933 nm, Ra = 3.945 nm). The key techniques described in this paper can be applied to the fabrication of other 3D micro devices.",10.1088/1361-6439/ab44fe,34,yes,no,no,no,yes,yes,yes,yes,no,no,yes,no,no,yes,no,yes,yes,yes,yes,no,no,no,yes,yes,yes,yes,yes,no,yes,yes,yes
J,"Lopes, AML; Teixeira, RC; Moreira, RP; Petrilli, HM; Assali, LVC; Araújo, JP",Monitoring LaMnO<sub>3</sub> Jahn-Teller distortion via electric-field gradient <i>ab initio</i> calculations,"The electric field gradient (EFG) is studied via ab initio density functional theory calculations for the prototype LaMnO3 manganite under ferromagnetic and A-type antiferromagnetic configurations with different values of on-site Hubbard U potential correction on the Mn-3d states. It is shown that the relaxation of internal atomic positions inhibits fully activated MnO6 Jahn-Teller distortions, as determined by calculating the EFG tensor and the Jahn-Teller distortion parameter.. In fact, a strong correlation between the EFG values, especially at the La site, and the Jahn-Teller distortion was found and used to confirm the importance of an appropriate description of the electron-electron correlations when predicting the ground state properties of LaMnO3 using a GGA + U approximation for the exchange-correlation functional.",10.1088/2516-1075/ab4ed6,35,yes,yes,no,no,yes,no,yes,no,yes,no,yes,yes,no,no,no,yes,yes,yes,no,yes,yes,yes,no,yes,yes,yes,no,no,yes,yes,no
J,"Luo, L; Yang, Q; Gong, JL; Wang, YF",Corona Discharge Detection System Based on Ultraviolet Sensor and Optical Lens,"Ultraviolet radiation produced by corona discharge can be used for discharge diagnosis, but the ultraviolet imager is expensive and the ultraviolet signal is susceptible to external interference during the day, so it can not accurately identify the occurrence of corona discharge. In this paper, an optical lens is designed to collect ultraviolet signal. In this paper, a corona detection method based on ultraviolet sensor and optical lens was proposed. The design of optical lens to concentrate the ultraviolet signal so as to suppress external interference was presented. By carrying out insulator corona discharge experiments, the feasibility of the proposed method was studied. Finally, a comparison and verification was made with the combination of corona discharge images collected by UV imager. Research results by this paper indicate that, when the detection distance is smaller than 5 m, and the power supply is about 700 V, the proposed corona detection method can effectively collect the ultraviolet rays generated by corona discharge, thus realizing the feasible recognition of corona discharge. Moreover, this method can feasibly reflect the changing of UV intensity with applied voltage and detection distance. The research results can provide important reference for the development and calibration of ultraviolet detection equipment.",10.1166/jno.2019.2716,36,yes,yes,no,no,yes,no,yes,no,yes,no,yes,yes,no,yes,yes,no,yes,yes,yes,no,yes,no,yes,yes,yes,yes,yes,no,yes,no,no
J,"Lyu, SL; Long, BW",Triangle diagram in heavy-baryon chiral perturbation theory,"The pion-baryon triangle diagram is inspected for a special kinematic region where the squared momentum transfer t is close to 4m2:t4m2m4/mN2<i. Instead of arguing on the ground of anomalous threshold, we investigate possible impacts on power counting. The pion can have very small energies, as opposed to m<i in the physical region, which allows all three propagators to be extremely near their mass shell and contributes significantly to the loop integral. We find that in this narrow kinematic window the static-limit approximation for the baryon propagator is invalid and the resummation of the kinetic energy is necessary. Interestingly, in contrast to low-energy two-baryon processes, this resummation of baryon recoils does not lead to overall enhancement of power counting of the diagram.",10.1088/1361-6471/ab4ed3,37,yes,yes,no,yes,yes,no,no,yes,no,no,yes,yes,no,no,no,no,yes,yes,yes,no,no,no,no,no,no,no,no,no,no,yes,yes
J,"Maekawa, Y; Miura, H; Prange, C",On Stability of Blow-Up Solutions of the Burgers Vortex Type for the Navier-Stokes Equations with a Linear Strain,"We study the three-dimensional Navier-Stokes equations in the presence of the axisymmetric linear strain, where the strain rate depends on time in a specific manner. It is known that the system admits solutions which blow up in finite time and whose profiles are in a backward self-similar form of the familiar Burgers vortices. In this paper it is shown that the existing stability theory of the Burgers vortex leads to the stability of these blow-up solutions as well. The secondary blow-up is also observed when the strain rate is relatively weak.",10.1007/s00021-019-0450-5,38,yes,yes,no,yes,yes,no,yes,yes,no,no,yes,yes,no,no,no,no,yes,yes,yes,no,no,no,no,no,yes,yes,no,no,no,yes,
J,"Marton, M; Ritomsky, M; Rehacek, V; Michniak, P; Behul, M; Novak, P; Vanco, L; Vojs, M",Comparison of Al and Cu masks used for patterning boron-doped diamonds in oxygen plasma,"In this paper we investigate the influence of different metallic (or metal-based) masking materials and plasma techniques for etching and patterning polycrystalline boron-doped diamond thin films. Lift-off technique was used to prepare various testing mask patterns with dimensions ranging from 1 ?m to 15 ?m. The results of plasma etching utilizing 100?nm Al and Cu masks are compared. Radio frequency and inductively coupled pure oxygen plasma techniques were used to obtain the fine etched structures. A simple etching scheme describing the obtained results is presented for each type of plasma technique and mask type. Although the Al mask is widely believed to have outstanding properties over other metallic materials, we found that the Cu mask exhibits lower side edge etching for both types of plasma techniques. A formation of thick and crystalline copper oxide layer in contrast with thin amorphous aluminum oxide is believed to be the reason for this behavior. Consequently, the etched structures also possessed much better side wall angles which is a key parameter for micro-fabrication of boron doped diamond microelectrodes, microfluidics, sensors and microelectromechanical devices in general.",10.1088/1361-6439/ab4d6f,39,,,,,,,,,,,,,,,,,,,,,,,,,,,,,,,
J,"Mei, Y; Zheng, WC; Liu, HG",Insight into the thermal shifts of ten fluorescence peaks Y<sub>1</sub>-Y<sub>10</sub> for Sm<SUP>3+</SUP> ions in Y<sub>3</sub>Al<sub>5</sub>O<sub>12</sub> crystal,"The observed linear thermal shifts of ten fluorescence peaks Y-1-Y-10 from room temperature to about 1000 K for Y3Al5O12:Sm3+ (grown by the Czochralski method) were investigated by considering both the static effect owing to lattice thermal expansion and the dynamic effect stemming from electron-phonon interaction. The static effects were acquired by, using the pressure dependences of these fluorescence peak positions. The static effects for the ten fluorescence peaks resulted in thermal blue shift, but the dynamic effects for all peaks except Y-7 led to thermal red shift. The observed nature of thermal shift (i.e. red or blue) of a fluorescence peak was due to competition between the static and dynamic effects. Based on an approximate treatment, the static parameter A (characterizing the static effect) and electron-phonon coupling parameter alpha' (characterizing the dynamic effect) for these fluorescence peaks were estimated in the case where therrhal shift curves from low temperature to near or higher than room temperature were not measured. Parameters A for all fluorescence peaks and alpha' for all peaks except Y-7 were comparable in sign and magnitude with those of the sharp luminescence peaks of other rare earth ions in crystals and so were deemed to be reasonable. The causes of the exception for alpha' of Y-7 spectral peak (including the very large observed thermal blue shift of this peak) remain unclear.",10.1016/j.jpcs.2019.109101,40,yes,no,no,yes,yes,no,yes,no,yes,no,yes,yes,yes,no,no,no,yes,yes,no,yes,yes,yes,no,yes,yes,yes,no,no,yes,yes,no
J,"Mu, J; Wang, X; Zuo, YL; Zhou, KN; Hu, BL; Zeng, XM; Wang, XD; Jiang, DB; Xie, N; Huang, XJ; Su, JQ",Dispersion Retrieval for Spatial-Spectral Interference of Ultra-Short Pulses,"Spatial-spectral interference is an effective way to characterize an unknown ultra-short pulse. The key of characterizing an unknown ultra-short pulse is to retrieve the dispersion. Considering that the spatial-spectral interference fringe is the equiphase line of different spectra in the space domain and that the phase difference between adjacent interferences is equal to 2p, we propose a novel method of dispersion retrieval for spatial-spectral interference. The analytic expression is deduced and demonstrated by simulated experiments. This method has the advantages of intuitive principle, less calculation and simple process with no Fourier transform, which are beneficial for practical applications.",10.1109/JPHOT.2019.2947363,41,yes,yes,no,yes,yes,no,yes,yes,no,no,yes,no,no,no,no,no,yes,yes,yes,no,no,no,no,yes,yes,no,yes,no,no,yes,yes
