Publication Type,Authors,Title,Abstract,DOI,ID,rule1,rule2,rule3,rule4,rule5,rule6,rule7,rule8,rule9,rule10,rule11,rule12,rule13,rule14,rule15,rule16,rule17,rule18,rule19,rule20,rule21,rule22,rule23,rule24,rule25,rule26,rule27,rule28,rule29,rule30,rule31
J,"Guo, J; Dai, XZ; Wang, C",Room-temperature anisotropic magnetoresistance of magnetic carbon films with vertically-grown graphene nanocrystallites,"In this study, graphene nanocrystallited carbon films were deposited with electron irradiation induced deposition in electron cyclotron resonance plasma. The orientation of nanocrstallites was revealed with transmission electron microscope (TEM) images. The TEM results showed that the graphene nanocrystallites aligned perpendicular to substrate surface. The anisotropic-magneto-resistive performances of the films were investigated under diowed that from 400 to 2 K, the film resistance varied periodically as the film rotated along its surface axial, exhibiting a sinusoidal feature. In room temperature, the average angular resolution of the film was better than 0.5%/degree, and the largest relative changing rate of the film MR ratio reached over 400% as magnetic field increased from 3 to 9 T. The mechanism of this performance was investigated through electrical transport measurement and magnetic hysteresis loops, which revealed the spin-enhanced magnetism of the nanocrystallites were the main origin of this anisotropic magnetic response behaviors.",10.1016/j.tsf.2019.137527,22,no,no,no,no,no,no,no,no,yes,no,yes,yes,no,yes,no,yes,yes,yes,no,yes,yes,yes,yes,yes,yes,no,no,no,no,yes,no
J,"Umenne, P",Micron-Sized Constrictions Fabricated Using the Femtosecond Laser Technique on YBCO Thin Films,"In this paper, I report on the fabrication of micron-sized constrictions in YBCO thin films using the femtosecond laser technique. The constrictions are S-shaped superconducting weak links fabricated on YBCO thin films. The constrictions show a measurable superconducting current flowing through them. Current-voltage (I-V) characteristics were used to determine the critical current I-C of the constrictions at 77 K. The width of the constrictions was determined at the narrowest point using SEM (scanning electron microscope). Three micron-sized constrictions were fabricated with a width of 2.88 mu m, 1.72 mu m, and 1.69 mu m and a length of 5 mu m. Based on the width and length of these constrictions in relation to the coherence length (xi) of the YBCO, these constrictions should conduct supercurrent by Abrikosov vortices. The SEM images show that the femtosecond laser heats the samples beyond the geometric boundary, damaging some of the superconductive phases of the YBCO constrictions. As a result, the constrictions conduct current by one-dimensional depairing.",10.1007/s10948-019-05348-6,23,yes,yes,no,no,yes,no,yes,no,yes,no,yes,yes,yes,yes,yes,yes,yes,yes,yes,no,yes,no,yes,yes,yes,yes,no,no,yes,yes,
J,"Shao, WY; Zhou, BB",3-D experimental UWB microwave imaging in dispersive media,"Three-dimensional (3D) microwave imaging in very dispersive media using a phase shift and sum (PSAS) algorithm is presented. The phase shift and amplitude attenuation within the dispersive media are compensated individually for each frequency component and then integrated to calculate the pixel values in the region of interest (ROI). Therefore, the multi-speed and multipath issue when an ultra-wide band (UWB) signal propagates in the dispersive media is overcome. The current approach is validated by lab-collected data using our self-developed 3-D UWB microwave measurement system. Image results are compared with prior arts at the end of this paper.",10.1080/09205071.2019.1696713,24,yes,yes,no,no,yes,yes,yes,yes,no,no,yes,no,no,yes,yes,no,yes,no,yes,no,no,no,no,no,yes,yes,no,no,yes,yes,
J,"Yousfi, MA; Ammari, C; Hajlaoui, K; Loukil, H; Tourki, Z",Constitutive modelling of wavy elastic response of metallic glass ribbon,A constitutive model is developed that incorporates the wavy elastic response of an arc-shaped metallic glass (MG) ribbon subjected to applied progressive normal load. This model is based on the evolution of the angle made between the buckled ribbon and the horizontal plane. It predicts the amount of elastic strain preventing the yielding of material when it is used as a flat spring or electromechanical switch for MEMS (Micro-Electro-Mechanical Systems) and NEMS (Nano-Electro-Mechanical Systems). The numerical solution of the constitutive equations resulting from the model is compared to experimental results and shows good agreement. This present result is useful for miniaturised ribbons since the estimation of the elastic strain in these was previously quite difficult.,10.1080/09500839.2019.1696482,25,yes,yes,no,no,yes,no,yes,yes,no,no,yes,no,no,no,no,no,yes,yes,yes,no,no,no,no,yes,yes,no,yes,no,yes,yes,
J,"Zhang, JS; Zhao, Y; Hou, K; Wu, CX; Guan, LH",An Fe-N co-doped tube-in-tube carbon nanostructure used as an efficient catalyst for the electrochemical oxygen reduction reaction,"An Fe-N co-doped tube-in-tube carbon nanostructure is synthesized for an efficient oxygen reduction reaction Thanks to its hollow nature, the mesoporous structure is enriched while defects are not prominent, allowing excellent activity (E-1/2 = 0.851 V) and durability together with methanol tolerance in an electrochemistry test under alkaline conditions. Furthermore, when the material is used as the cathode catalyst of a Zn-air battery, the battery exhibits a peak power density of 181.5 mW cm(-2).",10.1088/1361-6528/ab3ceb,26,yes,yes,no,no,yes,no,no,no,yes,no,yes,yes,no,no,no,yes,yes,yes,yes,no,no,no,no,yes,yes,yes,no,no,yes,yes,no
J,"Calligari, P; Torsello, M; Bortoli, M; Orian, L; Polimeno, A",Modelling of Ca<SUP>2+</SUP>-promoted structural effects in wild type and post-translationally modified Connexin26,"Connexins (Cx) are a class of membrane proteins important for auditory function, intercellular signalling and skin biology. Although the presence of concentration of calcium ions is known to work as a trigger for the Cx functionality, the structural changes induced by calcium binding still need to be well elucidated. In this computational study, we have explored the structural effects promoted by Ca2+ on both the wild type (Cx26WT) and on two post-translationally modified Connexin 26 (Cx26): Cx26E42-47 gamma, which contains two glutamates (E42 and E47) that are gamma-carboxylated and Cx26R75m, where a key arginine (R75) is N-monomethylated. These modified amino acids, whose forcefield parameters have been developed in this work, alter Cx26 structure around the Ca(2+)coordination site. Structural changes were assessed from the analysis of molecular dynamics (MD) simulations. We observed a strict relation between the chemical properties of the post-translational modifications and significantly different responses of Cx26 to Ca2+-binding, while charge-adding modifications have destabilising effects upon calcium coordination, the uncharged ones share the same structural properties of the wild-type counterpart. Overall, these findings suggest the critical role of the electrostatic network flanking the Ca2+ coordination site in maintaining the native tertiary and quaternary structures.",10.1080/08927022.2019.1690653,27,yes,no,yes,no,yes,no,yes,no,yes,no,yes,yes,no,no,no,no,yes,yes,no,yes,yes,yes,no,yes,yes,yes,no,no,yes,yes,yes
J,"Joshi, A; Ramachandran, CN",Switching the charge transfer characteristics of quaterthiophene from p-type to n-type <i>via</i> interactions with carbon nanotubes,"Carbon nanotube-based semiconductors are of great interest for optoelectronic applications at the nanoscale. The present study investigates the structural, optoelectronic and charge transport properties of non-covalent complexes formed between carbon nanotubes (CNTs) and quaterthiophene (4T) by employing dispersion-corrected density functional methods. The effect of different functionals viz., B97-D, B3LYP-GD3 and omega B97X-D on the properties of endo- and exohedral complexes is examined. The endohedral complex (4T@CNT) is found to be energetically more stable than the exohedral one (4T-CNT). Electronic properties such as the ionization energy, electron affinity and energy gap between the frontier molecular orbitals of the CNT are not significantly changed by the adsorption or the encapsulation of 4T. Contrary to the p-type characteristics of 4T, its complexes formed with CNTs exhibit n-type characteristics due to the higher electron mobility than the hole mobility. Among the endo- and exohedral complexes, the former one shows the highest electron mobility of 3.79 cm(2) V-1 s(-1). The absorption properties of all the systems were studied by time-dependent density functional theory (TD-DFT). It is found that the complexes undergo several charge transfer transitions in the visible region of the electromagnetic spectrum. The above results unequivocally suggest that the charge-transfer characteristics of 4T can be altered on forming complexes with CNTs.",10.1039/c9cp03030a,28,yes,no,no,no,yes,no,yes,yes,no,no,yes,yes,no,no,no,yes,yes,yes,yes,no,yes,yes,yes,yes,yes,yes,yes,no,yes,yes,no
J,"Kimmel, AV",Interfacial phenomena in nanocapacitors with multifunctional oxides,"The analysis of the structure, chemical stability, electronic and ferroelectric properties of the interfaces between Pt(001) and PbZrTiO3(001) have been performed with ab initio methods. We show that the chemical environment plays a critical role in determining the interfacial reconstruction and charge redistribution at the metal/oxide interfaces. We demonstrate that the difference in interfacial bonds formed at the Pt/PZT interfaces with (TiZr)O-2- and PbO-termination of PZT essentially defines the effectiveness of the screening, and ease of polarisation switching in PZT-based capacitors.",10.1039/c9cp04396a,29,yes,yes,no,no,yes,no,yes,no,yes,no,yes,yes,no,no,no,no,no,no,no,yes,no,no,no,no,no,no,no,no,yes,yes,yes
J,"Ohya, S; Roy, P",Potential algebra approach to quantum mechanics with generalized uncertainty principle,"In this note, we study the potential algebra for several models arising out of quantum mechanics with generalized uncertainty principle. We first show that the eigenvalue equation corresponding to the momentum-space Hamiltonian H = -(1 + beta p(2))d/dp(1 + beta p(2))d/dp+g(g - 1)beta(2)p(2) - g beta, which is associated with some one-dimensional models with minimal length uncertainty, can be solved by the unitary representations of the Lie algebra su(2) if g is an element of {1/2, 1, 3/2, 2, ...}. We then apply this result to spectral problems for the non-relativistic harmonic oscillator as well as the relativistic Dirac oscillator in the presence of a minimal length and show that these problems can be solved solely in terms of su(2). (C) 2019 The Authors. Published by Elsevier B.V. This is an open access article under the CC BY license (http://creativecommons.org/licenses/by/4.0/).",10.1016/j.physleta.2019.125953,30,yes,yes,no,no,yes,no,no,no,yes,no,yes,yes,no,no,no,no,no,no,no,yes,no,no,no,no,no,no,no,no,no,yes,yes
J,"Paul, J; Mondal, C; Biswas, A",Suppression of buried oxide induced variability on digital performance of GeOI pMOSFETs using substrate bias scheme,"Random variation in buried oxide thickness strongly affects the digital performance of ultra-thin body germanium-on-insulator MOSFETs. Dependencies of threshold voltage, ON-current, OFF-current and subthreshold slope of ultra-thin body germanium-on-insulator MOSFETs on three different BOX dielectrics are examined by employing well-calibrated Synopsys TCAD. The variation of threshold voltage and ON-current becomes less sensitive with high-k BOX dielectrics whereas smaller variation of OFF-current is observed for the device with low-k BOX dielectrics. The subthreshold slope remains almost unaltered for all BOX dielectrics. Furthermore, a positive substrate bias is found to suppress variability of digital performance parameters of GeOI p-MOSFETs.",10.1007/s00542-019-04701-y,31,yes,yes,no,no,yes,no,yes,yes,no,no,yes,no,no,yes,no,yes,yes,yes,yes,no,yes,no,no,yes,yes,no,no,no,yes,yes,no
J,"Azarov, A; Kuznetsov, A","Energetics, migration and trapping of Zn interstitials in ZnO","Zn interstitial (Zn-i) is one of the fundamental intrinsic defects in ZnO and prominently affects the physical properties of the material. Here, the energetics and migration properties of Zn-i have been studied in ion implanted ZnO using a new approach based on the Li marker diffusion. Specifically, ZnO single crystals were implanted with 3.2 keV/amu B and BF2 ions and the release of Zn-i from the implanted regions during annealing was correlated with the advance of the characteristic Li depleted region into the bulk of the samples. Using this methodology, we calculate the activation energy of 1.45 eV to govern the process for B implants. Assuming that the migration energy of Zn-i to be of similar to 0.6 eV, as discussed previously in literature, a barrier for releasing Zn-i from the implanted region may be estimated as similar to 0.8-0.9 eV. Meanwhile, in the BF2 implanted samples, the migration of Zn-i is less efficient, as interpreted from the Li redistribution features in these samples; in particular, it is argued that Zn-i may be trapped by defect complexes related to the presence of F.",10.1088/1361-6463/ab3eab,32,yes,yes,no,no,yes,no,yes,no,yes,no,yes,yes,no,yes,no,no,yes,yes,no,yes,no,no,yes,yes,yes,no,no,no,yes,yes,
J,"Bartha, A; Mísek, M; Zácek, M; Sechovsky, V; Prokleska, J",Basal plane anisotropy in Ce<sub>2</sub>RhIn<sub>8</sub>,"We report on the measurements of the magnetization and heat capacity of the tetragonal heavy-fermion compound Ce2RhIn8, dependent on the direction of the magnetic field applied perpendicular to the c axis. A notable anisotropic magnetization component having a fourfold symmetry has been observed in the antiferromagnetic state in low fields. The angular dependence of the heat capacity does not indicate any additional phase which implies that the observed magnetization anisotropy is an intrinsic property of Ce2RhIn8. A clear angular dependence of magnetic phase boundaries on the applied magnetic field has been also revealed. A possible interpretation of these results is discussed in the context of previously reported studies of magnetic structures in Ce2RhIn8.",10.1103/PhysRevB.100.184425,33,yes,yes,no,yes,yes,no,yes,yes,no,no,yes,yes,no,no,no,no,yes,yes,yes,no,no,no,no,yes,yes,yes,no,no,yes,yes,
J,"Bhardwaj, A; Manousakis, E",Linked cluster expansion of the many-body path integral,"We develop an approach of calculating the many-body path integral based on the linked cluster expansion method. First, we derive a linked cluster expansion and we give the diagrammatic rules for calculating the free energy and the pair distribution function g(r) as a systematic power-series expansion in the particle density. We also present a structured Pade approximation scheme in the momentum space to determine g(r). The calculated g(r) for distinguishable particles interacting with Lennard-Jones and hard-sphere potential in various attempted schemes of approximation of the diagrammatic series compares very well with the results of path-integral Monte Carlo simulation. Our method is applicable to a wide range of problems of current general interest and may be extended to the case of identical particles and, in particular, to the case of the many-fermion problem.",10.1103/PhysRevB.100.174203,34,yes,yes,no,no,yes,yes,yes,yes,no,no,yes,yes,no,no,no,no,yes,yes,no,yes,no,no,no,yes,yes,yes,yes,no,yes,yes,yes
J,"Isawa, S; Akashi, Y; Morita, R; Kaneko, R; Okada, H; Matsumoto, A; Akahane, K; Matsushima, Y; Ishikawa, H; Utaka, K",Regional Bandgap Tailoring of 1550 nm-Band InAs Quantum Dot Intermixing by Controlling Ion Implantation Depth,"The regional control of the bandgap energies using the highly stacked quantum dot (QD) on InP(311)B substrate changing ion implantation depths in the process of the quantum dot intermixing (QDI) technique is investigated. The QDI process involves B+ implantation and rapid thermal annealing (RTA) around 600 degrees C, in which the ion implantation depths are controlled regionally with a combination of SiO2 and polymer (AZ) films. Controlled blue shifts of the photoluminescence (PL) spectra verify the effectiveness of the regionally controlled QDI process for application to semiconductor photonic integrated circuits using 1550 nm-band QD such as integrated wavelength division multiplexing (WDM) light sources.",10.1002/pssa.201900521,35,yes,yes,no,no,yes,yes,yes,yes,no,no,yes,yes,no,no,no,yes,yes,yes,yes,no,no,no,no,yes,yes,yes,yes,no,yes,yes,no
J,"Khlebnikov, S; Sheoran, A",The first heat: production of entanglement entropy in the early universe,"Entanglement entropy (EE) of a spatial region quantifies correlations between the region and its surroundings. For a free scalar in the adiabatic vacuum in de Sitter space the EE is known to remain low, scaling as the surface area of the region. Here, we study the evolution of entanglement after the universe transitions from de Sitter to flat space. We concentrate on the case of a massless minimally coupled scalar. We find numerically that, after the de Sitter stage ends, the EE and the enyi entropy rapidly grow and saturate at values obeying the volume law. The final state of the subsystem (region) is a partially thermalized state reminiscent of a generalized Gibbs ensemble. We comment on application of our results to the question of when and how cosmological perturbations decohere.",10.1007/JHEP11(2019)157,36,yes,no,yes,no,yes,no,yes,yes,no,no,yes,yes,no,no,no,no,yes,yes,yes,no,yes,no,yes,yes,yes,yes,yes,no,yes,yes,yes
J,"Kitai, AH",Seamless ultrathin rear projection display,"A new architecture for a thin (2-cm depth) rear projection display is described. In order to achieve this small depth, a very high density of rear projectors is used. Three prototype displays using rear projectors on both 5- and 2-cm pitch arrays are described. The displays can achieve an effective screen pixel pitch of as small as 0.5 mm, which makes this technology competitive in terms of resolution with fine pitch LED displays; however, orders of magnitude fewer LEDs are required: Each rear projector requires only one white LED and a color liquid crystal light modulator. In the three prototypes, the projector light modulators utilize 101-cm (40 in.), 80-cm (31.5 in.), and 60-cm (24 in.) diagonal liquid crystal display glass. To minimize cost, no lenses are utilized for the rear projectors. An RGB LED array may augment the projector array, which provides a low resolution component of the image onto which the high resolution component is superimposed by the projector array. Edge gaps between active areas on adjacent LCD glass units are completely eliminated by the rear projection approach enabling low profile wall-size seamless displays. Display contrast depends on rear projection screen design.",10.1002/jsid.864,37,yes,yes,no,no,yes,yes,yes,yes,no,no,yes,no,no,yes,no,yes,yes,yes,yes,no,no,no,no,yes,yes,yes,yes,yes,no,no,yes
J,"Kogan, VG",Elastic fields in superconductors caused by moving vortices,"Strains in superconductors due to moving vortices and vortex lattices are discussed. It is shown that the energy stored in elastic strains increases with vortex velocity. For moving vortex lattices, the elastic energy depends on velocity orientation relative to the lattice having minimum for the velocity directed along one of the unit cell vectors of the moving lattice. It is shown that for supersonic motion, the vortex-induced stress field has a shape similar to supersonic shock waves.",10.1103/PhysRevB.100.174520,38,yes,yes,no,no,no,no,no,no,no,no,yes,yes,no,no,no,no,yes,yes,yes,no,no,no,no,yes,yes,no,no,no,no,yes,yes
J,"Lemou, M; Luz, AM; Méhats, F",Nonlinear Instability of Inhomogeneous Steady States Solutions to the HMF Model,"In this work we prove the nonlinear instability of inhomogeneous steady states solutions to the Hamiltonian mean field (HMF) model. We first study the linear instability of this model under a simple criterion by adapting the techniques developed in Lin (Math Res Lett 8:521-534, 2001). In a second part, we extend to the inhomogeneous case some techniques developed in Grenier (Commun Pure Appl Math 53(9):1067-1091, 2000), Han-Kwan and Hauray (Commun Math Phys 334(2):1101-1152), Han-Kwan and Nguyen (J Stat Phys 162(6):1639-1653) and prove a nonlinear instability result under the same criterion.",10.1007/s10955-019-02448-4,39,yes,yes,no,yes,yes,yes,yes,yes,yes,no,yes,yes,no,no,no,no,no,no,no,yes,no,no,no,no,no,no,no,no,no,yes,yes
J,"Moghaddam, MK; Moslemi, M; Farzaneh, M","Analytical Modeling of ZrO<sub>2</sub>, HfO<sub>2</sub> and SiO<sub>2</sub> Effect over Tunneling Field Effect Transistor","These days, tunneling field effect transistors (TFET) for their ability in decrease of off-current transistors and also for electronic device power consumption, it is best point out for a scientist to research on this kind of transistors. By reducing off-current, on-current decreases too in compare to MOSFET transistors. Researchers are trying to reduce-off-current so that a minimum decrease in on-current occurs. One of the methods is to select a suitable oxide for the gate electrode. This paper presents an analytical model for the potential distribution of ZrO2, HfO2 and SiO2 effect over TFET. Using the potential distribution, the tunneling drain current is derived analytically by integrating the band-to-band tunneling generation rate over the device volume. The all-clear proposed that analytical models are validated via numerical results obtained from device simulations in SILVACO ATLAS software based on a non-local band-to-band tunneling model. Then results were ompared together. The results show the optimized on-current against off-current ratio and subthreshold swing.",10.1007/s11664-019-07789-0,40,yes,yes,no,yes,yes,no,yes,yes,no,no,yes,yes,no,yes,no,yes,yes,yes,yes,no,yes,no,yes,no,no,no,no,no,yes,no,no
J,"Poluektov, YM; Soroka, AA",Waves in a Bose-Einstein Condensate of Atoms with a Dipole Moment,"Based on the modified Gross-Pitaevskii equation for atoms with intrinsic dipole moments, which accounts for the relaxation of a condensate, the dipole-dipole interaction and the interaction of atoms with the electromagnetic field, the propagation of the sound and electromagnetic waves in a Bose-Einstein condensate is studied. Owing to hybridization of the electromagnetic and sound waves near the resonance frequency of an atom, there arise the two branches of excitations in which the electromagnetic oscillations transform into the sound oscillations and vice versa. It is shown that under hybridization the crucial role is played by the dipole-dipole interaction, which leads to a substantial increase in the repulsion between the branches of the spectrum. The influence of the dissipative effects connected with the relaxation of the macroscopic wave function of the condensate and the imaginary part of the polarizability of an atom on the form of the dispersion curves is investigated.",10.1007/s10909-019-02272-w,41,yes,yes,no,no,yes,no,yes,yes,no,no,yes,no,no,no,no,no,yes,yes,yes,no,no,no,no,yes,yes,no,no,no,no,no,no
J,"Ugurlu, M; Akkus, T; Demir, L",The coherent to Compton scattering differential cross section ratios of some fifth period elements in the external magnetic field,"Some fifth-period elements Y, Zr, Nb, Mo, Ru, Rh, Pd, Ag and Cd have been obtained in powder form and converted into pellets by applying pressure (similar to 1 GPa). They have annealed at 1000 degrees C (except Cd similar to 300 degrees C). In the external magnetic fields (0.4 and 0.8 T) and without magnetic field, the coherent to Compton differential cross-sectional ratios has been investigated by using energy-dispersive X-ray fluorescence system. The data were analyzed via Origin 9.0 computer program. The results were calculated experimentally and theoretically. The theoretical results were obtained with two different methods, and these results were compared with the experimental results. These methods are relativistic form factor theory and non-relativistic form factor theory at without magnetic field. It was seen that the coherent to Compton differential cross-sectional ratios of the elements used in the present study increases with the increasing of the magnetic field and atomic number.",10.1007/s12648-019-01630-4,42,yes,yes,no,no,yes,no,no,no,yes,no,yes,yes,yes,yes,yes,yes,yes,yes,no,yes,yes,yes,yes,no,no,yes,no,no,no,no,no
