Publication Type,Authors,Title,Abstract,DOI,ID,rule1,rule2,rule3,rule4,rule5,rule6,rule7,rule8,rule9,rule10,rule11,rule12,rule13,rule14,rule15,rule16,rule17,rule18,rule19,rule20,rule21,rule22,rule23,rule24,rule25,rule26,rule27,rule28,rule29,rule30,rule31
J,"Muhammad-Najib, K; Nur-Farisha, N; Nurhafizatul-Aqma, Z; Ilhamsyah, ABP; Abd-Shukor, R","Effect of alkali metal carbonate A<sub>2</sub>CO<sub>3</sub> (A = Li, Na, K) on AC susceptibility and superconducting properties of YBa<sub>2</sub>Cu<sub>3</sub>O<sub>7-δ</sub>","The effect of alkali metal carbonate (A(2)CO(3))(x) addition on YBa2Cu3O7-delta with A = K, Na and Li for x = 0, 0.3, 0.5 and 1.0 wt% has been investigated. XRD patterns showed a single YBa2Cu3O7-delta phase for all samples. The resistance versus temperature measurements showed that all samples exhibited metallic normal state behavior. The addition of Li2O3 suppressed the superconductivity of YBa2Cu3O7-delta more than Na2CO3 and K2CO3. The AC susceptibility measurements showed a decrease in T-c chi ' for Li2CO3 addition. T-c chi ' was not much affected with Na2CO3 and K2CO3 addition which was around 93-94 K for x = 0-1.0 wt%. However, T-c chi ' was very much suppressed in the Li2O3-added samples with T-c chi ' decreasing from 94 K for x = 0 to 83 K for x = 1.0 wt%. The peak temperature T-p of the imaginary part of the susceptibility chi '' shifted to lower temperatures for Li2CO3, Na2CO3 and K2CO3 addition. This indicated the intergranular coupling and flux pinning force were suppressed when alkali metal carbonate was added. This work also showed that alkali metals with smaller ionic radius, Li, suppressed superconductivity of YBa2Cu3O7-delta more than the larger ionic radius, Na and K.",10.1007/s00339-019-3130-7,42,yes,no,no,no,yes,no,yes,no,yes,no,yes,yes,no,no,no,yes,yes,yes,no,yes,yes,yes,yes,yes,yes,yes,no,yes,no,yes,yes
J,"Muller, K",A REPRODUCING KERNEL HILBERT SPACE FRAMEWORK FOR INVERSE SCATTERING PROBLEMS WITHIN THE BORN APPROXIMATION,"In this work we develop a new reproducing kernel Hilbert space (RKHS) framework for inverse scattering problems using the Born approximation. We assume we have backscattered data of a field that is dependent on an unknown scattering potential. Our goal is to reconstruct or image this scattering potential. Assuming the scattering potential lies in a RKHS, we find that the imaging equation can be rewritten as the inner product of the desired unknown function with the adjoint of the forward operator applied to the kernel of the imaging operator. We therefore may choose the kernel of the imaging operator such that the adjoint applied to this kernel is precisely the reproducing kernel of the Hilbert space the reflectivity function lies in. In this way we are able to obtain an alternative definition of an ideal image. We will demonstrate this theory using synthetic aperture radar imaging as an example, though there are other applicable imaging modalities i.e. inverse diffraction and diffraction tomography [1, 6]. We choose SAR as it was the motivating application for this work. We will compare the RKHS ideal imaging technique to the standard microlocal analytic ideal image from backprojection theory. Note this method requires a variation of the standard SAR data model with the assumption of a full two dimensional data collection surface as opposed to a one dimensional flight path, however we are able to perform imaging with a single frequency and avoid the approximations made in the backprojection imaging operator derivation.",10.3934/ipi.2019058,43,yes,yes,no,yes,yes,no,yes,yes,no,no,yes,no,yes,no,no,no,no,no,no,no,no,no,no,no,no,yes,yes,yes,no,yes,yes
J,"Nag, A",On the prediction and analysis of pre-monsoon thunderstorms and their meteorological associations,"This paper investigates the frequency of severe weather phenomena such as thunderstorm, hailstorm, thundersquall and cyclonic disturbances for some selected stations of Gangetic West Bengal for the prediction of all these devastating phenomena with the aid of Doppler weather radar products along with the critical consideration of their meteorological association. Attempts have been made to conclude some common features of the nor'westers in Gangetic West Bengal during pre-monsoon season. From the analysis, it may be stated that Doppler weather radar products of Regional Meteorological Centre Kolkata are the supreme means for the nowcasting of all severe weather phenomena in the range of 250 km around Kolkata, i.e. Gangetic West Bengal and its surroundings.",10.1007/s12648-019-01407-9,44,yes,yes,no,no,yes,no,yes,no,yes,no,yes,yes,yes,yes,no,no,yes,yes,no,yes,no,no,no,yes,yes,yes,no,no,yes,yes,
J,"Nagata, K; Nakamura, T",The Supposition for the Kochen and Specker Theorem Using Sum rule and Product rule,"We investigate a hidden-variable theory introduced by Kochen and Specker. The ""hidden"" results of measurements are either 1 or -1. We suppose the validity of Sum rule and Product rule. Kochen and Specker suppose the two operations Sum rule and Product rule commute with each other. It is shown that the two operations Sum rule and Product rule do not commute with each other when we want to avoid the Kochen and Specker paradox. Otherwise we encounter the Kochen and Specker paradox. We mention the supposition for Green-berger, Horne, and Zeilinger paradox. It is discussed that only Product rule is necessary for the paradox. We give up the two paradoxes if (1) Sum rule and Product rule do not commute with each other and (2) Product rule is not valid.",10.1007/s10773-019-04267-5,45,yes,yes,no,yes,yes,no,yes,yes,no,no,yes,yes,no,no,no,no,yes,yes,yes,no,no,no,no,no,no,yes,yes,yes,yes,yes,yes
J,"Nayek, P; Maji, P; Sahoo, S",Lepton flavor violating decays in Z′ model,"Motivated by the hints of lepton flavor violating (LFV) decays, we study B-d,B-s -> mu tau, B-s,B-d -> tau e, and tau(-) -> e(-) + e(+) + e(-) decays in Z' model. These LFV decays present interesting patterns that may reveal the shape of new physics beyond the standard model. Considering the effect of both Z- and Z'-mediated flavor-changing neutral current we calculate the branching ratios for these decays. We find the branching ratios Br(B-s -> mu tau) similar to O(10(-10)), Br(B-d -> mu tau) similar to O(10(-12)), Br(B-s -> tau e) similar to O(10(-10)), Br(B-d -> tau e) similar to O(10(-12)), and Br(tau(-) -> e(-) + e(+) + e(-)) similar to O(10(-8)).",10.1139/cjp-2018-0864,46,yes,yes,no,yes,yes,no,yes,no,yes,no,yes,yes,no,no,no,yes,yes,yes,no,yes,no,no,no,yes,no,no,no,no,yes,yes,
J,"Nguyen, QH; Miau, JJ; Lai, YH; Josula, R",Pulsating pipe flow instability perturbed by a trip wire,"This study is concerned with the phenomenon of flow instability in the entrance region of a pulsating pipe flow perturbed by a trip wire at the inlet, where the flow was uniform at the core with a thin boundary layer on the wall. First of all, it is illustrated by a case without the installation of a trip wire that small disturbance developed in the accelerating phase of pulsation, which was well explained by the inflection-point instability mechanism Subsequently, one of the cases studied with the installation of a trip wire indicates that the inflection-point instability mechanism still played the key role, but the instability was promoted further upstream. On the other hand, there were cases of which the flow instability development was rather due to the viscous effect mainly which was decaying in a certain downstream region, followed by a renewal growth with irregular fluctuations.",10.1016/j.expthermflusci.2019.109869,47,yes,yes,no,yes,no,no,no,no,yes,no,yes,yes,no,no,no,no,yes,yes,no,yes,no,no,no,no,yes,no,no,no,no,yes,no
J,"Otsuka, K",Dynamic characterization of beating sinusoidal wave oscillations in a thin-slice solid-state laser with coupled orthogonally polarized transverse modes,"Dynamic characterization of self-induced beating sinusoidal wave (BSW) oscillations and related phenomena, which were previously explored in a thin-slice dual-polarization solid-state laser operating in the regime of incomplete mode-locking of orthogonally polarized transverse eigenmodes, namely, a quasi-locked state Otsuka (2018 Laser Phys. Lett. 15 075001), is performed in terms of the amplitude correlation coefficient and intensity circulation among various orthogonally polarized mode pairs. Polarization-dependent symmetry-breaking featuring a nonreciprocal intensity flow for different orthogonally polarized mode pairs operating in the BSW state are found. The singular state is hidden in a nonlinear system where a perfect mode-locked BSW state with a large amplitude correlation coefficient featuring reciprocal intensity flow is established for a transverse mode pair possessing particular polarization directions that are related to the intensity ratio of orthogonally polarized transverse eigenmodes. Self-organized chaos synchronization is shown to take place for such a single pair of transverse modes subjected to self-mixing modulations.",10.1088/1612-202X/ab5573,48,yes,yes,no,yes,yes,no,yes,no,yes,no,yes,yes,no,yes,no,yes,yes,yes,no,yes,no,no,no,yes,yes,yes,no,no,no,yes,yes
J,"Pan, LS; Lou, J; Li, HY; Kang, CW",Mass transition and mass diffusion coefficients in a diffuse interface model,"The purpose of this paper is to determine the mass transition and mass diffusion coefficients in the diffuse interface model. By means of the thermodynamic probabilities of molecules transiting (phase change) and shifting (diffusing), the rate of mass transition and the mass diffusion flux are derived first. By comparing them with the corresponding formulas in the diffuse interface model, the two coefficients are then obtained. The mass transition coefficient is proportional to the rate of molecular unidirectional transition under the mutual equilibrium of liquid and vapor species. The mass diffusion coefficient is proportional to the rate of molecular unidirectional travel through a unit surface under the condition that two local elements at two sides of the surface are in mutual equilibrium. This diffusion coefficient can finally be expressed as the product of the Fick concentration diffusion coefficient and the mixing density besides an energy (or temperature) factor. The Fick coefficient obtained at present is reduced to the self-diffusion coefficient at the gas boundary of the binary mixing layer and becomes the Fick diffusion coefficient of gas in pure liquid at the liquid boundary. The present coefficients (including Fick coefficient) are different from the existing ones in the literature.",10.1088/1402-4896/ab2e81,49,yes,yes,no,yes,yes,yes,yes,yes,no,no,yes,yes,no,no,no,no,no,no,no,no,no,no,no,no,no,yes,yes,yes,no,no,no
J,"Panagiotopoulos, I",Magnetic states and dynamics of bistable square Fe nanoislands,"The low energy magnetic configurations in square 300 nm Fe islands, having their magneto-crystalline easy axes aligned along the diagonals of the squares, are studied by micromagnetic simulations with the help of the mumax3 package. For thicknesses above 2.4 nm vortex configurations become the lowest energy states. However for the thickness range 1.5-2.5 nm ""leaf"", vortex and ""C"" state configurations have comparable energies and can be all stabilized as the energy barriers that separate them are substantial (209 k(B)T to 401 k(B)T) and much larger than their energy differences. Therefore in ordered arrays of such elements different states could be simultaneously present depending on the local interactions and previous history. In view of their use as tunable magnonic metamaterials the high frequency response of each configuration is micromagnetically simulated. The resonance frequencies in single elements as well as for arrays, and the localized spin wave modes that correspond to each resonance, are extracted for each of the low energy micromagnetic states.",10.1016/j.physb.2019.411664,50,yes,yes,no,no,yes,yes,yes,yes,no,no,yes,yes,no,yes,no,yes,yes,yes,yes,no,yes,no,yes,yes,yes,yes,no,no,yes,yes,
J,"Parsaei, S",Electromagnetic Transition Form Factor of the Nucleon Δ (1232) in The Nonrelativistic Constituent Quark Model,"The study of nucleon electromagnetic form factors has long been identified as a singular source of information for conception strong interactions in the extent of quark confinement. We have performed a calculation of the helicity amplitudes and the electromagnetic transition form factors of the electromagnetic excitation in Delta(1232) resonances. In this paper, the electromagnetic interaction for N (938) -> Delta(1232) transitions at four-momenta transfer 0 <= Q2(GeV2) <= 8 in the nonrelativistic constituent quark model calculated. In comparison with present experimental, relativistic and non-relativistic data, our results are in good agreement with the experimental and the other theoretical results, in particular of the medium-high Q(2) behavior.",10.1007/s00601-019-1527-7,51,yes,yes,no,no,yes,no,yes,no,yes,no,yes,yes,no,no,no,no,yes,no,yes,no,no,no,no,yes,yes,no,yes,no,yes,yes,yes
J,"Peng, YF; Yang, JT; Wu, WT; Sun, LG",Simulation and Analysis of Ionospheric Electric Field and Current Based on the Electrodynamic Process,"Research of ionospheric electric current density is generally based on some theoretical formulas and empirical models. The electrodynamic process of charged particles in plasma with a magnetic field can help analyze the formation mechanism of ionospheric electric field and current so that the ionospheric electric field intensity and current density can be simulated and studied. Furthermore, by establishing partial differential equations in magnetic dipole coordinates, electric current density in mid- and low-latitude ionosphere can be calculated by means of a series of more reasonable boundary conditions in this article. Besides, the wind drag and particles diffusion are taken into account to make the results more accurate. The electric field value fitted by the empirical model is used to verify the rationality of current density calculated indirectly. Through this theoretical model, the distribution of electric fields and currents in ionosphere has been carefully studied. In addition, several physical elements influencing the current value and direction are also studied, including external environmental factors, such as solar activity and geomagnetic index, as well as the internal factors, such as electrons and ions temperature. These works will be a great help in the future for the precise determination of ionospheric currents.",10.1109/TPS.2019.2953940,52,yes,yes,no,yes,yes,no,no,no,yes,yes,yes,yes,no,no,no,no,no,no,no,yes,no,no,no,no,no,no,no,no,no,no,no
J,"Pollock, MD","On scale invariance, the Milne universe and induced gravity","We discuss the notion of global scale invariance, as realized in the theory of induced gravity , whereby the Newton gravitational constant GN is generated from the expectation value of a scalar field phi. Assuming the Friedmann space-time ds2=dt2-a2(t)dx2, where the radius function is of the form a=(t/t0)2/3 gamma, and a power-law field phi=phi 0tn and matter energy-density source rho m=rho otm, which imply that m=-2 gamma m/gamma being the matter adiabatic index, conditions are derived for the positivity of epsilon. In the special case of the Milne universe, defined by gamma=2/3, which is also the string equation of state, the line element is invariant under global coordinate transformations t -> t=zeta t. There is then no creation of particle-anti-particle pairs, nor, analogously in the superstring theory, of string-anti-string pairs. These results follow from the correspondence principle, the respective classical wave states propagating without amplification or attenuation. Some aspects of scale and modular invariance of the superstring are also described.",10.1140/epjp/i2019-12930-5,53,yes,yes,no,yes,yes,no,no,yes,no,no,yes,no,no,no,no,no,yes,yes,yes,no,no,no,no,no,yes,yes,no,no,yes,yes,
J,"Rabe, B; Kämpfer, B","Dynamical Freeze-Out Phenomena: The Case of <i>K</i><SUP>±</SUP>, φ Transverse Momentum Spectra in Collisions of Au(1.23 A GeV) + Au","We argue for a continuous (dynamical) kinetic freeze-out of K +/-,phi observed at midrapidity in collisions of Au(1.23 A GeV) + Au. The simulations, by means of a transport model of Boltzmann-uhling-Uhlenbeck (BUU) type, point to time independent transverse momentum slope parameters after 20 fm/c. The complex interplay of expansion dynamics and strangeness production/exchange/absorption as well as elastic scatterings involved in the reaction network does not support the previous interpretation of a late freeze-out of K- due to larger cross sections.",10.3390/particles2040032,54,yes,yes,no,no,yes,yes,yes,yes,no,no,yes,yes,yes,no,no,yes,yes,yes,no,yes,yes,yes,yes,yes,yes,yes,no,no,yes,yes,yes
J,"Rajak, P; Kulkarni, PD; Krishnan, M; Chowdhury, P; Battacharyya, S",Spatially resolved structure and domain wall propagation in defect induced SmCo/Co exchange spring magnet,"SmCo5/Co exchange-coupled films with high saturation magnetization, and hence high energy product were fabricated on MgO substrates by sequential deposition of elemental Sm and Co layers at 450 degrees C followed by subsequent annealing at the same temperature for 1 h. Formation of defects induced multi-layered structures and the composition of individual layers were confirmed through high resolution Scanning Transmission Electron Microscopy (HRSTEM) imaging acquired on high angle annular dark field (HAADF) detector and Energy Dispersive X-ray (EDX) spectroscopy. Micromagnetic simulations and magnetic measurements further confirmed that the observed structure is coupled in rigid phase between soft and hard magnetic layers and the enhancement in coercivity results due to the domain wall pinning at the defects sites. This leads to the magnetic energy density in the film of the order of 22.2 MGOe which is close to the bulk value and have potential applications towards Micro-Electro-Mechanical Systems.",10.1016/j.jmmm.2019.165612,55,yes,yes,no,no,no,no,no,no,yes,no,yes,yes,yes,yes,yes,yes,yes,yes,no,yes,yes,yes,yes,yes,yes,yes,no,yes,yes,no,no
J,"Rebollo-Neira, L; Plastino, A",A dedicated methodology for irreversible compression of Gravitational Waves Sound with high quality reconstruction,"A dedicated method for irreversible compression of Gravitational Waves Sound with high quality recovery is proposed. The performance is tested on the sound signal which has been produced with the first gravitational wave that was detected, and on 36 theoretically generated signals. The approach is based on a model for data reduction rendering high quality approximation of the signals. The reduction of dimensionality is achieved by selecting elementary components from a redundant dictionary. Comparisons with the compression standard MP3 demonstrate the merit of the dedicated technique for compressing this type of sound. (C) 2019 Elsevier B.V. All rights reserved.",10.1016/j.physa.2019.122206,56,yes,yes,no,no,yes,yes,yes,yes,no,no,yes,no,yes,no,no,yes,yes,yes,yes,no,no,no,no,yes,yes,no,yes,no,no,yes,yes
J,"Ren, Y; Song, JJ; Yang, W; Dai, XY; Zhao, TL",Study on Carrier Mobility Model for PD-Ge Monolithic Optoelectronic Integration Chips,"Based on the difference of thermal expansion coefficient between Si and Ge, low-intensity tensile stress can be introduced into Ge epitaxial layer on Si substrate. S-Ge/Si semiconductor (as known as low tensile strained Ge grown on Si substrate) has a higher carrier mobility when compared with unstrained-Ge or Si material, so that s-Ge/Si is appropriate for the production of high-speed circuit. At the same time, transformation from indirect bandgap semiconductor Ge into Pseudo-Direct bandgap semiconductor (which is also called PD-Ge) will be happen after s-Ge/Si is heavy doped, which makes LED produced of PD-Ge material perform a higher luminous efficiency because the radiative recombining probability of carriers in PD-Ge material is greatly improved compared with unstrained one. Taking the advantages referred of s-Ge/Si into account, s-Ge/Si has the potential to PD-Ge monolithic optoelectronic integration. Carrier mobility of the semiconductor is one of the key physical parameters during the design and simulation of PD-Ge monolithic optoelectronic integrated system. While as far as the authors are aware, carrier mobility model of s-Ge/Si is still rarely reported to date. In view of that all above, based on the E-k relation in both conduction band and valence band of s-Ge/Si material, the analytical models of physical parameters in energy band are established, and the models are verified by experiments. Then the s-Ge/Si carrier models are further established based on our band structure model, and the Monte Carlo method is used to verify our s-Ge/Si carrier mobility model. The quantificational results of our paper will help understand s-Ge/Si material physics and provide an important theoretical basis for the design of PD-Ge monolithic optoelectronic integration.",10.1166/jno.2019.2685,57,yes,no,yes,yes,yes,no,yes,no,yes,yes,yes,yes,no,no,no,no,no,no,no,yes,no,yes,no,no,no,no,no,yes,yes,yes,yes
J,"Renner, SM; Schwert, DD",Exploring Friction with the Ancient Egyptians,"We devised an activity to explore friction by testing some of the common theories on how ancient Egyptians moved the stones used to build the pyramids. The activity is suitable for a high school physics course or introductory college courses for both science majors and non-science majors. The students investigate dragging a 1-kg mass (representing a stone) on a small wooden sled under three conditions: over dry sand, using wooden rollers over dry sand, and over wet sand. This last condition has been recently proposed as a potential method used by the Egyptians. The force required to pull the sled at a constant velocity is measured and used to calculate the kinetic coefficient of friction for each of the three test conditions. Students then perform a similar activity pulling their professor across a sand volleyball court. Versions of this experiment have been done in four classes of science majors (general physics, two 2-hour lab periods) and in four classes of non-science majors (physical sciences for educators, one 2-hour lab period).",10.1119/1.5135794,58,yes,no,no,yes,yes,no,yes,no,yes,no,yes,yes,yes,yes,yes,yes,no,no,no,yes,no,no,no,no,no,yes,no,no,no,yes,yes
J,"Roy, K; Ghosh, S; Nath, S; Ghosh, NK","Specific heat, entropy and magnetic properties of high <i>T</i><sub><i>c</i></sub> superconductivity within the planar <i>t</i>-<i>t</i><i>′</i>-<i>J</i>-<i>V</i> model","The finite temperature properties of the high T-c cuprates are investigated by an exact method at optimal doping using t-t '-J-V model. The role of next-nearest-neighbor (NNN) hopping interaction t ' and nearest-neighbor Coulomb repulsion V on the total energy, specific heat, entropy, magnetic properties, etc. in the superconducting, as well as normal phase, are considered. Specific heat curves show a single peak structure in the parameter range suitable for existence of superconducting phase. Two peak structure in the specific heat curve is observed at sufficiently large values of V/t. An asymmetry in specific heat curves and peak positions is observed for the hole- and electron-doped cuprates. Existence of a metallic phase is detected for positive t '/t for V/t <= 4J. Entropy calculation shows the system goes to a more disordered state with negative t '/t and V/t. A non-Fermi liquid behavior is revealed at low temperatures for positive t ' and small values of V . An asymmetry in Neel temperature is observed for the hole- and electron-doped cuprates. An unsaturated ferromagnetic phase emerges with an increase of V/t. Schematic magnetic phase diagrams are shown.",10.1140/epjb/e2019-100303-5,59,yes,yes,no,no,yes,no,yes,no,yes,no,yes,yes,no,no,no,yes,yes,yes,yes,no,no,no,no,yes,yes,yes,no,no,no,yes,no
J,"Rüdiger, G; Schultz, M",Non-diffusive angular momentum transport in rotating <i>z</i>-pinches,"The stability of conducting Taylor-Couette flows under the presence of toroidal magnetic background fields is considered. For strong enough magnetic amplitudes such magnetohydrodynamic flows are unstable against non-axisymmetric perturbations which may also transport angular momentum. In accordance with the often used diffusion approximation, one expects the angular momentum transport to be vanishing for rigid rotation. In the sense of a non-diffusive Lambda effect, however, even for rigidly rotating z-pinches, an axisymmetric angular momentum flux appears which is directed outward (inward) for large (small) magnetic Mach numbers. The internal rotation in a magnetized rotating tank can thus never be uniform. Those particular rotation laws are used to estimate the value of the instability-induced eddy viscosity for which the non-diffusive Lambda effect and the diffusive shear-induced transport compensate each other. The results provide the Shakura & Sunyaev viscosity ansatz leading to numerical values linearly growing with the applied magnetic field.",10.1017/S0022377819000606,60,yes,yes,no,yes,yes,no,yes,yes,no,no,yes,yes,no,no,no,no,yes,yes,yes,no,no,no,yes,yes,yes,no,yes,no,no,yes,no
