Publication Type,Authors,Title,Abstract,DOI
J,"Brow, RK",Review: the structure of simple phosphate glasses,"Recent developments of phosphate glasses for a variety of technological applications, from rare-earth ion hosts for solid state lasers to low temperature sealing glasses, have led to renewed interest in understanding the structures of these unusual materials. In this review, spectroscopic and diffraction studies of simple phosphate glasses, including v-P2O5 and binary phosphate compositions, are described. Special attention is given to the structures of anhydrous ultra-phosphate glasses, which have received close attention from the glass community only in the past six years. (C) 2000 Published by Elsevier Science B.V. All rights reserved.",10.1016/S0022-3093(99)00620-1
J,"Kim, HS; Gibbs, ZM; Tang, YL; Wang, H; Snyder, GJ",Characterization of Lorenz number with Seebeck coefficient measurement,"In analyzing zT improvements due to lattice thermal conductivity (kappa(L)) reduction, electrical conductivity (sigma) and total thermal conductivity (kappa(Total)) are often used to estimate the electronic component of the thermal conductivity (kappa(E)) and in turn kappa(L) from kappa(L) = similar to kappa(Total) - L sigma T. TheWiedemann-Franz law, kappa(E) = L sigma T, where L is Lorenz number, is widely used to estimate kappa(E) from sigma measurements. It is a common practice to treat L as a universal factor with 2.44 x 10(-8) W Omega K-2 (degenerate limit). However, significant deviations from the degenerate limit (approximately 40% or more for Kane bands) are known to occur for non-degenerate semiconductors where L converges to 1.5 x 10(-8) W Omega K-2 for acoustic phonon scattering. The decrease in L is correlated with an increase in thermopower (absolute value of Seebeck coefficient (S)). Thus, a first order correction to the degenerate limit of L can be based on the measured thermopower, vertical bar S vertical bar, independent of temperature or doping. We propose the equation: L = 1.5 + exp [ -vertical bar S vertical bar/116] (where L is in 10(-8) W Omega K-2 and S in mu V/K) as a satisfactory approximation for L. This equation is accurate within 5% for single parabolic band/acoustic phonon scattering assumption and within 20% for PbSe, PbS, PbTe, Si0.8Ge0.2 where more complexity is introduced, such as non-parabolic Kane bands, multiple bands, and/or alternate scattering mechanisms. The use of this equation for L rather than a constant value (when detailed band structure and scattering mechanism is not known) will significantly improve the estimation of lattice thermal conductivity. (C) 2015 Author(s).",10.1063/1.4908244
J,"Stoimenov, PK; Klinger, RL; Marchin, GL; Klabunde, KJ",Metal oxide nanoparticles as bactericidal agents,"Reactive magnesium oxide nanoparticles and halogen (Cl-2, Br-2) adducts of these MgO particles were allowed to contact certain bacteria and spore cells. Bacteriological test data, atomic force microscopy (AFM) images, and electron microscopy (TEM) images are provided, which yield insight into the biocidal action of these nanoscale materials. The tests show that these materials are very effective against Gram-positive and Gram-negative bacteria as well as spores. zeta-Potential measurements show an attractive interaction between the MgO nanoparticles and bacteria and spore cells, which is confirmed by confocal microscopy images. The AFM studies illustrate considerable changes in the cell membranes upon treatment, resulting in the death of the cells. TEM micrographs confirm these results and supply additional information about the processes inside the cells. Overall, the results presented illustrate that dry powder nanoparticulate formulations as well as water slurries are effective. It is proposed that abrasiveness, basic character, electrostatic attraction, and oxidizing power (due to the presence of active halogen) combine to promote these biocidal properties.",10.1021/la0202374
J,"Gref, R; Lück, M; Quellec, P; Marchand, M; Dellacherie, E; Harnisch, S; Blunk, T; Müller, RH",'Stealth' corona-core nanoparticles surface modified by polyethylene glycol (PEG):: influences of the corona (PEG chain length and surface density) and of the core composition on phagocytic uptake and plasma protein adsorption,"Nanoparticles possessing poly(ethylene glycol) (PEG) chains on their surface have been described as blood persistent drug delivery system with potential applications for intravenous drug administration. Considering the importance of protein interactions with injected colloidal dug carriers with regard to their in vivo fate, we analysed plasma protein adsorption onto biodegradable PEG-coated poly(lactic acid) (PLA), poly(lactic-co-glycolic acid) (PLGA) and poly(epsilon-caprolactone) (PCL) nanoparticles employing two-dimensional gel electrophoresis (2-D PAGE). A series of corona/core nanoparticles of sizes 160-270 nm were prepared from diblock PEG-PLA, PEG-PLGA and PEG-PCL and from PEG-PLA:PLA blends. The PEG Mw was varied from 2000-20 000 g/mole and the particles were prepared using different PEG contents. It was thus possible to study the influence of the PEG corona thickness and density, as well as the influence of the nature of the core (PLA, PLGA or PCL), on the competitive plasma protein adsorption, zeta potential and particle uptake by polymorphonuclear (PMN) cells. 2-D PAGE studies showed that plasma protein adsorption on PEG-coated PLA nanospheres strongly depends on the PEG molecular weight (Mw) (i.e. PEG chain length at the particle surface) as well as on the PEG content in the particles (i.e. PEG chain density at the surface of the particles). Whatever the thickness or the density of the corona, the qualitative composition of the plasma protein adsorption patterns was very similar, showing that adsorption was governed by interaction with a PLA surface protected more or less by PEG chains. The main spots on the gels were albumin, fibrinogen, IgG, Ig light chains, and the apolipoproteins apoA-I and apoE. For particles made of PEG-PLA45K with different PEG Mw, a maximal reduction in protein adsorption was found for a PEG Mw of 5000 g/mole. For nanospheres differing in their PEG content from 0.5 to 20 wt %, a PEG content between 2 and 5 wt % was determined as a threshold value for optimal protein resistance. When increasing the PEG content in the nanoparticles above 5 wt % no further reduction in protein adsorption was achieved. Phagocytosis by PMN studied using chemiluminescence and zeta potential data agreed well with these findings: the same PEG surface density threshold was found to ensure simultaneously efficient steric stabilization and to avoid the uptake by PMN cells. Supposing all the PEG chains migrate to the surface, this would correspond to a distance of about 1.5 nm between two terminally attached PEG chains in the covering 'brush'. Particles from PEG5K-PLA45K, PEG5K-PLGA45K; and PEG5K-PCL45K copolymers enabled to study the influence of the core on plasma protein adsorption, all other parameters (corona thickness and density) being kept constant. Adsorption patterns were in good qualitative agreement with each other. Only a few protein species were exclusively present just on one type of nanoparticle. However, the extent of proteins adsorbed differed in a large extent from one particle to another. In vivo studies could help elucidating the role of the type and amount of proteins adsorbed on the fate of the nanoparticles after intraveinous administration, as a function of the nature of their core. These results could be useful in the design of long circulating intravenously injectable biodegradable drug carriers endowed with protein resistant properties and low phagocytic uptake. (C) 2000 Elsevier Science B.V. All rights reserved.",10.1016/S0927-7765(99)00156-3
J,"Green, MA; Dunlop, ED; Levi, DH; Hohl-Ebinger, J; Yoshita, M; Ho-Baillie, AWY",Solar cell efficiency tables (version 54),"Consolidated tables showing an extensive listing of the highest independently confirmed efficiencies for solar cells and modules are presented. Guidelines for inclusion of results into these tables are outlined, and new entries since January 2019 are reviewed.",10.1002/pip.3171
J,"McFarland, AD; Van Duyne, RP",Single silver nanoparticles as real-time optical sensors with zeptomole sensitivity,"This work utilizes dark-field optical microscopy to demonstrate the localized surface plasmon resonance gamma(max) response of individual Ag nanoparticles to the formation of a monolayer of small-molecule adsorbates. The adsorption of fewer than 60 000 1-hexadecanethiol molecules on single Ag nanoparticles results in a localized surface plasmon resonance shift of 40.7 nm. Additionally, the kinetics of the single nanoparticle response was shown to be comparable to that of other real-time sensor technologies.",10.1021/nl034372s
J,"Miller, JS; Stevens, KR; Yang, MT; Baker, BM; Nguyen, DHT; Cohen, DM; Toro, E; Chen, AA; Galie, PA; Yu, X; Chaturvedi, R; Bhatia, SN; Chen, CS",Rapid casting of patterned vascular networks for perfusable engineered three-dimensional tissues,"In the absence of perfusable vascular networks, three-dimensional (3D) engineered tissues densely populated with cells quickly develop a necrotic core(1). Yet the lack of a general approach to rapidly construct such networks remains a major challenge for 3D tissue culture(2-4). Here, we printed rigid 3D filament networks of carbohydrate glass, and used them as a cytocompatible sacrificial template in engineered tissues containing living cells to generate cylindrical networks that could be lined with endothelial cells and perfused with blood under high-pressure pulsatile flow. Because this simple vascular casting approach allows independent control of network geometry, endothelialization and extravascular tissue, it is compatible with a wide variety of cell types, synthetic and natural extracellular matrices, and crosslinking strategies. We also demonstrated that the perfused vascular channels sustained the metabolic function of primary rat hepatocytes in engineered tissue constructs that otherwise exhibited suppressed function in their core.",10.1038/NMAT3357
J,"Lau, KKS; Bico, J; Teo, KBK; Chhowalla, M; Amaratunga, GAJ; Milne, WI; McKinley, GH; Gleason, KK",Superhydrophobic carbon nanotube forests,"The present study demonstrates the creation of a stable, superhydrophobic surface using the nanoscale roughness inherent in a vertically aligned carbon nanotube forest together with a thin, conformal hydrophobic poly(tetrafluoroethylene) (PTFE) coating on the surface of the nanotubes. Superhydrophobicity is achieved down to the microscopic level where essentially spherical, micrometer-sized water droplets can be suspended on top of the nanotube forest.",10.1021/nl034704t
J,"Sun, YM; Seo, JH; Takacs, CJ; Seifter, J; Heeger, AJ",Inverted Polymer Solar Cells Integrated with a Low-Temperature-Annealed Sol-Gel-Derived ZnO Film as an Electron Transport Layer,"Highly efficient and air-stable inverted polymer solar cells are fabricated with a poly(2,7-carbazole) derivative (PCDTBT):fullerene derivative (PC70BM) active layer. Low-temperature-annealed sol-gel-derived zinc oxide (ZnO) and molybdenum oxide films are selected as the electron and hole transporting layers, respectively. Power conversion efficiency (PCE) of 6.3% is demonstrated, which is the highest reported to date for inverted polymer solar cells.",10.1002/adma.201004301
J,"Pei, SF; Zhao, JP; Du, JH; Ren, WC; Cheng, HM",Direct reduction of graphene oxide films into highly conductive and flexible graphene films by hydrohalic acids,"We report a simple but highly-effective hydrohalic acid reducing method to reduce graphene oxide (GO) films into highly conductive graphene films without destroying their integrity and flexibility at low temperature based on the nucleophilic substitution reaction. GO films reduced for 1 h at 100 degrees C in 55% hydroiodic (HI) acid have an electrical conductivity as high as 298 S/cm and a C/O ratio above 12, both of which are much higher than films reduced by other chemical methods. The reduction maintains good integrity and flexibility, and even improves the strength and ductility, of the original GO films. Based on this reducing method, a flexible graphene-based transparent conductive film with a sheet resistance of 1.6 k Omega/sq and 85% transparency was obtained, further verifying the advantage of HI acid reduction. (C) 2010 Elsevier Ltd. All rights reserved.",10.1016/j.carbon.2010.08.006
J,"De, S; Higgins, TM; Lyons, PE; Doherty, EM; Nirmalraj, PN; Blau, WJ; Boland, JJ; Coleman, JN","Silver Nanowire Networks as Flexible, Transparent, Conducting Films: Extremely High DC to Optical Conductivity Ratios","We have used aqueous dispersions of silver nanowires to prepare thin, flexible, transparent, conducting films. The nanowires are of length and diameter close to 6.5 mu m and 85 nm, respectively. At low thickness, the films consist of networks but appear to become bulk-like for mean film thicknesses above similar to 160 nm. These films can be very transparent with optical transmittance reaching as high as 92% for low thickness. The transmittance (550 nm) decreases with increasing thickness, consistent with an optical conductivity of 6472 S/m. The films are also very uniform; the transmittance varies spatially by typically <2%. The sheet resistance decreases with increasing thickness, falling below 1 Omega/square for thicknesses above 300 nm. The DC conductivity increases from 2 x 101 S/m for very thin films before saturating at 5 X 106 S/m for thicker films. Similarly, the ratio of DC to optical conductivity increases with increasing thickness from 25 for the thinnest films, saturating at similar to 500 for thicknesses above similar to 160 nm. We believe this Is the highest conductivity ratio ever observed for nanostructured films and is matched only by doped metal oxide films. These nanowire films are electromechanically very robust, with all but the thinnest films showing no change in sheet resistance when flexed over >1000 cycles. Such results make these films ideal as replacements for indium tin oxide as transparent electrodes. We have prepared films with optical transmittance and sheet resistance of 85% and 13 Omega/square, respectively. This is very close to that displayed by commercially available indium tin oxide.",10.1021/nn900348c
J,"Ohno, T; Hasegawa, T; Tsuruoka, T; Terabe, K; Gimzewski, JK; Aono, M",Short-term plasticity and long-term potentiation mimicked in single inorganic synapses,"Memory is believed to occur in the human brain as a result of two types of synaptic plasticity: short-term plasticity (STP) and long-term potentiation (LTP; refs 1-4). In neuromorphic engineering(5,6), emulation of known neural behaviour has proven to be difficult to implement in software because of the highly complex interconnected nature of thought processes. Here we report the discovery of a Ag2S inorganic synapse, which emulates the synaptic functions of both STP and LTP characteristics through the use of input pulse repetition time. The structure known as an atomic switch(7,8), operating at critical voltages, stores information as STP with a spontaneous decay of conductance level in response to intermittent input stimuli, whereas frequent stimulation results in a transition to LTP. The Ag2S inorganic synapse has interesting characteristics with analogies to an individual biological synapse, and achieves dynamic memorization in a single device without the need of external preprogramming. A psychological model related to the process of memorizing and forgetting is also demonstrated using the inorganic synapses. Our Ag2S element indicates a breakthrough in mimicking synaptic behaviour essential for the further creation of artificial neural systems that emulate characteristics of human memory.",10.1038/NMAT3054
J,"Valenzano, L; Civalleri, B; Chavan, S; Bordiga, S; Nilsen, MH; Jakobsen, S; Lillerud, KP; Lamberti, C",Disclosing the Complex Structure of UiO-66 Metal Organic Framework: A Synergic Combination of Experiment and Theory,"Through a combined use of experimental and theoretical approaches such as XRPD, EXAFS, IR, and UV- vis spectroscopies and ab initio periodic DFT calculations, we report a detailed characterization of structural, vibrational, and electronic properties of UiO-66 (Zr-BDC MOF) in its hydroxylated and dehydroxylated forms. The stability of the materials with respect to the most common solvents, acids, and bases is determined by combining XRPD and TGA/MS techniques. The structures of the two forms of UiO-66 are refined through an interactive XRPD/EXAFS approach and validated by ab initio calculations. Experimental and calculated IR spectra are reported and compared to enlighten the nature of vibrational modes upon dehydroxylation and to show the complete reversibility of the dehydration/hydration phenomenon. Experimental and calculated band gaps are also reported and compared. In this work, we show the necessity to combine, in a synergic way, different experimental techniques and periodic ab initio approaches to disclose and fully understand the nature of complex novel materials such as UiO-66 on structural, vibrational, and electronic grounds. The correct structure refinement could not be possible using one of these three approaches alone, in particular, XRPD data were unable to detect an important distortion of the Zr6O6 units of the dehydrated material that was, however, foreseen in the ab initio calculations and measured in the EXAFS spectra.",10.1021/cm1022882
J,"Naslain, R","Design, preparation and properties of non-oxide CMCs for application in engines and nuclear reactors: an overview","SiC-based ceramic matrix composites, consisting of carbon or SiC fibers embedded in a SiC-matrix, are tough ceramics when the fiber/matrix bonding is properly optimized through the use of a thin interphase. They are fabricated according to different processing routes (chemical vapor infiltration, polymer impregnation/pyrolysis, liquid silicon infiltration or slurry impregnation/hot pressing) each of them displaying advantages and drawbacks which are briefly discussed. SiC-matrix composites are highly tailorable materials in terms of fiber-type (carbon fibers of SiC-based fibers such as Si-C-O, SiC + C or quasi-stoichiometric SiC reinforcements), interphase (pyrocarbon or hexagonal BN, as well as (PyC-SiC)(n) or (BN SiC)(n) multilayered interphases), matrix (simple SiC or matrices with improved oxidation resistance, such as self-healing matrices) and coatings (SiC or engineered multilayered coatings). The potential of SiC-matrix composites for application in advanced aerojet engines (after-burner hot section), gas turbine of electrical power/steam cogeneration (combustion chamber) and inner wall of the plasma chamber of nuclear fusion reaction, all of them corresponding to very severe conditions is discussed. (C) 2003 Elsevier Ltd. All rights reserved.",10.1016/S0266-3538(03)00230-6
J,"Tian, ZRR; Voigt, JA; Liu, J; McKenzie, B; McDermott, MJ; Rodriguez, MA; Konishi, H; Xu, HF",Complex and oriented ZnO nanostructures,"Extended and oriented nanostructures are desirable for many applications, but direct fabrication of complex nanostructures with controlled crystalline morphology, orientation and surface architectures remains a significant challenge. Here we report a low-temperature, environmentally benign, solution-based approach for the preparation of complex and oriented ZnO nanostructures, and the systematic modification of their crystal morphology. Using controlled seeded growth and citrate anions that selectively adsorb on ZnO basal planes as the structure-directing agent, we prepared large arrays of oriented ZnO nanorods with controlled aspect ratios, complex film morphologies made of oriented nanocolumns and nanoplates (remarkably similar to biomineral structures in red abalone shells) and complex bilayers showing in situ column-to-rod morphological transitions. The advantages of some of these ZnO structures for photocatalytic decompositions of volatile organic compounds were demonstrated. The novel ZnO nanostructures are expected to have great potential for sensing, catalysis, optical emission, piezoelectric transduction, and actuations.",10.1038/nmat1014
J,"Pang, C; Lee, GY; Kim, TI; Kim, SM; Kim, HN; Ahn, SH; Suh, KY",A flexible and highly sensitive strain-gauge sensor using reversible interlocking of nanofibres,"Flexible skin-attachable strain-gauge sensors are an essential component in the development of artificial systems that can mimic the complex characteristics of the human skin. In general, such sensors contain a number of circuits or complex layered matrix arrays. Here, we present a simple architecture for a flexible and highly sensitive strain sensor that enables the detection of pressure, shear and torsion. The device is based on two interlocked arrays of high-aspect-ratio Pt-coated polymeric nanofibres that are supported on thin polydimethylsiloxane layers. When different sensing stimuli are applied, the degree of interconnection and the electrical resistance of the sensor changes in a reversible, directional manner with specific, discernible strain-gauge factors. The sensor response is highly repeatable and reproducible up to 10,000 cycles with excellent on/off switching behaviour. We show that the sensor can be used to monitor signals ranging from human heartbeats to the impact of a bouncing water droplet on a superhydrophobic surface.",10.1038/NMAT3380
J,"Deng, MT; Yu, CL; Huang, GY; Larsson, M; Caroff, P; Xu, HQ",Anomalous Zero-Bias Conductance Peak in a Nb-InSb Nanowire-Nb Hybrid Device,"Semiconductor InSb nanowires are expected to provide an excellent material platform for the study of Majorana fermions in solid state systems. Here, we report on the realization of a Nb-InSb nanowire-Nb hybrid quantum device and the observation of a zero-bias conductance peak structure in the device. An InSb nanowire quantum dot is formed in the device between the two Nb contacts. Due to the proximity effect, the InSb nanowire segments covered by the superconductor Nb contacts turn to superconductors with a superconducting energy gap Delta(InSb) similar to 0.25 meV. A tunable critical supercurrent is observed in the device in high back gate voltage regions in which the Fermi level in the InSb nanowire is located above the tunneling barriers of the quantum dot and the device is open to conduction. When a perpendicular magnetic field is applied to the devices, the critical supercurrent is seen to decrease as the magnetic field increases. However, at sufficiently low back gate voltages, the device shows the quasi-particle Coulomb blockade characteristics and the supercurrent is strongly suppressed even at zero magnetic field. This transport characteristic changes when a perpendicular magnetic field stronger than a critical value, at which the Zeeman energy in the InSb nanowire is E-z similar to Delta(Insb), is applied to the device. In this case, the transport measurements show a conductance peak at the zero bias voltage and the entire InSb nanowire in the device behaves as in a topological superconductor phase. We also show that this zero-bias conductance peak structure can persist over a large range of applied magnetic fields and could be interpreted as a transport signature of Majorana fermions in the InSb nanowire.",10.1021/nl303758w
J,"Gelinck, GH; Huitema, HEA; Van Veenendaal, E; Cantatore, E; Schrijnemakers, L; Van der Putten, JBPH; Geuns, TCT; Beenhakkers, M; Giesbers, JB; Huisman, BH; Meijer, EJ; Benito, EM; Touwslager, FJ; Marsman, AW; Van Rens, BJE; De Leeuw, DM",Flexible active-matrix displays and shift registers based on solution-processed organic transistors,"At present, flexible displays are an important focus of research(1-3). Further development of large, flexible displays requires a cost-effective manufacturing process for the active-matrix backplane, which contains one transistor per pixel. One way to further reduce costs is to integrate (part of) the display drive circuitry, such as row shift registers, directly on the display substrate. Here, we demonstrate flexible active-matrix monochrome electrophoretic displays based on solution-processed organic transistors on 25-mum-thick polyimide substrates. The displays can be bent to a radius of 1 cm without significant loss in performance. Using the same process flow we prepared row shift registers. With 1,888 transistors, these are the largest organic integrated circuits reported to date. More importantly, the operating frequency of 5 kHz is sufficiently high to allow integration with the display operating at video speed. This work therefore represents a major step towards 'system-on-plastic'.",10.1038/nmat1061
J,"Turner, LK; Collins, FG",Carbon dioxide equivalent (CO<sub>2</sub>-e) emissions: A comparison between geopolymer and OPC cement concrete,"Concrete for construction has traditionally been based on an Ordinary Portland Cement (OPC) binder. Geopolymers, an alternative binder based on fly ash (a fine waste collected from the emissions liberated by coal burning power stations) that is activated by an alkaline activator, have potential to lower the significant carbon footprint of OPC concrete. This paper presents the results of comprehensive carbon footprint estimates for both geopolymer and OPC concrete, including energy expending activities associated with mining and transport of raw materials, manufacturing and concrete construction. Previous studies have shown a wide variation of reported emission estimates: the results of this study are benchmarked with data from those studies. (C) 2013 Elsevier Ltd. All rights reserved.",10.1016/j.conbuildmat.2013.01.023
