Publication Type,Authors,Title,Abstract,DOI
J,"Zhou, Y; Bao, QL; Tang, LAL; Zhong, YL; Loh, KP","Hydrothermal Dehydration for the ""Green"" Reduction of Exfoliated Graphene Oxide to Graphene and Demonstration of Tunable Optical Limiting Properties","This work reports a simple, clean, and controlled hydrothermal dehydration route to convert graphene oxide (GO) to stable graphene solution, The hydrothermally treated GO was characterized using UV-visible absorption spectroscopy, atomic force microscopy, Raman spectroscopy, X-ray photoemission spectroscopy, and solid state C-13 NMR spectra. Compared to chemical reduction processes using hydrazine, the present ""water-only"" route has the combined advantages of removing oxygen functional groups from GO and repairing the aromatic structures. By controlling the hydrothermal temperatures, we can modify the physical properties of GO and obtain tunable optical limiting performance.",10.1021/cm9006603
J,"Gilman, JW; Jackson, CL; Morgan, AB; Harris, R; Manias, E; Giannelis, EP; Wuthenow, M; Hilton, D; Phillips, SH",Flammability properties of polymer - Layered-silicate nanocomposites. Polypropylene and polystyrene nanocomposites,"Our continuing study of the mechanism of flammability reduction of polymer-layered-silicate nanocomposites has yielded results for polypropylene-graft-maleic anhydride and polystyrene-layered-silicate nanocomposites using montmorillonite and fluorohectorite. Cone calorimetry was used to measure the heat release rate and other flammability properties of the nanocomposites, under well-controlled combustion conditions. Both the polymer-layered-silicate nanocomposites and the combustion residues were studied by transmission electron microscopy and X-ray diffraction. We have found evidence for a common mechanism of flammability reduction. We also found that the type of layered silicate, nanodispersion, and processing degradation have an influence on the flammability reduction.",10.1021/cm0001760
J,"Hu, XS; Li, SB; Peng, H",A comparative study of equivalent circuit models for Li-ion batteries,"This paper presents a comparative study of twelve equivalent circuit models for Li-ion batteries. These twelve models were selected from state-of-the-art lumped models reported in the literature. The test data used is obtained from a battery test system with a climate chamber. The test schedule is designed to measure key cell attributes under highly dynamical excitations. The datasets were collected from two types of Li-ion cells under three different temperatures. The multi-swarm particle swarm optimization algorithm is used to identify the optimal model parameters for the two types of Li-ion cells. The usefulness of these models is then studied through a comprehensive evaluation by examining model complexity, model accuracy, and robustness of the model by applying the model to datasets obtained from other cells of the same chemistry type. (C) 2011 Elsevier BM. All rights reserved.",10.1016/j.jpowsour.2011.10.013
J,"Kempton, W; Tomic, J",Vehicle-to-grid power fundamentals: Calculating capacity and net revenue,"As the light vehicle fleet moves to electric drive (hybrid, battery, and fuel cell vehicles), an opportunity opens for ""vehicle-to-grid"" (V2G) power. This article defines the three vehicle types that can produce V2G power, and the power markets they can sell into. V2G only makes sense if the vehicle and power market are matched. For example, V2G appears to be unsuitable for baseload power-the constant round-the-clock electricity supply-because baseload power can be provided more cheaply by large generators, as it is today. Rather, V2G's greatest near-term promise is for quick-response, high-value electric services. These quick-response electric services are purchased to balance constant fluctuations in load and to adapt to unexpected equipment failures; they account for 5-10% of electric cost-$12 billion per year in the US. This article develops equations to calculate the capacity for grid power from three types of electric drive vehicles. These equations are applied to evaluate revenue and costs for these vehicles to supply electricity to three electric markets (peak power, spinning reserves, and regulation). The results suggest that the engineering rationale and economic motivation for V2G power are compelling. The societal advantages of developing V2G include an additional revenue stream for cleaner vehicles, increased stability and reliability of the electric grid, lower electric system costs, and eventually, inexpensive storage and backup for renewable electricity. (c) 2005 Elsevier B.V. All rights reserved.",10.1016/j.jpowsour.2004.12.025
J,"Medintz, IL; Clapp, AR; Mattoussi, H; Goldman, ER; Fisher, B; Mauro, JM",Self-assembled nanoscale biosensors based on quantum dot FRET donors,"The potential of luminescent semiconductor quantum dots (QDs) to enable development of hybrid inorganic-bioreceptor sensing materials has remained largely unrealized. We report the design, formation and testing of QD-protein assemblies that function as chemical sensors. In these assemblies, multiple copies of Escherichia coli maltose-binding protein (MBP) coordinate to each QD by a C-terminal oligohistidine segment and function as sugar receptors. Sensors are self-assembled in solution in a controllable manner. In one configuration, a beta-cyclodextrin-QSY9 dark quencher conjugate bound in the MBP saccharide binding site results in fluorescence resonance energy-transfer (FRET) quenching of QD photoluminescence. Added maltose displaces the beta-cyclodextrin-QSY9, and QD photoluminescence increases in a systematic manner. A second maltose sensor assembly consists of QDs coupled with Cy3-labelled MBP bound to beta-cyclodextrin-Cy3.5. In this case, the QD donor drives sensor function through a two-step FRET mechanism that overcomes inherent QD donor-acceptor distance limitations. Quantum dot-biomolecule assemblies constructed using these methods may facilitate development of new hybrid sensing materials.",10.1038/nmat961
J,"Raghupathi, KR; Koodali, RT; Manna, AC",Size-Dependent Bacterial Growth Inhibition and Mechanism of Antibacterial Activity of Zinc Oxide Nanoparticles,"The antibacterial properties of zinc oxide nanoparticles were investigated using both Gram-positive and Gram-negative microorganisms. These studies demonstrate that ZnO nanoparticles have a wide range of antibacterial activities toward various microorganisms that are commonly found in environmental settings. The antibacterial activity of the ZnO nanoparticles was inversely proportional to the size of the nanoparticles in S. aureus. Surprisingly, the antibacterial activity did not require specific UV activation using artificial lamps, rather activation was achieved under ambient lighting conditions. Northern analyses of various reactive oxygen species (ROS) specific genes and confocal microscopy suggest that the antibacterial activity of ZnO nanoparticles might involve both the production of reactive oxygen species and the accumulation of nanoparticles in the cytoplasm or on the outer membranes. Overall, the experimental results suggest that ZnO nanoparticles could be developed as antibacterial agents against a wide range of microorganisms to control and prevent the spreading and persistence of bacterial infections.",10.1021/la104825u
J,"Stevens, DA; Dahn, JR",High capacity anode materials for rechargeable sodium-ion batteries,"Electrochemical techniques have been used to study the reversible insertion of sodium into hard-carbon host structures at room temperature. In this paper we compare these results with those for lithium insertion in the same materials and demonstrate the presence of similar alkali;ali metal insertion mechanisms in both cases. Despite the gravimetric capacities being lower for sodium than lithium insertion, we have achieved a reversible sodium capacity of 300 mAh/g, close to that for lithium insertion in graphitic carbon anode materials. Such materials may therefore be useful as anodes in rechargeable sodium-ion batteries. (C) 2000 The Electrochemical Society. S0013-4651(99)11-034-6. All rights reserved.",10.1149/1.1393348
J,"Liu, J; Zhang, HB; Sun, RH; Liu, YF; Liu, ZS; Zhou, AG; Yu, ZZ","Hydrophobic, Flexible, and Lightweight MXene Foams for High-Performance Electromagnetic-Interference Shielding","Ultrathin, lightweight, and flexible electromagnetic-interference (EMI) shielding materials are urgently required to manage increasingly serious radiation pollution. 2D transition-metal carbides (MXenes) are considered promising alternatives to graphene for providing excellent EMI-shielding performance due to their outstanding metallic electrical conductivity. However, the hydrophilicity of MXene films may affect their stability and reliability when applied in moist or wet environments. Herein, for the first time, an efficient and facile approach is reported to fabricate freestanding, flexible, and hydrophobic MXene foam with reasonable strength by assembling MXene sheets into films followed by a hydrazine-induced foaming process. In striking contrast to well-known hydrophilic MXene materials, the MXene foams surprisingly exhibit hydrophobic surfaces and outstanding water resistance and durability. More interestingly, a much enhanced EMI-shielding effectiveness of approximate to 70 dB is achieved for the lightweight MXene foam as compared to its unfoamed film counterpart (53 dB) due to the highly efficient wave attenuation in the favorable porous structure. Therefore, the hydrophobic, flexible, and lightweight MXene foam with an excellent EMI-shielding performance is highly promising for applications in aerospace and portable and wearable smart electronics.",10.1002/adma.201702367
J,"Wen, B; Cao, MS; Lu, MM; Cao, WQ; Shi, HL; Liu, J; Wang, XX; Jin, HB; Fang, XY; Wang, WZ; Yuan, J",Reduced Graphene Oxides: Light-Weight and High-Efficiency Electromagnetic Interference Shielding at Elevated Temperatures,"Chemical graphitized r-GOs, as the thinnest and lightest material in the carbon family, exhibit high-efficiency electromagnetic interference (EMI) shielding at elevated temperature, attributed to the cooperation of dipole polarization and hopping conductivity. The r-GO composites show different temperature-dependent imaginary permittivities and EMI shielding performances with changing mass ratio.",10.1002/adma.201400108
J,"Yeh, JW",Recent progress in high-entropy alloys,"The thirty or so presently used common alloy systems are typically based on one or, at most, two elements. It has been considered that alloys consisting of a greater number of principal elements will form complicated and brittle microstructures, and hence research regarding such multi-principal-element alloys has received very limited attention. It was suggested by Yeh in 1995, however, that alloy systems with five or more metallic elements will in fact possess higher mixing entropies, and therefore favour the formation of multielement solid-solution phases, as opposed to the inferred complex structures consisting of many intermetallic compounds. Indeed, work over the past decade into such multi-principal-element alloys, which have fittingly been coined as ""high-entropy alloys"" (HE alloys), has found them to form simple phases with nanocrystalline and even amorphous structures. In addition to the high-entropy effect, these structural characteristics are ascribed to the large lattice distortion and sluggish diffusion of such multielemental mixtures. Dependant upon the composition and/or processing route, HE alloys have been found to possess a wide spectrum of microstructures and properties. The superior properties exhibited by HE alloys over conventional alloys, along with the huge number of possible compositions that may give new phenomena and functional uses, makes these proposed HE alloys of great interest not only from a research perspective but also in numerous industrial applications. Therefore, this paper reviews the recent progress made on HE alloys, and possible future directions.",10.3166/acsm.31.633-648
J,"Roundy, S; Wright, PK",A piezoelectric vibration based generator for wireless electronics,"Enabling technologies for wireless sensor networks have gained considerable attention in research communities over the past few years. It is highly desirable, even necessary in certain situations, for wireless sensor nodes to be self-powered. With this coal in mind, a vibration based piezoelectric generator has been developed as an enabling technology for wireless sensor networks. The focus of this paper is to discuss the modeling, design. and optimization of a piezoelectric generator based on a two-layer bending element. An analytical model of the generator has been developed and validated. In addition to providing intuitive design insight, the model has been used as the basis for design optimization. Designs of 1 cm(3) in size generated using the model have demonstrated a power output of 375 muW from a vibration source of 2.5 m s(-2) at 120 Hz. Furthermore, a 1 cm(3) generator has been used to power a custom designed 1.9 GHz radio transmitter from the same vibration source.",10.1088/0964-1726/13/5/018
J,"Su, KH; Wei, QH; Zhang, X; Mock, JJ; Smith, DR; Schultz, S",Interparticle coupling effects on plasmon resonances of nanogold particles,The collaborative oscillation of conductive electrons in metal nanoparticles results in a surface plasmon resonance that makes them useful for various applications including biolabeling. We investigate the coupling between pairs of elliptical metal particles by simulations and experiments. The results demonstrate that the resonant wavelength peak of two interacting particles is red-shifted from that of a single particle because of near-field coupling. It is also found that the shift decays approximately exponentially with increasing particle spacing and become negligible when the gap between the two particles exceeds about 2.5 times the particle short-axis length.,10.1021/nl034197f
J,"Wang, ZJ; Weng, HM; Wu, QS; Dai, X; Fang, Z",Three-dimensional Dirac semimetal and quantum transport in Cd<sub>3</sub>As<sub>2</sub>,"Based on the first-principles calculations, we recover the silent topological nature of Cd3As2, a well known semiconductor with high carrier mobility. We find that it is a symmetry-protected topological semimetal with a single pair of three-dimensional (3D) Dirac points in the bulk and nontrivial Fermi arcs on the surfaces. It can be driven into a topological insulator and a Weyl semimetal state by symmetry breaking, or into a quantum spin Hall insulator with a gap more than 100 meV by reducing dimensionality. We propose that the 3D Dirac cones in the bulk of Cd3As2 can support sizable linear quantum magnetoresistance even up to room temperature.",10.1103/PhysRevB.88.125427
J,"Girifalco, LA; Hodak, M; Lee, RS","Carbon nanotubes, buckyballs, ropes, and a universal graphitic potential","The potential energies of interaction between two parallel, infinitely long carbon nanotubes of the same diameter, and between C-60 and a nanotube in various arrangements, were computed by assuming a continuous distribution of atoms on the tube and ball surfaces and using a Lennard-Jones (LJ) carbon-carbon potential. The constants in the LJ potential are different for graphene-graphene and C-60-C-60 interactions. From these, the constants for tube-C-60 interactions were estimated using averaging rules from the theory of dispersion forces. For tubes in ropes, the cohesive energy per unit length, the compressibility, and the equilibrium separation distance were computed as a function of tube radius. For a C-60 molecule interacting with tubes, the binding energy inside a tube was much higher than on a tube or at the tube mouth. Within a tube, the binding energy was highest at a spherically capped end. The potential energies for tubes of all radii, as well as for interactions between C-60 molecules, for a C-60 molecule outside of a nanotube, between a C-60 molecule and a graphene sheet, and between graphene sheets, all fell on the same curve when plotted in terms of certain reduced parameters. Because of this, all the potentials can be represented by a simple analytic form, thereby greatly simplifying all computations of van der Waals interactions in graphitic systems. Binding-energy results were all consistent with the recently proposed mechanism of peapod formation based on transmission electron microscopy experiments.",10.1103/PhysRevB.62.13104
J,"Kirchner, C; Liedl, T; Kudera, S; Pellegrino, T; Javier, AM; Gaub, HE; Stölzle, S; Fertig, N; Parak, WJ",Cytotoxicity of colloidal CdSe and CdSe/ZnS nanoparticles,"Cytotoxicity of CdSe and CdSe/ZnS nanoparticles has been investigated for different surface modifications such as coating with mercaptopropionic acid, silanization, and polymer coating. For all cases, quantitative values for the onset of cytotoxic effects in serum-free culture media are given. These values are correlated with microscope images in which the uptake of the particles by the cells has been investigated. Our data suggest that in addition to the release of toxic Cd2+ ions from the particles also their surface chemistry, in particular their stability toward aggregation, plays an important role for cytotoxic effects. Additional patch clamp experiments investigate effects of the particles on currents through ion channels.",10.1021/nl047996m
J,"An, ZF; Zheng, C; Tao, Y; Chen, RF; Shi, HF; Chen, T; Wang, ZX; Li, HH; Deng, RR; Liu, XG; Huang, W",Stabilizing triplet excited states for ultralong organic phosphorescence,"The control of the emission properties of synthetic organic molecules through molecular design has led to the development of high-performance optoelectronic devices with tunable emission colours, high quantum efficiencies and efficient energy/charge transfer processes(1-4). However, the task of generating excited states with long lifetimes has been met with limited success, owing to the ultrafast deactivation of the highly active excited states(5). Here, we present a design rule that can be used to tune the emission lifetime of a wide range of luminescent organic molecules, based on effective stabilization of triplet excited states through strong coupling in H-aggregated molecules. Our experimental data revealed that luminescence lifetimes up to 1.35 s, which are several orders of magnitude longer than those of conventional organic fluorophores(6,7), can be realized under ambient conditions. These results outline a fundamental principle to design organic molecules with extended lifetimes of excited states, providing a major step forward in expanding the scope of organic phosphorescence applications.",10.1038/NMAT4259
J,"Sampaio, J; Cros, V; Rohart, S; Thiaville, A; Fert, A","Nucleation, stability and current-induced motion of isolated magnetic skyrmions in nanostructures","Magnetic skyrmions are topologically stable spin configurations, which usually originate from chiral interactions known as Dzyaloshinskii-Moriya interactions. Skyrmion lattices were initially observed in bulk non-centrosymmetric crystals, but have more recently been noted in ultrathin films, where their existence is explained by interfacial Dzyaloshinskii-Moriya interactions induced by the proximity to an adjacent layer with strong spin-orbit coupling. Skyrmions are promising candidates as information carriers for future information-processing devices due to their small size (down to a few nanometres) and to the very small current densities needed to displace skyrmion lattices. However, any practical application will probably require the creation, manipulation and detection of isolated skyrmions in magnetic thin-film nanostructures. Here, we demonstrate by numerical investigations that an isolated skyrmion can be a stable configuration in a nanostructure, can be locally nucleated by injection of spin-polarized current, and can be displaced by current-induced spin torques, even in the presence of large defects.",10.1038/NNANO.2013.210
J,"Lucchese, MM; Stavale, F; Ferreira, EHM; Vilani, C; Moutinho, MVO; Capaz, RB; Achete, CA; Jorio, A",Quantifying ion-induced defects and Raman relaxation length in graphene,"Raman scattering is used to study disorder in graphene subjected to low energy (90 eV) Ar' ion bombardment The evolution of the intensity ratio between the G band (1585 cm(-1)) and the disorder-induced D band (1345 cm(-1)) with ion dose is determined, providing a spectroscopy-based method to quantify the density of defects in graphene This evolution can be fitted by a phenomenological model, which is in conceptual agreement with a well-established amorphization. trajectory for graphitic materials Our results show that the broadly used Tuinstra-Koenig relation should be limited to the measure of crystallite sizes, and allows extraction of the Raman relaxation length for the disorder-induced Raman scattering process (C) 2010 Elsevier Ltd All rights reserved",10.1016/j.carbon.2009.12.057
J,"Sheng, WC; Gasteiger, HA; Shao-Horn, Y",Hydrogen Oxidation and Evolution Reaction Kinetics on Platinum: Acid vs Alkaline Electrolytes,"The kinetics of the hydrogen oxidation reaction (HOR) and hydrogen evolution reaction (HER) on polycrystalline platinum [Pt(pc)] and high surface area carbon-supported platinum nanoparticles (Pt/C) were studied in 0.1 M KOH using rotating disk electrode (RDE) measurements. After corrections of noncompensated solution resistance from ac impedance spectroscopy and of hydrogen mass transport in the HOR branch, the kinetic current densities were fitted to the Butler-Volmer equation using a transfer coefficient of alpha = 0.5, from which HOR/HER exchange current densities on Pt(pc) and Pt/C were obtained, and the HOR/HER mechanisms in alkaline solution were discussed. Unlike the HOR/HER rates on Pt electrodes in alkaline solution, the HOR/HER rates on a Pt electrode in 0.1 M HClO(4) were limited entirely by hydrogen diffusion, which renders the quantification of the HOR/HER kinetics impossible by conventional RDE measurements. The simulation of the hydrogen anode performance based on the specific exchange current densities of the HOR/HER at 80 degrees C illustrates that in addition to the oxygen reduction reaction cell voltage loss on the cathode, the slow HOR kinetics are projected to cause significant anode potential losses in alkaline fuel cells for low platinum loadings (> 130 mV at 0.05 mg(Pt)/cm(anode)(2) and 1.5 A/cm(anode)(2)), contrary to what is reported for proton exchange membrane fuel cells. (C) 2010 The Electrochemical Society. [DOI: 10.1149/1.3483106] All rights reserved.",10.1149/1.3483106
J,"Sun, YM; Welch, GC; Leong, WL; Takacs, CJ; Bazan, GC; Heeger, AJ",Solution-processed small-molecule solar cells with 6.7% efficiency,"Organic photovoltaic devices that can be fabricated by simple processing techniques are under intense investigation in academic and industrial laboratories because of their potential to enable mass production of flexible and coste-ffective devices(1,2). Most of the attention has been focused on solution-processed polymer bulk-heterojunction (BHJ) solar cells3-7. A combination of polymer design, morphology control, structural insight and device engineering has led to power conversion efficiencies (PCEs) reaching the 6-8% range for conjugated polymer/fullerene blends(8,9). Solution-processed small-molecule BHJ (SM BHJ) solar cells have received less attention, and their efficiencies have remained below those of their polymeric counterparts(10). Here, we report efficient solution-processed SM BHJ solar cells based on a new molecular donor, DTS(PTTh2)(2). A record PCE of 6.7% under AM 1.5G irradiation (100mWcm(-2)) is achieved for small-molecule BHJ devices from DTS(PTTh2)(2) V PC70BM (donor to acceptor ratio of 7: 3). This high efficiency was obtained by using remarkably small percentages of solvent additive (0.25% v/v of 1,8-diiodooctane, DIO) during the film-forming process, which leads to reduced domain sizes in the BHJ layer. These results provide important progress for solution-processed organic photovoltaics and demonstrate that solar cells fabricated from small donor molecules can compete with their polymeric counterparts.",10.1038/NMAT3160
J,"Kim, GH; Shao, L; Zhang, K; Pipe, KP",Engineered doping of organic semiconductors for enhanced thermoelectric efficiency,"Significant improvements to the thermoelectric figure of merit ZT have emerged in recent years, primarily due to the engineering of material composition and nanostructure in inorganic semiconductors(1) (ISCs). However, many present high-ZT materials are based on low-abundance elements that pose challenges for scale-up, as they entail high material costs in addition to brittleness and difficulty in large-area deposition. Here we demonstrate a strategy to improve ZT in conductive polymers and other organic semiconductors (OSCs) for which the base elements are earth-abundant. By minimizing total dopant volume, we show that all three parameters constituting ZT vary in a manner so that ZT increases; this stands in sharp contrast to ISCs, for which these parameters have trade-offs. Reducing dopant volume is found to be as important as optimizing carrier concentration when maximizing ZT in OSCs. Implementing this strategy with the dopant poly(styrenesulphonate) in poly(3,4-ethylenedioxythiophene), we achieve ZT = 0.42 at room temperature.",10.1038/NMAT3635
