Publication Type,Authors,Title,Abstract,DOI
J,"Rooney, MS; Shukla, SA; Wu, CJ; Getz, G; Hacohen, N",Molecular and Genetic Properties of Tumors Associated with Local Immune Cytolytic Activity,"How the genomic landscape of a tumor shapes and is shaped by anti-tumor immunity has not been systematically explored. Using large-scale genomic data sets of solid tissue tumor biopsies, we quantified the cytolytic activity of the local immune infiltrate and identified associated properties across 18 tumor types. The number of predicted MHC Class I-associated neoantigens was correlated with cytolytic activity and was lower than expected in colorectal and other tumors, suggesting immune-mediated elimination. We identified recurrently mutated genes that showed positive association with cytolytic activity, including beta-2-microglobulin (B2M), HLA-A, -B and -C and Caspase 8 (CASP8), highlighting loss of antigen presentation and blockade of extrinsic apoptosis as key strategies of resistance to cytolytic activity. Genetic amplifications were also associated with high cytolytic activity, including immunosuppressive factors such as PDL1/2 and ALOX12B/15B. Our genetic findings thus provide evidence for immunoediting in tumors and uncover mechanisms of tumor-intrinsic resistance to cytolytic activity.",10.1016/j.cell.2014.12.033
J,"Grant, CE; Bailey, TL; Noble, WS",FIMO: scanning for occurrences of a given motif,"A motif is a short DNA or protein sequence that contributes to the biological function of the sequence in which it resides. Over the past several decades, many computational methods have been described for identifying, characterizing and searching with sequence motifs. Critical to nearly any motif-based sequence analysis pipeline is the ability to scan a sequence database for occurrences of a given motif described by a position-specific frequency matrix. Results: We describe Find Individual Motif Occurrences (FIMO), a software tool for scanning DNA or protein sequences with motifs described as position-specific scoring matrices. The program computes a log-likelihood ratio score for each position in a given sequence database, uses established dynamic programming methods to convert this score to a P-value and then applies false discovery rate analysis to estimate a q-value for each position in the given sequence. FIMO provides output in a variety of formats, including HTML, XML and several Santa Cruz Genome Browser formats. The program is efficient, allowing for the scanning of DNA sequences at a rate of 3.5 Mb/s on a single CPU.",10.1093/bioinformatics/btr064
J,"Gaulton, A; Bellis, LJ; Bento, AP; Chambers, J; Davies, M; Hersey, A; Light, Y; McGlinchey, S; Michalovich, D; Al-Lazikani, B; Overington, JP",ChEMBL: a large-scale bioactivity database for drug discovery,"ChEMBL is an Open Data database containing binding, functional and ADMET information for a large number of drug-like bioactive compounds. These data are manually abstracted from the primary published literature on a regular basis, then further curated and standardized to maximize their quality and utility across a wide range of chemical biology and drug-discovery research problems. Currently, the database contains 5.4 million bioactivity measurements for more than 1 million compounds and 5200 protein targets. Access is available through a web-based interface, data downloads and web services at: https://www.ebi.ac.uk/chembldb.",10.1093/nar/gkr777
J,"Enright, AJ; Van Dongen, S; Ouzounis, CA",An efficient algorithm for large-scale detection of protein families,"Detection of protein families in large databases is one of the principal research objectives in structural and functional genomics. Protein family classification can significantly contribute to the delineation of functional diversity of homologous proteins, the prediction of function based on domain architecture or the presence of sequence motifs as well as comparative genomics, providing valuable evolutionary insights. We present a novel approach called TRIBE-MCL for rapid and accurate clustering of protein sequences into families. The method relies on the Markov cluster (MCL) algorithm for the assignment of proteins into families based on precomputed sequence similarity information. This novel approach does not suffer from the problems that normally hinder other protein sequence clustering algorithms, such as the presence of multi-domain proteins, promiscuous domains and fragmented proteins. The method has been rigorously tested and validated on a number of very large databases, including SwissProt, InterPro, SCOP and the draft human genome. Our results indicate that the method is ideally suited to the rapid and accurate detection of protein families on a large scale. The method has been used to detect and categorise protein families within the draft human genome and the resulting families have been used to annotate a large proportion of human proteins.",10.1093/nar/30.7.1575
J,"Tang, ZF; Kang, BX; Li, CW; Chen, TX; Zhang, ZM",GEPIA2: an enhanced web server for large-scale expression profiling and interactive analysis,"Introduced in 2017, the GEPIA (Gene Expression Profiling Interactive Analysis) web server has been a valuable and highly cited resource for gene expression analysis based on tumor and normal samples from the TCGA and the GTEx databases. Here, we present GEPIA2, an updated and enhanced version to provide insights with higher resolution and more functionalities. Featuring 198 619 isoforms and 84 cancer subtypes, GEPIA2 has extended gene expression quantification from the gene level to the transcript level, and supports analysis of a specific cancer subtype, and comparison between subtypes. In addition, GEPIA2 has adopted new analysis techniques of gene signature quantification inspired by single-cell sequencing studies, and provides customized analysis where users can upload their own RNA-seq data and compare them with TCGA and GTEx samples. We also offer an API for batch process and easy retrieval of the analysis results. The updated web server is publicly accessible at http://gepia2.cancer-pku.cn/.",10.1093/nar/gkz430
J,"Abascal, F; Zardoya, R; Posada, D",ProtTest: selection of best-fit models of protein evolution,"Using an appropriate model of amino acid replacement is very important for the study of protein evolution and phylogenetic inference. We have built a tool for the selection of the best-fit model of evolution, among a set of candidate models, for a given protein sequence alignment.",10.1093/bioinformatics/bti263
J,"Vranken, WF; Boucher, W; Stevens, TJ; Fogh, RH; Pajon, A; Llinas, P; Ulrich, EL; Markley, JL; Ionides, J; Laue, ED",The CCPN data model for NMR spectroscopy: Development of a software pipeline,"To address data management and data exchange problems in the nuclear magnetic resonance (NMR) community, the Collaborative Computing Project for the NMR, community (CCPN) created a ""Data Model"" that describes all the different types of information needed in an NMR structural study, from molecular structure and NMR parameters to coordinates. This paper describes the development of a set of software applications that use the Data Model and its associated libraries, thus validating the approach. These applications are freely available and provide a pipeline for high-throughput analysis of NMR data. Three programs work directly with the Data Model: CcpNmr Analysis, an entirely new analysis and interactive display program, the CcpNmr FormatConverter, which allows transfer of data from programs commonly used in NMR to and from the Data Model, and the CLOUDS software for automated structure calculation and assignment (Carnegie Mellon University), which was rewritten to interact directly with the Data Model. The ARIA 2.0 software for structure calculation (Institut Pasteur) and the QUEEN program for validation of restraints (University of Nijmegen) were extended to provide conversion of their data to the Data Model. During these developments the Data Model has been thoroughly tested and used, demonstrating that applications can successfully exchange data via the Data Model. The software architecture developed by CCPN is now ready for new developments, such as integration with additional software applications and extensions of the Data Model into other areas of research. (c) 2005 Wiley-Liss, Inc.",10.1002/prot.20449
J,"Marcais, G; Kingsford, C","A fast, lock-free approach for efficient parallel counting of occurrences of <i>k</i>-mers","Motivation: Counting the number of occurrences of every k-mer (substring of length k) in a long string is a central subproblem in many applications, including genome assembly, error correction of sequencing reads, fast multiple sequence alignment and repeat detection. Recently, the deep sequence coverage generated by next-generation sequencing technologies has caused the amount of sequence to be processed during a genome project to grow rapidly, and has rendered current k-mer counting tools too slow and memory intensive. At the same time, large multicore computers have become commonplace in research facilities allowing for a new parallel computational paradigm. Results: We propose a new k-mer counting algorithm and associated implementation, called Jellyfish, which is fast and memory efficient. It is based on a multithreaded, lock-free hash table optimized for counting k-mers up to 31 bases in length. Due to their flexibility, suffix arrays have been the data structure of choice for solving many string problems. For the task of k-mer counting, important in many biological applications, Jellyfish offers a much faster and more memory-efficient solution.",10.1093/bioinformatics/btr011
J,"Broman, KW; Wu, H; Sen, S; Churchill, GA",R/qtl: QTL mapping in experimental crosses,"R/qtl is an extensible, interactive environment for mapping quantitative trait loci (QTLs) in experimental populations derived from inbred lines. It is implemented as an add-on package for the freely-available statistical software, R, and includes functions for estimating genetic maps, identifying genotyping errors, and performing single-QTL and two-dimensional, two-QTL genome scans by multiple methods, with the possible inclusion of covariates.",10.1093/bioinformatics/btg112
J,"Puillandre, N; Lambert, A; Brouillet, S; Achaz, G","ABGD, Automatic Barcode Gap Discovery for primary species delimitation","Within uncharacterized groups, DNA barcodes, short DNA sequences that are present in a wide range of species, can be used to assign organisms into species. We propose an automatic procedure that sorts the sequences into hypothetical species based on the barcode gap, which can be observed whenever the divergence among organisms belonging to the same species is smaller than divergence among organisms from different species. We use a range of prior intraspecific divergence to infer from the data a model-based one-sided confidence limit for intraspecific divergence. The method, called Automatic Barcode Gap Discovery (ABGD), then detects the barcode gap as the first significant gap beyond this limit and uses it to partition the data. Inference of the limit and gap detection are then recursively applied to previously obtained groups to get finer partitions until there is no further partitioning. Using six published data sets of metazoans, we show that ABGD is computationally efficient and performs well for standard prior maximum intraspecific divergences (a few per cent of divergence for the five data sets), except for one data set where less than three sequences per species were sampled. We further explore the theoretical limitations of ABGD through simulation of explicit speciation and population genetics scenarios. Our results emphasize in particular the sensitivity of the method to the presence of recent speciation events, via (unrealistically) high rates of speciation or large numbers of species. In conclusion, ABGD is fast, simple method to split a sequence alignment data set into candidate species that should be complemented with other evidence in an integrative taxonomic approach.",10.1111/j.1365-294X.2011.05239.x
J,"Marchler-Bauer, A; Derbyshire, MK; Gonzales, NR; Lu, SN; Chitsaz, F; Geer, LY; Geer, RC; He, J; Gwadz, M; Hurwitz, DI; Lanczycki, CJ; Lu, F; Marchler, GH; Song, JS; Thanki, N; Wang, ZX; Yamashita, RA; Zhang, DC; Zheng, CJ; Bryant, SH",CDD: NCBI's conserved domain database,"NCBI's CDD, the Conserved Domain Database, enters its 15(th) year as a public resource for the annotation of proteins with the location of conserved domain footprints. Going forward, we strive to improve the coverage and consistency of domain annotation provided by CDD. We maintain a live search system as well as an archive of pre-computed domain annotation for sequences tracked in NCBI's Entrez protein database, which can be retrieved for single sequences or in bulk. We also maintain import procedures so that CDD contains domain models and domain definitions provided by several collections available in the public domain, as well as those produced by an in-house curation effort. The curation effort aims at increasing coverage and providing finer-grained classifications of common protein domains, for which a wealth of functional and structural data has become available. CDD curation generates alignment models of representative sequence fragments, which are in agreement with domain boundaries as observed in protein 3D structure, and which model the structurally conserved cores of domain families as well as annotate conserved features.",10.1093/nar/gku1221
J,"Chambers, I; Colby, D; Robertson, M; Nichols, J; Lee, S; Tweedie, S; Smith, A","Functional expression cloning of Nanog, a pluripotency sustaining factor in embryonic stem cells","Embryonic stem (ES) cells undergo extended proliferation while remaining poised for multilineage differentiation. A unique network of transcription factors may characterize self-renewal and simultaneously suppress differentiation. We applied expression cloning in mouse ES cells to isolate a self-renewal determinant. Nanog is a divergent homeodomain protein that directs propagation of undifferentiated ES cells. Nanog mRNA is present in pluripotent mouse and human cell lines, and absent from differentiated cells. In preimplantation embryos, Nanog is restricted to founder cells from which ES cells can be derived. Endogenous Nanog acts in parallel with cytokine stimulation of Stat3 to drive ES cell self-renewal. Elevated Nanog expression from transgene constructs is sufficient for clonal expansion of ES cells, bypassing Stat3 and maintaining Oct4 levels. Cytokine dependence, multilineage differentiation, and embryo colonization capacity are fully restored upon transgene excision. These findings establish a central role for Nanog in the transcription factor hierarchy that defines ES cell identity.",10.1016/S0092-8674(03)00392-1
J,"Wu, J; Boström, P; Sparks, LM; Ye, L; Choi, JH; Giang, AH; Khandekar, M; Virtanen, KA; Nuutila, P; Schaart, G; Huang, KX; Tu, H; Lichtenbelt, WDV; Hoeks, J; Enerbäck, S; Schrauwen, P; Spiegelman, BM",Beige Adipocytes Are a Distinct Type of Thermogenic Fat Cell in Mouse and Human,"Brown fat generates heat via the mitochondrial uncoupling protein UCP1, defending against hypothermia and obesity. Recent data suggest that there are two distinct types of brown fat: classical brown fat derived from a myf-5 cellular lineage and UCP1-positive cells that emerge in white fat from a non-myf-5 lineage. Here, we report the isolation of ""beige"" cells from murine white fat depots. Beige cells resemble white fat cells in having extremely low basal expression of UCP1, but, like classical brown fat, they respond to cyclic AMP stimulation with high UCP1 expression and respiration rates. Beige cells have a gene expression pattern distinct from either white or brown fat and are preferentially sensitive to the polypeptide hormone irisin. Finally, we provide evidence that previously identified brown fat deposits in adult humans are composed of beige adipocytes. These data provide a foundation for studying this mammalian cell type with therapeutic potential.",10.1016/j.cell.2012.05.016
J,"Picelli, S; Faridani, OR; Björklund, ÅK; Winberg, G; Sagasser, S; Sandberg, R",Full-length RNA-seq from single cells using Smart-seq2,"Emerging methods for the accurate quantification of gene expression in individual cells hold promise for revealing the extent, function and origins of cell-to-cell variability. Different high-throughput methods for single-cell RNA-seq have been introduced that vary in coverage, sensitivity and multiplexing ability. We recently introduced Smart-seq for transcriptome analysis from single cells, and we subsequently optimized the method for improved sensitivity, accuracy and full-length coverage across transcripts. Here we present a detailed protocol for Smart-seq2 that allows the generation of full-length cDNA and sequencing libraries by using standard reagents. The entire protocol takes similar to 2 d from cell picking to having a final library ready for sequencing; sequencing will require an additional 1-3 d depending on the strategy and sequencer. The current limitations are the lack of strand specificity and the inability to detect nonpolyadenylated (polyA(-)) RNA.",10.1038/nprot.2014.006
J,"Harding, HP; Zhang, YH; Zeng, HQ; Novoa, I; Lu, PD; Calfon, M; Sadri, N; Yun, C; Popko, B; Paules, R; Stojdl, DF; Bell, JC; Hettmann, T; Leiden, JM; Ron, D",An integrated stress response regulates amino acid metabolism and resistance to oxidative stress,"Eukaryotic cells respond to unfolded proteins in their endoplasmic reticulum (ER stress), amino acid starvation, or oxidants by phosphorylating the alpha subunit of translation initiation factor 2 (eIF2alpha). This adaptation inhibits general protein synthesis while promoting translation and expression of the transcription factor ATF4. Atf4(-/-) cells are impaired in expressing genes involved in amino acid import, glutathione biosynthesis, and resistance to oxidative stress. Perk(-/-) cells, lacking an upstream ER stress-activated eIF2alpha kinase that activates Atf4, accumulate endogenous peroxides during ER stress, whereas interference with the ER oxidase ERO1 abrogates such accumulation. A signaling pathway initiated by eIF2alpha phosphorylation protects cells against metabolic consequences of ER oxidation by promoting the linked processes of amino acid sufficiency and resistance to oxidative stress.",10.1016/S1097-2765(03)00105-9
J,"Gilbert, LA; Larson, MH; Morsut, L; Liu, ZR; Brar, GA; Torres, SE; Stern-Ginossar, N; Brandman, O; Whitehead, EH; Doudna, JA; Lim, WA; Weissman, JS; Qi, LS",CRISPR-Mediated Modular RNA-Guided Regulation of Transcription in Eukaryotes,"The genetic interrogation and reprogramming of cells requires methods for robust and precise targeting of genes for expression or repression. The CRISPR-associated catalytically inactive dCas9 protein offers a general platform for RNA-guided DNA targeting. Here, we show that fusion of dCas9 to effector domains with distinct regulatory functions enables stable and efficient transcriptional repression or activation in human and yeast cells, with the site of delivery determined solely by a coexpressed short guide (sg)RNA. Coupling of dCas9 to a transcriptional repressor domain can robustly silence expression of multiple endogenous genes. RNA-seq analysis indicates that CRISPR interference (CRISPRi)-mediated transcriptional repression is highly specific. Our results establish that the CRISPR system can be used as a modular and flexible DNA-binding platform for the recruitment of proteins to a target DNA sequence, revealing the potential of CRISPRi as a general tool for the precise regulation of gene expression in eukaryotic cells.",10.1016/j.cell.2013.06.044
J,"Fagerberg, L; Hallström, BM; Oksvold, P; Kampf, C; Djureinovic, D; Odeberg, J; Habuka, M; Tahmasebpoor, S; Danielsson, A; Edlund, K; Asplund, A; Sjöstedt, E; Lundberg, E; Szigyarto, CA; Skogs, M; Takanen, JO; Berling, H; Tegel, H; Mulder, J; Nilsson, P; Schwenk, JM; Lindskog, C; Danielsson, F; Mardinoglu, A; Sivertsson, Å; von Feilitzen, K; Forsberg, M; Zwahlen, M; Olsson, I; Navani, S; Huss, M; Nielsen, J; Ponten, F; Uhlén, M",Analysis of the Human Tissue-specific Expression by Genome-wide Integration of Transcriptomics and Antibody-based Proteomics,"Global classification of the human proteins with regards to spatial expression patterns across organs and tissues is important for studies of human biology and disease. Here, we used a quantitative transcriptomics analysis (RNA-Seq) to classify the tissue-specific expression of genes across a representative set of all major human organs and tissues and combined this analysis with antibody-based profiling of the same tissues. To present the data, we launch a new version of the Human Protein Atlas that integrates RNA and protein expression data corresponding to approximate to 80% of the human protein-coding genes with access to the primary data for both the RNA and the protein analysis on an individual gene level. We present a classification of all human protein-coding genes with regards to tissue-specificity and spatial expression pattern. The integrative human expression map can be used as a starting point to explore the molecular constituents of the human body.",10.1074/mcp.M113.035600
J,"Robinson, D; Van Allen, EM; Wu, YM; Schultz, N; Lonigro, RJ; Mosquera, JM; Montgomery, B; Taplin, ME; Pritchard, CC; Attard, G; Beltran, H; Abida, W; Bradley, RK; Vinson, J; Cao, XH; Vats, P; Kunju, LP; Hussain, M; Feng, FY; Tomlins, SA; Cooney, KA; Smith, DC; Brennan, C; Siddiqui, J; Mehra, R; Chen, Y; Rathkopf, DE; Morris, MJ; Solomon, SB; Durack, JC; Reuter, VE; Gopalan, A; Gao, JJ; Loda, M; Lis, RT; Bowden, M; Balk, SP; Gaviola, G; Sougnez, C; Gupta, M; Yu, EY; Mostaghel, EA; Cheng, HH; Mulcahy, H; True, LD; Plymate, SR; Dvinge, H; Ferraldeschi, R; Flohr, P; Miranda, S; Zafeiriou, Z; Tunariu, N; Mateo, J; Perez-Lopez, R; Demichelis, F; Robinson, BD; Schiffman, M; Nanus, DM; Tagawa, ST; Sigaras, A; Eng, KW; Elemento, O; Sboner, A; Heath, EI; Scher, HI; Pienta, KJ; Kantoff, P; de Bono, JS; Rubin, MA; Nelson, PS; Garraway, LA; Sawyers, CL; Chinnaiyan, AM",Integrative Clinical Genomics of Advanced Prostate Cancer,"Toward development of a precision medicine framework for metastatic, castration-resistant prostate cancer (mCRPC), we established a multi-institutional clinical sequencing infrastructure to conduct prospective whole-exome and transcriptome sequencing of bone or soft tissue tumor biopsies from a cohort of 150 mCRPC affected individuals. Aberrations of AR, ETS genes, TP53, and PTEN were frequent (40%-60% of cases), with TP53 and AR alterations enriched in mCRPC compared to primary prostate cancer. We identified new genomic alterations in PIK3CA/B, R-spondin, BRAF/RAF1, APC, beta-catenin, and ZBTB16/PLZF. Moreover, aberrations of BRCA2, BRCA1, and ATM were observed at substantially higher frequencies (19.3% overall) compared to those in primary prostate cancers. 89% of affected individuals harbored a clinically actionable aberration, including 62.7% with aberrations in AR, 65% in other cancer-related genes, and 8% with actionable pathogenic germline alterations. This cohort study provides clinically actionable information that could impact treatment decisions for these affected individuals.",10.1016/j.cell.2015.05.001
J,"Battye, TGG; Kontogiannis, L; Johnson, O; Powell, HR; Leslie, AGW",<i>iMOSFLM</i>: a new graphical interface for diffraction-image processing with <i>MOSFLM</i>,"iMOSFLM is a graphical user interface to the diffraction data-integration program MOSFLM. It is designed to simplify data processing by dividing the process into a series of steps, which are normally carried out sequentially. Each step has its own display pane, allowing control over parameters that influence that step and providing graphical feedback to the user. Suitable values for integration parameters are set automatically, but additional menus provide a detailed level of control for experienced users. The image display and the interfaces to the different tasks (indexing, strategy calculation, cell refinement, integration and history) are described. The most important parameters for each step and the best way of assessing success or failure are discussed.",10.1107/S0907444910048675
J,"Delcher, AL; Bratke, KA; Powers, EC; Salzberg, SL",Identifying bacterial genes and endosymbiont DNA with Glimmer,"Motivation: The Glimmer gene-finding software has been successfully used for finding genes in bacteria, arch ae a and viruses representing hundreds of species. We describe several major changes to the Glimmer system, including improved methods for identifying both coding regions and start codons. We also describe a new module of Glimmer that can distinguish host and endosymbiont DNA. This module was developed in response to the discovery that eukaryotic genome sequencing projects sometimes inadvertently capture the DNA of intracellular bacteria living in the host. Results: The new methods dramatically reduce the rate of false-positive predictions, while maintaining Glimmer's 99% sensitivity rate at detecting genes in most species, and they find substantially more correct start sites, as measured by comparisons to known and well-curated genes. We show that our interpolated Markov model (IMM) DNA discriminator correctly separated 99% of the sequences in a recent genome project that produced a mixture of sequences from the bacterium Prochloron didemni and its sea squirt host, Lissoclinum patella.",10.1093/bioinformatics/btm009
