Publication Type,Authors,Title,Abstract,DOI
J,"Kiel, MJ; Yilmaz, ÖH; Iwashita, T; Yilmaz, OH; Terhorst, C; Morrison, SJ",SLAM family receptors distinguish hematopoietic stem and progenitor cells and reveal endothelial niches for stem cells,"To improve our ability to identify hematopoletic stem cells (HSCs) and their localization in vivo, we compared the gene expression profiles of highly purified HSCs and non-self-renewing multipotent hematopoletic progenitors (MPPs). Cell surface receptors of the SLAM family, including CD150, CD244, and CD48, were differentially expressed among functionally distinct progenitors. HSCs were highly purified as CD150(+)CD244(-)CD48(-) cells while MPPs were CD244(+) CD150(-)CD48(-) and most restricted progenitors were CD48(+)CD244(+)CD150(-). The primitiveness of hematopoietic progenitors could thus be predicted based on the combination of SLAM family members they expressed. This is the first family of receptors whose combinatorial expression precisely distinguishes stem and progenitor cells. The ability to purify HSCs based on a simple combination of SLAM receptors allowed us to identify HSCs in tissue sections. Many HSCs were associated with sinusoidal endothelium in spleen and bone marrow, though some HSCs were associated with endosteum. HSCs thus occupy multiple niches, including sinusoldal endothelium in diverse tissues.",10.1016/j.cell.2005.05.026
J,"Saldanha, AJ",Java Treeview-extensible visualization of microarray data,"Open source software encourages innovation by allowing users to extend the functionality of existing applications. Treeview is a popular application for the visualization of microarray data, but is closed-source and platform-specific, which limits both its current utility and suitability as a platform for further development. Java Treeview is an open-source, cross-platform rewrite that handles very large datasets well, and supports extensions to the file format that allow the results of additional analysis to be visualized and compared. The combination of a general file format and open source makes Java Treeview an attractive choice for solving a class of visualization problems. An applet version is also available that can be used on any website with no special server-side setup.",10.1093/bioinformatics/bth349
J,"de Hoon, MJL; Imoto, S; Nolan, J; Miyano, S",Open source clustering software,"We have implemented k-means clustering, hierarchical clustering and self-organizing maps in a single multipurpose open-source library of C routines, callable from other C and C++ programs. Using this library, we have created an improved version of Michael Eisen's well-known Cluster program for Windows, Mac OS X and Linux/Unix. In addition, we generated a Python and a Perl interface to the C Clustering Library, thereby combining the flexibility of a scripting language with the speed of C.",10.1093/bioinformatics/bth078
J,"Williams, CJ; Headd, JJ; Moriarty, NW; Prisant, MG; Videau, LL; Deis, LN; Verma, V; Keedy, DA; Hintze, BJ; Chen, VB; Jain, S; Lewis, SM; Arendall, WB; Snoeyink, J; Adams, PD; Lovell, SC; Richardson, JS; Richardson, DC",MolProbity: More and better reference data for improved all-atom structure validation,"This paper describes the current update on macromolecular model validation services that are provided at the MolProbity website, emphasizing changes and additions since the previous review in 2010. There have been many infrastructure improvements, including rewrite of previous Java utilities to now use existing or newly written Python utilities in the open-source CCTBX portion of the Phenix software system. This improves long-term maintainability and enhances the thorough integration of MolProbity-style validation within Phenix. There is now a complete MolProbity mirror site at . GitHub serves our open-source code, reference datasets, and the resulting multi-dimensional distributions that define most validation criteria. Coordinate output after Asn/Gln/His flip correction is now more idealized, since the post-refinement step has apparently often been skipped in the past. Two distinct sets of heavy-atom-to-hydrogen distances and accompanying van der Waals radii have been researched and improved in accuracy, one for the electron-cloud-center positions suitable for X-ray crystallography and one for nuclear positions. New validations include messages at input about problem-causing format irregularities, updates of Ramachandran and rotamer criteria from the million quality-filtered residues in a new reference dataset, the CaBLAM C-CO virtual-angle analysis of backbone and secondary structure for cryoEM or low-resolution X-ray, and flagging of the very rare cis-nonProline and twisted peptides which have recently been greatly overused. Due to wide application of MolProbity validation and corrections by the research community, in Phenix, and at the worldwide Protein Data Bank, newly deposited structures have continued to improve greatly as measured by MolProbity's unique all-atom clashscore.",10.1002/pro.3330
J,"Afgan, E; Baker, D; Batut, B; van den Beek, M; Bouvier, D; Cech, M; Chilton, J; Clements, D; Coraor, N; Grüning, BA; Guerler, A; Hillman-Jackson, J; Hiltemann, S; Jalili, V; Rasche, H; Soranzo, N; Goecks, J; Taylor, J; Nekrutenko, A; Blankenberg, D","The Galaxy platform for accessible, reproducible and collaborative biomedical analyses: 2018 update","Galaxy (homepage: https://galaxyproject.org, main public server: https://usegalaxy.org) is a web-based scientific analysis platform used by tens of thousands of scientists across the world to analyze large biomedical datasets such as those found in genomics, proteomics, metabolomics and imaging. Started in 2005, Galaxy continues to focus on three key challenges of data-driven biomedical science: making analyses accessible to all researchers, ensuring analyses are completely reproducible, and making it simple to communicate analyses so that they can be reused and extended. During the last two years, the Galaxy team and the open-source community around Galaxy have made substantial improvements to Galaxy's core framework, user interface, tools, and training materials. Framework and user interface improvements now enable Galaxy to be used for analyzing tens of thousands of datasets, and >5500 tools are now available from the Galaxy ToolShed. The Galaxy community has led an effort to create numerous high-quality tutorials focused on common types of genomic analyses. The Galaxy developer and user communities continue to grow and be integral to Galaxy's development. The number of Galaxy public servers, developers contributing to the Galaxy framework and its tools, and users of the main Galaxy server have all increased substantially.",10.1093/nar/gky379
J,"Kim, DH; Sarbassov, DD; Ali, SM; King, JE; Latek, RR; Erdjument-Bromage, H; Tempst, P; Sabatini, DM",MTOR interacts with Raptor to form a nutrient-sensitive complex that signals to the cell growth machinery,"mTOR/RAFT1/FRAP is the target of the immunosuppressive drug rapamycin and the central component of a nutrient- and hormone-sensitive signaling pathway that regulates cell growth. We report that mTOR forms a stoichiometric complex with raptor, an evolutionarily conserved protein with at least two roles in the mTOR pathway. Raptor has a positive role in nutrient-stimulated signaling to the downstream effector S6K1, maintenance of cell size, and mTOR protein expression. The association of raptor with mTOR also negatively regulates the mTOR kinase activity. Conditions that repress the pathway, such as nutrient deprivation and mitochondrial uncoupling, stabilize the mTOR-raptor association and inhibit mTOR kinase activity. We propose that raptor is a missing component of the mTOR pathway that through its association with mTOR regulates cell size in response to nutrient levels.",10.1016/S0092-8674(02)00808-5
J,"Metsalu, T; Vilo, J",ClustVis: a web tool for visualizing clustering of multivariate data using Principal Component Analysis and heatmap,"The Principal Component Analysis (PCA) is a widely used method of reducing the dimensionality of high-dimensional data, often followed by visualizing two of the components on the scatterplot. Although widely used, the method is lacking an easy-to-use web interface that scientists with little programming skills could use to make plots of their own data. The same applies to creating heatmaps: it is possible to add conditional formatting for Excel cells to show colored heatmaps, but for more advanced features such as clustering and experimental annotations, more sophisticated analysis tools have to be used. We present a web tool called ClustVis that aims to have an intuitive user interface. Users can upload data from a simple delimited text file that can be created in a spreadsheet program. It is possible to modify data processing methods and the final appearance of the PCA and heatmap plots by using drop-down menus, text boxes, sliders etc. Appropriate defaults are given to reduce the time needed by the user to specify input parameters. As an output, users can download PCA plot and heatmap in one of the preferred file formats. This web server is freely available at http://biit.cs.ut.ee/clustvis/.",10.1093/nar/gkv468
J,"Kanehisa, M; Goto, S; Sato, Y; Kawashima, M; Furumichi, M; Tanabe, M","Data, information, knowledge and principle: back to metabolism in KEGG","In the hierarchy of data, information and knowledge, computational methods play a major role in the initial processing of data to extract information, but they alone become less effective to compile knowledge from information. The Kyoto Encyclopedia of Genes and Genomes (KEGG) resource (http://www.kegg.jp/ or http://www.genome.jp/kegg/) has been developed as a reference knowledge base to assist this latter process. In particular, the KEGG pathway maps are widely used for biological interpretation of genome sequences and other high-throughput data. The link from genomes to pathways is made through the KEGG Orthology system, a collection of manually defined ortholog groups identified by K numbers. To better automate this interpretation process the KEGG modules defined by Boolean expressions of K numbers have been expanded and improved. Once genes in a genome are annotated with K numbers, the KEGG modules can be computationally evaluated revealing metabolic capacities and other phenotypic features. The reaction modules, which represent chemical units of reactions, have been used to analyze design principles of metabolic networks and also to improve the definition of K numbers and associated annotations. For translational bioinformatics, the KEGG MEDICUS resource has been developed by integrating drug labels (package inserts) used in society.",10.1093/nar/gkt1076
J,"Simon, HU; Haj-Yehia, A; Levi-Schaffer, F",Role of reactive oxygen species (ROS) in apoptosis induction,"Reactive oxygen species (ROS) and mitochondria play an important role in apoptosis induction under both physiologic and pathologic conditions. Interestingly, mitochondria are both source and target of ROS. Cytochrome c release from mitochondria, that triggers caspase activation, appears to be largely mediated by direct or indirect ROS action. On the other hand, ROS have also anti-apoptotic effects. This review focuses on the role of ROS in the regulation of apoptosis, especially in inflammatory cells.",10.1023/A:1009616228304
J,"Bailey, TL; Johnson, J; Grant, CE; Noble, WS",The MEME Suite,"The MEME Suite is a powerful, integrated set of web-based tools for studying sequence motifs in proteins, DNA and RNA. Such motifs encode many biological functions, and their detection and characterization is important in the study of molecular interactions in the cell, including the regulation of gene expression. Since the previous description of the MEME Suite in the 2009 Nucleic Acids Research Web Server Issue, we have added six new tools. Here we describe the capabilities of all the tools within the suite, give advice on their best use and provide several case studies to illustrate how to combine the results of various MEME Suite tools for successful motif-based analyses. The MEME Suite is freely available for academic use at http://meme-suite.org, and source code is also available for download and local installation.",10.1093/nar/gkv416
J,"Martinez, FO; Sica, A; Mantovani, A; Locati, M",Macrophage activation and polarization,"Macrophages are widely distributed immune system cells that play an indispensable role in homeostasis and defense. They can be phenotypically polarized by the microenvironment to mount specific functional programs. Polarized macrophages can be broadly classified in two main groups: classically activated macrophages (or M1), whose prototypical activating stimuli are IFNgamma and LPS, and alternatively activated macrophages (or M2), further subdivided in M2a (after exposure to IL-4 or IL-13), M2b (immune complexes in combination with IL-1beta or LPS) and M2c (IL-10, TGFbeta or glucocorticoids). M1 exhibit potent microbicidal properties and promote strong IL-12-mediated Th1 responses, whilst M2 support Th2-associated effector functions. Beyond infection M2 polarized macrophages play a role in resolution of inflammation through high endocityc clearance capacities and trophic factor synthesis, accompanied by reduced pro-inflammatory cytokine secretion. Similar functions are also exerted by tumor-associated macrophages (TAM), which also display an alternative-like activation phenotype and play a detrimental pro-tumoral role. Here we review the main functions of polarized macrophages and discuss the perpectives of this field.",10.2741/2692
J,"Davey Smith, G; Hemani, G",Mendelian randomization: genetic anchors for causal inference in epidemiological studies,"Observational epidemiological studies are prone to confounding, reverse causation and various biases and have generated findings that have proved to be unreliable indicators of the causal effects of modifiable exposures on disease outcomes. Mendelian randomization (MR) is a method that utilizes genetic variants that are robustly associated with such modifiable exposures to generate more reliable evidence regarding which interventions should produce health benefits. The approach is being widely applied, and various ways to strengthen inference given the known potential limitations of MR are now available. Developments of MR, including two-sample MR, bidirectional MR, network MR, two-step MR, factorial MR and multiphenotype MR, are outlined in this review. The integration of genetic information into population-based epidemiological studies presents translational opportunities, which capitalize on the investment in genomic discovery research.",10.1093/hmg/ddu328
J,"Kanehisa, M; Goto, S; Hattori, M; Aoki-Kinoshita, KF; Itoh, M; Kawashima, S; Katayama, T; Araki, M; Hirakawa, M",From genomics to chemical genomics: new developments in KEGG,"The increasing amount of genomic and molecular information is the basis for understanding higher-order biological systems, such as the cell and the organism, and their interactions with the environment, as well as for medical, industrial and other practical applications. The KEGG resource (http://www.genome.jp/kegg/) provides a reference knowledge base for linking genomes to biological systems, categorized as building blocks in the genomic space (KEGG GENES) and the chemical space (KEGG LIGAND), and wiring diagrams of interaction networks and reaction networks (KEGG PATHWAY). A fourth component, KEGG BRITE, has been formally added to the KEGG suite of databases. This reflects our attempt to computerize functional interpretations as part of the pathway reconstruction process based on the hierarchically structured knowledge about the genomic, chemical and network spaces. In accordance with the new chemical genomics initiatives, the scope of KEGG LIGAND has been significantly expanded to cover both endogenous and exogenous molecules. Specifically, RPAIR contains curated chemical structure transformation patterns extracted from known enzymatic reactions, which would enable analysis of genome-environment interactions, such as the prediction of new reactions and new enzyme genes that would degrade new environmental compounds. Additionally, drug information is now stored separately and linked to new KEGG DRUG structure maps.",10.1093/nar/gkj102
J,"Verdonk, ML; Cole, JC; Hartshorn, MJ; Murray, CW; Taylor, RD",Improved protein-ligand docking using GOLD,"The Chemscore function was implemented as a scoring function for the protein-ligand docking program GOLD, and its performance compared to the original Goldscore function and two consensus docking protocols, ""Goldscore-CS"" and ""Chemscore-GS,"" in terms of docking accuracy, prediction of binding affinities, and speed. In the ""Goldscore-GS"" protocol, dockings produced with the Goldscore function are scored and ranked with the Chemscore function; in the ""Chemscore-GS"" protocol, dockings produced with the Chemscore function are scored and ranked with the Goldscore function. Comparisons were made for a ""clean"" set of 224 protein-ligand complexes, and for two subsets of this set, one for which the ligands are ""drug-like,"" the other for which they are ""fragment-like."" For ""drug-like"" and ""fragment-like"" ligands, the docking accuracies obtained with Chemscore and Goldscore functions are similar. For larger ligands, Goldscore gives superior results. Docking with the Chemscore function is up to three times faster than docking with the Goldscore function. Both combined docking protocols give significant improvements in docking accuracy over the use of the Goldscore or Chemscore function alone. ""Goldscore-GS"" gives success rates of up to 81% (top-ranked GOLD solution within 2.0 Angstrom of the experimental binding mode) for the ""clean list,"" but at the cost of long search times. For most virtual screening applications, ""Chemscore-GS"" seems optimal; search settings that give docking speeds of around 0.25-1.3 min/compound have success rates of about 78% for ""drug-like"" compounds and 85% for ""fragment-like"" compounds. In terms of producing binding energy estimates, the Goldscore function appears to perform better than the Chemscore function and the two consensus protocols, particularly for faster search settings. Even at docking speeds of around 1-2 min/compound, the Goldscore function predicts binding energies with a standard deviation of similar to10.5 kJ/mol. (C) 2003 Wiley-Liss, Inc.",10.1002/prot.10465
J,"Rosenberg, SA; Yang, JC; Restifo, NP",Cancer immunotherapy: moving beyond current vaccines,"Great progress has been made in the field of tumor immunology in the past decade, but optimism about the clinical application of currently available cancer vaccine approaches is based more on surrogate endpoints than on clinical tumor regression. In our cancer vaccine trials of 440 patients, the objective response rate was low (2.6%), and comparable to the results obtained by others. We consider here results in cancer vaccine trials and highlight alternate strategies that mediate cancer regression in preclinical and clinical models.",10.1038/nm1100
J,"Sing, T; Sander, O; Beerenwinkel, N; Lengauer, T",ROCR: visualizing classifier performance in R,"ROCR is a package for evaluating and visualizing the performance of scoring classifiers in the statistical language R. It features over 25 performance measures that can be freely combined to create two-dimensional performance curves. Standard methods for investigating trade-offs between specific performance measures are available within a uniform framework, including receiver operating characteristic (ROC) graphs, precision/recall plots, lift charts and cost curves. ROCR integrates tightly with R's powerful graphics capabilities, thus allowing for highly adjustable plots. Being equipped with only three commands and reasonable default values for optional parameters, ROCR combines flexibility with ease of usage.",10.1093/bioinformatics/bti623
J,"Twig, G; Elorza, A; Molina, AJA; Mohamed, H; Wikstrom, JD; Walzer, G; Stiles, L; Haigh, SE; Katz, S; Las, G; Alroy, J; Wu, M; Py, BF; Yuan, J; Deeney, JT; Corkey, BE; Shirihai, OS",Fission and selective fusion govern mitochondrial segregation and elimination by autophagy,"Accumulation of depolarized mitochondria within beta-cells has been associated with oxidative damage and development of diabetes. To determine the source and fate of depolarized mitochondria, individual mitochondria were photolabeled and tracked through fusion and fission. Mitochondria were found to go through frequent cycles of fusion and fission in a 'kiss and run' pattern. Fission events often generated uneven daughter units: one daughter exhibited increased membrane potential (Delta psi(m)) and a high probability of subsequent fusion, while the other had decreased membrane potential and a reduced probability for a fusion event. Together, this pattern generated a subpopulation of non-fusing mitochondria that were found to have reduced Delta psi(m) and decreased levels of the fusion protein OPA1. Inhibition of the fission machinery through DRP1(K38A) or FIS1 RNAi decreased mitochondrial autophagy and resulted in the accumulation of oxidized mitochondrial proteins, reduced respiration and impaired insulin secretion. Pulse chase and arrest of autophagy at the pre-proteolysis stage reveal that before autophagy mitochondria lose Delta psi(m) and OPA1, and that overexpression of OPA1 decreases mitochondrial autophagy. Together, these findings suggest that fission followed by selective fusion segregates dysfunctional mitochondria and permits their removal by autophagy.",10.1038/sj.emboj.7601963
J,"Furman, D; Campisi, J; Verdin, E; Carrera-Bastos, P; Targ, S; Franceschi, C; Ferrucci, L; Gilroy, DW; Fasano, A; Miller, GW; Miller, AH; Mantovani, A; Weyand, CM; Barzilai, N; Goronzy, JJ; Rando, TA; Effros, RB; Lucia, A; Kleinstreuer, N; Slavich, GM",Chronic inflammation in the etiology of disease across the life span,"Although intermittent increases in inflammation are critical for survival during physical injury and infection, recent research has revealed that certain social, environmental and lifestyle factors can promote systemic chronic inflammation (SCI) that can, in turn, lead to several diseases that collectively represent the leading causes of disability and mortality worldwide, such as cardiovascular disease, cancer, diabetes mellitus, chronic kidney disease, non-alcoholic fatty liver disease and autoimmune and neurodegenerative disorders. In the present Perspective we describe the multi-level mechanisms underlying SCI and several risk factors that promote this health-damaging phenotype, including infections, physical inactivity, poor diet, environmental and industrial toxicants and psychological stress. Furthermore, we suggest potential strategies for advancing the early diagnosis, prevention and treatment of SCI.",10.1038/s41591-019-0675-0
J,"Wang, TJ; Larson, MG; Vasan, RS; Cheng, S; Rhee, EP; McCabe, E; Lewis, GD; Fox, CS; Jacques, PF; Fernandez, C; O'Donnell, CJ; Carr, SA; Mootha, VK; Florez, JC; Souza, A; Melander, O; Clish, CB; Gerszten, RE",Metabolite profiles and the risk of developing diabetes,"Emerging technologies allow the high-throughput profiling of metabolic status from a blood specimen (metabolomics). We investigated whether metabolite profiles could predict the development of diabetes. Among 2,422 normoglycemic individuals followed for 12 years, 201 developed diabetes. Amino acids, amines and other polar metabolites were profiled in baseline specimens by liquid chromatography-tandem mass spectrometry (LC-MS). Cases and controls were matched for age, body mass index and fasting glucose. Five branched-chain and aromatic amino acids had highly significant associations with future diabetes: isoleucine, leucine, valine, tyrosine and phenylalanine. A combination of three amino acids predicted future diabetes (with a more than fivefold higher risk for individuals in top quartile). The results were replicated in an independent, prospective cohort. These findings underscore the potential key role of amino acid metabolism early in the pathogenesis of diabetes and suggest that amino acid profiles could aid in diabetes risk assessment.",10.1038/nm.2307
J,"Schliep, KP",phangorn: phylogenetic analysis in R,"phangorn is a package for phylogenetic reconstruction and analysis in the R language. Previously it was only possible to estimate phylogenetic trees with distance methods in R. phangorn, now offers the possibility of reconstructing phylogenies with distance based methods, maximum parsimony or maximum likelihood (ML) and performing Hadamard conjugation. Extending the general ML framework, this package provides the possibility of estimating mixture and partition models. Furthermore, phangorn offers several functions for comparing trees, phylogenetic models or splits, simulating character data and performing congruence analyses.",10.1093/bioinformatics/btq706
J,"Letunic, I; Bork, P",Interactive Tree Of Life (iTOL): an online tool for phylogenetic tree display and annotation,"Interactive Tree Of Life (iTOL) is a web-based tool for the display, manipulation and annotation of phylogenetic trees. Trees can be interactively pruned and re-rooted. Various types of data such as genome sizes or protein domain repertoires can be mapped onto the tree. Export to several bitmap and vector graphics formats is supported.",10.1093/bioinformatics/btl529
