Publication Type,Authors,Title,Abstract,DOI
J,"Du, CY; Fang, M; Li, YC; Li, L; Wang, XD","Smac, a mitochondrial protein that promotes cytochrome c-dependent caspase activation by eliminating IAP inhibition","We report here the identification of a novel protein, Smac, which promotes caspase activation in the cytochrome c/Apaf-1/caspase-9 pathway. Smac promotes caspase-9 activation by binding to inhibitor of apoptosis proteins, IAPs, and removing their inhibitory activity. Smac is normally a mitochondrial protein but is released into the cytosol when cells undergo apoptosis. Mitochondrial import and cleavage of its signal peptide are required for Smac to gain its apoptotic activity. Overexpression of Smac increases cells' sensitivity to apoptotic stimuli. Smac is the second mitochondrial protein, along with cytochrome c, that promotes apoptosis by activating caspases.",10.1016/S0092-8674(00)00008-8
J,"Horton, P; Park, KJ; Obayashi, T; Fujita, N; Harada, H; Adams-Collier, CJ; Nakai, K",WoLF PSORT: protein localization predictor,"WoLF PSORT is an extension of the PSORT II program for protein subcellular location prediction. WoLF PSORT converts protein amino acid sequences into numerical localization features; based on sorting signals, amino acid composition and functional motifs such as DNA-binding motifs. After conversion, a simple k-nearest neighbor classifier is used for prediction. Using html, the evidence for each prediction is shown in two ways: (i) a list of proteins of known localization with the most similar localization features to the query, and (ii) tables with detailed information about individual localization features. For convenience, sequence alignments of the query to similar proteins and links to UniProt and Gene Ontology are provided. Taken together, this information allows a user to understand the evidence (or lack thereof) behind the predictions made for particular proteins. WoLF PSORT is available at wolfpsort.org.",10.1093/nar/gkm259
J,"Szklarczyk, D; Franceschini, A; Kuhn, M; Simonovic, M; Roth, A; Minguez, P; Doerks, T; Stark, M; Muller, J; Bork, P; Jensen, LJ; von Mering, C","The STRING database in 2011: functional interaction networks of proteins, globally integrated and scored","An essential prerequisite for any systems-level understanding of cellular functions is to correctly uncover and annotate all functional interactions among proteins in the cell. Toward this goal, remarkable progress has been made in recent years, both in terms of experimental measurements and computational prediction techniques. However, public efforts to collect and present protein interaction information have struggled to keep up with the pace of interaction discovery, partly because protein-protein interaction information can be error-prone and require considerable effort to annotate. Here, we present an update on the online database resource Search Tool for the Retrieval of Interacting Genes (STRING); it provides uniquely comprehensive coverage and ease of access to both experimental as well as predicted interaction information. Interactions in STRING are provided with a confidence score, and accessory information such as protein domains and 3D structures is made available, all within a stable and consistent identifier space. New features in STRING include an interactive network viewer that can cluster networks on demand, updated on-screen previews of structural information including homology models, extensive data updates and strongly improved connectivity and integration with third-party resources. Version 9.0 of STRING covers more than 1100 completely sequenced organisms; the resource can be reached at http://string-db.org.",10.1093/nar/gkq973
J,"Chong, J; Soufan, O; Li, C; Caraus, I; Li, SZ; Bourque, G; Wishart, DS; Xia, JG",MetaboAnalyst 4.0: towards more transparent and integrative metabolomics analysis,"We present a new update to MetaboAnalyst (version 4.0) for comprehensive metabolomic data analysis, interpretation, and integration with other omics data. Since the last major update in 2015, MetaboAnalyst has continued to evolve based on user feedback and technological advancements in the field. For this year's update, four newkey features have been added to MetaboAnalyst 4.0, including: (1) real-time R command tracking and display coupled with the release of a companion MetaboAnalystR package; (2) a MS Peaks to Pathways module for prediction of pathway activity from untargeted mass spectral data using themummichog algorithm; (3) a Biomarker Meta-analysis module for robust biomarker identification through the combination of multiple metabolomic datasets and (4) a Network Explorer module for integrative analysis of metabolomics, metagenomics, and/or transcriptomics data. The user interface of MetaboAnalyst 4.0 has been reengineered to provide a more modern look and feel, as well as to give more space and flexibility to introduce new functions. The underlying knowledgebases (compound libraries, metabolite sets, and metabolic pathways) have also been updated based on the latest data from the Human Metabolome Database (HMDB). A Docker image of MetaboAnalyst is also available to facilitate download and local installation of MetaboAnalyst. MetaboAnalyst 4.0 is freely available at http://metaboanalyst.ca.",10.1093/nar/gky310
J,"Epstein, ACR; Gleadle, JM; McNeill, LA; Hewitson, KS; O'Rourke, J; Mole, DR; Mukherji, M; Metzen, E; Wilson, MI; Dhanda, A; Tian, YM; Masson, N; Hamilton, DL; Jaakkola, P; Barstead, R; Hodgkin, J; Maxwell, PH; Pugh, CW; Schofield, CJ; Ratcliffe, PJ",<i>C-elegans</i> EGL-9 and mammalian homologs define a family of dioxygenases that regulate HIF by prolyl hydroxylation,"HIF is a transcriptional complex that plays a central role in mammalian oxygen homeostasis. Recent studies have defined posttranslational modification by prolyl hydroxylation as a key regulatory event that targets HIF-alpha. subunits for proteasomal destruction via the von Hippel-Lindau ubiquitylation complex. Here, we define a conserved HIF-VHL-prolyl hydroxylase pathway in C. elegans, and use a genetic approach to identify EGL-9 as a dioxygenase that regulates HIF by prolyl hydroxylation. In mammalian cells, we show that the HIF-prolyl hydroxylases are represented by a series of isoforms bearing a conserved 2-histidine-1-carboxylate iron coordination motif at the catalytic site. Direct modulation of recombinant enzyme activity by graded hypoxia, iron chelation, and cobaltous ions mirrors the characteristics of HIF induction in vivo, fulfilling requirements for these enzymes being oxygen sensors that regulate HIF.",10.1016/S0092-8674(01)00507-4
J,"Hubisz, MJ; Falush, D; Stephens, M; Pritchard, JK",Inferring weak population structure with the assistance of sample group information,"Genetic clustering algorithms require a certain amount of data to produce informative results. In the common situation that individuals are sampled at several locations, we show how sample group information can be used to achieve better results when the amount of data is limited. New models are developed for the STRUCTURE program, both for the cases of admixture and no admixture. These models work by modifying the prior distribution for each individual's population assignment. The new prior distributions allow the proportion of individuals assigned to a particular cluster to vary by location. The models are tested on simulated data, and illustrated using microsatellite data from the CEPH Human Genome Diversity Panel. We demonstrate that the new models allow structure to be detected at lower levels of divergence, or with less data, than the original STRUCTURE models or principal components methods, and that they are not biased towards detecting structure when it is not present. These models are implemented in a new version of STRUCTURE which is freely available online at http://pritch.bsd.uchicago.edu/structure.html.",10.1111/j.1755-0998.2009.02591.x
J,"Carbon, S; Douglass, E; Dunn, N; Good, B; Harris, NL; Lewis, SE; Mungall, CJ; Basu, S; Chisholm, RL; Dodson, RJ; Hartline, E; Fey, P; Thomas, PD; Albou, LP; Ebert, D; Kesling, MJ; Mi, H; Muruganujian, A; Huang, X; Poudel, S; Mushayahama, T; Hu, JC; LaBonte, SA; Siegele, DA; Antonazzo, G; Attrill, H; Brown, NH; Fexova, S; Garapati, P; Jones, TEM; Marygold, SJ; Millburn, GH; Rey, AJ; Trovisco, V; dos Santos, G; Emmert, DB; Falls, K; Zhou, P; Goodman, JL; Strelets, VB; Thurmond, J; Courtot, M; Osumi-Sutherland, D; Parkinson, H; Roncaglia, P; Acencio, ML; Kuiper, M; Laegreid, A; Logie, C; Lovering, RC; Huntley, RP; Denny, P; Campbell, NH; Kramarz, B; Acquaah, V; Ahmad, SH; Chen, H; Rawson, JH; Chibucos, MC; Giglio, M; Nadendla, S; Tauber, R; Duesbury, MJ; Del-Toro, N; Meldal, BHM; Perfetto, L; Porras, P; Orchard, S; Shrivastava, A; Xie, Z; Chang, HY; Finn, RD; Mitchell, AL; Rawlings, ND; Richardson, L; Sangrador-Vegas, A; Blake, JA; Christie, KR; Dolan, ME; Drabkin, HJ; Hill, DP; Ni, L; Sitnikov, D; Harris, MA; Oliver, SG; Ruther-Ford, K; Wood, V; Hayles, J; Bahler, J; Lock, A; Bolton, ER; De Pons, J; Dwinell, M; Hayman, GT; Laulederkind, SJF; Shimoyama, M; Tutaj, M; Wang, SJ; D'Eustachio, P; Matthews, L; Balhoff, JP; Aleksander, SA; Binkley, G; Dunn, BL; Cherry, JM; Engel, SR; Gondwe, F; Karra, K; MacPherson, KA; Miyasato, SR; Nash, RS; Ng, PC; Sheppard, TK; Shrivatsav, VPA; Simison, M; Skrzypek, MS; Weng, S; Wong, ED; Feuermann, M; Gaudet, P; Bakker, E; Berardini, TZ; Reiser, L; Subramaniam, S; Huala, E; Arighi, C; Auchincloss, A; Axelsen, K; Argoud-Puy, G; Bateman, A; Bely, B; Blatter, MC; Boutet, E; Breuza, L; Bridge, A; Britto, R; Bye-A-Jee, H; Casals-Casas, C; Coudert, E; Estreicher, A; Famiglietti, L; Garmiri, P; Georghiou, G; Gos, A; Gruaz-Gumowski, N; Hatton-Ellis, E; Hinz, U; Hulo, C; Ignatchenko, A; Jungo, F; Keller, G; Laiho, K; Lemercier, P; Lieberherr, D; Lussi, Y; Mac-Dougall, A; Magrane, M; Martin, MJ; Masson, P; Natale, DA; Hyka-Nouspikel, N; Pedruzzi, I; Pichler, K; Poux, S; Rivoire, C; Rodríguez-López, M; Sawford, T; Speretta, E; Shypitsyna, A; Stutz, A; Sundaram, S; Tognolli, M; Tyagi, N; Warner, K; Zaru, R; Wu, C; Diehl, AD; Chan, J; Cho, J; Gao, S; Grove, C; Harrison, MC; Howe, K; Lee, R; Mendel, J; Muller, HM; Raciti, D; Van Auken, K; Berriman, M; Stein, L; Sternberg, PW; Howe, D; Toro, S; Westerfield, M",The Gene Ontology Resource: 20 years and still GOing strong,"The Gene Ontology resource (GO; http://geneontology.org) provides structured, computable knowledge regarding the functions of genes and gene products. Founded in 1998, GO has become widely adopted in the life sciences, and its contents are under continual improvement, both in quantity and in quality. Here, we report the major developments of the GO resource during the past two years. Each monthly release of the GO resource is now packaged and given a unique identifier (DOI), enabling GO-based analyses on a specific release to be reproduced in the future. The molecular function ontology has been refactored to better represent the overall activities of gene products, with a focus on transcription regulator activities. Quality assurance efforts have been ramped up to address potentially out-of-date or inaccurate annotations. New evidence codes for high-throughput experiments now enable users to filter out annotations obtained from these sources. GO-CAM, a new framework for representing gene function that is more expressive than standard GO annotations, has been released, and users can now explore the growing repository of these models. We also provide the GO ribbon' widget for visualizing GO annotations to a gene; the widget can be easily embedded in any web page.",10.1093/nar/gky1055
J,"Lemmon, MA; Schlessinger, J",Cell Signaling by Receptor Tyrosine Kinases,"Recent structural studies of receptor tyrosine kinases (RTKs) have revealed unexpected diversity in the mechanisms of their activation by growth factor ligands. Strategies for inducing dimerization by ligand binding are surprisingly diverse, as are mechanisms that couple this event to activation of the intracellular tyrosine kinase domains. As our understanding of these details becomes increasingly sophisticated, it provides an important context for therapeutically countering the effects of pathogenic RTK mutations in cancer and other diseases. Much remains to be learned, however, about the complex signaling networks downstream from RTKs and how alterations in these networks are translated into cellular responses.",10.1016/j.cell.2010.06.011
J,"Lagos-Quintana, M; Rauhut, R; Yalcin, A; Meyer, J; Lendeckel, W; Tuschl, T",Identification of tissue-specific microRNAs from mouse,"MicroRNAs (miRNAs) are a new class of noncoding RNAs, which are encoded as short inverted repeats in the genomes of invertebrates and vertebrates [1, 2]. It is believed that miRNAs are modulators of target mRNA translation and stability, although most target mRNAs remain to be identified. Here we describe the identification of 34 novel miRNAs by tissue-specific cloning of approximately 21-nucleotide RNAs from mouse. Almost all identified miRNAs are conserved in the human genome and are also frequently found in nonmammalian vertebrate genomes, such as pufferfish. In heart, liver, or brain, it is found that a single, tissue-specifically expressed miRNA dominates the population of expressed miRNAs and suggests a role for these miRNAs in tissue specification or cell lineage decisions. Finally, a miRNA was identified that appears to be the fruitfly and mammalian ortholog of C. elegans lin-4 stRNA.",10.1016/S0960-9822(02)00809-6
J,"Yang, YH; Dudoit, S; Luu, P; Lin, DM; Peng, V; Ngai, J; Speed, TP",Normalization for cDNA microarray data: a robust composite method addressing single and multiple slide systematic variation,"There are many sources of systematic variation in cDNA microarray experiments which affect the measured gene expression levels (e.g. differences in labeling efficiency between the two fluorescent dyes). The term normalization refers to the process of removing such variation. A constant adjustment is often used to force the distribution of the Intensity log ratios to have a median of zero for each slide. However, such global normalization approaches are not adequate in situations where dye biases can depend on spot overall intensity and/or spatial location within the array. This article proposes normalization methods that are based on robust local regression and account for intensity and spatial dependence in dye biases for different types of cDNA microarray experiments. The selection of appropriate controls for normalization is discussed and a novel set of controls (microarray sample pool, MSP) is Introduced to aid In intensity-dependent normalization. Lastly, to allow for comparisons of expression levels across slides, a robust method based on maximum likelihood estimation is proposed to adjust for scale differences among slides.",10.1093/nar/30.4.e15
J,"Goddard, TD; Huang, CC; Meng, EC; Pettersen, EF; Couch, GS; Morris, JH; Ferrin, TE",UCSF ChimeraX: Meeting modern challenges in visualization and analysis,"UCSF ChimeraX is next-generation software for the visualization and analysis of molecular structures, density maps, 3D microscopy, and associated data. It addresses challenges in the size, scope, and disparate types of data attendant with cutting-edge experimental methods, while providing advanced options for high-quality rendering (interactive ambient occlusion, reliable molecular surface calculations, etc.) and professional approaches to software design and distribution. This article highlights some specific advances in the areas of visualization and usability, performance, and extensibility. ChimeraX is free for noncommercial use and is available from / for Windows, Mac, and Linux.",10.1002/pro.3235
J,"Dolinsky, TJ; Nielsen, JE; McCammon, JA; Baker, NA",PDB2PQR: an automated pipeline for the setup of Poisson-Boltzmann electrostatics calculations,"Continuum solvation models, such as Poisson-Boltzmann and Generalized Born methods, have become increasingly popular tools for investigating the influence of electrostatics on biomolecular structure, energetics and dynamics. However, the use of such methods requires accurate and complete structural data as well as force field parameters such as atomic charges and radii. Unfortunately, the limiting step in continuum electrostatics calculations is often the addition of missing atomic coordinates to molecular structures from the Protein Data Bank and the assignment of parameters to biomolecular structures. To address this problem, we have developed the PDB2PQR web service (http://agave.wustl.edu/pdb2pqr/). This server automates many of the common tasks of preparing structures for continuum electrostatics calculations, including adding a limited number of missing heavy atoms to biomolecular structures, estimating titration states and protonating biomolecules in a manner consistent with favorable hydrogen bonding, assigning charge and radius parameters from a variety of force fields, and finally generating 'PQR' output compatible with several popular computational biology packages. This service is intended to facilitate the setup and execution of electrostatics calculations for both experts and non-experts and thereby broaden the accessibility to the biological community of continuum electrostatics analyses of biomolecular systems.",10.1093/nar/gkh381
J,"Whyte, WA; Orlando, DA; Hnisz, D; Abraham, BJ; Lin, CY; Kagey, MH; Rahl, PB; Lee, TI; Young, RA",Master Transcription Factors and Mediator Establish Super-Enhancers at Key Cell Identity Genes,"Master transcription factors Oct4, Sox2, and Nanog bind enhancer elements and recruit Mediator to activate much of the gene expression program of pluripotent embryonic stem cells (ESCs). We report here that the ESC master transcription factors form unusual enhancer domains at most genes that control the pluripotent state. These domains, which we call super-enhancers, consist of clusters of enhancers that are densely occupied by the master regulators and Mediator. Super-enhancers differ from typical enhancers in size, transcription factor density and content, ability to activate transcription, and sensitivity to perturbation. Reduced levels of Oct4 or Mediator cause preferential loss of expression of super-enhancer-associated genes relative to other genes, suggesting how changes in gene expression programs might be accomplished during development. In other more differentiated cells, super-enhancers containing cell-type-specific master transcription factors are also found at genes that define cell identity. Super-enhancers thus play key roles in the control of mammalian cell identity.",10.1016/j.cell.2013.03.035
J,"Kozomara, A; Birgaoanu, M; Griffiths-Jones, S",miRBase: from microRNA sequences to function,"miRBase catalogs, names and distributes microRNA gene sequences. The latest release of miRBase (v22) contains microRNA sequences from 271 organisms: 38589 hairpin precursors and 48860 mature microRNAs. We describe improvements to the database and website to provide more information about the quality of microRNA gene annotations, and the cellular functions of their products. We have collected 1493 small RNA deep sequencing datasets and mapped a total of 5.5 billion reads to microRNA sequences. The read mapping patterns provide strong support for the validity of between 20% and 65% of microRNA annotations in different well-studied animal genomes, and evidence for the removal of >200 sequences from the database. To improve the availability of microRNA functional information, we are disseminating Gene Ontology terms annotated against miRBase sequences. We have also used a text-mining approach to search for microRNA gene names in the full-text of open access articles. Over 500 000 sentences from 18 542 papers contain microRNA names. We score these sentences for functional information and link them with 12 519 microRNA entries. The sentences themselves, and word clouds built from them, provide effective summaries of the functional information about specific microRNAs. miRBase is publicly and freely available at http://mirbase.org/.",10.1093/nar/gky1141
J,"Cawthon, RM",Telomere measurement by quantitative PCR,"It has long been presumed impossible to measure telomeres in vertebrate DNA by PCR amplification with oligonucleotide primers designed to hybridize to the TTAGGG and CCCTAA repeats, because only primer dimer-derived products are expected. Here we present a primer pair that eliminates this problem, allowing simple and rapid measurement of telomeres in a closed tube, fluorescence-based assay. This assay will facilitate investigations of the biology of telomeres and the roles they play in the molecular pathophysiology of diseases and aging.",10.1093/nar/30.10.e47
J,"Brenchley, JM; Price, DA; Schacker, TW; Asher, TE; Silvestri, G; Rao, S; Kazzaz, Z; Bornstein, E; Lambotte, O; Altmann, D; Blazar, BR; Rodriguez, B; Teixeira-Johnson, L; Landay, A; Martin, JN; Hecht, FM; Picker, LJ; Lederman, MM; Deeks, SG; Douek, DC",Microbial translocation is a cause of systemic immune activation in chronic HIV infection,"Chronic activation of the immune system is a hallmark of progressive HIV infection and better predicts disease outcome than plasma viral load, yet its etiology remains obscure. Here we show that circulating microbial products, probably derived from the gastrointestinal tract, are a cause of HIV-related systemic immune activation. Circulating lipopolysaccharide, which we used as an indicator of microbial translocation, was significantly increased in chronically HIV-infected individuals and in simian immunodeficiency virus (SIV)-infected rhesus macaques (P <= 0.002). We show that increased lipopolysaccharide is bioactive in vivo and correlates with measures of innate and adaptive immune activation. Effective antiretroviral therapy seemed to reduce microbial translocation partially. Furthermore, in nonpathogenic SIV infection of sooty mangabeys, microbial translocation did not seem to occur. These data establish a mechanism for chronic immune activation in the context of a compromised gastrointestinal mucosal surface and provide new directions for therapeutic interventions that modify the consequences of acute HIV infection.",10.1038/nm1511
J,"Köljalg, U; Nilsson, RH; Abarenkov, K; Tedersoo, L; Taylor, AFS; Bahram, M; Bates, ST; Bruns, TD; Bengtsson-Palme, J; Callaghan, TM; Douglas, B; Drenkhan, T; Eberhardt, U; Dueñas, M; Grebenc, T; Griffith, GW; Hartmann, M; Kirk, PM; Kohout, P; Larsson, E; Lindahl, BD; Luecking, R; Martin, MP; Matheny, PB; Nguyen, NH; Niskanen, T; Oja, J; Peay, KG; Peintner, U; Peterson, M; Poldmaa, K; Saag, L; Saar, I; Schüessler, A; Scott, JA; Senes, C; Smith, ME; Suija, A; Taylor, DL; Telleria, MT; Weiss, M; Larsson, KH",Towards a unified paradigm for sequence-based identification of fungi,"The nuclear ribosomal internal transcribed spacer (ITS) region is the formal fungal barcode and in most cases the marker of choice for the exploration of fungal diversity in environmental samples. Two problems are particularly acute in the pursuit of satisfactory taxonomic assignment of newly generated ITS sequences: (i) the lack of an inclusive, reliable public reference data set and (ii) the lack of means to refer to fungal species, for which no Latin name is available in a standardized stable way. Here, we report on progress in these regards through further development of the UNITE database (http://unite.ut.ee) for molecular identification of fungi. All fungal species represented by at least two ITS sequences in the international nucleotide sequence databases are now given a unique, stable name of the accession number type (e.g. Hymenoscyphus pseudoalbidus|GU586904|SH133781.05FU), and their taxonomic and ecological annotations were corrected as far as possible through a distributed, third-party annotation effort. We introduce the term species hypothesis' (SH) for the taxa discovered in clustering on different similarity thresholds (97-99%). An automatically or manually designated sequence is chosen to represent each such SH. These reference sequences are released (http://unite.ut.ee/repository.php) for use by the scientific community in, for example, local sequence similarity searches and in the QIIME pipeline. The system and the data will be updated automatically as the number of public fungal ITS sequences grows. We invite everybody in the position to improve the annotation or metadata associated with their particular fungal lineages of expertise to do so through the new Web-based sequence management system in UNITE.",10.1111/mec.12481
