Publication Type,Authors,Title,Abstract,DOI
J,"Troyanskaya, O; Cantor, M; Sherlock, G; Brown, P; Hastie, T; Tibshirani, R; Botstein, D; Altman, RB",Missing value estimation methods for DNA microarrays,"Motivation: Gene expression microarray experiments can generate data sets with multiple missing expression values. Unfortunately, many algorithms for gene expression analysis require a complete matrix of gene array values as input. For example, methods such as hierarchical clustering and K-means clustering are not robust to missing data, and may lose effectiveness even with a few missing values. Methods for imputing missing data are needed, therefore, to minimize the effect of incomplete data sets on analyses, and to increase the range of data sets to which these algorithms can be applied. In this report, we investigate automated methods for estimating missing data. Results: We present a comparative study of several methods for the estimation of missing values in gene microarray data. We implemented and evaluated three methods: a Singular Value Decomposition (SVD) based method (SVDimpute), weighted K-nearest neighbors (KNNimpute), and row average. We evaluated the methods using a variety of parameter settings and over different real data sets, and assessed the robustness of the imputation methods to the amount of missing data over the range of 1-20% missing values. We show that KNNimpute appears to provide a more robust and sensitive method for missing value estimation than SVDimpute, and both SVDimpute and KNNimpute surpass the commonly used row average method las well as filling missing values with zeros). We report results of the comparative experiments and provide recommendations and tools for accurate estimation of missing microarray data under a variety of conditions.",10.1093/bioinformatics/17.6.520
J,"Aibar, S; González-Blas, CB; Moerman, T; Van, AHT; Imrichova, H; Hulselmans, G; Rambow, F; Marine, JC; Geurts, P; Aerts, J; van den Oord, J; Atak, ZK; Wouters, J; Aerts, S",SCENIC: single-cell regulatory network inference and clustering,"We present SCENIC, a computational method for simultaneous gene regulatory network reconstruction and cell-state identification from single-cell RNA-seq data (http://scenic.aertslab.org). On a compendium of single-cell data from tumors and brain, we demonstrate that cis-regulatory analysis can be exploited to guide the identification of transcription factors and cell states. SCENIC provides critical biological insights into the mechanisms driving cellular heterogeneity.",10.1038/NMETH.4463
J,"Catchen, J; Hohenlohe, PA; Bassham, S; Amores, A; Cresko, WA",Stacks: an analysis tool set for population genomics,"Massively parallel short-read sequencing technologies, coupled with powerful software platforms, are enabling investigators to analyse tens of thousands of genetic markers. This wealth of data is rapidly expanding and allowing biological questions to be addressed with unprecedented scope and precision. The sizes of the data sets are now posing significant data processing and analysis challenges. Here we describe an extension of the Stacks software package to efficiently use genotype-by-sequencing data for studies of populations of organisms. Stacks now produces core population genomic summary statistics and SNP-by-SNP statistical tests. These statistics can be analysed across a reference genome using a smoothed sliding window. Stacks also now provides several output formats for several commonly used downstream analysis packages. The expanded population genomics functions in Stacks will make it a useful tool to harness the newest generation of massively parallel genotyping data for ecological and evolutionary genetics.",10.1111/mec.12354
J,"Muramatsu, M; Kinoshita, K; Fagarasan, S; Yamada, S; Shinkai, Y; Honjo, T","Class switch recombination and hypermutation require activation-induced cytidine deaminase (AID), a potential RNA editing enzyme",Induced overexpression of AID in CH12F3-2 B lymphoma cells augmented class switching from IgM to IgA without cytokine stimulation. AID deficiency caused a complete defect in class switching and showed a hyper-IgM phenotype with enlarged germinal centers containing strongly activated B cells before or after immunization. AID(-/-) spleen cells stimulated in vitro with LPS and cytokines failed to undergo class switch recombination although they expressed germline transcripts. Immunization of AID(-/-) chimera with 4-hydroxy-3-nitrophenylacetyl (NP) chicken gamma-globulin induced neither accumulation of mutations in the NP-specific variable region gene nor class switching. These results suggest that AID may be involved in regulation or catalysis of the DNA modification step of both class switching and somatic hypermutation.,10.1016/S0092-8674(00)00078-7
J,"Aryee, MJ; Jaffe, AE; Corrada-Bravo, H; Ladd-Acosta, C; Feinberg, AP; Hansen, KD; Irizarry, RA",Minfi: a flexible and comprehensive Bioconductor package for the analysis of Infinium DNA methylation microarrays,"Motivation: The recently released Infinium HumanMethylation450 array (the '450k' array) provides a high-throughput assay to quantify DNA methylation (DNAm) at similar to 450000 loci across a range of genomic features. Although less comprehensive than high-throughput sequencing-based techniques, this product is more cost-effective and promises to be the most widely used DNAm high-throughput measurement technology over the next several years. Results: Here we describe a suite of computational tools that incorporate state-of-the-art statistical techniques for the analysis of DNAm data. The software is structured to easily adapt to future versions of the technology. We include methods for preprocessing, quality assessment and detection of differentially methylated regions from the kilobase to the megabase scale. We show how our software provides a powerful and flexible development platform for future methods. We also illustrate how our methods empower the technology to make discoveries previously thought to be possible only with sequencing-based methods.",10.1093/bioinformatics/btu049
J,"Wishart, DS; Knox, C; Guo, AC; Shrivastava, S; Hassanali, M; Stothard, P; Chang, Z; Woolsey, J",DrugBank:: a comprehensive resource for <i>in silico</i> drug discovery and exploration,"DrugBank is a unique bioinformatics/cheminformatics resource that combines detailed drug (i.e. chemical) data with comprehensive drug target (i.e. protein) information. The database contains > 4100 drug entries including > 800 FDA approved small molecule and biotech drugs as well as > 3200 experimental drugs. Additionally, > 14 000 protein or drug target sequences are linked to these drug entries. Each DrugCard entry contains > 80 data fields with half of the information being devoted to drug/chemical data and the other half devoted to drug target or protein data. Many data fields are hyperlinked to other databases(KEGG, PubChem, ChEBI, PDB, Swiss-Prot and GenBank) and a variety of structure viewing applets. The database is fully searchable supporting extensive text, sequence, chemical structure and relational query searches. Potential applications of DrugBank include in silico drug target discovery, drug design, drug docking or screening, drug metabolism prediction, drug interaction prediction and general pharmaceutical education. DrugBank is available at http://redpoll.pharmacy.ualberta.ca/drugbank/.",10.1093/nar/gkj067
J,"Beltrami, AP; Barlucchi, L; Torella, D; Baker, M; Limana, F; Chimenti, S; Kasahara, H; Rota, M; Musso, E; Urbanek, K; Leri, A; Kajstura, J; Nadal-Ginard, B; Anversa, P",Adult cardiac stem cells are multipotent and support myocardial regeneration,"The notion of the adult heart as terminally differentiated organ without self-renewal potential has been undermined by the existence of a subpopulation of replicating myocytes in normal and pathological states. The origin and significance of these cells has remained obscure for lack of a proper biological context. We report the existence of Lin(-) c-kit(POS) cells with the properties of cardiac stem cells. They are self-renewing, clonogenic, and multipotent, giving rise to myocytes, smooth muscle, and endothelial cells. When injected into an ischemic heart, these cells or their clonal progeny reconstitute well-differentiated myocardium, formed by blood-carrying new vessels and myocytes with the characteristics of young cells, encompassing similar to70% of the ventricle. Thus, the adult heart, like the brain, is mainly composed of terminally differentiated cells, but is not a terminally differentiated organ because it contains stem cells supporting its regeneration. The existence of these cells opens new opportunities for myocardial repair.",10.1016/S0092-8674(03)00687-1
J,"Mayakonda, A; Lin, DC; Assenov, Y; Plass, C; Koeffler, HP",Maftools: efficient and comprehensive analysis of somatic variants in cancer,"Numerous large-scale genomic studies of matched tumor-normal samples have established the somatic landscapes of most cancer types. However, the downstream analysis of data from somatic mutations entails a number of computational and statistical approaches, requiring usage of independent software and numerous tools. Here, we describe an R Bioconductor package, Maftools, which offers a multitude of analysis and visualization modules that are commonly used in cancer genomic studies, including driver gene identification, pathway, signature, enrichment, and association analyses. Maftools only requires somatic variants in Mutation Annotation Format (MAF) and is independent of larger alignment files. With the implementation of well-established statistical and computational methods, Maftools facilitates data-driven research and comparative analysis to discover novel results from publicly available data sets. In the present study, using three of the well-annotated cohorts from The Cancer Genome Atlas (TCGA), we describe the application of Maftools to reproduce known results. More importantly, we show that Maftools can also be used to uncover novel findings through integrative analysis.",10.1101/gr.239244.118
J,"Haas, BJ; Gevers, D; Earl, AM; Feldgarden, M; Ward, DV; Giannoukos, G; Ciulla, D; Tabbaa, D; Highlander, SK; Sodergren, E; Methé, B; DeSantis, TZ; Petrosino, JF; Knight, R; Birren, BW",Chimeric 16S rRNA sequence formation and detection in Sanger and 454-pyrosequenced PCR amplicons,"Bacterial diversity among environmental samples is commonly assessed with PCR-amplified 16S rRNA gene (16S) sequences. Perceived diversity, however, can be influenced by sample preparation, primer selection, and formation of chimeric 16S amplification products. Chimeras are hybrid products between multiple parent sequences that can be falsely interpreted as novel organisms, thus inflating apparent diversity. We developed a new chimera detection tool called Chimera Slayer (CS). CS detects chimeras with greater sensitivity than previous methods, performs well on short sequences such as those produced by the 454 Life Sciences (Roche) Genome Sequencer, and can scale to large data sets. By benchmarking CS performance against sequences derived from a controlled DNA mixture of known organisms and a simulated chimera set, we provide insights into the factors that affect chimera formation such as sequence abundance, the extent of similarity between 16S genes, and PCR conditions. Chimeras were found to reproducibly form among independent amplifications and contributed to false perceptions of sample diversity and the false identification of novel taxa, with less-abundant species exhibiting chimera rates exceeding 70%. Shotgun metagenomic sequences of our mock community appear to be devoid of 16S chimeras, supporting a role for shotgun metagenomics in validating novel organisms discovered in targeted sequence surveys.",10.1101/gr.112730.110
J,"Wang, HY; Yang, H; Shivalila, CS; Dawlaty, MM; Cheng, AW; Zhang, F; Jaenisch, R",One-Step Generation of Mice Carrying Mutations in Multiple Genes by CRISPR/Cas-Mediated Genome Engineering,"Mice carrying mutations in multiple genes are traditionally generated by sequential recombination in embryonic stem cells and/or time-consuming inter-crossing of mice with a single mutation. The CRISPR/Cas system has been adapted as an efficient gene-targeting technology with the potential for multiplexed genome editing. We demonstrate that CRISPR/Cas-mediated gene editing allows the simultaneous disruption of five genes (Tet1, 2, 3, Sry, Uty - 8 alleles) in mouse embryonic stem (ES) cells with high efficiency. Coinjection of Cas9 mRNA and single-guide RNAs (sgRNAs) targeting Tet1 and Tet2 into zygotes generated mice with biallelic mutations in both genes with an efficiency of 80%. Finally, we show that coinjection of Cas9 mRNA/sgRNAs with mutant oligos generated precise point mutations simultaneously in two target genes. Thus, the CRISPR/Cas system allows the one-step generation of animals carrying mutations in multiple genes, an approach that will greatly accelerate the in vivo study of functionally redundant genes and of epistatic gene interactions.",10.1016/j.cell.2013.04.025
J,"Vizcaíno, JA; Csordas, A; del-Toro, N; Dianes, JA; Griss, J; Lavidas, I; Mayer, G; Perez-Riverol, Y; Reisinger, F; Ternent, T; Xu, QW; Wang, R; Hermjakob, H",2016 update of the PRIDE database and its related tools,"The PRoteomics IDEntifications (PRIDE) database is one of the world-leading data repositories of mass spectrometry (MS)-based proteomics data. Since the beginning of 2014, PRIDE Archive (http://www.ebi.ac.uk/pride/archive/) is the new PRIDE archival system, replacing the original PRIDE database. Here we summarize the developments in PRIDE resources and related tools since the previous update manuscript in the Database Issue in 2013. PRIDE Archive constitutes a complete redevelopment of the original PRIDE, comprising a new storage backend, data submission system and web interface, among other components. PRIDE Archive supports the most-widely used PSI (Proteomics Standards Initiative) data standard formats (mzML and mzIdentML) and implements the data requirements and guidelines of the ProteomeXchange Consortium. The wide adoption of ProteomeXchange within the community has triggered an unprecedented increase in the number of submitted data sets (around 150 data sets per month). We outline some statistics on the current PRIDE Archive data contents. We also report on the status of the PRIDE related stand-alone tools: PRIDE Inspector, PRIDE Converter 2 and the ProteomeXchange submission tool. Finally, we will give a brief update on the resources under development 'PRIDE Cluster' and 'PRIDE Proteomes', which provide a complementary view and quality-scored information of the peptide and protein identification data available in PRIDE Archive.",10.1093/nar/gkv1145
J,"Simpson, JT; Wong, K; Jackman, SD; Schein, JE; Jones, SJM; Birol, I",ABySS: A parallel assembler for short read sequence data,"Widespread adoption of massively parallel deoxyribonucleic acid (DNA) sequencing instruments has prompted the recent development of de novo short read assembly algorithms. A common shortcoming of the available tools is their inability to efficiently assemble vast amounts of data generated from large-scale sequencing projects, such as the sequencing of individual human genomes to catalog natural genetic variation. To address this limitation, we developed ABySS (Assembly By Short Sequences), a parallelized sequence assembler. As a demonstration of the capability of our software, we assembled 3.5 billion paired-end reads from the genome of an African male publicly released by Illumina, Inc. Approximately 2.76 million contigs >= 100 base pairs (bp) in length were created with an N50 size of 1499 bp, representing 68% of the reference human genome. Analysis of these contigs identified polymorphic and novel sequences not present in the human reference assembly, which were validated by alignment to alternate human assemblies and to other primate genomes.",10.1101/gr.089532.108
J,"O'Brien, J; Wilson, I; Orton, T; Pognan, F",Investigation of the Alamar Blue (resazurin) fluorescent dye for the assessment of mammalian cell cytotoxicity,"We show here the identity of Alamar Blue as resazurin. The 'resazurin reduction test' has been used for about 50 years to monitor bacterial and yeast contamination of milk, and also for assessing semen quality. Resazurin (blue and nonfluorescent) is reduced to resorufin (pink and highly fluorescent) which is further reduced to hydroresorufin (uncoloured and nonfluorescent). It is still not known how this reduction occurs, intracellularly via enzyme activity or in the medium as a chemical reaction, although the reduced fluorescent form of Alamar Blue was found in the cytoplasm and of living cells nucleus of dead cells. Recently, the dye has gained popularity as a very simple and versatile way of measuring cell proliferation and cytotoxicity. This dye presents numerous advantages over other cytotoxicity or proliferation tests but we observed several drawbacks to the routine use of Alamar Blue. Tests with several toxicants in different cell lines and rat primary hepatocytes have shown accumulation of the fluorescent product of Alamar Blue in the medium which could lead to an overestimation of cell population. Also, the extensive reduction of Alamar Blue by metabolically active cells led to a final nonfluorescent product, and hence an underestimation of cellular activity.",10.1046/j.1432-1327.2000.01606.x
J,"Wyman, SK; Jansen, RK; Boore, JL",Automatic annotation of organellar genomes with DOGMA,"The Dual Organellar GenoMe Annotator (DOGMA) automates the annotation of organellar (plant chloroplast and animal mitochondrial) genomes. It is a Web-based package that allows the use of BLAST searches against a custom database, and conservation of basepairing in the secondary structure of animal mitochondrial tRNAs to identify and annotate genes. DOGMA provides a graphical user interface for viewing and editing annotations. Annotations are stored on our password-protected server to enable repeated sessions of working on the same genome. Finished annotations can be extracted for direct submission to GenBank.",10.1093/bioinformatics/bth352
J,"Falagas, ME; Pitsouni, EI; Malietzis, GA; Pappas, G","Comparison of PubMed, Scopus, Web of Science, and Google Scholar: strengths and weaknesses","The evolution of the electronic age has led to the development of numerous medical databases on the World Wide Web, offering search facilities on a particular subject and the ability to perform citation analysis. We compared the content coverage and practical utility of PubMed, Scopus, Web of Science, and Google Scholar. The official Web pages of the databases were used to extract information on the range of journals covered, search facilities and restrictions, and update frequency. We used the example of a keyword search to evaluate the usefulness of these databases in biomedical information retrieval and a specific published article to evaluate their utility in performing citation analysis. All databases were practical in use and offered numerous search facilities. PubMed and Google Scholar are accessed for free. The keyword search with PubMed offers optimal update frequency and includes online early articles; other databases can rate articles by number of citations, as an index of importance. For citation analysis, Scopus offers about 20% more coverage than Web of Science, whereas Google Scholar offers results of inconsistent accuracy. PubMed remains an optimal tool in biomedical electronic research. Scopus covers a wider journal range, of help both in keyword searching and citation analysis, but it is currently limited to recent articles ( published after 1995) compared with Web of Science. Google Scholar, as for the Web in general, can help in the retrieval of even the most obscure information but its use is marred by inadequate, less often updated, citation information.",10.1096/fj.07-9492LSF
J,"Meyer, F; Paarmann, D; D'Souza, M; Olson, R; Glass, EM; Kubal, M; Paczian, T; Rodriguez, A; Stevens, R; Wilke, A; Wilkening, J; Edwards, RA",The metagenomics RAST server - a public resource for the automatic phylogenetic and functional analysis of metagenomes,"Background: Random community genomes (metagenomes) are now commonly used to study microbes in different environments. Over the past few years, the major challenge associated with metagenomics shifted from generating to analyzing sequences. High-throughput, low-cost next-generation sequencing has provided access to metagenomics to a wide range of researchers. Results: A high-throughput pipeline has been constructed to provide high-performance computing to all researchers interested in using metagenomics. The pipeline produces automated functional assignments of sequences in the metagenome by comparing both protein and nucleotide databases. Phylogenetic and functional summaries of the metagenomes are generated, and tools for comparative metagenomics are incorporated into the standard views. User access is controlled to ensure data privacy, but the collaborative environment underpinning the service provides a framework for sharing datasets between multiple users. In the metagenomics RAST, all users retain full control of their data, and everything is available for download in a variety of formats. Conclusion: The open-source metagenomics RAST service provides a new paradigm for the annotation and analysis of metagenomes. With built-in support for multiple data sources and a back end that houses abstract data types, the metagenomics RAST is stable, extensible, and freely available to all researchers. This service has removed one of the primary bottlenecks in metagenome sequence analysis-the availability of high-performance computing for annotating the data.",10.1186/1471-2105-9-386
J,"Seth, RB; Sun, LJ; Ea, CK; Chen, ZJJ","Identification and characterization of MAVS, a mitochondrial antiviral signaling protein that activates NF-κB and IRF3","Viral infection triggers host innate immune responses through activation of the transcription factors NF-kappa B and IRF3, which coordinately regulate the expression of type-I interferons such as interferon-beta (IFN-beta). Herein, we report the identification of a novel protein termed MAVS (mitochondrial antiviral signaling), which mediates the activation of NF-kappa B and IRF3 in response to viral infection. Silencing of MAVS expression through RNA interference abolishes the activation of NF-kappa B and IRF3 by viruses, thereby permitting viral replication. Conversely, overexpression of MAVS induces the expression of IFN-beta through activation of NF-kappa B and IRF3, thus boosting antiviral immunity. Epistasis experiments show that MAVS is required for the phosphorylation of IRF3 and I kappa B and functions downstream of RIG-I, an intracellular receptor for viral RNA. MAVS contains an N-terminal CARD-like domain and a C-terminal transmembrane domain, both of which are essential for MAVS signaling. The transmembrane domain targets MAVS to the mitochondria, implicating a new role of mitochondria in innate immunity.",10.1016/j.cell.2005.08.012
J,"Sreerama, N; Woody, RW","Estimation of protein secondary structure from circular dichroism spectra: Comparison of CONTIN, SELCON, and CDSSTR methods with an expanded reference set","We have expanded the reference set of proteins used in SELCON3 by including 11 additional proteins (selected from the reference sets of Yang and co-workers and Keiderling and co-workers). Depending on the wavelength range and whether or not denatured proteins are included in the reference set, five reference sets were constructed with the number of reference proteins varying from 29 to 48. The performance of three popular methods for estimating protein secondary structure fractions from CD spectra (implemented in software packages CONTIN, SELCON3, and CDSSTR) and a variant of CONTIN, CONTIN/LL, that incorporates the variable selection method in the locally linearized model in CONTIN, were examined using the five reference sets described here, and a aa-protein reference set. Secondary structure assignments from DSSP were used in the analysis. The performances of all three methods were comparable, in spite of the differences in the algorithms used in the three software packages. While CDSSTR performed the best with a smaller reference set and larger wavelength range, and CONTIN/LL performed the best with a larger reference set and smaller wavelength range, the performances for individual secondary structures were mixed. Analyzing protein CD spectra using all three methods should improve the reliability of predicted secondary structural fractions. The three programs are provided in CDPro software package and have been modified for easier use with the different reference sets described in this paper. CDPro software is available at the website: http:/lamar.colostate.edu/ similar to sreeram/CDPro. (C) 2000 Academic Press.",10.1006/abio.2000.4880
